Symbol,Name,Price (Intraday),Change,% Change,Volume,Avg Vol (3 month),Market Cap,Date
GDLNF,Energy Transition Minerals Ltd,0.01,-0.0054,-35.06,50000,61059,14369000,2024-07-01T20:10:47.925859
AWH,Aspira Women's Health Inc.,0.99,-0.5,-33.56,483248,62406,12325000,2024-07-01T20:10:47.925859
CSSE,"Chicken Soup for the Soul Entertainment, Inc.",0.1175,-0.0765,-39.43,10249000,5363000,3814000,2024-07-01T20:10:47.925859
NMREF,Namibia Critical Metals Inc.,0.015,-0.02,-57.14,23385,27222,3075000,2024-07-01T20:10:47.925859
VTAK,"Catheter Precision, Inc.",0.3799,-0.2051,-35.06,1746000,85725,2877000,2024-07-01T20:10:47.925859
TIOG,"Tingo Group, Inc.",0.0112,-0.0068,-37.78,7419,307056,2710000,2024-07-01T20:10:47.925859
AMBBF,Ambari Brands Inc.,0.037,-0.023,-38.33,1050,13006,2092000,2024-07-01T20:10:47.925859
CSSEP,"Chicken Soup for the Soul Entertainment, Inc.",0.375,-0.835,-69.01,221232,96959,1316000,2024-07-01T20:10:47.925859
BERI,"Blue Earth Resources, Inc.",0.011,-0.01,-47.62,87335,17788,1254000,2024-07-01T20:10:47.925859
