Symbol,Name,Price (Intraday),Change,% Change,Volume,Avg Vol (3 month),Market Cap,Date
HLOGF,Helium One Global Ltd,0.0109,-0.0051,-31.88,6000,274040,61338000,2024-04-27T06:20:41.165681
RQHTF,Reliq Health Technologies Inc.,0.055,-0.0563,-50.58,48039,47869,34083000,2024-04-27T06:20:41.165681
EJH,E-Home Household Service Holdings Limited,0.5264,-0.2436,-31.64,6636000,1120000,9399000,2024-04-27T06:20:41.165681
USCUF,US Copper Corp.,0.0213,-0.01,-31.84,217888,12849,2529000,2024-04-27T06:20:41.165681
NUWE,"Nuwellis, Inc.",0.1678,-0.1212,-41.94,18261000,1274000,1141000,2024-04-27T06:20:41.165681
VEII,"Value Exchange International, Inc.",0.016,-0.033,-67.35,330405,15900,696012,2024-04-27T06:20:41.165681
