Symbol,Name,Price (Intraday),Change,% Change,Volume,Avg Vol (3 month),Market Cap,Date
HLOGF,Helium One Global Limited,0.0125,-0.0075,-37.5,64371,47862,73821000,2024-12-10T20:26:13.744127
ALSCF,Alset AI Ventures Inc.,0.05,-0.027,-35.06,119500,147170,5138000,2024-12-10T20:26:13.744127
USCMF,US Critical Metals Corp.,0.049,-0.021,-30.0,206000,97855,3120000,2024-12-10T20:26:13.744127
NGRBF,Nextgen Food Robotics Corp.,0.03,-0.02,-40.0,13620,31582,1517000,2024-12-10T20:26:13.744127
IMPM,"Impac Mortgage Holdings, Inc.",0.03,-0.019,-38.78,3000,26103,1097000,2024-12-10T20:26:13.744127
NTBLQ,"Notable Labs, Ltd.",0.013,-0.012,-48.0,90252,2637000,125573,2024-12-10T20:26:13.744127
