Symbol,Name,Price (Intraday),Change,% Change,Volume,Avg Vol (3 month),Market Cap,Date
MTEN,Mingteng International Corporation Inc.,0.6,-0.46,-43.15,6038000,410377,11911000,2026-01-09T07:48:16.482699
GRHI,"Gold Rock Holdings, Inc.",0.01,-0.01,-53.18,40000,18060,2454000,2026-01-09T07:48:16.482699
TAAG,The Awareness Group Inc,0.03,-0.01,-30.61,25950,24076,2027000,2026-01-09T07:48:16.482699
VVWT,VIVA World Trade Inc.,0.01,-0.01,-38.18,10000,103887,1346000,2026-01-09T07:48:16.482699
CGNO,"CognoGroup, Inc.",0.01,-0.01,-47.4,62000,59950,850977,2026-01-09T07:48:16.482699
