title,time_published,url,ticker,relevance_score,ticker_sentiment_label,ticker_sentiment_score
"Tesla, Nvidia, John Wiley & Sons And Other Big Stocks Moving Higher On Thursday - Tesla  ( NASDAQ:TSLA ) ",20240613T141719,https://www.benzinga.com/news/24/06/39313835/tesla-nvidia-john-wiley-sons-and-other-big-stocks-moving-higher-on-thursday,ACLS,0.191929,Bullish,0.671603
"NetApp, Autodesk And Other Big Gainers From Thursday",20220826T082250,https://www.benzinga.com/news/22/08/28645151/netapp-autodesk-and-other-big-gainers-from-thursday,ACLS,0.088147,Somewhat-Bullish,0.281543
Goldman Sachs: 89 stocks expected to be winners as they build out AI infrastructure,20240705T100000,https://www.businessinsider.com/ai-stocks-companies-building-out-infrastructure-goldman-sachs-picks-2024-7,ACLS,0.058687,Neutral,0.022996
"Ollie's Bargain Outlet Posts Upbeat Earnings, Joins Verint Systems, Guidewire Software And Other Big Stocks Moving Higher On Wednesday - Ollie's Bargain Outlet  ( NASDAQ:OLLI ) ",20240605T142346,https://www.benzinga.com/news/24/06/39186219/ollies-bargain-outlet-posts-upbeat-earnings-joins-verint-systems-guidewire-software-and-other-big-st,ACLS,0.136888,Somewhat-Bullish,0.323895
The Benchmark Company Announces Upcoming September Conference Schedule,20240822T151153,https://www.benzinga.com/pressreleases/24/08/g40510267/the-benchmark-company-announces-upcoming-september-conference-schedule,ACLS,0.050679,Neutral,0.0
The Benchmark Company Announces Upcoming September Conference Schedule,20230823T142553,https://www.benzinga.com/pressreleases/23/08/g34005661/the-benchmark-company-announces-upcoming-september-conference-schedule,ACLS,0.055109,Neutral,0.0
10 Information Technology Stocks Moving In Tuesday's Intraday Session,20220405T181529,https://www.benzinga.com/intraday-update/22/04/26482941/10-information-technology-stocks-moving-in-tuesdays-intraday-session,ACLS,0.088276,Neutral,-0.000835
"Earnings Scheduled For May 4, 2022",20220504T083630,https://www.benzinga.com/news/earnings/22/05/26983503/earnings-scheduled-for-may-4-2022,ACLS,0.010898,Neutral,0.000417
