title,time_published,url,ticker,relevance_score,ticker_sentiment_label,ticker_sentiment_score
"Why Vicinity Motor Is Trading Higher By Over 65%; Here Are 26 Stocks Moving Premarket - Adeia  ( NASDAQ:ADEA ) , AeroClean Technologies  ( NASDAQ:AERC ) ",20221005T105429,https://www.benzinga.com/news/22/10/29150310/why-vicinity-motor-is-trading-higher-by-over-65-here-are-26-stocks-moving-premarket,AGTC,0.129168,Somewhat-Bearish,-0.155979
66 Biggest Movers From Yesterday,20220323T082532,https://www.benzinga.com/news/22/03/26252727/66-biggest-movers-from-yesterday,AGTC,0.058745,Neutral,0.002524
Mid-Afternoon Market Update: HireRight Rises Following Q4 Results; Applied Genetic Technologies Shares Fall,20220322T183616,https://www.benzinga.com/news/earnings/22/03/26246162/mid-afternoon-market-update-hireright-rises-following-q4-results-applied-genetic-technologies-share,AGTC,0.146025,Neutral,-0.001266
Mid-Day Market Update: Dow Jumps Over 200 Points; ORIC Pharmaceuticals Shares Slide,20220322T163222,https://www.benzinga.com/news/earnings/22/03/26243930/mid-day-market-update-dow-jumps-over-200-points-oric-pharmaceuticals-shares-slide,AGTC,0.146692,Neutral,-0.000244
43 Stocks Moving In Tuesday's Mid-Day Session,20220322T160108,https://www.benzinga.com/news/22/03/26243380/43-stocks-moving-in-tuesdays-mid-day-session,AGTC,0.083672,Neutral,-0.004022
"Gene therapy market size to grow by USD 4.61 billion from 2022 to 2027, North America is estimated to contribute 39 ... - PR Newswire",20240318T093600,https://www.prnewswire.com/news-releases/gene-therapy-market-size-to-grow-by-usd-4-61-billion-from-2022-to-2027--north-america-is-estimated-to-contribute-39-to-the-growth-technavio-302090363.html,AGTC,0.067064,Somewhat-Bullish,0.179328
"Carnival Surges Over 12%, Here's 75 Biggest Movers From Friday",20220627T082640,https://www.benzinga.com/news/22/06/27857165/carnival-surges-over-12-heres-75-biggest-movers-from-friday,AGTC,0.061229,Neutral,0.000418
"The Daily Biotech Pulse: Pfizer-BioNTech's COVID-19 Booster For Kids 5-11 Coming Soon, Ultragenyx In-Licenses Gene Therapy For Genetic Disorder, Ampio's AP-013 Trial Under Independent Investigation",20220517T130455,https://www.benzinga.com/general/biotech/22/05/27249090/the-daily-biotech-pulse-pfizer-biontechs-covid-19-booster-for-5-11-year-kids-soon-ultragenyx-in-l,AGTC,0.178426,Neutral,-0.003384
