title,time_published,url,ticker,relevance_score,ticker_sentiment_label,ticker_sentiment_score
Bispecific Antibody Clinical Trial Pipeline Appears Robust With 250+ Key Pharma Companies Actively Working in the Therapeutics Segment | DelveInsight,20230703T210100,https://www.prnewswire.com/news-releases/bispecific-antibody-clinical-trial-pipeline-appears-robust-with-250-key-pharma-companies-actively-working-in-the-therapeutics-segment--delveinsight-301868673.html,AKESF,0.081483,Neutral,0.105903
Antibody-drug Conjugates Clinical Trial Pipeline Experiences Momentum: DelveInsight Estimates a Diverse Pipeline Comprising 180+ Companies Working in the Domain,20230626T210100,https://www.prnewswire.com/news-releases/antibody-drug-conjugates-clinical-trial-pipeline-experiences-momentum-delveinsight-estimates-a-diverse-pipeline-comprising-180-companies-working-in-the-domain-301862784.html,AKESF,0.020903,Neutral,0.063178
"Head and Neck Squamous Cell Carcinoma Market to Witness Upsurge in Growth by 2032, Assesses DelveInsight | Key Companies in the Market - Pfizer, Merck, Eisai, AstraZeneca, Innate, Roche, GlaxoSmithKline, BeiGene, IO Biotech, Incyte",20230918T210100,https://www.prnewswire.com/news-releases/head-and-neck-squamous-cell-carcinoma-market-to-witness-upsurge-in-growth-by-2032-assesses-delveinsight--key-companies-in-the-market---pfizer-merck-eisai-astrazeneca-innate-roche-glaxosmithkline-beigene-io-biotech-incyt-301930322.html,AKESF,0.046273,Neutral,0.058004
"Triple-Negative Breast Cancer Market to Accelerate Substantially During the Forecast Period  ( 2023-2032 ) , Examines DelveInsight | Key Companies to Watch - Roche, AbbVie, AstraZeneca, BeiGene, GlaxoSmithKline, Genentech, Eli Lilly, Novartis",20230906T210100,https://www.prnewswire.com/news-releases/triple-negative-breast-cancer-market-to-accelerate-substantially-during-the-forecast-period-20232032-examines-delveinsight--key-companies-to-watch---roche-abbvie-astrazeneca-beigene-glaxosmithkline-genentech-eli-lilly--301918858.html,AKESF,0.022494,Neutral,-0.053504
Molecular Glues Clinical Trial Pipeline Appears Robust With 10+ Key Pharma Companies Actively Working in the Therapeutics Segment | DelveInsight,20240711T213100,https://www.prnewswire.com/news-releases/molecular-glues-clinical-trial-pipeline-appears-robust-with-10-key-pharma-companies-actively-working-in-the-therapeutics-segment--delveinsight-302194515.html,AKESF,0.024904,Neutral,0.02309
