title,time_published,url,ticker,relevance_score,ticker_sentiment_label,ticker_sentiment_score
AMD To Rally Over 19%? Here Are 10 Top Analyst Forecasts For Monday - Advanced Micro Devices  ( NASDAQ:AMD ) ,20240610T115437,https://www.benzinga.com/news/24/06/39248002/amd-to-rally-over-19-here-are-10-top-analyst-forecasts-for-monday,AMD,0.221481,Bullish,0.404832
This Healthcare Stock Is Trading Higher By 148%: Here Are 40 Stocks Moving Premarket,20220803T115008,https://www.benzinga.com/news/22/08/28328611/this-healthcare-stock-is-trading-higher-by-148-here-are-40-stocks-moving-premarket,AMD,0.115232,Neutral,0.072488
"Stocks making the biggest moves midday: Yelp, AutoZone, Lowe's, Apple and more",20230523T162939,https://www.cnbc.com/2023/05/23/stocks-making-biggest-midday-moves-yelp-autozone-lowes-and-more.html,AMD,0.097259,Somewhat-Bullish,0.16299
This Healthcare Stock Is Trading Higher By 148%: Here Are 40 Stocks Moving Premarket,20220803T115008,https://www.benzinga.com/news/22/08/28328611/this-healthcare-stock-is-trading-higher-by-148-here-are-40-stocks-moving-premarket,AMD,0.115232,Neutral,0.072488
Most Active Stocks Today? 5 Chinese Stocks For Your Watchlist,20220606T191556,https://stockmarket.com/featured/most-active-stocks-today-5-chinese-stocks-for-your-watchlist-2022-06-06,AMD,0.071549,Neutral,0.042111
"Earnings Scheduled For May 3, 2022",20220503T085235,https://www.benzinga.com/news/earnings/22/05/26953640/earnings-scheduled-for-may-3-2022,AMD,0.01558,Neutral,-0.002332
