title,time_published,url,ticker,relevance_score,ticker_sentiment_label,ticker_sentiment_score
ANNX: Insider Buying Sends Annexon Stock Higher. But Does That Make It a Buy?,20220721T131546,https://stocknews.com/news/annx-vrtx-amgn-biib-insider-buying-sends-annexon-stock-higher-but-does-that-make/,AMGN,0.137671,Neutral,0.041143
89bio Appoints Francis Sarena as Chief Operating Officer,20240807T120000,https://www.globenewswire.com/news-release/2024/08/07/2925882/0/en/89bio-Appoints-Francis-Sarena-as-Chief-Operating-Officer.html,AMGN,0.042196,Neutral,0.017635
Pyxis Oncology Announces Leadership Changes,20220413T103500,https://www.globenewswire.com/news-release/2022/04/13/2421745/0/en/Pyxis-Oncology-Announces-Leadership-Changes.html,AMGN,0.03368,Neutral,0.014874
Cardiol Therapeutics Fights Heart Inflammation With Novel Formulations - Cardiol Therapeutics  ( NASDAQ:CRDL ) ,20231012T135319,https://www.benzinga.com/general/biotech/23/10/35220787/cardiol-therapeutics-fights-heart-inflammation-with-novel-formulations,AMGN,0.033328,Neutral,-0.01534
"Gene Therapy Market Set for 19% CAGR Surge, Reaching USD 38.34 Billion by 2031 | SkyQuest Technology",20240912T133000,https://www.benzinga.com/pressreleases/24/09/g40833623/gene-therapy-market-set-for-19-cagr-surge-reaching-usd-38-34-billion-by-2031-skyquest-technology,AMGN,0.039878,Neutral,0.026899
"Hefty Listing Price Of New Drugs For Cancer, Rare Diseases Put Pressure On Annual Hike For Older Drugs - bluebird bio  ( NASDAQ:BLUE ) , Amgen  ( NASDAQ:AMGN ) ",20230310T181042,https://www.benzinga.com/general/biotech/23/03/31300483/hefty-listing-price-of-new-drugs-for-cancer-rare-diseases-put-pressure-on-annual-hike-for-older-d,AMGN,0.310843,Neutral,-0.149909
"TScan Therapeutics Expands Clinical Team with the Appointment of Dawn Pinchasik, M.D., M.S., as Vice President, Clinical Development",20240206T120000,https://www.globenewswire.com/news-release/2024/02/06/2824126/0/en/TScan-Therapeutics-Expands-Clinical-Team-with-the-Appointment-of-Dawn-Pinchasik-M-D-M-S-as-Vice-President-Clinical-Development.html,AMGN,0.036926,Neutral,0.045711
Longeveron Welcomes Three New Prominent Board Members,20230613T123000,https://www.globenewswire.com/news-release/2023/06/13/2687120/0/en/Longeveron-Welcomes-Three-New-Prominent-Board-Members.html,AMGN,0.028764,Neutral,-0.024573
