title,time_published,url,ticker,relevance_score,ticker_sentiment_label,ticker_sentiment_score
"Stocks That Hit 52-Week Lows On Thursday - PRA Group  ( NASDAQ:PRAA ) , Perimeter Solutions  ( NYSE:PRM ) ",20231005T172202,https://www.benzinga.com/news/23/10/35111787/stocks-that-hit-52-week-lows-on-thursday,AMRC,0.013047,Neutral,0.004424
"Earnings Scheduled For May 2, 2022",20220502T091616,https://www.benzinga.com/news/earnings/22/05/26923268/earnings-scheduled-for-may-2-2022,AMRC,0.037992,Neutral,-0.00068
"ROTH MKM to Host 9th Annual London Conference on June 20-22, 2023",20230613T102223,https://investingnews.com/roth-mkm-to-host-9th-annual-london-conference-on-june-20-22-2023/,AMRC,0.058472,Somewhat-Bullish,0.244057
"ROTH MKM to Host 9th Annual London Conference on June 20-22, 2023",20230613T100000,https://www.benzinga.com/pressreleases/23/06/g32830691/roth-mkm-to-host-9th-annual-london-conference-on-june-20-22-2023,AMRC,0.057837,Somewhat-Bullish,0.235023
"Azenta Reports Upbeat Earnings, Joins Talis Biomedical, Sally Beauty And Other Big Stocks Moving Higher On Tuesday - Adaptive Biotechnologies  ( NASDAQ:ADPT ) , Accolade  ( NASDAQ:ACCD ) ",20231114T153913,https://www.benzinga.com/news/23/11/35779972/azenta-reports-upbeat-earnings-joins-talis-biomedical-sally-beauty-and-other-big-stocks-moving-highe,AMRC,0.202366,Neutral,0.0
