title,time_published,url,ticker,relevance_score,ticker_sentiment_label,ticker_sentiment_score
"Earnings Scheduled For May 12, 2022",20220512T085523,https://www.benzinga.com/news/earnings/22/05/27156592/earnings-scheduled-for-may-12-2022,AMTX,0.017681,Neutral,-0.089053
This Communication Services Stock Jumped 149%; Here Are 90 Biggest Movers From Friday,20220801T092759,https://www.benzinga.com/news/22/08/28283022/this-communication-services-stock-jumped-149-here-are-90-biggest-movers-from-friday,AMTX,0.043303,Neutral,0.0
88 Biggest Movers From Yesterday,20220309T085743,https://www.benzinga.com/news/22/03/26055397/88-biggest-movers-from-yesterday,AMTX,0.047792,Neutral,0.024176
Why Quoin Pharmaceuticals Plunged Over 62%; Here Are 120 Biggest Movers From Friday,20220808T070540,https://www.benzinga.com/news/22/08/28391297/why-quoin-pharmaceuticals-plunged-over-62-here-are-120-biggest-movers-from-friday,AMTX,0.033328,Neutral,0.0
"Earnings Scheduled For March 10, 2022",20220310T093327,https://www.benzinga.com/news/earnings/22/03/26075023/earnings-scheduled-for-march-10-2022,AMTX,0.014477,Neutral,-0.058989
