title,time_published,url,ticker,relevance_score,ticker_sentiment_label,ticker_sentiment_score
Annexon Presents ARCHER Trial Results at ASRS 2023 Highlighting Potential of ANX007 as a Differentiated Treatment for Geographic Atrophy - Annexon  ( NASDAQ:ANNX ) ,20230730T160000,https://www.benzinga.com/pressreleases/23/07/g33460789/annexon-presents-archer-trial-results-at-asrs-2023-highlighting-potential-of-anx007-as-a-different,ANNX,0.226477,Neutral,0.08008
"Annexon Biosciences Strengthens Leadership Team with Appointment of Jamie Dananberg, M.D., as Chief Medical Officer",20230727T103000,https://www.globenewswire.com/news-release/2023/07/27/2711977/0/en/Annexon-Biosciences-Strengthens-Leadership-Team-with-Appointment-of-Jamie-Dananberg-M-D-as-Chief-Medical-Officer.html,ANNX,0.692465,Bullish,0.375752
"Annexon Biosciences Strengthens Leadership Team with Appointment of Jamie Dananberg, M.D., as Chief Medical Officer - Annexon  ( NASDAQ:ANNX ) ",20230727T103000,https://www.benzinga.com/pressreleases/23/07/g33414017/annexon-biosciences-strengthens-leadership-team-with-appointment-of-jamie-dananberg-m-d-as-chief-m,ANNX,0.630286,Bullish,0.357439
Annexon to Report ARCHER Phase 2 Trial Results in Geographic Atrophy at ASRS 2023,20230724T103000,https://www.globenewswire.com/news-release/2023/07/24/2709360/0/en/Annexon-to-Report-ARCHER-Phase-2-Trial-Results-in-Geographic-Atrophy-at-ASRS-2023.html,ANNX,0.822984,Somewhat-Bullish,0.167853
"Geographic Atrophy Market to Boost Significantly, Assesses DelveInsight | Key Companies Active in the Domain - Novartis, Annexon, Apellis, Ionis, Astellas, Gyroscope, Genentech, Aviceda, Iveric Bio",20230628T210100,https://www.prnewswire.com/news-releases/geographic-atrophy-market-to-boost-significantly-assesses-delveinsight--key-companies-active-in-the-domain---novartis-annexon-apellis-ionis-astellas-gyroscope-genentech-aviceda-iveric-bio-301865699.html,ANNX,0.077426,Neutral,-0.01029
Annexon  ( ANNX )  Stock Down More Than 50% Last Week: Here's Why,20230530T144000,https://www.zacks.com/stock/news/2101444/annexon-annx-stock-down-more-than-50-last-week-heres-why,ANNX,0.303175,Neutral,-0.085406
"Crude Oil Drops Sharply; Best Buy Earnings Top Expectations - Annexon  ( NASDAQ:ANNX ) , Digital Turbine  ( NASDAQ:APPS ) ",20230525T183908,https://www.benzinga.com/news/earnings/23/05/32582243/crude-oil-drops-sharply-best-buy-earnings-top-expectations,ANNX,0.1172,Neutral,0.00807
"Nasdaq Surges 1.5%; NVIDIA Shares Jump Following Strong Q1 Results - Annexon  ( NASDAQ:ANNX ) , Digital Turbine  ( NASDAQ:APPS ) ",20230525T160218,https://www.benzinga.com/news/earnings/23/05/32579047/nasdaq-surges-1-5-nvidia-shares-jump-following-strong-q1-results,ANNX,0.115787,Neutral,0.008028
Why Shares of Annexon Are Plummeting Thursday,20230525T155231,https://www.fool.com/investing/2023/05/25/why-shares-of-annexon-are-plummeting-thursday/,ANNX,0.47672,Somewhat-Bullish,0.320793
Why Annexon  ( ANNX )  Stock Is Getting Hammered - Annexon  ( NASDAQ:ANNX ) ,20230525T153507,https://www.benzinga.com/news/23/05/32576633/why-annexon-annx-stock-is-getting-hammered,ANNX,0.925854,Neutral,0.0
"Dow Drops 100 Points; US GDP Tops Estimates - Annexon  ( NASDAQ:ANNX ) , Digital Turbine  ( NASDAQ:APPS ) ",20230525T134627,https://www.benzinga.com/news/earnings/23/05/32574777/dow-drops-100-points-us-gdp-tops-estimates,ANNX,0.131284,Neutral,0.008523
Why Annexon  ( ANNX )  Stock Is Tumbling Today - Annexon  ( NASDAQ:ANNX ) ,20230525T121227,https://www.benzinga.com/general/biotech/23/05/32568850/annexons-eye-disease-drug-reports-mixed-trial-results-will-focus-on-planned-late-stage-study,ANNX,0.740604,Somewhat-Bearish,-0.157162
Annexon Biosciences to Participate in the 22nd Annual Needham Virtual Healthcare Conference,20230411T103000,https://www.globenewswire.com/news-release/2023/04/11/2644185/0/en/Annexon-Biosciences-to-Participate-in-the-22nd-Annual-Needham-Virtual-Healthcare-Conference.html,ANNX,0.874686,Bullish,0.35742
Annexon Reports Fourth Quarter and Year-End 2022 Financial Results and Reiterates Anticipated Milestones,20230306T113000,https://www.globenewswire.com/news-release/2023/03/06/2620852/0/en/Annexon-Reports-Fourth-Quarter-and-Year-End-2022-Financial-Results-and-Reiterates-Anticipated-Milestones.html,ANNX,0.366061,Neutral,0.130637
Annexon Biosciences to Participate in the 43rd Annual Cowen Healthcare Conference,20230227T113000,https://www.globenewswire.com/news-release/2023/02/27/2615857/0/en/Annexon-Biosciences-to-Participate-in-the-43rd-Annual-Cowen-Healthcare-Conference.html,ANNX,0.874686,Bullish,0.353806
Annexon Reports Inducement Grants to New Employees Under Nasdaq Listing Rule 5635 ( c )  ( 4 )  - Annexon  ( NASDAQ:ANNX ) ,20230216T210500,https://www.benzinga.com/pressreleases/23/02/g30950897/annexon-reports-inducement-grants-to-new-employees-under-nasdaq-listing-rule-5635-c-4,ANNX,0.746257,Bullish,0.483172
Annexon Reports Inducement Grant to New Employee Under Nasdaq Listing Rule 5635 ( c )  ( 4 ) ,20230117T213000,https://www.globenewswire.com/news-release/2023/01/17/2590531/0/en/Annexon-Reports-Inducement-Grant-to-New-Employee-Under-Nasdaq-Listing-Rule-5635-c-4.html,ANNX,0.748842,Bullish,0.51896
Annexon Reports Inducement Grant to New Employee Under Nasdaq Listing Rule 5635 ( c )  ( 4 ) ,20230117T213000,https://www.benzinga.com/pressreleases/23/01/g30451541/annexon-reports-inducement-grant-to-new-employee-under-nasdaq-listing-rule-5635-c-4,ANNX,0.730954,Bullish,0.50599
Annexon Highlights Strategic Focus to Advance Four Flagship Complement Programs through Late-Stage Development and Progress Across Three Therapeutic Franchises,20230108T140000,https://www.globenewswire.com/news-release/2023/01/08/2584729/0/en/Annexon-Highlights-Strategic-Focus-to-Advance-Four-Flagship-Complement-Programs-through-Late-Stage-Development-and-Progress-Across-Three-Therapeutic-Franchises.html,ANNX,0.372027,Neutral,0.148518
Annexon Highlights Strategic Focus to Advance Four Flagship Complement Programs through Late-Stage Development and Progress Across Three Therapeutic Franchises - Annexon  ( NASDAQ:ANNX ) ,20230108T140000,https://www.benzinga.com/pressreleases/23/01/g30323708/annexon-highlights-strategic-focus-to-advance-four-flagship-complement-programs-through-late-stage,ANNX,0.352223,Somewhat-Bullish,0.181715
"Annexon Appoints Industry Veteran, Dr. Rick Artis, as Chief Scientific Officer to Support the Advancement and Expansion of Complement-focused Portfolio",20230106T113000,https://www.globenewswire.com/news-release/2023/01/06/2584298/0/en/Annexon-Appoints-Industry-Veteran-Dr-Rick-Artis-as-Chief-Scientific-Officer-to-Support-the-Advancement-and-Expansion-of-Complement-focused-Portfolio.html,ANNX,0.68145,Bullish,0.493496
"Annexon Appoints Industry Veteran, Dr. Rick Artis, as Chief Scientific Officer to Support the Advancement and Expansion of Complement-focused Portfolio - Annexon  ( NASDAQ:ANNX ) ",20230106T113000,https://www.benzinga.com/pressreleases/23/01/g30307799/annexon-appoints-industry-veteran-dr-rick-artis-as-chief-scientific-officer-to-support-the-advance,ANNX,0.672864,Bullish,0.488192
Annexon to Present at 41st Annual J.P. Morgan Healthcare Conference,20230104T113000,https://www.globenewswire.com/news-release/2023/01/04/2582723/0/en/Annexon-to-Present-at-41st-Annual-J-P-Morgan-Healthcare-Conference.html,ANNX,0.874686,Bullish,0.35742
Annexon to Present at 41st Annual J.P. Morgan Healthcare Conference - Annexon  ( NASDAQ:ANNX ) ,20230104T113000,https://www.benzinga.com/pressreleases/23/01/g30270433/annexon-to-present-at-41st-annual-j-p-morgan-healthcare-conference,ANNX,0.855251,Bullish,0.351275
"Wall Street Analysts Think Annexon, Inc.  ( ANNX )  Could Surge 241%: Read This Before Placing a Bet",20221201T145527,https://www.zacks.com/stock/news/2024227/wall-street-analysts-think-annexon-inc-annx-could-surge-241-read-this-before-placing-a-bet,ANNX,0.284861,Bullish,0.366893
"How Much Upside is Left in Annexon, Inc.  ( ANNX ) ? Wall Street Analysts Think 246%",20221115T145516,https://www.zacks.com/stock/news/2018429/how-much-upside-is-left-in-annexon-inc-annx-wall-street-analysts-think-246,ANNX,0.286864,Bullish,0.359395
Annexon Reports Third Quarter 2022 Financial Results and Plans to Provide Updates on Complement Therapeutic Portfolio in January 2023,20221103T103000,https://www.globenewswire.com/news-release/2022/11/03/2547351/0/en/Annexon-Reports-Third-Quarter-2022-Financial-Results-and-Plans-to-Provide-Updates-on-Complement-Therapeutic-Portfolio-in-January-2023.html,ANNX,0.340194,Somewhat-Bullish,0.228482
Annexon Reports Inducement Grants to New Employees Under Nasdaq Listing Rule 5635 ( c )  ( 4 ) ,20220916T200100,https://www.globenewswire.com/news-release/2022/09/16/2517825/0/en/Annexon-Reports-Inducement-Grants-to-New-Employees-Under-Nasdaq-Listing-Rule-5635-c-4.html,ANNX,0.767202,Bullish,0.49683
Annexon Reports Inducement Grants to New Employees Under Nasdaq Listing Rule 5635 ( c )  ( 4 )  - Annexon  ( NASDAQ:ANNX ) ,20220916T200100,https://www.benzinga.com/pressreleases/22/09/g28902001/annexon-reports-inducement-grants-to-new-employees-under-nasdaq-listing-rule-5635-c-4,ANNX,0.748842,Bullish,0.483733
BioCryst Pharmaceuticals  ( NASDAQ:BCRX )  - BioCryst Names Dr. Bill Sheridan Chief Development Officer and Appoints Dr. Ryan Arnold Chief Medical Officer,20220914T200110,https://www.benzinga.com/pressreleases/22/09/g28872104/biocryst-names-dr-bill-sheridan-chief-development-officer-and-appoints-dr-ryan-arnold-chief-medica,ANNX,0.06623,Neutral,0.044129
BioCryst Names Dr. Bill Sheridan Chief Development Officer and Appoints Dr. Ryan Arnold Chief Medical Officer,20220914T200100,https://www.globenewswire.com/news-release/2022/09/14/2516384/29446/en/BioCryst-Names-Dr-Bill-Sheridan-Chief-Development-Officer-and-Appoints-Dr-Ryan-Arnold-Chief-Medical-Officer.html,ANNX,0.069697,Neutral,0.045268
Co. Advancing Drug Class With Broad Potential,20220914T160429,https://www.investorideas.com/news/2022/biotech/09142Advancing-Drug-Class.asp,ANNX,0.083687,Neutral,-0.034947
Annexon Reports Inducement Grants to New Employees Under Nasdaq Listing Rule 5635 ( c )  ( 4 ) ,20220817T200500,https://www.globenewswire.com/news-release/2022/08/17/2500377/0/en/Annexon-Reports-Inducement-Grants-to-New-Employees-Under-Nasdaq-Listing-Rule-5635-c-4.html,ANNX,0.775204,Bullish,0.483492
Annexon Reports Inducement Grants to New Employees Under Nasdaq Listing Rule 5635 ( c )  ( 4 ) ,20220817T200500,https://www.benzinga.com/pressreleases/22/08/g28541480/annexon-reports-inducement-grants-to-new-employees-under-nasdaq-listing-rule-5635-c-4,ANNX,0.471718,Bullish,0.374621
ANNX: Insider Buying Sends Annexon Stock Higher. But Does That Make It a Buy?,20220721T131546,https://stocknews.com/news/annx-vrtx-amgn-biib-insider-buying-sends-annexon-stock-higher-but-does-that-make/,ANNX,0.740328,Somewhat-Bullish,0.27022
ANNX: 4 Penny Stocks to Target Following the Latest Jobs Report,20220714T144552,https://stocknews.com/news/annx-apre-ysg-endp-4-penny-stocks-to-target-following-the-latest-jobs-report/,ANNX,0.280615,Neutral,0.147796
"The Daily Biotech Pulse: GSK To Supply 50M Flu Vaccine Doses To US, FDA Lifts Hold On Greenwich's Cancer Immunotherapy Trial, Connect Biopharma Sees CBP-201 Topline Data Sooner",20220712T130420,https://www.benzinga.com/general/biotech/22/07/28031430/the-daily-biotech-pulse-gsk-to-supply-50m-flu-vaccine-doses-to-us-fda-lifts-hold-on-greenwichs-ca,ANNX,0.115232,Neutral,0.115886
Annexon Closes $130 Million Private Placement Extending its Operating Runway into the Second Half of 2025,20220711T222500,https://www.globenewswire.com/news-release/2022/07/11/2477683/0/en/Annexon-Closes-130-Million-Private-Placement-Extending-its-Operating-Runway-into-the-Second-Half-of-2025.html,ANNX,0.381861,Somewhat-Bullish,0.305135
Annexon Closes $130 Million Private Placement Extending its Operating Runway into the Second Half of 2025,20220711T222500,https://www.benzinga.com/pressreleases/22/07/g28026055/annexon-closes-130-million-private-placement-extending-its-operating-runway-into-the-second-half-o,ANNX,0.378181,Somewhat-Bullish,0.300703
"Tesla, Twitter And 76 Biggest Movers From Friday",20220711T113029,https://www.benzinga.com/news/22/07/28014980/tesla-twitter-and-76-biggest-movers-from-friday,ANNX,0.056741,Neutral,0.139954
Best Penny Stocks To Buy Now? 4 To Watch After Jobs Report,20220708T143353,https://pennystocks.com/featured/2022/07/08/best-penny-stocks-buy-now-4-watch-jobs-report/,ANNX,0.116447,Somewhat-Bullish,0.2473
"The Daily Biotech Pulse: Pfizer Inks Pact With Africa For COVID-19 Pills, Emergent Bio & Ridgeback To Increase Access To Ebola Treatment, ADC Therapeutics & Sobi In European Pact For Lymphoma Drug",20220708T121902,https://www.benzinga.com/general/biotech/22/07/27998206/the-daily-biotech-pulse-pfizer-inks-pact-with-africa-for-covid-19-pills-emergent-bio-ridgeback-to,ANNX,0.126985,Neutral,0.000447
Annexon Announces $130 Million Private Placement Financing,20220708T110000,https://www.globenewswire.com/news-release/2022/07/08/2476488/0/en/Annexon-Announces-130-Million-Private-Placement-Financing.html,ANNX,0.486054,Neutral,0.024683
Annexon Announces $130 Million Private Placement Financing,20220708T110000,https://www.benzinga.com/pressreleases/22/07/g27997941/annexon-announces-130-million-private-placement-financing,ANNX,0.4232,Neutral,0.026843
79 Biggest Movers From Yesterday,20220608T080800,https://www.benzinga.com/news/22/06/27602286/79-biggest-movers-from-yesterday,ANNX,0.090145,Neutral,-0.001855
Annexon Touts Final Huntington's Trial Data Confirming No New Safety Issues,20220607T161903,https://www.benzinga.com/general/biotech/22/06/27591329/annexon-touts-final-huntingtons-trial-data-confirming-no-new-safety-issues,ANNX,0.547593,Neutral,0.009164
Annexon Biosciences Reports Phase 2 Clinical Trial Results Demonstrating Upstream Classical Complement Inhibition Associated with Clinical Benefit in Huntington's Disease,20220607T103000,https://www.globenewswire.com/news-release/2022/06/07/2457463/0/en/Annexon-Biosciences-Reports-Phase-2-Clinical-Trial-Results-Demonstrating-Upstream-Classical-Complement-Inhibition-Associated-with-Clinical-Benefit-in-Huntington-s-Disease.html,ANNX,0.189076,Somewhat-Bullish,0.213885
Annexon Biosciences to Present at the 2022 Jefferies Healthcare Conference,20220602T103000,https://www.globenewswire.com/news-release/2022/06/02/2454978/0/en/Annexon-Biosciences-to-Present-at-the-2022-Jefferies-Healthcare-Conference.html,ANNX,0.820913,Neutral,0.059198
Annexon Biosciences to Present at the 2022 Jefferies Healthcare Conference,20220602T103000,https://www.benzinga.com/pressreleases/22/06/g27517261/annexon-biosciences-to-present-at-the-2022-jefferies-healthcare-conference,ANNX,0.725852,Neutral,0.062903
Annexon Biosciences to Present Data Highlighting Novel Approach to Treating Complement-Driven Diseases at Upcoming Medical Meetings,20220601T113000,https://www.globenewswire.com/news-release/2022/06/01/2454125/0/en/Annexon-Biosciences-to-Present-Data-Highlighting-Novel-Approach-to-Treating-Complement-Driven-Diseases-at-Upcoming-Medical-Meetings.html,ANNX,0.323184,Neutral,0.079376
103 Biggest Movers From Yesterday,20220511T102237,https://www.benzinga.com/news/22/05/27130447/103-biggest-movers-from-yesterday,ANNX,0.06399,Neutral,-0.035967
"ADCT Awaits Cami Trial Data, CSTL Boosts Revenue Outlook, ANNX To Report HD Trial Data In Q2",20220510T094515,https://markets.businessinsider.com/news/stocks/adct-awaits-cami-trial-data-cstl-boosts-revenue-outlook-annx-to-report-hd-trial-data-in-q2-1031440845,ANNX,0.065452,Neutral,0.125946
Annexon Biosciences to Participate in Upcoming May Investor Conferences,20220505T103000,https://www.benzinga.com/pressreleases/22/05/g27013929/annexon-biosciences-to-participate-in-upcoming-may-investor-conferences,ANNX,0.633388,Neutral,0.050372
53 Biggest Movers From Yesterday,20220421T085205,https://www.benzinga.com/news/22/04/26731039/53-biggest-movers-from-yesterday,ANNX,0.068836,Neutral,0.000828
What Are Penny Stocks? What You Need to Know and 3 to Watch,20220420T194134,https://pennystocks.com/featured/2022/04/20/what-are-penny-stocks-what-need-know-3-watch/,ANNX,0.128523,Neutral,0.125917
54 Biggest Movers From Yesterday,20220420T094334,https://www.benzinga.com/news/22/04/26706319/54-biggest-movers-from-yesterday,ANNX,0.103524,Neutral,0.00183
38 Stocks Moving In Tuesday's Mid-Day Session,20220419T161631,https://www.benzinga.com/news/22/04/26694580/38-stocks-moving-in-tuesdays-mid-day-session,ANNX,0.15119,Neutral,0.00042
23 Stocks Moving in Tuesday's Pre-Market Session,20220419T103745,https://www.benzinga.com/news/22/04/26682742/23-stocks-moving-in-tuesdays-pre-market-session,ANNX,0.190117,Neutral,0.000243
Stocks That Hit 52-Week Lows On Monday,20220418T154044,https://www.benzinga.com/news/22/04/26669813/stocks-that-hit-52-week-lows-on-monday,ANNX,0.005428,Neutral,-0.013213
Stocks That Hit 52-Week Lows On Friday,20220408T163534,https://www.benzinga.com/news/22/04/26547302/stocks-that-hit-52-week-lows-on-friday,ANNX,0.011399,Neutral,-0.005653
"Annexon Biosciences Completes Enrollment in ARCHER Phase 2 Trial of Novel C1q Inhibitor, ANX007, in Patients with Geographic Atrophy",20220407T103000,https://www.globenewswire.com/news-release/2022/04/07/2418284/0/en/Annexon-Biosciences-Completes-Enrollment-in-ARCHER-Phase-2-Trial-of-Novel-C1q-Inhibitor-ANX007-in-Patients-with-Geographic-Atrophy.html,ANNX,0.347432,Somewhat-Bullish,0.307787
Stocks That Hit 52-Week Lows On Monday,20220404T160501,https://www.benzinga.com/news/22/04/26453944/stocks-that-hit-52-week-lows-on-monday,ANNX,0.031491,Neutral,-0.008559
Annexon Biosciences to Participate in the 21st Annual Needham Virtual Healthcare Conference,20220404T103000,https://www.globenewswire.com/news-release/2022/04/04/2415510/0/en/Annexon-Biosciences-to-Participate-in-the-21st-Annual-Needham-Virtual-Healthcare-Conference.html,ANNX,0.702913,Neutral,0.034113
Annexon Biosciences to Participate in the 21st Annual Needham Virtual Healthcare Conference,20220404T103000,https://www.benzinga.com/pressreleases/22/04/g26444887/annexon-biosciences-to-participate-in-the-21st-annual-needham-virtual-healthcare-conference,ANNX,0.668612,Neutral,0.049633
Stocks That Hit 52-Week Lows On Friday,20220401T170001,https://www.benzinga.com/news/22/04/26425809/stocks-that-hit-52-week-lows-on-friday,ANNX,0.021113,Neutral,-0.026488
Stocks That Hit 52-Week Lows On Thursday,20220331T181044,https://www.benzinga.com/news/22/03/26401822/stocks-that-hit-52-week-lows-on-thursday,ANNX,0.02511,Neutral,-0.025102
Stocks That Hit 52-Week Lows On Wednesday,20220330T164203,https://www.benzinga.com/news/22/03/26376884/stocks-that-hit-52-week-lows-on-wednesday,ANNX,0.067177,Neutral,-0.027664
Stocks That Hit 52-Week Lows On Tuesday,20220329T154325,https://www.benzinga.com/news/22/03/26352676/stocks-that-hit-52-week-lows-on-tuesday,ANNX,0.027837,Neutral,-0.010405
Stocks That Hit 52-Week Lows On Monday,20220328T154408,https://www.benzinga.com/news/22/03/26326033/stocks-that-hit-52-week-lows-on-monday,ANNX,0.016131,Neutral,-0.050564
Stocks That Hit 52-Week Lows On Wednesday,20220323T154749,https://www.benzinga.com/news/22/03/26261101/stocks-that-hit-52-week-lows-on-wednesday,ANNX,0.03456,Neutral,-0.030484
Stocks That Hit 52-Week Lows On Tuesday,20220315T163235,https://www.benzinga.com/news/22/03/26148458/stocks-that-hit-52-week-lows-on-tuesday,ANNX,0.00539,Neutral,-0.038652
MiroBio Continues Expansion of Executive Leadership Team with Key Appointments to Advance Development of Checkpoint Agonist Antibodies for Autoimmune Disease,20220308T113000,https://www.benzinga.com/pressreleases/22/03/g26034189/mirobio-continues-expansion-of-executive-leadership-team-with-key-appointments-to-advance-developm,ANNX,0.046724,Somewhat-Bullish,0.170835
