title,time_published,url,ticker,relevance_score,ticker_sentiment_label,ticker_sentiment_score
"Small-Cell Lung Cancer Market to Accelerate Substantially During the Study Period  ( 2019-2032 ) , Assesses DelveInsight | Leading Companies - Amgen, Novartis, AbbVie, BMS, Clovis Oncology, Cardiff Oncology, Roche, Daiichi Sankyo",20231004T210100,https://www.prnewswire.com/news-releases/small-cell-lung-cancer-market-to-accelerate-substantially-during-the-study-period-20192032-assesses-delveinsight--leading-companies----amgen-novartis-abbvie-bms-clovis-oncology-cardiff-oncology-roche-daiichi-sankyo-301946615.html,APLM,0.021778,Neutral,-0.092267
"Why Bed Bath & Beyond Shares Are Trading Lower By 23%; Here Are 20 Stocks Moving Premarket - Bed Bath & Beyond  ( NASDAQ:BBBY ) , Apollomics  ( NASDAQ:APLM ) ",20230426T123739,https://www.benzinga.com/news/23/04/32009221/why-bed-bath-beyond-shares-are-trading-lower-by-23-here-are-20-stocks-moving-premarket,APLM,0.188683,Neutral,-0.033848
Bispecific Antibody Clinical Trial Pipeline Appears Robust With 250+ Key Pharma Companies Actively Working in the Therapeutics Segment | DelveInsight,20230703T210100,https://www.prnewswire.com/news-releases/bispecific-antibody-clinical-trial-pipeline-appears-robust-with-250-key-pharma-companies-actively-working-in-the-therapeutics-segment--delveinsight-301868673.html,APLM,0.020404,Neutral,-0.004464
"Why First Republic Bank Shares Are Trading Lower By 34%; Here Are 20 Stocks Moving Premarket - Dunxin Financial Hldgs  ( AMEX:DXF ) , Apollomics  ( NASDAQ:APLM ) ",20230501T130719,https://www.benzinga.com/news/23/05/32118728/why-first-republic-bank-shares-are-trading-lower-by-34-here-are-20-stocks-moving-premarket,APLM,0.162255,Somewhat-Bearish,-0.234753
"Why Salesforce Shares Are Trading Higher By Over 9%; Here Are 20 Stocks Moving Premarket - Aditxt  ( NASDAQ:ADTX ) , Ampio Pharmaceuticals  ( AMEX:AMPE ) ",20231130T130137,https://www.benzinga.com/news/23/11/36020980/why-salesforce-shares-are-trading-higher-by-over-9-here-are-20-stocks-moving-premarket,APLM,0.132368,Bearish,-0.356381
"Why UP Fintech Shares Are Trading Higher By Around 7%; Here Are 20 Stocks Moving Premarket - AgriFORCE Growing Systems  ( NASDAQ:AGRI ) , Apollomics  ( NASDAQ:APLM ) ",20231127T131025,https://www.benzinga.com/news/23/11/35956771/why-up-fintech-shares-are-trading-higher-by-around-7-here-are-20-stocks-moving-premarket,APLM,0.145145,Neutral,0.069925
Why Chipotle Shares Are Trading Higher By 13%? Here Are Other Stocks Moving In Wednesday's Mid-Day Session,20230426T181251,https://markets.businessinsider.com/news/stocks/why-chipotle-shares-are-trading-higher-by-13-here-are-other-stocks-moving-in-wednesday-s-mid-day-session-1032264876,APLM,0.064623,Neutral,-0.02414
"Acuity Brands, C3.ai And Other Big Stocks Moving Lower On Tuesday - XIAO-I  ( NASDAQ:AIXI ) , C3.ai  ( NYSE:AI ) ",20230404T145743,https://www.benzinga.com/news/23/04/31659315/acuity-brands-c3-ai-and-other-big-stocks-moving-lower-on-tuesday,APLM,0.249106,Bearish,-0.623681
