title,time_published,url,ticker,relevance_score,ticker_sentiment_label,ticker_sentiment_score
This Healthcare Stock Is Trading Higher By 148%: Here Are 40 Stocks Moving Premarket,20220803T115008,https://www.benzinga.com/news/22/08/28328611/this-healthcare-stock-is-trading-higher-by-148-here-are-40-stocks-moving-premarket,AYX,0.076971,Somewhat-Bullish,0.21937
Stocks That Hit 52-Week Lows On Monday,20220613T161842,https://www.benzinga.com/markets/options/22/06/27677156/52-weeks-high-and-low-article,AYX,0.005366,Neutral,-0.000512
"Location Analytics Tools Market to grow by USD 11.84 billion from 2021 to 2026, Market driven by the rise in ... - PR Newswire",20230915T073500,https://www.prnewswire.com/news-releases/location-analytics-tools-market-to-grow-by-usd-11-84-billion-from-2021-to-2026--market-driven-by-the-rise-in-awareness-of-location-enabled-services--technavio-301928501.html,AYX,0.056275,Neutral,0.0
The Geospatial Analytics Market to grow by USD 102.97 billion between 2022 to 2027|Alphabet Inc. and Alteryx Inc ... - PR Newswire,20230728T160000,https://www.prnewswire.com/news-releases/the-geospatial-analytics-market-to-grow-by-usd-102-97-billion-between-2022-to-2027alphabet-inc-and-alteryx-inc-are-major-vendors---technavio-301887575.html,AYX,0.032871,Neutral,0.102575
"Geographic Information System Analytics Market Size to Grow by USD 17.61 Bn, Retail and Real Estate to be Largest Revenue-generating End-user Segment - Technavio",20221013T231500,https://www.prnewswire.com/news-releases/geographic-information-system-analytics-market-size-to-grow-by-usd-17-61-bn-retail-and-real-estate-to-be-largest-revenue-generating-end-user-segment---technavio-301647644.html,AYX,0.038468,Neutral,0.041405
USD 80.74 Bn growth expected in Geospatial Analytics Market -- Driven by rising applications of geospatial data analytics in disaster management,20220827T030000,https://www.prnewswire.com/news-releases/usd-80-74-bn-growth-expected-in-geospatial-analytics-market--driven-by-rising-applications-of-geospatial-data-analytics-in-disaster-management-301612278.html,AYX,0.053509,Neutral,0.0
Global Location Analytics Market to Reach $24.9 Billion by 2026,20220628T101500,https://www.prnewswire.com/news-releases/global-location-analytics-market-to-reach-24-9-billion-by-2026--301575761.html,AYX,0.061774,Neutral,0.000611
"Earnings Scheduled For May 3, 2022",20220503T085235,https://www.benzinga.com/news/earnings/22/05/26953640/earnings-scheduled-for-may-3-2022,AYX,0.01558,Neutral,-0.062652
"Why Alteryx Shares Are Trading Higher By Over 10%; Here Are 20 Stocks Moving Premarket - Aeva Technologies  ( NYSE:AEVA ) , AppHarvest  ( NASDAQ:APPH ) ",20230210T133135,https://www.benzinga.com/news/23/02/30853869/why-alteryx-shares-are-trading-higher-by-over-10-here-are-20-stocks-moving-premarket,AYX,0.124164,Somewhat-Bullish,0.230871
"Datadog, Tripadvisor, Myriad Genetics, Planet Fitness And Other Big Stocks Moving Higher On Tuesday - Appian  ( NASDAQ:APPN ) , Augmedix  ( NASDAQ:AUGX ) ",20231107T155442,https://www.benzinga.com/news/23/11/35648180/datadog-tripadvisor-myriad-genetics-planet-fitness-and-other-big-stocks-moving-higher-on-tuesday,AYX,0.146916,Bullish,0.521295
"Why MediaAlpha Shares Jumped Around 30%; Here Are 112 Biggest Movers From Friday - Alcoa  ( NYSE:AA ) , Adient  ( NYSE:ADNT ) ",20221107T080741,https://www.benzinga.com/news/22/11/29586663/why-mediaalpha-shares-jumped-around-30-here-are-112-biggest-movers-from-friday,AYX,0.03443,Neutral,0.0
Pigment announces $88 million Series C,20230608T120000,https://www.prnewswire.com/news-releases/pigment-announces-88-million-series-c-301845489.html,AYX,0.091335,Neutral,0.128017
