title,time_published,url,ticker,relevance_score,ticker_sentiment_label,ticker_sentiment_score
"Crude Oil Drops Sharply; Best Buy Earnings Top Expectations - Annexon  ( NASDAQ:ANNX ) , Digital Turbine  ( NASDAQ:APPS ) ",20230525T183908,https://www.benzinga.com/news/earnings/23/05/32582243/crude-oil-drops-sharply-best-buy-earnings-top-expectations,BBY,0.175009,Neutral,-0.040112
Stocks That Hit 52-Week Lows On Monday,20220613T161842,https://www.benzinga.com/markets/options/22/06/27677156/52-weeks-high-and-low-article,BBY,0.005366,Neutral,0.037999
Stocks That Hit 52-Week Lows On Monday,20220516T175917,https://www.benzinga.com/markets/options/22/05/27226401/52-weeks-high-and-low-article,BBY,0.026147,Neutral,-0.005872
"UPS reaches tentative contract with 340,000 unionized workers potentially dodging calamitous strike",20230725T155500,https://apnews.com/article/ups-teamsters-strike-labor-logistics-delivery-a94482dbff7bfb67ad82f607ab127672,BBY,0.051886,Neutral,-0.051
Hestia Capital could be preparing to shake up the board at Pitney Bowes,20221210T133016,https://www.cnbc.com/2022/12/10/hestia-capital-could-be-preparing-to-shake-up-the-board-at-pitney-bowes.html,BBY,0.042122,Neutral,0.075446
Here's how retailers are tackling the delivery challenges that come with skyrocketing e-commerce sales post-COVID,20220308T184700,https://www.marketwatch.com/story/heres-how-retailers-are-tackling-the-delivery-challenges-that-come-with-skyrocketing-e-commerce-sales-post-covid-11646765225,BBY,0.052813,Neutral,0.042339
"Retail Trends Unwrapped: Analyst Unveils Surprising Shifts In Consumer Spending As 2023 Looms - Nordstrom  ( NYSE:JWN ) , Target  ( NYSE:TGT ) , Dollar Gen  ( NYSE:DG ) , Dollar Tree  ( NASDAQ:DLTR ) ",20231229T182106,https://www.benzinga.com/analyst-ratings/analyst-color/23/12/36430219/retail-trends-unwrapped-analyst-unveils-surprising-shifts-in-consumer-spending-as-2,BBY,0.178459,Somewhat-Bullish,0.307179
"With Resale App TipTop, Postmates Founder Bastian Lehmann Wants To Turn Your Junk Into Cash",20230921T150010,https://www.forbes.com/sites/alexkonrad/2023/09/21/with-resale-app-tiptop-postmates-founder-bastian-lehmann-wants-to-turn-your-junk-into-cash/,BBY,0.023464,Neutral,0.09691
"TikTok ban, Supreme Court student loan hearing and Tesla Investor Day top week ahead",20230227T050559,https://www.foxbusiness.com/markets/tiktok-ban-supreme-court-student-loan-hearing-tesla-investor-day-top-week-ahead,BBY,0.034332,Neutral,0.0
Meet The Midwestern Retailer Quietly Making A Fortune Selling Used Stuff - And Beating The S&P 500,20220701T103000,https://www.forbes.com/sites/laurendebter/2022/06/30/winmark-corporation-platos-closet-secondhand-resale/,BBY,0.038204,Somewhat-Bullish,0.168669
Want Dividends? Check Out These 3 Stocks,20240717T223200,https://www.fool.com/investing/2024/07/17/want-dividends-check-out-these-3-stocks/,BBY,0.075635,Neutral,0.05652
"Stocks Fall As Salesforce, Dell Dive On Earnings: Weekly Review",20240531T154000,https://www.investors.com/news/stock-market-retreats-salesforce-dell-earnings-losers/,BBY,0.043499,Somewhat-Bearish,-0.177165
"Baidu To $180? Plus This Analyst Cuts PT On MacroGenics By 56% - Arvinas  ( NASDAQ:ARVN ) , American Eagle Outfitters  ( NYSE:AEO ) ",20221123T155641,https://www.benzinga.com/news/22/11/29841487/baidu-to-180-plus-this-analyst-cuts-pt-on-macrogenics-by-56,BBY,0.721785,Somewhat-Bullish,0.319136
"Dow Jumps Over 300 Points; S&P 500 Rises 1% - American Res  ( NASDAQ:AREC ) , Agora  ( NASDAQ:API ) ",20221122T192313,https://www.benzinga.com/news/earnings/22/11/29829239/dow-jumps-over-300-points-s-p-500-rises-1,BBY,0.213674,Somewhat-Bullish,0.304667
"Crude Oil Surges 2%; Best Buy Posts Upbeat Earnings - Best Buy Co  ( NYSE:BBY ) , Agora  ( NASDAQ:API ) ",20221122T174032,https://www.benzinga.com/news/earnings/22/11/29827589/crude-oil-surges-2-best-buy-posts-upbeat-earnings,BBY,0.217508,Somewhat-Bullish,0.30867
The World's Best Vodka-According To The 2024 TAG Global Spirit Awards,20240519T093544,https://www.forbes.com/sites/bradjaphe/2024/05/19/the-worlds-best-vodka-according-to-the-2024-tag-global-spirit-awards/,BBY,0.077593,Somewhat-Bullish,0.261552
Strategic Innovation: 5 Point Plan To Renew Successful Organizations,20240502T142055,https://www.forbes.com/sites/andrewbinns/2024/05/02/strategic-innovation-5-point-plan-to-renew-successful-organizations/,BBY,0.133396,Somewhat-Bullish,0.238984
Stocks That Hit 52-Week Lows On Wednesday,20220518T160908,https://www.benzinga.com/markets/options/22/05/27281415/52-weeks-high-and-low-article,BBY,0.023291,Neutral,0.069529
Hanesbrands Q3 Earnings on the Horizon: Key Insights for Investors,20241105T173700,https://www.zacks.com/stock/news/2364672/hanesbrands-q3-earnings-on-the-horizon-key-insights-for-investors,BBY,0.166169,Neutral,0.076937
Sonos' new chief commercial officer dishes on her plans to overhaul its marketing strategy and turbocharge its share of the audio market,20231115T165900,https://www.businessinsider.com/sonos-hires-first-ever-chief-commercial-officer-deirdre-findlay-2023-11,BBY,0.058047,Somewhat-Bullish,0.167999
Best Buy's  ( BBY )  Omnichannel Moves Appear Encouraging,20230413T140700,https://www.zacks.com/stock/news/2078316/best-buys-bby-omnichannel-moves-appear-encouraging,BBY,0.490746,Bullish,0.568084
"Why Shopify, CrowdStrike, and Roku Slumped Thursday -- but Shouldn't Have",20230309T203506,https://www.fool.com/investing/2023/03/09/why-shopify-crowdstrike-and-roku-slumped-thursday/,BBY,0.053749,Neutral,0.110014
Retailers could face cost cuts and slower sales this year,20230219T130002,https://www.cnbc.com/2023/02/19/walmart-home-depot-earnings-preview.html,BBY,0.038101,Neutral,0.076902
Walmart takes a cautious approach to holiday hiring,20220921T132255,https://apnews.com/article/holidays-124ff5082390a8abf05e698d15e3e9ab,BBY,0.076115,Neutral,0.0
Walmart takes a cautious approach to holiday hiring,20220921T132255,https://apnews.com/article/holidays-124ff5082390a8abf05e698d15e3e9ab,BBY,0.074692,Neutral,0.0
"Vera Bradley, Inc. Announces Media Business Executive Jessica Rodriguez to Join Board of Directors - Vera Bradley  ( NASDAQ:VRA ) ",20240126T210146,https://www.benzinga.com/pressreleases/24/01/g36809135/vera-bradley-inc-announces-media-business-executive-jessica-rodriguez-to-join-board-of-directors,BBY,0.034282,Neutral,0.017306
"Vera Bradley, Inc. Announces Media Business Executive Jessica Rodriguez to Join Board of Directors",20240126T210100,https://www.globenewswire.com/news-release/2024/01/26/2818285/17650/en/Vera-Bradley-Inc-Announces-Media-Business-Executive-Jessica-Rodriguez-to-Join-Board-of-Directors.html,BBY,0.035189,Neutral,0.017365
Here are all the best back-to-school sales for the whole family,20230728T174458,https://www.cnn.com/cnn-underscored/deals/best-back-to-school-sales-2023-07-28,BBY,0.022264,Neutral,0.081057
"Zuckerberg fallout, EBT tech issue, Powell speech reaction and more: Monday's 5 things to know",20220829T052643,https://www.foxbusiness.com/markets/zuckerberg-fallout-ebt-tech-issue-powell-speech-reaction-mondays-5-things-know,BBY,0.032558,Neutral,0.0
"Jobs data, Bed Bath & Beyond update, Best Buy earnings top week ahead",20220829T001226,https://www.foxbusiness.com/markets/jobs-data-bed-bath-beyond-update-best-buy-earnings-week-ahead,BBY,0.046095,Neutral,0.0
Kroger Customers Feel the Price Pinch and Other Market News,20220627T205700,https://www.fool.com/investing/2022/06/27/kroger-customers-feel-the-price-pinch-and-other-ma/,BBY,0.012756,Neutral,-0.012534
