title,time_published,url,ticker,relevance_score,ticker_sentiment_label,ticker_sentiment_score
"Stocks That Hit 52-Week Lows On Wednesday - Bristol-Myers Squibb Company Common Stock  ( NYSE:BMY ) , SenesTech, Inc. - Common Stock  ( NASDAQ:SNES ) ",20231004T160117,https://www.benzinga.com/markets/options/23/10/35092508/stocks-that-hit-52-week-lows-on-wednesday,BLYQ,0.006354,Neutral,-0.090814
Junior Achievement of Southern California Empowers the Next Generation Through New Financial Literacy-Focused Marketing Campaign,20240408T184024,https://www.benzinga.com/pressreleases/24/04/g38148716/junior-achievement-of-southern-california-empowers-the-next-generation-through-new-financial-liter,BLYQ,0.042496,Neutral,0.139264
Best Penny Stocks This Week? 4 Short Squeeze Stocks To Watch,20230222T173500,https://pennystocks.com/featured/2023/02/22/best-penny-stocks-this-week-4-short-squeeze-stocks-to-watch-february-2023/,BLYQ,0.033799,Neutral,0.13654
"How does MLB take over a local broadcast? Even with months of planning, it's a mad scramble",20230719T011300,https://apnews.com/article/mlb-padres-tv-bally-diamond-takeover-7e7a6c833d5f7dae64142c37f37d6f19,BLYQ,0.126561,Neutral,0.079211
"Bally's Corporation  ( BALY )  Reports Q2 Loss, Misses Revenue Estimates",20230803T123510,https://www.zacks.com/stock/news/2131792/ballys-corporation-baly-reports-q2-loss-misses-revenue-estimates,BLYQ,0.069697,Neutral,-0.004066
