title,time_published,url,ticker,relevance_score,ticker_sentiment_label,ticker_sentiment_score
Why Recursion Pharmaceuticals Shares Are Trading Lower By Around 10%? Here Are Other Stocks Moving In Tuesday's Mid-Day Session - Intel  ( NASDAQ:INTC ) ,20240903T174109,https://www.benzinga.com/news/24/09/40693495/why-recursion-pharmaceuticals-shares-are-trading-lower-by-around-10-here-are-other-stocks-moving-in,BNRG,0.090474,Neutral,0.071763
"Why Guess? Shares Are Trading Lower By Around 15%; Here Are 20 Stocks Moving Premarket - Anghami  ( NASDAQ:ANGH ) , AgileThought  ( NASDAQ:AGIL ) ",20231122T125806,https://www.benzinga.com/news/23/11/35914672/why-guess-shares-are-trading-lower-by-around-15-here-are-20-stocks-moving-premarket,BNRG,0.13459,Somewhat-Bullish,0.200129
Why Ascent Solar Technologies Shares Are Trading Lower By Around 50%? Here Are Other Stocks Moving In Wednesday's Mid-Day Session - Ascent Solar Technologies  ( NASDAQ:ASTI ) ,20240410T180705,https://www.benzinga.com/news/24/04/38189280/why-ascent-solar-technologies-shares-are-trading-lower-by-around-50-here-are-other-stocks-moving-in,BNRG,0.094576,Bearish,-0.39635
"Why iMedia Brands Shares Are Trading Higher By Over 13%; Here Are 20 Stocks Moving Premarket - IMAC Hldgs  ( NASDAQ:BACK ) , Brenmiller Energy  ( NASDAQ:BNRG ) ",20230412T122758,https://www.benzinga.com/news/23/04/31766625/why-imedia-brands-shares-are-trading-higher-by-over-13-here-are-20-stocks-moving-premarket,BNRG,0.148273,Somewhat-Bullish,0.171671
"Why National CineMedia Shares Are Trading Higher By Around 111%; Here Are 20 Stocks Moving Premarket - Agrify  ( NASDAQ:AGFY ) , Brenmiller Energy  ( NASDAQ:BNRG ) ",20230411T122012,https://www.benzinga.com/news/23/04/31741625/why-national-cinemedia-shares-are-trading-higher-by-around-111-here-are-20-stocks-moving-premarket,BNRG,0.163354,Bullish,0.369854
