title,time_published,url,ticker,relevance_score,ticker_sentiment_label,ticker_sentiment_score
"The Zacks Analyst Blog Highlights Lilly, Merck, Roche, Pfizer and Moderna",20220620T092400,https://www.zacks.com/stock/news/1940866/the-zacks-analyst-blog-highlights-lilly-merck-roche-pfizer-and-moderna,BNTX,0.132033,Neutral,-0.02385
"Pharma Stock Roundup: FDA Panel Nod for PFE, MRNA Young Kids' COVID Jabs & More",20220617T123700,https://www.zacks.com/stock/news/1940269/pharma-stock-roundup-fda-panel-nod-for-pfe-mrna-young-kids-covid-jabs-more,BNTX,0.193434,Neutral,-0.015649
"The Daily Biotech Pulse: Roche's Alzheimer's Drug Fails, Advisors Back Pfizer, Moderna Shots For Youngest Kids, Valneva Settles COVID-19 Pact With UK",20220616T140943,https://www.benzinga.com/general/biotech/22/06/27737919/the-daily-biotech-pulse-roches-alzheimers-drug-fails-advisors-back-pfizer-moderna-shots-for-young,BNTX,0.098719,Neutral,-0.002903
"The Daily Biotech Pulse: Moderna Files For 2nd COVID Booster Shot Authorization, Lexicon Secures Debt Funding, Amneal Gets Sub-License to Manufacture Generic COVID Pill",20220318T115038,https://www.benzinga.com/general/biotech/22/03/26197749/the-daily-biotech-pulse-moderna-files-for-2nd-covid-booster-shot-authorization-lexicon-secures-de,BNTX,0.135576,Neutral,0.003182
"The Daily Biotech Pulse: Pfizer-BioNTech COVID-19 Booster Data In Kids, Regeneron's COVID-19 Therapy Decision Pushed, Protagonist's Rusfertide Breakthrough Tag Update And More",20220414T133544,https://www.benzinga.com/general/biotech/22/04/26630399/the-daily-biotech-pulse-pfizer-biontech-covid-19-booster-data-in-kids-regenerons-covid-19-therapy,BNTX,0.125635,Neutral,0.01172
"The Daily Biotech Pulse: Pfizer/BioNTech's COVID-19 Booster For Kids, Moderna Starts First African Trial Of mRNA HIV Vaccine, Tonix Extends COVID-19 Antiviral Research Pact",20220518T141510,https://www.benzinga.com/general/biotech/22/05/27274688/the-daily-biotech-pulse-pfizerbiontechs-covid-19-booster-for-kids-5-11-years-moderna-starts-first,BNTX,0.177193,Neutral,0.023019
"Small-Cell Lung Cancer Market to Accelerate Substantially During the Study Period  ( 2019-2032 ) , Assesses DelveInsight | Leading Companies - Amgen, Novartis, AbbVie, BMS, Clovis Oncology, Cardiff Oncology, Roche, Daiichi Sankyo",20231004T210100,https://www.prnewswire.com/news-releases/small-cell-lung-cancer-market-to-accelerate-substantially-during-the-study-period-20192032-assesses-delveinsight--leading-companies----amgen-novartis-abbvie-bms-clovis-oncology-cardiff-oncology-roche-daiichi-sankyo-301946615.html,BNTX,0.043539,Neutral,-0.042655
"Why Streamline Health Solutions Shares Are Trading Lower By Over 68%? Here Are Other Stocks Moving In Monday's Mid-Day Session - Aldeyra Therapeutics  ( NASDAQ:ALDX ) , Alignment Healthcare  ( NASDAQ:ALHC ) ",20231016T170953,https://www.benzinga.com/news/23/10/35272489/why-streamline-health-solutions-shares-are-trading-lower-by-over-68-here-are-other-stocks-moving-in,BNTX,0.076236,Somewhat-Bearish,-0.234441
Why ContraFect Shares Are Trading Higher By Around 30%; Here Are 20 Stocks Moving Premarket,20231016T131535,https://markets.businessinsider.com/news/stocks/why-contrafect-shares-are-trading-higher-by-around-30-here-are-20-stocks-moving-premarket-1032708380,BNTX,0.105604,Somewhat-Bearish,-0.240048
"Why ContraFect Shares Are Trading Higher By Around 30%; Here Are 20 Stocks Moving Premarket - Ambrx Biopharma  ( NASDAQ:AMAM ) , Amphenol  ( NYSE:APH ) ",20231016T124712,https://www.benzinga.com/news/23/10/35266067/why-contrafect-shares-are-trading-higher-by-around-30-here-are-20-stocks-moving-premarket,BNTX,0.194242,Somewhat-Bearish,-0.318104
"Pancreatic Endocrine Tumor Market is Expected to Expand at a Healthy Growth Rate by 2032, Assesses DelveInsight | Key Companies - Merck, Theradex, SynerGene, Mirati, Novartis, Syntrix Biosystems, Eli Lilly, Boehringer Ingelheim",20230803T210100,https://www.prnewswire.com/news-releases/pancreatic-endocrine-tumor-market-is-expected-to-expand-at-a-healthy-growth-rate-by-2032-assesses-delveinsight--key-companies---merck-theradex-synergene-mirati-novartis-syntrix-biosystems-eli-lilly-boehringer-ingelheim-301892397.html,BNTX,0.02074,Neutral,-0.020974
"Stocks making the biggest moves midday: GameStop, Tesla, FedEx and more",20220318T163340,https://www.cnbc.com/2022/03/18/stocks-making-the-biggest-moves-midday-gamestop-tesla-and-more.html,BNTX,0.086807,Neutral,0.001449
"Cutaneous Melanoma Market is Predicted to Exhibit Remarkable Growth, Predicts DelveInsight | Key Companies - Merck, Amgen, Anaveon, Eisai, Regeneron, BMS, AstraZeneca, Seagen, Novartis, Eli Lilly and Company",20230724T210100,https://www.prnewswire.com/news-releases/cutaneous-melanoma-market-is-predicted-to-exhibit-remarkable-growth-predicts-delveinsight--key-companies---merck-amgen-anaveon-eisai-regeneron-bms-astrazeneca-seagen-novartis-eli-lilly-and-company-301883725.html,BNTX,0.080638,Neutral,0.047754
"Why Huntington Bancshares Shares Surged Around 10%; Here Are 72 Biggest Movers From Friday - Amprius Technologies  ( NYSE:AMPX ) , ALFI  ( NASDAQ:ALF ) ",20221024T093702,https://www.benzinga.com/news/22/10/29374553/why-huntington-bancshares-shares-surged-around-10-here-are-72-biggest-movers-from-friday,BNTX,0.062761,Neutral,0.0
"After a covid-fuelled adrenaline rush, biotech is crashing",20220810T165426,https://www.economist.com/business/2022/08/10/after-a-covid-fuelled-adrenaline-rush-biotech-is-crashing,BNTX,0.068306,Neutral,0.099304
Pfizer  ( PFE )  Q3 2024 Earnings Call Transcript,20241029T213018,https://www.fool.com/earnings/call-transcripts/2024/10/29/pfizer-pfe-q3-2024-earnings-call-transcript/,BNTX,0.016049,Neutral,0.078802
Alkermes Issues Letter to Shareholders Highlighting Skills and Experience of Refreshed Board of Directors - Alkermes  ( NASDAQ:ALKS ) ,20230613T110000,https://www.benzinga.com/pressreleases/23/06/n32831446/alkermes-issues-letter-to-shareholders-highlighting-skills-and-experience-of-refreshed-board-of-di,BNTX,0.009551,Neutral,-0.047079
