title,time_published,url,ticker,relevance_score,ticker_sentiment_label,ticker_sentiment_score
The Smartest Stocks to Buy With $50 Right Now and Hold Forever,20220625T110000,https://www.fool.com/investing/2022/06/25/the-smartest-stocks-to-buy-with-50-right-now-and-h/,BRK-A,0.0532,Neutral,0.002405
"Sea, UiPath, J&J Snack Foods And Other Big Gainers From Tuesday - Evoqua Water Technologies  ( NYSE:AQUA ) , Azenta  ( NASDAQ:AZTA ) ",20221116T073308,https://www.benzinga.com/news/22/11/29742456/sea-uipath-j-j-snack-foods-and-other-big-gainers-from-tuesday,BRK-A,0.137278,Neutral,-0.058948
"HUYA, Tencent Music Entertainment, Taiwan Semiconductor Manufacturing, And Some Other Big Stocks Moving Higher In Today's Pre-Market Session - Alibaba Group Holding  ( NYSE:BABA ) , Azenta  ( NASDAQ:AZTA ) ",20221115T112903,https://www.benzinga.com/news/22/11/29723179/huya-tencent-music-entertainment-taiwan-semiconductor-manufacturing-and-some-other-big-stocks-moving,BRK-A,0.09186,Neutral,-0.090509
How to Invest Confidently in Residential Housing,20220822T193000,https://www.fool.com/investing/2022/08/22/how-to-invest-confidently-in-residential-housing/,BRK-A,0.009944,Neutral,0.061864
"Warren Buffett May Have Been Right to Sell Snowflake Stock. Does That Mean You Should Sell, Too?",20240825T085000,https://www.fool.com/investing/2024/08/25/warren-buffett-right-sell-snowflake-should-sell/,BRK-A,0.058472,Neutral,0.0
Is It Too Late to Buy Micron Technology Stock?,20240720T151300,https://www.fool.com/investing/2024/07/20/is-it-too-late-to-buy-micron-technology-stock/,BRK-A,0.038407,Neutral,0.10375
46% of Warren Buffett's $410 Billion Portfolio Is Invested in 4 Artificial Intelligence  ( AI )  Stocks,20240712T073400,https://www.fool.com/investing/2024/07/12/46-warren-buffett-portfolio-invested-4-ai-stocks/,BRK-A,0.106384,Neutral,0.128988
Best Blue Chip Dividend Stocks to Buy for 2024 and Beyond,20231219T192004,https://www.kiplinger.com/investing/best-blue-chip-dividend-stocks-to-buy,BRK-A,0.073098,Somewhat-Bullish,0.208049
"This Stock Is Beating the Market in 2022, and It's Still a Buy",20220528T112900,https://www.fool.com/investing/2022/05/28/this-stock-is-beating-the-market-in-2022-and-its-s/,BRK-A,0.420283,Neutral,0.026737
Dow and S&P 500: Stocks close mixed after Powell's testimony and fresh jobs data,20230308T192100,https://www.cnn.com/business/live-news/stock-market-house-testimony-jerome-powell-030823/index.html,BRK-A,0.020866,Neutral,-0.052149
"Stocks making the biggest moves midday: Stitch Fix, Tesla, WeWork, Campbell Soup and more",20230308T180631,https://www.cnbc.com/2023/03/08/stocks-making-the-biggest-moves-midday-stitch-fix-tesla-wework-campbell-soup-and-more.html,BRK-A,0.082677,Neutral,0.039054
"Jim Cramer's top 10 things to watch in the stock market Wednesday: Powell Day 2, strong jobs",20230308T142532,https://www.cnbc.com/2023/03/08/jim-cramers-top-10-things-wednesday-powell-day-2-strong-jobs.html,BRK-A,0.058615,Somewhat-Bullish,0.182003
"Stocks making the biggest premarket moves: CrowdStrike, Occidental Petroleum, Tesla and more",20230308T130232,https://www.cnbc.com/2023/03/08/stocks-making-the-biggest-premarket-moves-crwd-oxy-tsla.html,BRK-A,0.090816,Neutral,0.06323
2 Investing Lessons I Learned From the Stock Market in 2022,20221226T111400,https://www.fool.com/investing/2022/12/26/2-investing-lessons-learned-from-the-stock-market/,BRK-A,0.041251,Neutral,-0.066998
"Vera Bradley, WeWork rise; Stitch Fix, Tesla fall",20230308T211736,https://apnews.com/article/financial-markets-stocks-wall-street-ba47a96fc1dd5dfd79e6873ea76efff6,BRK-A,0.282234,Bullish,0.625643
"FreightCar America, Inc. Announces Appointment of Nicholas J. Randall as Chief Operating Officer",20230518T113000,https://www.globenewswire.com/news-release/2023/05/18/2671780/0/en/FreightCar-America-Inc-Announces-Appointment-of-Nicholas-J-Randall-as-Chief-Operating-Officer.html,BRK-A,0.06515,Neutral,0.118167
"FreightCar America, Inc. Announces Appointment of Nicholas J. Randall as Chief Operating Officer - FreightCar America  ( NASDAQ:RAIL ) ",20230518T113000,https://www.benzinga.com/pressreleases/23/05/g32462742/freightcar-america-inc-announces-appointment-of-nicholas-j-randall-as-chief-operating-officer,BRK-A,0.06179,Neutral,0.111024
Mueller Water Products Provides Update on Leadership Team and Board Refreshment - Mueller Water Products  ( NYSE:MWA ) ,20240506T202925,https://www.benzinga.com/pressreleases/24/05/g38654058/mueller-water-products-provides-update-on-leadership-team-and-board-refreshment,BRK-A,0.016518,Neutral,0.011163
75 Biggest Movers From Yesterday,20220322T084232,https://www.benzinga.com/news/22/03/26233669/75-biggest-movers-from-yesterday,BRK-A,0.024987,Neutral,0.006659
46 Stocks Moving In Monday's Mid-Day Session,20220321T164430,https://www.benzinga.com/news/22/03/26224657/46-stocks-moving-in-mondays-mid-day-session,BRK-A,0.040691,Neutral,0.020894
Why Meihua Stock Is Moving Today - Meihua Intl Medical Techs  ( NASDAQ:MHUA ) ,20240731T165510,https://www.benzinga.com/news/24/07/40075984/why-meihua-stock-is-moving-today,BRK-A,0.084722,Somewhat-Bullish,0.176861
Cramer's lightning round: I like Truist,20220321T232615,https://www.cnbc.com/2022/03/21/cramers-lightning-round-i-like-truist.html,BRK-A,0.141393,Bullish,0.936885
Why Psychedelic-Pharma Clearmind Medicine Stock Is Moving Higher - Clearmind Medicine  ( NASDAQ:CMND ) ,20240628T171140,https://www.benzinga.com/news/24/06/39554543/why-psychedelic-pharma-clearmind-medicine-stock-is-moving-higher,BRK-A,0.081552,Somewhat-Bullish,0.171544
What's Going On With Psychedelic Drug-Developers SciSparc And Clearmind Stock? - SciSparc  ( NASDAQ:SPRC ) ,20240220T182921,https://www.benzinga.com/markets/cannabis/24/02/37219436/whats-going-on-with-psychedelic-drug-developers-scisparc-and-clearmind-stock,BRK-A,0.074001,Somewhat-Bullish,0.16933
Proposed Settlement with the Dominican Republic Government,20240604T043000,https://investingnews.com/proposed-settlement-with-the-dominican-republic-government/,BRK-A,0.104228,Neutral,-0.144607
Stock Market Today: Dow Slips on Dreary Economic Data,20240603T201008,https://www.kiplinger.com/investing/stocks/stock-market-today-dow-slips-on-dreary-economic-data,BRK-A,0.076602,Neutral,-0.040922
Don't Believe Your Eyes -- Berkshire Hathaway Isn't a Worthless Stock,20240603T185500,https://www.fool.com/investing/2024/06/03/dont-believe-your-eyes-berkshire-hathaway-isnt-a-w/,BRK-A,0.183198,Neutral,-0.021708
"Warren Buffett Berkshire Hathaway Stock Investors Get A $600,000 Scare",20240603T175700,https://www.investors.com/research/warren-buffett-berkshire-hathaway-brka-stock-brkb/,BRK-A,0.333257,Neutral,-0.116053
Stock market glitch shows Berkshire Hathaway stock down 99% as NYSE deals with technical issues,20240603T144300,https://markets.businessinsider.com/news/stocks/berkshire-hathaway-stock-down-99-stock-market-glitch-nyse-error-2024-6,BRK-A,0.498188,Somewhat-Bullish,0.159369
"Berkshire Hathaway, Chipotle, More NYSE Stocks Hit With Trading Halts Triggered By Technical Issues - Abbott Laboratories  ( NYSE:ABT ) , Ault Disruptive Tech  ( AMEX:ADRT ) ",20240603T143746,https://www.benzinga.com/markets/equities/24/06/39138985/berkshire-hathaway-chipotle-more-nyse-stocks-hit-with-trading-halts-triggered-by-technical-issue,BRK-A,0.277433,Somewhat-Bearish,-0.268877
NYSE says bizarre glitch that showed Berkshire Hathaway down 99.97% has been resolved | Business,20240603T142800,https://edition.cnn.com/2024/06/03/investing/new-york-stock-exchange-technical-issue/index.html,BRK-A,0.219477,Neutral,-0.022496
"NYSE technical issue impacting some stock prices, incorrectly showing Berkshire Hathaway down 99%",20240603T141210,https://www.cnbc.com/2024/06/03/nyse-technical-issue-impacting-some-stock-prices-incorrectly-showing-berkshire-hathaway-down-99percent.html,BRK-A,0.145145,Neutral,0.00906
"Inside The Audacious Plan To Use 10,000 Nuclear Microreactors To Wean The World Off Coal",20230203T113000,https://www.forbes.com/sites/christopherhelman/2023/02/03/inside-the-audacious-plan-to-use-10000-nuclear-microreactors-to-wean-the-world-off-oil/,BRK-A,0.026127,Neutral,0.04922
3 Cash Cow Stocks to Buy in This Bear Market,20221013T104000,https://www.fool.com/investing/2022/10/13/3-cash-cow-stocks-to-buy-in-this-bear-market/,BRK-A,0.037098,Neutral,0.082858
Cramer's lightning round: Marqeta is not a buy,20220728T231539,https://www.cnbc.com/2022/07/28/cramers-lightning-round-marqeta-is-not-a-buy.html,BRK-A,0.205807,Neutral,0.0
Who Benefits From Amazon's Stock Split?,20220316T162750,https://www.fool.com/investing/2022/03/16/who-benefits-from-amazons-stock-split/,BRK-A,0.006381,Bullish,0.867769
What's Going On With Versus Systems Stock Tuesday? - Versus Systems  ( NASDAQ:VS ) ,20240702T155049,https://www.benzinga.com/news/24/07/39600669/whats-going-on-with-versus-systems-stock-tuesday,BRK-A,0.094762,Somewhat-Bullish,0.176961
Is Nu Holdings Stock a Buy Before Nov. 13?,20241102T222400,https://www.fool.com/investing/2024/11/02/is-nu-holdings-stock-a-buy-before-nov-13/,BRK-A,0.056674,Neutral,0.057925
Billionaire Israel Englander Just Bought 30.9 Million Shares in This Little-Known Warren Buffett and Cathie Wood Stock. Time to Buy?,20241018T100000,https://www.fool.com/investing/2024/10/18/billionaire-israel-englander-just-bought-309-milli/,BRK-A,0.06211,Somewhat-Bullish,0.185137
Should You Ignore SoFi and Buy This Magnificent Digital Bank Stock Instead?,20241016T093000,https://www.fool.com/investing/2024/10/16/should-you-ignore-sofi-and-buy-this-magnific/,BRK-A,0.065327,Neutral,0.135229
"Three Stocks: SoFi Technologies, Citi, and Sirius XM Holdings",20241014T200919,https://moneymorning.com/2024/10/14/three-stocks-sofi-technologies-citi-and-sirius-xm-holdings/,BRK-A,0.059785,Neutral,0.079999
"NVIDIA, Trump Media & Technology, Bausch + Lomb, Sirius XM And Other Big Stocks Moving Higher On Monday - NVIDIA  ( NASDAQ:NVDA ) ",20241014T174753,https://www.benzinga.com/news/24/10/41318786/nvidia-trump-media-technology-bausch-lomb-sirius-xm-and-other-big-stocks-moving-higher-on-monday,BRK-A,0.107016,Somewhat-Bullish,0.151117
"Nu Holdings: Buy, Sell, or Hold?",20240627T100000,https://www.fool.com/investing/2024/06/27/nu-holdings-buy-sell-or-hold/,BRK-A,0.060848,Somewhat-Bullish,0.157036
"GME, BRK.A, NVDA, SOFI, TSLA: Top 5 Trending Stocks Today - NVIDIA  ( NASDAQ:NVDA ) , GameStop  ( NYSE:GME ) ",20240604T022955,https://www.benzinga.com/markets/equities/24/06/39150973/gamestop-berkshire-hathaway-nvidia-sofi-tesla-why-these-5-stocks-are-on-investors-radars-today,BRK-A,0.160099,Neutral,-0.063477
Can SoFi Stock Help You Retire a Millionaire?,20240428T162500,https://www.fool.com/investing/2024/04/28/can-sofi-stock-help-you-retire-a-millionaire/,BRK-A,0.063933,Neutral,0.081049
SoFi Technologies Stock Is Sliding Tuesday: What's Going On? - SoFi Techs  ( NASDAQ:SOFI ) ,20240305T140308,https://www.benzinga.com/news/24/03/37482527/sofi-technologies-stock-is-sliding-tuesday-whats-going-on,BRK-A,0.102449,Somewhat-Bullish,0.180924
Stock Prices Are Astronomical. How They Became So Costly.,20240216T080000,https://www.barrons.com/amp/articles/stock-prices-stratosphere-costly-b04483fe,BRK-A,0.048327,Neutral,0.070837
Forget Upstart Stock: 2 Stocks to Buy Hand Over Fist Instead,20240127T105000,https://www.fool.com/investing/2024/01/27/forget-hot-ticker-2-stocks-to-buy-hand-over-fist-i/,BRK-A,0.054607,Neutral,0.063818
Want $1 Million in Retirement? 3 Stocks to Buy Now and Hold for Decades,20240117T121500,https://www.fool.com/investing/2024/01/17/want-1-million-in-retirement-3-stocks-to-buy-now-a/,BRK-A,0.140621,Somewhat-Bullish,0.201558
Better Buy: SoFi Stock or Nu Stock?,20230925T132000,https://www.fool.com/investing/2023/09/25/better-buy-sofi-or-nu/,BRK-A,0.040553,Neutral,0.0
2 No-Brainer Stocks to Buy Right Now for Less than $10,20230824T092500,https://www.fool.com/investing/2023/08/24/2-no-brainer-stocks-buy-right-now-less-than-10/,BRK-A,0.056943,Neutral,0.133958
Investors Load Up On 3 Stocks Beyond The 'Magnificent Seven',20230814T120000,https://www.investors.com/etfs-and-funds/sectors/sp500-investors-load-up-on-stocks-beyond-the-magnificent-seven/,BRK-A,0.286193,Somewhat-Bullish,0.261304
