title,time_published,url,ticker,relevance_score,ticker_sentiment_label,ticker_sentiment_score
Bitdeer Technologies Group  ( BTDR )  Matches Q2 Earnings Estimates,20240812T121503,https://www.zacks.com/stock/news/2320457/bitdeer-technologies-group-btdr-matches-q2-earnings-estimates,BTDR,0.135347,Neutral,0.118631
"Why BioVie Shares Are Trading Lower By Around 42%; Here Are 20 Stocks Moving Premarket - Adial Pharmaceuticals  ( NASDAQ:ADIL ) , Aadi Bioscience  ( NASDAQ:AADI ) ",20240304T130436,https://www.benzinga.com/news/24/03/37453547/why-biovie-shares-are-trading-lower-by-around-42-here-are-20-stocks-moving-premarket,BTDR,0.146025,Somewhat-Bullish,0.280381
"Rivian Automotive Reports Weak Delivery Figures, Joins JOYY, MiMedx Group And Other Big Stocks Moving Lower On Tuesday - Amprius Technologies  ( NYSE:AMPX ) , ARM Holdings  ( NASDAQ:ARM ) ",20240102T164708,https://www.benzinga.com/news/24/01/36455106/rivian-automotive-reports-weak-delivery-figures-joins-joyy-mimedx-group-and-other-big-stocks-moving,BTDR,0.16849,Bearish,-0.447507
"Delta Air Lines Reports Q4 Results, Joins United Airlines, American Airlines And Other Big Stocks Moving Lower On Friday - Alaska Air Gr  ( NYSE:ALK ) , American Airlines Group  ( NASDAQ:AAL ) ",20240112T153901,https://www.benzinga.com/news/24/01/36612655/delta-air-lines-reports-q4-results-joins-united-airlines-american-airlines-and-other-big-stocks-movi,BTDR,0.230235,Bearish,-0.540586
"Global Mofy Metaverse Reports Follow-on Offering, Joins Lyft, Coinbase Global And Other Big Stocks Moving Lower On Friday - Applied Optoelectronics  ( NASDAQ:AAOI ) , Avalo Therapeutics  ( NASDAQ:AVTX ) ",20231229T154503,https://www.benzinga.com/news/23/12/36429147/global-mofy-metaverse-reports-follow-on-offering-joins-lyft-coinbase-global-and-other-big-stocks-mov,BTDR,0.247838,Bullish,0.42322
