title,time_published,url,ticker,relevance_score,ticker_sentiment_label,ticker_sentiment_score
Chinese tech ADRs rise as end of Didi probe raises hope of easing crackdowns,20220606T145800,https://www.reuters.com/markets/europe/chinese-tech-adrs-rise-end-didi-probe-raises-hope-easing-crackdowns-2022-06-06/,CBSU,0.110768,Somewhat-Bearish,-0.238529
"Wall Street set to rebound as China ADRs, growth stocks rally",20220606T125700,https://www.reuters.com/markets/us/futures-rebound-china-adrs-rally-tech-growth-stocks-rise-2022-06-06/,CBSU,0.069234,Neutral,-0.017096
Will ETFs Suffer as US Homebuilder Confidence Dips in June?,20220617T220000,https://www.zacks.com/stock/news/1940651/will-etfs-suffer-as-us-homebuilder-confidence-dips-in-june,CBSU,0.040622,Neutral,-0.051776
"As crisis worsens, Sri Lankan businesses want Rajapaksa to go",20220512T070130,https://www.aljazeera.com/economy/2022/5/12/as-crisis-worsens-sri-lankas-businesses-want-rajapaksa-to-go,CBSU,0.203002,Bearish,-0.453833
WTI: 2 Undervalued Energy Stocks with Much More Upside,20220427T190620,https://stocknews.com/news/wti-egy-2-undervalued-energy-stocks-with-much-more-upside/,CBSU,0.039276,Bearish,-0.512254
Romania Sees an Opening to Become an Energy Power in Europe,20220615T090043,https://www.nytimes.com/2022/06/15/business/romania-energy-nuclear-power-natural-gas.html,CBSU,0.020936,Somewhat-Bearish,-0.262694
