title,time_published,url,ticker,relevance_score,ticker_sentiment_label,ticker_sentiment_score
53 Biggest Movers From Yesterday,20220421T085205,https://www.benzinga.com/news/22/04/26731039/53-biggest-movers-from-yesterday,CCORF,0.03445,Neutral,0.013515
"Concert Pharmaceuticals, Coeur Mining And Other Big Stocks Moving Higher On Thursday",20230119T153711,https://www.benzinga.com/news/23/01/30485939/concert-pharmaceuticals-coeur-mining-and-other-big-stocks-moving-higher-on-thursday,CCORF,0.160633,Somewhat-Bullish,0.165657
Why Cardiol Therapeutics  ( CRDL )  Stock Is Down 20% Today - Cardiol Therapeutics  ( NASDAQ:CRDL ) ,20241009T144156,https://www.benzinga.com/news/24/10/41252681/why-cardiol-therapeutics-crdl-stock-is-down-20-today,CCORF,0.12546,Neutral,0.148047
Cardiol Therapeutics to Present at Canaccord Genuity 43rd Annual Growth Conference,20230809T122246,https://investingnews.com/cardiol-therapeutics-to-present-at-canaccord-genuity-43rd-annual-growth-conference-2663077837/,CCORF,0.054236,Somewhat-Bullish,0.150794
Cardiol Therapeutics to Present at Canaccord Genuity 43rd Annual Growth Conference,20230809T115253,https://investingnews.com/cardiol-therapeutics-to-present-at-canaccord-genuity-43rd-annual-growth-conference/,CCORF,0.054236,Somewhat-Bullish,0.150794
Cardiol Therapeutics Announces At-The-Market Equity Offering Program,20220609T203825,https://investingnews.com/cardiol-therapeutics-announces-at-the-market-equity-offering-program/,CCORF,0.07597,Neutral,0.023207
