title,time_published,url,ticker,relevance_score,ticker_sentiment_label,ticker_sentiment_score
DAO: 3 Trending China Stocks to Consider,20240223T140330,https://stocknews.com/news/dao-xnet-tour-3-trending-china-stocks-to-consider/,CIH,0.025734,Neutral,-0.130315
"Alibaba, JD Logistics shares tank as SoftBank reportedly plans to pare stakes",20230413T062307,https://www.scmp.com/business/china-business/article/3216905/alibaba-jd-logistics-shares-tank-japans-softbank-reportedly-plans-major-sell-us36-billion-china,CIH,0.056674,Neutral,0.080069
"Why Shares of Alibaba, Full Truck Alliance, and KE Holdings Fell Today",20221019T203149,https://www.fool.com/investing/2022/10/19/why-shares-of-alibaba-full-truck-alliance-and-ke-h/,CIH,0.071784,Neutral,-0.024876
"Why Shares of JD.com, Kanzhun Limited, and KE Holdings Are Falling Today",20220706T150647,https://www.fool.com/investing/2022/07/06/why-shares-of-jdcom-kanzhun-limited-and-ke-holding/,CIH,0.142228,Neutral,-0.083703
Chinese stocks still cheap for Credit Suisse as others fret about zero-Covid,20220701T070056,https://www.scmp.com/business/markets/article/3183796/not-too-late-chase-chinese-stocks-still-near-near-bottom-credit,CIH,0.231995,Neutral,0.012941
"QuantaSing Announces Appointment of New Independent Director - QuantaSing Group  ( NASDAQ:QSG ) , Waterdrop  ( NYSE:WDH ) ",20240122T100000,https://www.benzinga.com/pressreleases/24/01/g36711769/quantasing-announces-appointment-of-new-independent-director,CIH,0.044551,Neutral,-0.002952
QuantaSing Announces Appointment of New Independent Director,20240122T100000,https://www.globenewswire.com/news-release/2024/01/22/2812787/0/en/QuantaSing-Announces-Appointment-of-New-Independent-Director.html,CIH,0.046543,Neutral,-0.002966
Stocks That Hit 52-Week Lows On Monday,20220523T161249,https://www.benzinga.com/markets/options/22/05/27350703/52-weeks-high-and-low-article,CIH,0.037702,Neutral,-0.006134
