title,time_published,url,ticker,relevance_score,ticker_sentiment_label,ticker_sentiment_score
" ( AQST ) , CME Group  ( CME )  - FedEx Faces Price Target Cut By This Analyst; Also Check Out Some Other Major PT Changes",20220906T152338,https://www.benzinga.com/news/22/09/28760458/fedex-faces-price-target-cut-by-this-analyst-also-check-out-some-other-major-pt-changes,CME,0.546745,Somewhat-Bullish,0.341563
"Jobs data, Bed Bath & Beyond update, Best Buy earnings top week ahead",20220829T001226,https://www.foxbusiness.com/markets/jobs-data-bed-bath-beyond-update-best-buy-earnings-week-ahead,CME,0.046095,Neutral,0.135359
"Alphabet, Nvidia, PepsiCo And Other Big Stocks Moving Higher On Monday",20240318T150849,https://markets.businessinsider.com/news/stocks/alphabet-nvidia-pepsico-and-other-big-stocks-moving-higher-on-monday-1033172590,CME,0.097062,Neutral,0.0
Black Ore Emerges from Stealth with $60 Million in Funding to Bring AI to Financial Services,20231107T170000,https://www.benzinga.com/pressreleases/23/11/g35651354/black-ore-emerges-from-stealth-with-60-million-in-funding-to-bring-ai-to-financial-services,CME,0.038592,Neutral,0.135822
3 Stocks About to Join the Rate Cut Party - Albemarle  ( NYSE:ALB ) ,20240322T194406,https://www.benzinga.com/news/24/03/37889053/3-stocks-about-to-join-the-rate-cut-party,CME,0.102013,Neutral,-0.031568
