title,time_published,url,ticker,relevance_score,ticker_sentiment_label,ticker_sentiment_score
"Why Coupa Software Shares Jumped Around 29%; Here Are 72 Biggest Movers From Wednesday - Autodesk  ( NASDAQ:ADSK ) , Aenza SAA  ( NYSE:AENZ ) ",20221125T095236,https://www.benzinga.com/news/22/11/29855752/why-coupa-software-shares-jumped-around-29-here-are-72-biggest-movers-from-wednesday,CNK,0.054857,Somewhat-Bullish,0.169868
"Warner Bros. Discovery, Twilio, Monster Beverage And Some Other Big Stocks Moving Lower On Friday",20220805T152024,https://www.benzinga.com/news/earnings/22/08/28377851/warner-bros-discovery-twilio-monster-beverage-and-some-other-big-stocks-moving-lower-on-friday,CNK,0.11894,Neutral,0.0
"Coconut Water, Glassmaking And Plushies: Here Are 100 U.S. Small-Cap Gems For Investors",20231110T113000,https://www.forbes.com/sites/hanktucker/2023/11/10/coconut-water-glassmaking-and-plushies-here-are-100-us-small-cap-gems-for-investors/,CNK,0.030102,Somewhat-Bullish,0.168505
The Benchmark Company Announces Upcoming September Conference Schedule,20240822T151153,https://www.benzinga.com/pressreleases/24/08/g40510267/the-benchmark-company-announces-upcoming-september-conference-schedule,CNK,0.050679,Neutral,0.0
The Benchmark Company Announces Upcoming September Conference Schedule,20230823T142553,https://www.benzinga.com/pressreleases/23/08/g34005661/the-benchmark-company-announces-upcoming-september-conference-schedule,CNK,0.055109,Neutral,0.0
The Benchmark Company Announces Upcoming Consumer/Media/Entertainment One-on-One Investor Conference,20220824T170509,https://www.benzinga.com/pressreleases/22/08/g28620340/the-benchmark-company-announces-upcoming-consumermediaentertainment-one-on-one-investor-conference,CNK,0.04912,Neutral,0.019918
