title,time_published,url,ticker,relevance_score,ticker_sentiment_label,ticker_sentiment_score
Brink's Expands Board of Directors with Appointment of Keith R. Wyche - Brink's  ( NYSE:BCO ) ,20220929T201638,https://www.benzinga.com/pressreleases/22/09/g29086537/brinks-expands-board-of-directors-with-appointment-of-keith-r-wyche,CNXC,0.096283,Neutral,0.0
Brink's Expands Board of Directors with Appointment of Keith R. Wyche,20220929T201600,https://www.globenewswire.com/news-release/2022/09/29/2525633/35146/en/Brink-s-Expands-Board-of-Directors-with-Appointment-of-Keith-R-Wyche.html,CNXC,0.09989,Neutral,0.0
90 Biggest Movers From Yesterday,20220510T091132,https://www.benzinga.com/news/22/05/27100105/90-biggest-movers-from-yesterday,CNXC,0.025166,Neutral,0.011942
90 Biggest Movers From Yesterday,20220510T091132,https://markets.businessinsider.com/news/stocks/90-biggest-movers-from-yesterday-1031440764,CNXC,0.023017,Neutral,0.00757
"Kohl's Posts Upbeat Q2 Earnings, Joins Box, Waldencast, AeroVironment And Other Big Stocks Moving Higher On Wednesday - Kohl's  ( NYSE:KSS ) ",20240828T141742,https://www.benzinga.com/news/24/08/40602596/kohls-posts-upbeat-q2-earnings-joins-box-waldencast-aerovironment-and-other-big-stocks-moving-higher,CNXC,0.279015,Somewhat-Bullish,0.306461
Call Center Outsourcing Market In Europe- Set again your Business Strategy with new ideas | Technavio - PR Newswire,20230825T103000,https://www.prnewswire.com/news-releases/call-center-outsourcing-market-in-europe--set-again-your-business-strategy-with-new-ideas--technavio-301908776.html,CNXC,0.082677,Neutral,0.01745
"Customer Care BPO Market Worth $34.57 Billion, Globally, by 2028 at 7.5% CAGR | The Insight Partners",20230503T145641,https://www.benzinga.com/pressreleases/23/05/g32189845/customer-care-bpo-market-worth-34-57-billion-globally-by-2028-at-7-5-cagr-the-insight-partners,CNXC,0.127908,Somewhat-Bullish,0.205795
"Business Process Outsourcing  ( BPO )  Market worth USD 293.650 Billion by 2029 Global Outsourcing Trends, Competitive Analysis, Business Environment, Regional Analysis",20230125T063608,https://www.benzinga.com/pressreleases/23/01/g30562117/business-process-outsourcing-bpo-market-worth-usd-293-650-billion-by-2029-global-outsourcing-trend,CNXC,0.025596,Neutral,-0.002751
"TTEC Names Charles ""Chuck"" Koskovich as Chief Operating Officer for TTEC Engage",20220920T123000,https://www.prnewswire.com/news-releases/ttec-names-charles-chuck-koskovich-as-chief-operating-officer-for-ttec-engage-301627794.html,CNXC,0.079656,Somewhat-Bullish,0.227505
