title,time_published,url,ticker,relevance_score,ticker_sentiment_label,ticker_sentiment_score
"Saia, Annexon, Core Scientific And Other Big Stocks Moving Higher On Tuesday - Saia  ( NASDAQ:SAIA ) ",20240604T140859,https://www.benzinga.com/news/24/06/39161979/saia-annexon-core-scientific-and-other-big-stocks-moving-higher-on-tuesday,CORZQ,0.305058,Somewhat-Bullish,0.204805
Why HealthEquity Shares Are Trading Higher; Here Are 20 Stocks Moving Premarket - HealthEquity  ( NASDAQ:HQY ) ,20240604T095006,https://www.benzinga.com/news/24/06/39153820/why-healthequity-shares-are-trading-higher-here-are-20-stocks-moving-premarket,CORZQ,0.127456,Somewhat-Bullish,0.201935
"Tesla, Nvidia, John Wiley & Sons And Other Big Stocks Moving Higher On Thursday - Tesla  ( NASDAQ:TSLA ) ",20240613T141719,https://www.benzinga.com/news/24/06/39313835/tesla-nvidia-john-wiley-sons-and-other-big-stocks-moving-higher-on-thursday,CORZQ,0.096671,Bullish,0.363258
CytomX Therapeutics Reports Full Year 2022 Financial Results and Provides Business Update,20230327T201500,https://www.globenewswire.com/news-release/2023/03/27/2635245/37704/en/CytomX-Therapeutics-Reports-Full-Year-2022-Financial-Results-and-Provides-Business-Update.html,CORZQ,0.015851,Neutral,0.047794
"Bragar Eagel & Squire, P.C. Reminds Investors That Class Action Lawsuits Have Been Filed Against Rent, Core Scientific, Torrid, and Olaplex and Encourages Investors to Contact the Firm - Torrid Holdings  ( NYSE:CURV ) , Core Scientific, Inc. - Common Stock  ( NASDAQ:CORZ ) ",20230109T020600,https://www.benzinga.com/pressreleases/23/01/g30324867/bragar-eagel-squire-p-c-reminds-investors-that-class-action-lawsuits-have-been-filed-against-rent-,CORZQ,0.11739,Neutral,-0.046557
