title,time_published,url,ticker,relevance_score,ticker_sentiment_label,ticker_sentiment_score
StockNews.com Initiates Coverage on AC Immune  ( NASDAQ:ACIU ) ,20220819T060848,https://www.etfdailynews.com/2022/08/19/stocknews-com-initiates-coverage-on-ac-immune-nasdaqaciu-2/,COST,0.082963,Neutral,0.050453
"Why NanoVibronix Shares Surged Over 25%; Here Are 82 Biggest Movers From Friday - ABVC BioPharma  ( NASDAQ:ABVC ) , Altimmune  ( NASDAQ:ALT ) ",20220926T074323,https://www.benzinga.com/news/22/09/29002223/why-nanovibronix-shares-surged-over-25-here-are-82-biggest-movers-from-friday,COST,0.066784,Neutral,0.042888
"US Stocks Mixed; Costco Posts Upbeat Earnings - Battalion Oil  ( AMEX:BATL ) , Aadi Bioscience  ( NASDAQ:AADI ) ",20231215T144144,https://www.benzinga.com/news/earnings/23/12/36258141/us-stocks-mixed-costco-posts-upbeat-earnings,COST,0.19117,Somewhat-Bullish,0.300135
"Why Streamline Health Solutions Shares Are Trading Lower By Over 68%? Here Are Other Stocks Moving In Monday's Mid-Day Session - Aldeyra Therapeutics  ( NASDAQ:ALDX ) , Alignment Healthcare  ( NASDAQ:ALHC ) ",20231016T170953,https://www.benzinga.com/news/23/10/35272489/why-streamline-health-solutions-shares-are-trading-lower-by-over-68-here-are-other-stocks-moving-in,COST,0.038162,Neutral,0.063334
Why ContraFect Shares Are Trading Higher By Around 30%; Here Are 20 Stocks Moving Premarket,20231016T131535,https://markets.businessinsider.com/news/stocks/why-contrafect-shares-are-trading-higher-by-around-30-here-are-20-stocks-moving-premarket-1032708380,COST,0.105604,Somewhat-Bullish,0.17774
"Why ContraFect Shares Are Trading Higher By Around 30%; Here Are 20 Stocks Moving Premarket - Ambrx Biopharma  ( NASDAQ:AMAM ) , Amphenol  ( NYSE:APH ) ",20231016T124712,https://www.benzinga.com/news/23/10/35266067/why-contrafect-shares-are-trading-higher-by-around-30-here-are-20-stocks-moving-premarket,COST,0.097854,Somewhat-Bullish,0.167429
How The RealReal Will Pivot From Growth To Profits,20230329T155036,https://www.forbes.com/sites/pamdanziger/2023/03/29/how-the-realreal-will-pivot-from-growth-to-profits/,COST,0.027164,Neutral,0.0
"TikTok ban, Supreme Court student loan hearing and Tesla Investor Day top week ahead",20230227T050559,https://www.foxbusiness.com/markets/tiktok-ban-supreme-court-student-loan-hearing-tesla-investor-day-top-week-ahead,COST,0.034332,Neutral,0.0
"Barron's Top Weekend Stock Picks: Costco, Johnson & Johnson, And How Tesla Could Become A Value Stock - ConocoPhillips  ( NYSE:COP ) ",20221224T171757,https://www.benzinga.com/news/large-cap/22/12/30194895/barrons-top-weekend-stock-picks-costco-johnson-johnson-and-how-tesla-could-become-a-value-stock,COST,0.342487,Bullish,0.54984
"Dow, S&P Take a Break Ahead of Eventful Stock Market Thursday",20240925T222300,https://www.zacks.com/stock/news/2341648/dow-sp-take-a-break-ahead-of-eventful-stock-market-thursday,COST,0.081276,Neutral,0.078494
"Stocks Fall As Salesforce, Dell Dive On Earnings: Weekly Review",20240531T154000,https://www.investors.com/news/stock-market-retreats-salesforce-dell-earnings-losers/,COST,0.065209,Neutral,0.074584
Futures: Fed's Inflation Report Due; AI Winner Dell Dives Late,20240530T205100,https://www.investors.com/market-trend/stock-market-today/dow-jones-futures-fed-inflation-report-due-key-sector-dives-dell-plunges/,COST,0.191422,Somewhat-Bearish,-0.184584
"Fed Inflation Gauge, Key Earnings Highlight Investing Action Plan",20240524T120000,https://www.investors.com/research/investing-action-plan/fed-inflation-gauge-key-earnings/,COST,0.12028,Neutral,-0.009407
Visa  ( V )  Q4 2023 Earnings Call Transcript,20231025T020023,https://www.fool.com/earnings/call-transcripts/2023/10/24/visa-v-q4-2023-earnings-call-transcript/,COST,0.00454,Somewhat-Bullish,0.201728
Visa  ( V )  Q1 2023 Earnings Call Transcript,20230127T023022,https://www.fool.com/earnings/call-transcripts/2023/01/26/visa-v-q1-2023-earnings-call-transcript/,COST,0.004238,Neutral,0.143322
"Coca-Cola  ( KO )  Exceeds Earnings Estimates, but Here Are the 5 Best Consumer Staples Stocks to Buy Now",20221025T154908,https://www.kiplinger.com/investing/stocks/coca-cola-ko-exceeds-earnings-estimates-but-these-are-the-5-best-consumer-staples-stocks-to-buy-now,COST,0.148273,Neutral,-0.094394
"Dow Tumbles Nearly 300 Points: Investor Optimism Improves Slightly, But Fear Index Remains In 'Greed' Zone - Stitch Fix  ( NASDAQ:SFIX ) ",20240926T065226,https://www.benzinga.com/news/earnings/24/09/41039697/dow-tumbles-nearly-300-points-investor-optimism-improves-slightly-but-fear-index-remains-in-greed-z,COST,0.223866,Neutral,0.0
"Teacher discounts on makeup, meal subscriptions, and streaming available now",20240514T195800,https://www.businessinsider.com/guides/deals/teacher-discounts-deals-and-freebies,COST,0.104911,Neutral,0.081813
"Why this market has left behind direct-to-consumer companies like Warby Parker, AllBirds and Rent the Runway | Business",20240403T110500,https://www.cnn.com/2024/04/03/investing/premarket-stocks-trading/index.html,COST,0.15347,Somewhat-Bullish,0.174355
"Super Micro, Nvidia, Taiwan Semi, Macy's, Apple, Li Auto, Lyft, and More Stock Market Movers",20240304T092800,https://www.barrons.com/amp/articles/stock-market-movers-bd49873d,COST,0.073773,Neutral,0.0
Stitch Fix's  ( SFIX )  Q1 Earnings Coming Up: What's in the Cards?,20231130T184200,https://www.zacks.com/stock/news/2191804/stitch-fixs-sfix-q1-earnings-coming-up-whats-in-the-cards,COST,0.211191,Somewhat-Bullish,0.264595
"Another Oversold Company Pops On Mixed Earnings: How To Profit From This Pattern - Stitch Fix  ( NASDAQ:SFIX ) , Nike  ( NYSE:NKE ) ",20230929T164932,https://www.benzinga.com/markets/penny-stocks/23/09/35007727/another-oversold-company-pops-on-mixed-earnings-how-to-profit-from-this-pattern,COST,0.250386,Somewhat-Bearish,-0.203392
"Wall Street grows pessimistic about holiday season, but record profit still expected",20221205T182600,https://www.marketwatch.com/story/wall-street-grows-pessimistic-about-holiday-season-but-record-profit-still-expected-11670264782,COST,0.144275,Neutral,0.017814
"Musk pushes Twitter files, Georgia runoff election, FTX fallout ongoing top week ahead",20221204T232326,https://www.foxbusiness.com/markets/musk-twitter-georgia-runoff-election-ftx-sbf-top-week-ahead,COST,0.066784,Neutral,0.0
Is the worst over for bitcoin and the rest of crypto?,20221204T155300,https://www.cnn.com/2022/12/04/investing/stocks-week-ahead/index.html,COST,0.114137,Neutral,0.020304
3 Small-Cap Growth Stocks You'll Regret Not Buying on the Dip,20221201T104000,https://www.fool.com/investing/2022/12/01/small-cap-growth-stocks-regret-not-buying-on-dip/,COST,0.041755,Neutral,0.113284
Who needs another subscription service? Walmart is betting its millions of customers do,20221002T120001,https://www.cnbc.com/2022/10/02/walmart-inflation-walmart-plus-subscriptions.html,COST,0.048327,Neutral,-0.042825
Consumer Goods Stocks to Watch,20220924T130000,https://www.fool.com/investing/2022/09/24/consumer-goods-stocks-to-watch/,COST,0.00927,Neutral,0.033604
"Costco To Surge Around 16%? Plus This Analyst Predicts $190 For NVIDIA - Beyond Meat  ( NASDAQ:BYND ) , Allegion  ( NYSE:ALLE ) ",20220921T145827,https://www.benzinga.com/news/22/09/28950412/costco-to-surge-around-16-plus-this-analyst-predicts-190-for-nvidia,COST,0.44622,Bullish,0.505509
Monday's Market Minute: A Busy Week for Investors and Traders,20220919T174332,https://www.benzinga.com/news/earnings/22/09/28919349/mondays-market-minute-a-busy-week-for-investors-and-traders,COST,0.272788,Neutral,0.11086
"Costco, FedEx earnings, Fed decision, existing home sales top week ahead",20220918T120400,https://www.foxbusiness.com/markets/costco-fedex-earnings-fed-decision-existing-home-sales-top-week-ahead,COST,0.118064,Neutral,0.0
Another big rate hike is coming. Lather. Rinse. Repeat | Business,20220918T113314,https://www.cnn.com/2022/09/18/investing/stocks-week-ahead/index.html,COST,0.074926,Neutral,0.0
Stitch Fix  ( SFIX )  to Post Q4 Earnings: What's in the Offing?,20220915T212300,https://www.zacks.com/stock/news/1981209/stitch-fix-sfix-to-post-q4-earnings-whats-in-the-offing,COST,0.200273,Somewhat-Bullish,0.196678
"BRF S.A. Q2 Earnings in the Cards: Things to Consider - BRF  ( NYSE:BRFS ) , Coty  ( NYSE:COTY ) ",20240812T200921,https://www.benzinga.com/news/earnings/24/08/40318772/brf-s-a-q2-earnings-in-the-cards-things-to-consider,COST,0.122894,Neutral,0.124778
BRF S.A.  ( BRFS )  Q2 Earnings in the Cards: Things to Consider,20240812T151500,https://www.zacks.com/stock/news/2320863/brf-sa-brfs-q2-earnings-in-the-cards-things-to-consider,COST,0.176717,Neutral,0.146865
"Costco Goes Netflix Way To Stop Sharing Of Subscriptions, Satya Nadella Wants To Ditch Console Exclusives, Investors Cheer Rite Aid Q1 Performance: Today's Top Stories",20230629T133618,https://markets.businessinsider.com/news/stocks/costco-goes-netflix-way-to-stop-sharing-of-subscriptions-satya-nadella-wants-to-ditch-console-exclusives-investors-cheer-rite-aid-q1-performance-today-s-top-stories-1032418049,COST,0.100029,Neutral,0.134542
"Top Stories Thursday, June 29: Costco Goes Netflix Way To Stop Sharing Of Subscriptions, Satya Nadella Wants To Ditch Console Exclusives, Investors Cheer Rite Aid Q1 Performance - Costco Wholesale  ( NASDAQ:COST ) , Amazon.com  ( NASDAQ:AMZN ) ",20230629T133617,https://www.benzinga.com/news/23/06/33059187/costco-goes-netflix-way-to-stop-sharing-of-subscriptions-satya-nadella-wants-to-ditch-console-exclus,COST,0.111834,Somewhat-Bullish,0.197962
"Beat the Market the Zacks Way: Shopify, Lululemon, Telos in Focus",20231211T125600,https://www.zacks.com/stock/news/2195999/beat-the-market-the-zacks-way-shopify-lululemon-telos-in-focus,COST,0.069697,Neutral,0.106453
"Profire Energy  ( NASDAQ:PFIE )  Downgraded by StockNews.com to ""Hold""",20240601T112642,https://www.defenseworld.net/2024/06/01/profire-energy-nasdaqpfie-downgraded-by-stocknews-com-to-hold.html,COST,0.085629,Neutral,0.135573
Profire Energy  ( NASDAQ:PFIE )  Now Covered by StockNews.com,20220819T085442,https://reporter.am/2022/08/19/profire-energy-nasdaqpfie-now-covered-by-stocknews-com.html,COST,0.073321,Neutral,0.081486
"Top 4 Defensive Stocks You'll Regret Missing This Quarter - Medifast  ( NYSE:MED ) , Australian Oilseeds Hldgs  ( NASDAQ:COOT ) ",20240502T125624,https://www.benzinga.com/trading-ideas/long-ideas/24/05/38582499/top-4-defensive-stocks-youll-regret-missing-this-quarter,COST,0.088799,Neutral,0.013969
Daily: The Motives Behind Some Return-To-Office Mandates,20240610T123006,https://www.forbes.com/sites/daniellechemtob/2024/06/10/forbes-daily-the-motives-behind-some-return-to-office-mandates/,COST,0.024248,Neutral,0.036931
Bio-Path  ( NASDAQ:BPTH )  Coverage Initiated by Analysts at StockNews.com,20240416T062842,https://www.defenseworld.net/2024/04/16/bio-path-nasdaqbpth-coverage-initiated-by-analysts-at-stocknews-com.html,COST,0.092569,Somewhat-Bullish,0.17103
Bio-Path  ( NASDAQ:BPTH )  Now Covered by StockNews.com,20220819T081642,https://reporter.am/2022/08/19/bio-path-nasdaqbpth-now-covered-by-stocknews-com-2.html,COST,0.12165,Somewhat-Bullish,0.166451
Michael Lewis on How to Spot the Real Expert,20220526T213300,https://www.fool.com/investing/2022/05/26/michael-lewis-on-how-to-spot-the-real-expert/,COST,0.03814,Somewhat-Bullish,0.227181
Ultrapar Participações  ( NYSE:UGP )  Lowered to Hold at StockNews.com,20221211T071041,https://reporter.am/2022/12/11/ultrapar-participacoes-nyseugp-lowered-to-hold-at-stocknews-com-2.html,COST,0.075635,Neutral,0.106528
My Top 10 Stocks to Buy in 2024 Are Beating the Market by 48%. Should You Buy Them for 2025?,20241207T211100,https://www.fool.com/investing/2024/12/07/my-top-10-stocks-to-buy-in-2024-beat-the-market-by/,COST,0.118842,Somewhat-Bullish,0.15196
5 Stocks Ready for Action Before Friday's Jobs Report,20240903T121657,https://moneymorning.com/2024/09/03/5-stocks-ready-for-action-before-fridays-jobs-report/,COST,0.265378,Neutral,-0.077996
Stock Prices Are Astronomical. How They Became So Costly.,20240216T080000,https://www.barrons.com/amp/articles/stock-prices-stratosphere-costly-b04483fe,COST,0.024175,Neutral,-0.072218
10 Top Stocks to Buy in 2024,20231208T133000,https://www.fool.com/investing/2023/12/08/10-top-stocks-to-buy-in-2024/,COST,0.088363,Somewhat-Bullish,0.159505
3 Stocks That Could Make You Rich,20231124T110900,https://www.fool.com/investing/2023/11/24/3-stocks-that-could-make-you-rich/,COST,0.15769,Somewhat-Bullish,0.172087
Warning: 1 Major Red Flag for SoFi Stock,20231002T111700,https://www.fool.com/investing/2023/10/02/warning-1-major-red-flag-for-sofi-stock/,COST,0.062597,Neutral,-0.065368
