title,time_published,url,ticker,relevance_score,ticker_sentiment_label,ticker_sentiment_score
Best Growth Stocks to Buy for October 31st,20241031T082300,https://www.zacks.com/commentary/2361369/best-growth-stocks-to-buy-for-october-31st,CRS,0.838487,Neutral,-0.004072
Best Growth Stocks to Buy for October 25th,20241025T062100,https://www.zacks.com/commentary/2357420/best-growth-stocks-to-buy-for-october-25th,CRS,0.841282,Somewhat-Bullish,0.151964
Best Growth Stocks to Buy for October 23rd,20241023T063700,https://www.zacks.com/commentary/2355431/best-growth-stocks-to-buy-for-october-23rd,CRS,0.841282,Somewhat-Bullish,0.151964
"Natural Grocers By Vitamin Cottage, Elastic, Matthews International, Gap And Other Big Stocks Moving Higher On Friday - Atkore  ( NYSE:ATKR ) , Carpenter Tech  ( NYSE:CRS ) ",20241122T155904,https://www.benzinga.com/24/11/42141440/natural-grocers-by-vitamin-cottage-elastic-matthews-international-gap-and-other-big-stocks-moving-higher-on-frida,CRS,0.219809,Neutral,0.145677
"GoDaddy To Rally Around 44%? Here Are 10 Other Analyst Forecasts For Wednesday - C.H. Robinson Worldwide  ( NASDAQ:CHRW ) , Casey's General Stores  ( NASDAQ:CASY ) ",20230913T124525,https://www.benzinga.com/news/23/09/34534477/godaddy-to-rally-around-44-here-are-10-other-analyst-forecasts-for-wednesday,CRS,0.265859,Somewhat-Bullish,0.263193
