title,time_published,url,ticker,relevance_score,ticker_sentiment_label,ticker_sentiment_score
Why Esperion Therapeutics Shares Are Trading Higher By Around 7%; Here Are 20 Stocks Moving Premarket,20240408T100548,https://markets.businessinsider.com/news/stocks/why-esperion-therapeutics-shares-are-trading-higher-by-around-7-here-are-20-stocks-moving-premarket-1033228934,CRYPTO:BTC,0.083251,Neutral,-0.020913
"Why Esperion Therapeutics Shares Are Trading Higher By Around 7%; Here Are 20 Stocks Moving Premarket - Antelope Ent Hldgs  ( NASDAQ:AEHL ) , Allarity Therapeutics  ( NASDAQ:ALLR ) ",20240408T091551,https://www.benzinga.com/news/24/04/38137629/why-esperion-therapeutics-shares-are-trading-higher-by-around-7-here-are-20-stocks-moving-premarket,CRYPTO:BTC,0.076115,Somewhat-Bullish,0.169166
"Dow Tumbles Over 300 Points; Crude Oil Down 2% - Ainos  ( NASDAQ:AIMD ) , Antelope Ent Hldgs  ( NASDAQ:AEHL ) ",20220930T194810,https://www.benzinga.com/news/earnings/22/09/29104493/dow-tumbles-over-300-points-crude-oil-down-2,CRYPTO:BTC,0.06515,Neutral,-0.045505
"Nasdaq Jumps Over 100 Points; Crude Oil Down 1.5% - Ainos  ( NASDAQ:AIMD ) , Antelope Ent Hldgs  ( NASDAQ:AEHL ) ",20220930T160635,https://www.benzinga.com/news/earnings/22/09/29099844/nasdaq-jumps-over-100-points-crude-oil-down-1-5,CRYPTO:BTC,0.064623,Somewhat-Bullish,0.163266
"EXCLUSIVE: Top 20 Most-Searched Tickers On Pro In December 2024 - Where Do Tesla, Nvidia, Quantum Computing Stock Rank? - Apple  ( NASDAQ:AAPL ) ",20250101T141541,https://www.benzinga.com/trading-ideas/25/01/42755273/exclusive-top-20-most-searched-tickers-on-benzinga-pro-in-december-2024-where-do-tesla-nvidia-quant,CRYPTO:BTC,0.223866,Somewhat-Bullish,0.210416
"Toyota Motor, SEALSQ, KULR Technology And Other Big Stocks Moving Higher On Thursday - Exodus Movement  ( AMEX:EXOD ) ",20241226T152118,https://www.benzinga.com/24/12/42686714/toyota-motor-sealsq-kulr-technology-and-other-big-stocks-moving-higher-on-thursday,CRYPTO:BTC,0.428632,Somewhat-Bullish,0.186591
Quantum computer 'threat' to crypto is exaggerated - For now,20241021T130000,https://cointelegraph.com/news/quantum-computing-bitcoin-encryption-keys,CRYPTO:BTC,0.075555,Neutral,0.005125
Physics for fintech: How quantum AI can make humans better crypto traders,20240831T172651,https://cointelegraph.com/news/physics-fintech-quantum-ai-humans-better-crypto-traders,CRYPTO:BTC,0.077845,Somewhat-Bearish,-0.169595
Synchronoss Technologies  ( NASDAQ:SNCR )  Now Covered by Analysts at StockNews.com,20230916T074043,https://www.defenseworld.net/2023/09/16/synchronoss-technologies-nasdaqsncr-now-covered-by-analysts-at-stocknews-com.html,CRYPTO:BTC,0.072876,Neutral,0.136913
Why Aaron's Shares Are Trading Lower By Over 9%? Here Are Other Stocks Moving In Tuesday's Mid-Day Session,20230801T190537,https://markets.businessinsider.com/news/stocks/why-aaron-s-shares-are-trading-lower-by-over-9-here-are-other-stocks-moving-in-tuesday-s-mid-day-session-1032502331,CRYPTO:BTC,0.032961,Somewhat-Bearish,-0.196022
"TeraWulf Posts Weak Results, Joins StoneCo And Other Big Stocks Moving Lower In Tuesday's Pre-Market Session - TeraWulf  ( NASDAQ:WULF ) ",20240514T092446,https://www.benzinga.com/news/24/05/38808973/terawulf-posts-weak-results-joins-stoneco-and-other-big-stocks-moving-lower-in-tuesdays-pre-market-s,CRYPTO:BTC,0.122269,Neutral,-0.015808
"Crude Oil Down Over 1%; Cognyte Software Shares Plummet - Cognyte Software  ( NASDAQ:CGNT ) , Acrivon Therapeutics  ( NASDAQ:ACRV ) ",20240409T183443,https://www.benzinga.com/news/earnings/24/04/38170230/crude-oil-down-over-1-cognyte-software-shares-plummet,CRYPTO:BTC,0.078099,Somewhat-Bearish,-0.206972
Dow Dips 150 Points; Laser Photonics Shares Spike Higher,20240409T161350,https://markets.businessinsider.com/news/stocks/dow-dips-150-points-laser-photonics-shares-spike-higher-1033234287,CRYPTO:BTC,0.083833,Somewhat-Bearish,-0.210128
"Dow Dips 150 Points; Laser Photonics Shares Spike Higher - Biophytis  ( NASDAQ:BPTS ) , Acrivon Therapeutics  ( NASDAQ:ACRV ) ",20240409T160523,https://www.benzinga.com/news/earnings/24/04/38167401/dow-dips-150-points-laser-photonics-shares-spike-higher,CRYPTO:BTC,0.081276,Somewhat-Bearish,-0.208669
"Casey's General Stores, Cognyte Software, Beauty Health And Other Big Stocks Moving Higher On Tuesday - Bitfarms  ( NASDAQ:BITF ) , Casey's General Stores  ( NASDAQ:CASY ) ",20230912T142440,https://www.benzinga.com/news/23/09/34492305/caseys-general-stores-cognyte-software-beauty-health-and-other-big-stocks-moving-higher-on-tuesday,CRYPTO:BTC,0.116348,Neutral,0.0
"Dow Rises Over 50 Points; US NFIB Small Business Optimism Index Drops In March - Adtran  ( NASDAQ:ADTN ) , Brookdale Senior Living  ( NYSE:BKD ) ",20230411T135557,https://www.benzinga.com/news/earnings/23/04/31744673/dow-rises-over-50-points-us-nfib-small-business-optimism-index-drops-in-march,CRYPTO:BTC,0.071145,Neutral,0.059957
S&P 500 Down Over 1%; Bit Brother Shares Plummet,20230118T200324,https://www.benzinga.com/news/earnings/23/01/30470997/s-p-500-down-over-1-bit-brother-shares-plummet,CRYPTO:BTC,0.061315,Neutral,0.114017
US Stocks Turn Lower; Dow Dips Over 300 Points,20230118T170244,https://www.benzinga.com/news/earnings/23/01/30467063/us-stocks-turn-lower-dow-dips-over-300-points,CRYPTO:BTC,0.064449,Neutral,0.114121
4 Penny Stocks To Watch After OTRK Stock Explodes Over 140%,20220801T153057,https://pennystocks.com/featured/2022/08/01/4-penny-stocks-to-watch-after-otrk-stock-explodes-over-140/,CRYPTO:BTC,0.218817,Somewhat-Bullish,0.152397
90 Biggest Movers From Yesterday,20220513T094449,https://www.benzinga.com/news/22/05/27184008/90-biggest-movers-from-yesterday,CRYPTO:BTC,0.021782,Neutral,-0.000882
"Bitcoin's $59K Surge Leads To $71M In Short Squeezes; Dogecoin, Shiba Inu, Floki Surge, Pushing Meme Coin Market Cap To $26.5B; Donald Trump Wins Michigan's GOP Primary, Setting Stage For March 5 'Super Tuesday' - Top Headlines Today While US Was Sleeping",20240228T144635,https://www.benzinga.com/markets/cryptocurrency/24/02/37365250/bitcoins-59k-surge-leads-to-71m-in-short-squeezes-dogecoin-shiba-inu-floki-surge-pushing-m,CRYPTO:BTC,0.259451,Neutral,0.079921
Why didn't crypto walk the walk at ETHDenver?,20230307T183213,https://cointelegraph.com/news/why-didn-t-crypto-walk-the-walk-at-ethdenver,CRYPTO:BTC,0.048523,Somewhat-Bullish,0.24504
"Job Cuts Today, What Tomorrow? Big Tech Faces Some Big Tests.",20230124T113100,https://www.barrons.com/amp/articles/what-to-know-today-51674547396,CRYPTO:BTC,0.085936,Neutral,-0.060922
"S&P 500 Down 2%; Nasdaq Drops 250 Points - China Pharma Holding  ( AMEX:CPHI ) , EHang Holdings  ( NASDAQ:EH ) ",20221205T193208,https://www.benzinga.com/news/earnings/22/12/29963368/s-p-500-down-2-nasdaq-drops-250-points,CRYPTO:BTC,0.057907,Neutral,-0.101063
"Gold Down 1%; China Pharma Shares Spike Higher - China Pharma Holding  ( AMEX:CPHI ) , EHang Holdings  ( NASDAQ:EH ) ",20221205T172731,https://www.benzinga.com/news/earnings/22/12/29961550/gold-down-1-china-pharma-shares-spike-higher,CRYPTO:BTC,0.059341,Neutral,-0.101119
