title,time_published,url,ticker,relevance_score,ticker_sentiment_label,ticker_sentiment_score
"The Zacks Analyst Blog Highlights SPDR S&P Semiconductor ETF, First Trust NASDAQ Technology Dividend Index Fund, Invesco S&P SmallCap Information Technology ETF, Defiance Quantum ETF and First Trust Indxx Metaverse ETF",20230113T100000,https://www.zacks.com/stock/news/2038831/the-zacks-analyst-blog-highlights-spdr-sp-semiconductor-etf-first-trust-nasdaq-technology-dividend-index-fund-invesco-sp-smallcap-information-technology-etf-defiance-quantum-etf-and-first-trust-indxx-metaverse-etf,CRYPTO:QTUM,0.058188,Neutral,0.032
3 Reasons Why Tech ETFs May Rebound in 2023,20230112T180000,https://www.zacks.com/stock/news/2038671/3-reasons-why-tech-etfs-may-rebound-in-2023,CRYPTO:QTUM,0.068896,Somewhat-Bearish,-0.176851
Quantum Computing: Hype or Investment Opportunity?,20241223T193300,https://www.zacks.com/stock/news/2387113/quantum-computing-hype-or-investment-opportunity,CRYPTO:QTUM,0.085324,Neutral,0.105776
"Quantum Computing: The New AI? A Look at the Rapidly Expanding Market and Top Stocks For 2025 - Global X Cloud Computing ETF  ( NASDAQ:CLOU ) , ARK Next Generation Internet ETF  ( ARCA:ARKW ) ",20241222T190045,https://www.benzinga.com/markets/equities/24/12/42638753/quantum-computing-the-new-ai-a-look-at-the-rapidly-expanding-market-and-top-stocks-for-2025,CRYPTO:QTUM,0.083833,Somewhat-Bearish,-0.288342
"Zacks Investment Ideas feature highlights: NVIDIA, Rigetti Computing, D-Wave Quantum, IonQ and The Defiance Quantum ETF",20241219T100000,https://www.zacks.com/stock/news/2385558/zacks-investment-ideas-feature-highlights-nvidia-rigetti-computing-d-wave-quantum-ionq-and-the-defiance-quantum-etf,CRYPTO:QTUM,0.07887,Neutral,-0.057779
Quantum Computing: The Next Revolution After AI?,20241218T200500,https://www.zacks.com/stock/news/2385494/quantum-computing-the-next-revolution-after-ai,CRYPTO:QTUM,0.085022,Neutral,0.00318
"Top 2025 Tech Trend: Hold 2 Quantum Computing Stocks, Avoid 1",20241212T200500,https://www.zacks.com/stock/news/2383032/top-2025-tech-trend-hold-2-quantum-computing-stocks-avoid-1,CRYPTO:QTUM,0.05133,Neutral,0.06807
"Quantum Computing Stocks Roundup: D-Wave, Rigetti, IonQ Lead the Charge With Explosive Growth - NVIDIA  ( NASDAQ:NVDA ) , IonQ  ( NYSE:IONQ ) ",20241208T193016,https://www.benzinga.com/trading-ideas/movers/24/12/42380768/quantum-computing-stocks-roundup-d-wave-rigetti-ionq-lead-the-charge-with-explosive-growth,CRYPTO:QTUM,0.054983,Somewhat-Bullish,0.156502
