title,time_published,url,ticker,relevance_score,ticker_sentiment_label,ticker_sentiment_score
"Harpoon Therapeutics, Heron Therapeutics And Other Big Stocks Moving Higher In Monday's Pre-Market Session - Altimmune  ( NASDAQ:ALT ) , Annexon  ( NASDAQ:ANNX ) ",20240108T103728,https://www.benzinga.com/news/24/01/36529043/harpoon-therapeutics-heron-therapeutics-and-other-big-stocks-moving-higher-in-mondays-pre-market-ses,CRYPTO:NXT,0.163909,Neutral,0.0
Blackbaud Announces 2024 First Quarter Results,20240430T201000,https://www.prnewswire.com/news-releases/blackbaud-announces-2024-first-quarter-results-302132087.html,CRYPTO:NXT,0.01582,Neutral,0.115182
"Integra LifeSciences Posts Upbeat Results, Joins Air Transport Services, Freshpet, Yum China And Other Big Stocks Moving Higher On Monday - Advance Auto Parts  ( NYSE:AAP ) , XIAO-I  ( NASDAQ:AIXI ) ",20241104T165841,https://www.benzinga.com/news/24/11/41719945/integra-lifesciences-posts-upbeat-results-joins-air-transport-services-freshpet-yum-china-and-other,CRYPTO:NXT,0.089797,Bullish,0.357238
Reasons to Add Nextracker  ( NXT )  Stock to Your Portfolio Now,20240401T132900,https://www.zacks.com/stock/news/2248297/reasons-to-add-nextracker-nxt-stock-to-your-portfolio-now,CRYPTO:NXT,0.209365,Neutral,0.142289
"Stocks Handle Huge Earnings, Fed, Jobs Report: Weekly Review",20240202T171500,https://www.investors.com/news/stock-market-handles-huge-earnings-week-fed-powell-jobs-report-weekly-review/,CRYPTO:NXT,0.016621,Somewhat-Bullish,0.155736
