title,time_published,url,ticker,relevance_score,ticker_sentiment_label,ticker_sentiment_score
"Crude Oil Drops Sharply; Best Buy Earnings Top Expectations - Annexon  ( NASDAQ:ANNX ) , Digital Turbine  ( NASDAQ:APPS ) ",20230525T183908,https://www.benzinga.com/news/earnings/23/05/32582243/crude-oil-drops-sharply-best-buy-earnings-top-expectations,CRYPTO:BTC,0.058759,Neutral,-0.099781
"Nasdaq Surges 1.5%; NVIDIA Shares Jump Following Strong Q1 Results - Annexon  ( NASDAQ:ANNX ) , Digital Turbine  ( NASDAQ:APPS ) ",20230525T160218,https://www.benzinga.com/news/earnings/23/05/32579047/nasdaq-surges-1-5-nvidia-shares-jump-following-strong-q1-results,CRYPTO:BTC,0.058047,Neutral,-0.0997
"Dow Drops 100 Points; US GDP Tops Estimates - Annexon  ( NASDAQ:ANNX ) , Digital Turbine  ( NASDAQ:APPS ) ",20230525T134627,https://www.benzinga.com/news/earnings/23/05/32574777/dow-drops-100-points-us-gdp-tops-estimates,CRYPTO:BTC,0.065866,Somewhat-Bearish,-0.180831
54 Biggest Movers From Yesterday,20220420T094334,https://www.benzinga.com/news/22/04/26706319/54-biggest-movers-from-yesterday,CRYPTO:BTC,0.034595,Neutral,-0.000106
38 Stocks Moving In Tuesday's Mid-Day Session,20220419T161631,https://www.benzinga.com/news/22/04/26694580/38-stocks-moving-in-tuesdays-mid-day-session,CRYPTO:BTC,0.050668,Neutral,-0.001525
"Why US Futures Are Rising Wednesday - Corvus Pharma  ( NASDAQ:CRVS ) , Applied DNA Sciences  ( NASDAQ:APDN ) ",20241218T112212,https://www.benzinga.com/trading-ideas/previews/24/12/42549182/us-stocks-to-open-higher-as-rate-cut-expectations-surge-all-eyes-on-dow-jones-to-break-its,CRYPTO:BTC,0.03804,Neutral,0.030464
Applied DNA Sciences  ( NASDAQ:APDN )  Receives New Coverage from Analysts at StockNews.com,20240304T071648,https://www.defenseworld.net/2024/03/04/applied-dna-sciences-nasdaqapdn-receives-new-coverage-from-analysts-at-stocknews-com.html,CRYPTO:BTC,0.089462,Neutral,0.144151
StockNews.com Upgrades Applied DNA Sciences  ( NASDAQ:APDN )  to Hold,20230323T052844,https://www.defenseworld.net/2023/03/23/stocknews-com-upgrades-applied-dna-sciences-nasdaqapdn-to-hold-2.html,CRYPTO:BTC,0.167904,Neutral,0.124205
Dow Drops More Than 200 Points; Caterpillar Shares Fall Following Q2 Results,20220802T185225,https://www.benzinga.com/news/earnings/22/08/28317928/dow-drops-more-than-200-points-caterpillar-shares-fall-following-q2-results,CRYPTO:BTC,0.080458,Neutral,-0.098684
Nasdaq Turns Positive; Crude Oil Moves Higher,20220802T161610,https://www.benzinga.com/news/earnings/22/08/28315227/nasdaq-turns-positive-crude-oil-moves-higher,CRYPTO:BTC,0.083833,Neutral,0.038541
Crude Oil Drops 1%; General Motors Earnings Miss Views,20220726T183646,https://www.benzinga.com/news/earnings/22/07/28212522/crude-oil-drops-1-general-motors-earnings-miss-views,CRYPTO:BTC,0.062597,Neutral,-0.130067
Nasdaq Tumbles 200 Points; McDonald's Posts Upbeat Q2 Earnings,20220726T163041,https://www.benzinga.com/news/earnings/22/07/28210367/nasdaq-tumbles-200-points-mcdonalds-posts-upbeat-q2-earnings,CRYPTO:BTC,0.064276,Neutral,-0.130147
"Why Intelligent Bio Solutions Shares Are Trading Lower By Around 55%? Here Are Other Stocks Moving In Monday's Mid-Day Session - AERWINS Technologies  ( NASDAQ:AWIN ) , Arch Resources  ( NYSE:ARCH ) ",20231002T170027,https://www.benzinga.com/news/23/10/35037344/why-intelligent-bio-solutions-shares-are-trading-lower-by-around-55-here-are-other-stocks-moving-in,CRYPTO:BTC,0.056674,Neutral,0.149958
"Pitney Bowes, Marathon Digital And Other Big Stocks Moving Higher On Monday - Cipher Mining  ( NASDAQ:CIFR ) , Cleanspark  ( NASDAQ:CLSK ) ",20231002T142053,https://www.benzinga.com/news/23/10/35032992/pitney-bowes-marathon-digital-and-other-big-stocks-moving-higher-on-monday,CRYPTO:BTC,0.350564,Bullish,0.405915
"Why NanoVibronix Shares Surged Over 25%; Here Are 82 Biggest Movers From Friday - ABVC BioPharma  ( NASDAQ:ABVC ) , Altimmune  ( NASDAQ:ALT ) ",20220926T074323,https://www.benzinga.com/news/22/09/29002223/why-nanovibronix-shares-surged-over-25-here-are-82-biggest-movers-from-friday,CRYPTO:BTC,0.022284,Neutral,-0.129348
StockNews.com Downgrades Tuniu  ( NASDAQ:TOUR )  to Hold,20231103T072843,https://www.defenseworld.net/2023/11/03/stocknews-com-downgrades-tuniu-nasdaqtour-to-hold.html,CRYPTO:BTC,0.081276,Somewhat-Bullish,0.150867
StockNews.com Upgrades Tuniu  ( NASDAQ:TOUR )  to Buy,20231028T054843,https://www.defenseworld.net/2023/10/28/stocknews-com-upgrades-tuniu-nasdaqtour-to-buy.html,CRYPTO:BTC,0.087503,Neutral,0.130048
StockNews.com Downgrades Tuniu  ( NASDAQ:TOUR )  to Sell,20230323T052843,https://www.defenseworld.net/2023/03/23/stocknews-com-downgrades-tuniu-nasdaqtour-to-sell.html,CRYPTO:BTC,0.192694,Neutral,0.133924
77 Biggest Movers From Yesterday,20220601T090222,https://www.benzinga.com/news/22/06/27492435/77-biggest-movers-from-yesterday,CRYPTO:BTC,0.057208,Neutral,0.010905
40 Stocks Moving In Tuesday's Mid-Day Session,20220531T160405,https://www.benzinga.com/news/22/05/27478950/40-stocks-moving-in-tuesdays-mid-day-session,CRYPTO:BTC,0.115787,Neutral,0.009003
"Advanced Human Imaging  ( NASDAQ:AHI ) , Aditxt  ( NASDAQ:ADTX )  - Why Immunocore Shares Dipped 22%; Here Are 73 Biggest Movers From Friday",20220912T072340,https://www.benzinga.com/news/22/09/28823434/why-immunocore-shares-dipped-22-here-are-73-biggest-movers-from-friday,CRYPTO:BTC,0.062597,Somewhat-Bullish,0.192188
"uniQure  ( NASDAQ:QURE )  Upgraded to ""Sell"" at StockNews.com",20240303T074844,https://www.defenseworld.net/2024/03/03/uniqure-nasdaqqure-upgraded-to-sell-at-stocknews-com.html,CRYPTO:BTC,0.049526,Neutral,0.042955
"Ally Financial Reports Upbeat Earnings, Joins Badger Meter, Genuine Parts And Other Big Stocks Moving Higher On Thursday - Ally Financial  ( NYSE:ALLY ) , Apogee Enterprises  ( NASDAQ:APOG ) ",20240418T175852,https://www.benzinga.com/news/24/04/38321505/ally-financial-reports-upbeat-earnings-joins-badger-meter-genuine-parts-and-other-big-stocks-moving,CRYPTO:BTC,0.100308,Somewhat-Bullish,0.167488
50 Biggest Movers From Yesterday,20220329T091148,https://www.benzinga.com/news/22/03/26340073/50-biggest-movers-from-yesterday,CRYPTO:BTC,0.037259,Neutral,0.001987
35 Stocks Moving In Monday's Mid-Day Session,20220328T161143,https://www.benzinga.com/news/22/03/26327227/35-stocks-moving-in-mondays-mid-day-session,CRYPTO:BTC,0.051696,Neutral,0.003047
99 Biggest Movers From Yesterday,20220512T082956,https://www.benzinga.com/news/22/05/27156577/99-biggest-movers-from-yesterday,CRYPTO:BTC,0.021239,Neutral,0.007596
90 Biggest Movers From Yesterday,20220510T091132,https://www.benzinga.com/news/22/05/27100105/90-biggest-movers-from-yesterday,CRYPTO:BTC,0.050306,Neutral,-0.001558
90 Biggest Movers From Yesterday,20220510T091132,https://markets.businessinsider.com/news/stocks/90-biggest-movers-from-yesterday-1031440764,CRYPTO:BTC,0.046015,Neutral,0.000813
"Crude Oil Falls 2.5%; Ralph Lauren Posts Upbeat Earnings - Blade Air Mobility  ( NASDAQ:BLDE ) , Durect  ( NASDAQ:DRRX ) ",20231108T195219,https://www.benzinga.com/news/earnings/23/11/35682856/crude-oil-falls-2-5-ralph-lauren-posts-upbeat-earnings,CRYPTO:BTC,0.066784,Somewhat-Bullish,0.339928
"Dow Falls Over 100 Points; US Wholesale Inventories Edge Higher - Durect  ( NASDAQ:DRRX ) , Establishment Labs Hldgs  ( NASDAQ:ESTA ) ",20231108T175506,https://www.benzinga.com/news/earnings/23/11/35680235/dow-falls-over-100-points-us-wholesale-inventories-edge-higher,CRYPTO:BTC,0.075397,Somewhat-Bullish,0.343487
"Why Bed Bath & Beyond Shares Are Trading Lower By 23%; Here Are 20 Stocks Moving Premarket - Bed Bath & Beyond  ( NASDAQ:BBBY ) , Apollomics  ( NASDAQ:APLM ) ",20230426T123739,https://www.benzinga.com/news/23/04/32009221/why-bed-bath-beyond-shares-are-trading-lower-by-23-here-are-20-stocks-moving-premarket,CRYPTO:BTC,0.063425,Neutral,0.122089
"Stock Market Today: Dow Jones, S&P 500 Opened Higher; Coinbase Stock Slides After Earnings Report",20220511T141515,https://stockmarket.com/featured/stock-market-today-dow-jones-s-coinbase-stock-slides-after-earnings-report-2022-05-11,CRYPTO:BTC,0.080688,Neutral,-0.110381
"10 Short Squeeze Stocks To Watch: Getty Images, Bitcoin Depot, Blue Apron Holdings And More - Getty Images Holdings  ( NYSE:GETY ) ",20230911T145221,https://www.benzinga.com/markets/cryptocurrency/23/09/34441982/10-short-squeeze-stocks-to-watch-getty-images-bitcoin-depot-blue-apron-holdings-and-more,CRYPTO:BTC,0.237551,Neutral,0.106042
"Chembio Diagnostics  ( NASDAQ:CEMI ) , Ayala Pharmaceuticals  ( NASDAQ:AYLA )  - Why Zumiez Is Trading Lower By 14%; Here Are 20 Stocks Moving Premarket",20220909T103544,https://www.benzinga.com/news/22/09/28807938/why-zumiez-is-trading-lower-by-14-here-are-20-stocks-moving-premarket,CRYPTO:BTC,0.079656,Neutral,0.0
Why Zumiez Is Trading Lower By 14%; Here Are 20 Stocks Moving Premarket,20220909T103544,https://markets.businessinsider.com/news/stocks/why-zumiez-is-trading-lower-by-14-here-are-20-stocks-moving-premarket-1031734321,CRYPTO:BTC,0.082111,Neutral,0.0
Why Crypto-Related Stocks Are Trading Lower: Here Are 34 Stocks Moving Premarket,20220819T112410,https://www.benzinga.com/news/22/08/28564076/why-crypto-related-stocks-are-trading-lower-here-are-34-stocks-moving-premarket,CRYPTO:BTC,0.127007,Somewhat-Bearish,-0.284584
Dow Dips More Than 200 Points; Crude Oil Moves Lower,20220722T185928,https://www.benzinga.com/news/earnings/22/07/28174160/dow-dips-more-than-200-points-crude-oil-moves-lower,CRYPTO:BTC,0.074692,Somewhat-Bearish,-0.151856
Nasdaq Drops Around 200 Points; Hanger Shares Spike Higher,20220722T164959,https://www.benzinga.com/news/earnings/22/07/28172512/nasdaq-drops-around-200-points-hanger-shares-spike-higher,CRYPTO:BTC,0.075397,Somewhat-Bearish,-0.152041
$1 Million Bet On CalAmp? 4 Penny Stocks Insiders are Buying,20220701T133116,https://www.benzinga.com/trading-ideas/long-ideas/22/07/27931578/1-million-bet-on-calamp-4-penny-stocks-insiders-are-buying,CRYPTO:BTC,0.096014,Neutral,0.015282
53 Biggest Movers From Yesterday,20220408T084938,https://www.benzinga.com/news/22/04/26539460/53-biggest-movers-from-yesterday,CRYPTO:BTC,0.031907,Neutral,-0.067735
38 Stocks Moving In Thursday's Mid-Day Session,20220407T171413,https://www.benzinga.com/news/22/04/26529716/38-stocks-moving-in-thursdays-mid-day-session,CRYPTO:BTC,0.044051,Neutral,-0.033101
"How a Bitcoin ATM Operator Thinks Hackers Accessed Personal Data for 58,000 Users",20241213T130623,https://decrypt.co/296415/bitcoin-atm-hacker-personal-data,CRYPTO:BTC,0.152018,Neutral,-0.127665
"Bitcoin Ordinals Startup, Project Spartacus Revive WikiLeaks Afghan War Logs",20241205T140102,https://decrypt.co/294952/ordinalsbot-revives-wikileaks-afghan-war-logs-bitcoin-ordinals-project,CRYPTO:BTC,0.629492,Neutral,-0.076912
Upbit to store user data on AWS: What users should know,20240924T092421,https://cointelegraph.com/news/upbit-user-data-aws-us,CRYPTO:BTC,0.205807,Neutral,0.0
Restaking will spark the next big rush of money into crypto,20240917T180431,https://cointelegraph.com/news/restaking-will-spark-next-big-rush-money-into-crypto,CRYPTO:BTC,0.200688,Somewhat-Bullish,0.153407
Mind Reading Technology Reads Minds Already,20240826T160632,https://www.benzinga.com/general/24/08/40557119/mind-reading-technology-reads-minds-already,CRYPTO:BTC,0.054607,Somewhat-Bearish,-0.168846
Crypto Payment Network for AI Agents Launched by Former Ripple Execs,20240821T110106,https://decrypt.co/245632/skyfire-crypto-payment-network-ai-agents-usdc,CRYPTO:BTC,0.049526,Neutral,0.13712
BlockQuarry Corp. Unveils Strategic Shift Towards AI and HPC Integration for Enhanced Growth and Efficiency,20240801T120000,https://www.globenewswire.com/news-release/2024/08/01/2922702/0/en/BlockQuarry-Corp-Unveils-Strategic-Shift-Towards-AI-and-HPC-Integration-for-Enhanced-Growth-and-Efficiency.html,CRYPTO:BTC,0.127456,Somewhat-Bullish,0.272305
Irys launches layer-1 programmatic data blockchain,20240730T130000,https://cointelegraph.com/news/irys-launches-layer-1-programmatic-data-blockchain,CRYPTO:BTC,0.116348,Neutral,-0.012585
10 years on: How Ethereum's ICO changed the crypto landscape,20240723T133200,https://cointelegraph.com/news/10-years-ethereum-ico-crypto-landscape,CRYPTO:BTC,0.21462,Neutral,0.015076
New zero energy storage tech could lead to immortal blockchains,20240720T203851,https://cointelegraph.com/news/new-zero-energy-storage-tech-immortal-blockchains,CRYPTO:BTC,0.134214,Neutral,-0.077111
Germany's Bitcoin Balance Grows as Users Send BTC With Secret Messages,20240715T182034,https://decrypt.co/239855/germany-bitcoin-balance-grows-users-send-btc-secret-messages,CRYPTO:BTC,0.928139,Neutral,-0.008443
Exploring Sui's Object-Centric Model and the Move Programming Language,20240629T123000,https://cointelegraph.com/news/sui-object-centric-model-move-programming-language,CRYPTO:BTC,0.027042,Neutral,0.0
Why is Bitcoin DeFi blooming? Developers share their insights,20240624T173000,https://cointelegraph.com/news/why-is-bitcoin-defi-blooming-developers-share-their-insights,CRYPTO:BTC,0.909239,Bullish,0.471018
The Hype Trap: 3 Overblown Stocks to Escape Before It's Too Late,20240622T140026,https://markets.businessinsider.com/news/stocks/the-hype-trap-3-overblown-stocks-to-escape-before-its-too-late-1033497493,CRYPTO:BTC,0.29234,Neutral,0.129754
Why Ethereum Layer-2 Network Taiko Is Spending $100K Daily on Blobs,20240608T182719,https://decrypt.co/234426/why-ethereum-l2-taiko-spending-100k-daily-blobs,CRYPTO:BTC,0.038223,Neutral,-0.139264
Blockchain can help eliminate cybercrime threats,20240529T133000,https://cointelegraph.com/news/blockchain-reducing-cybercrime-2024,CRYPTO:BTC,0.055751,Neutral,0.05289
This Crypto Startup Says You Can Earn Rewards By Training Its AI,20240521T160114,https://decrypt.co/231542/this-crypto-startup-says-you-can-earn-rewards-by-training-its-ai,CRYPTO:BTC,0.060541,Neutral,0.137348
"Trader turns $3K into $46M in PEPE, Ethereum gas overhaul, Tornado dev guilty: Hodler's Digest, May 12-18",20240518T203000,https://cointelegraph.com/magazine/trader-turns-3k-into-46m-pepe-ethereum-gas-overhaul-tornado-cash-dev-guilty-hodlers-digest-may-12-18/,CRYPTO:BTC,0.434285,Neutral,0.138732
How Lorenzo Protocol is Supercharging Bitcoin DeFi With Liquid Restaking,20240517T171638,https://decrypt.co/230634/how-lorenzo-protocol-is-supercharging-bitcoin-defi-with-liquid-restaking,CRYPTO:BTC,0.904419,Bullish,0.404653
BRC20 Ordinals: Bitcoin's High-Tech Leap Or A Distraction?,20240513T094715,https://www.forbes.com/sites/irinaheaver/2024/05/13/brc20-ordinals-bitcoins-high-tech-leap-or-a-distraction/,CRYPTO:BTC,0.722395,Somewhat-Bullish,0.154246
Coinbase leverages MiFID II to enhance European derivatives offerings,20240106T071726,https://cointelegraph.com/news/coinbase-leverages-mifid-ii-to-enhance-european-derivatives-offerings,CRYPTO:BTC,0.109956,Neutral,0.066627
Coinbase is planning a pivotal acquisition that will allow it to launch crypto derivatives in the EU,20240105T210501,https://www.cnbc.com/2024/01/05/coinbase-to-expand-crypto-derivatives-in-eu-with-license-acquisition-.html,CRYPTO:BTC,0.177802,Neutral,-0.003028
How will James Cleverly deliver the biggest ever reduction in net migration?,20231205T144606,https://theweek.com/politics/how-will-james-cleverly-deliver-the-biggest-ever-reduction-in-net-migration,CRYPTO:BTC,0.035241,Neutral,0.128686
'Make sure Ethereum wins' - Steve Newcomb reveals zkSync's prime directive - Cointelegraph Magazine,20221228T144500,https://cointelegraph.com/magazine/make-sure-ethereum-wins-steve-newcomb-reveals-zksyncs-prime-directive/,CRYPTO:BTC,0.022772,Neutral,0.097088
"US Stocks Mixed After Wednesday's Rally - Aziyo Biologics  ( NASDAQ:AZYO ) , Arco Platform  ( NASDAQ:ARCE ) ",20221201T152433,https://www.benzinga.com/news/earnings/22/12/29925840/us-stocks-mixed-after-wednesdays-rally,CRYPTO:BTC,0.054483,Somewhat-Bullish,0.158824
Nasdaq Fights to Stay Green as These 2 Stocks Soar,20220531T174645,https://www.fool.com/investing/2022/05/31/nasdaq-fights-to-stay-green-as-these-2-stocks-soar/,CRYPTO:BTC,0.399416,Neutral,-0.043194
"Nasdaq, S&P 500 On Track To Rise Yet Again: What's Driving Futures - Invesco QQQ Trust, Series 1  ( NASDAQ:QQQ ) , SPDR S&P 500  ( ARCA:SPY ) ",20240924T105848,https://www.benzinga.com/news/earnings/24/09/40998340/nasdaq-s-p-500-futures-firm-chinas-economic-stimulus-fuels-commodities-bitcoin-steady-heres-what-tr,CRYPTO:BTC,0.071145,Neutral,0.095508
Analyst Claims Bitcoin Is Excelling In Its Current Cycle Based On Three Metrics; Michael Cohen's Family Doxxed After Trump's Hush Money Conviction - Top Headlines Today While US Slept,20240605T131324,https://www.benzinga.com/markets/cryptocurrency/24/06/39184122/analyst-claims-bitcoin-is-excelling-in-its-current-cycle-based-on-three-metrics-michael-co,CRYPTO:BTC,0.181137,Neutral,0.026524
"Nasdaq, S&P 500 Eye Strong Open Today: What's Driving Stock Futures Up? - Invesco QQQ Trust, Series 1  ( NASDAQ:QQQ ) , SPDR S&P 500  ( ARCA:SPY ) ",20240605T112425,https://www.benzinga.com/news/earnings/24/06/39180770/wall-street-looks-to-extend-gains-as-traders-eye-more-jobs-data-why-this-analyst-sees-4-s-p-500-ris,CRYPTO:BTC,0.113866,Neutral,0.003467
"Nasdaq, S&P 500 Futures Drop As Tech Weakens, Meme Stock Rally Sputters: Analyst Sees Rate Cuts Hinging On Key Fed Data - Invesco QQQ Trust, Series 1  ( NASDAQ:QQQ ) , SPDR S&P 500  ( ARCA:SPY ) ",20240604T112738,https://www.benzinga.com/news/earnings/24/06/39155948/nasdaq-s-p-500-futures-drop-as-tech-weakens-meme-stock-rally-sputters-analyst-sees-rate-cuts-hingin,CRYPTO:BTC,0.100518,Neutral,-0.145385
"Nasdaq, S&P 500 Set To Open Lower Today: What's Going On With Stock Futures? - Invesco QQQ Trust, Series 1  ( NASDAQ:QQQ ) , SPDR S&P 500  ( ARCA:SPY ) ",20240305T113825,https://www.benzinga.com/news/earnings/24/03/37477255/nasdaq-futures-slide-on-mega-cap-tech-weakness-analyst-paints-1999-like-rosy-picture-tells-investor,CRYPTO:BTC,0.103778,Neutral,0.130032
"GitLab, Target, AeroVironment, Tesla, MicroStrategy, Paymentus, and More Stock Market Movers",20240305T092200,https://www.barrons.com/amp/articles/stock-market-movers-5bdb61c2,CRYPTO:BTC,0.290033,Somewhat-Bullish,0.190143
"Nasdaq, S&P 500 Futures Point To Nervous Monday Start While Bitcoin Sizzles: What's Going On? - Invesco QQQ Trust, Series 1  ( NASDAQ:QQQ ) , SPDR S&P 500  ( ARCA:SPY ) ",20240304T112156,https://www.benzinga.com/news/earnings/24/03/37450241/wall-street-turns-cautious-after-record-close-while-bitcoin-sizzles-analyst-says-blast-off-from-oct,CRYPTO:BTC,0.150278,Neutral,0.072223
"General Electric, Verizon, Cleveland-Cliffs And Other Big Stocks Moving Higher On Tuesday - Amneal Pharmaceuticals  ( NYSE:AMRX ) , Agilysys  ( NASDAQ:AGYS ) ",20231024T154050,https://www.benzinga.com/news/23/10/35396872/general-electric-verizon-cleveland-cliffs-and-other-big-stocks-moving-higher-on-tuesday,CRYPTO:BTC,0.30928,Somewhat-Bullish,0.342238
"Apple To Start Rolling Out iOS 17 Update Today, Bitcoin, Ethereum, Dogecoin Trade Mixed - Top Headlines Today While US Was Sleeping",20230918T120754,https://www.benzinga.com/news/23/09/34684478/apple-to-start-rolling-out-ios-17-update-today-bitcoin-ethereum-dogecoin-trade-mixed-top-headlines-t,CRYPTO:BTC,0.180685,Somewhat-Bullish,0.183622
Apple's Impressive First Shot and a Messy Crypto Situation,20230613T194031,https://www.fool.com/investing/2023/06/13/apples-impressive-first-shot-and-a-messy-crypto-si/,CRYPTO:BTC,0.006005,Neutral,0.007403
"Crude Oil Rises Over 1%; United Natural Foods Posts Downbeat Results - Farmer Bros  ( NASDAQ:FARM ) , Couchbase  ( NASDAQ:BASE ) ",20230607T185355,https://www.benzinga.com/news/earnings/23/06/32765941/crude-oil-rises-over-1-united-natural-foods-posts-downbeat-results,CRYPTO:BTC,0.049835,Somewhat-Bullish,0.285449
"Nasdaq Drops Over 100 Points; Campbell Soup Earnings Beat Estimates - Campbell Soup  ( NYSE:CPB ) , Couchbase  ( NASDAQ:BASE ) ",20230607T163734,https://www.benzinga.com/news/earnings/23/06/32763380/nasdaq-drops-over-100-points-campbell-soup-earnings-beat-estimates,CRYPTO:BTC,0.050786,Somewhat-Bullish,0.285613
"Stocks Open Higher; US Trade Deficit Widens In April - Chijet Motor Co  ( NASDAQ:CJET ) , Couchbase  ( NASDAQ:BASE ) ",20230607T134718,https://www.benzinga.com/news/earnings/23/06/32758538/stocks-open-higher-us-trade-deficit-widens-in-april,CRYPTO:BTC,0.05833,Somewhat-Bullish,0.286078
2023 layoff tracker: The latest on which companies have announced job cuts | Business,20230425T190700,https://www.cnn.com/2023/04/25/business/layoffs-2023/index.html,CRYPTO:BTC,0.026241,Neutral,0.12352
"Apple investor day, Powell testimony, jobs report top week ahead",20230305T185259,https://www.foxbusiness.com/markets/apple-investor-day-powell-testimony-jobs-report-top-week-ahead,CRYPTO:BTC,0.047278,Neutral,-0.084968
Here are the companies that have laid off employees this year -- so far | Business,20230121T224300,https://www.cnn.com/2023/01/21/business/layoffs-google-vox-microsoft/,CRYPTO:BTC,0.0686,Neutral,0.134517
Here are the companies that have laid off employees this year -- so far | Business,20230121T224300,https://www.cnn.com/2023/01/21/business/layoffs-google-vox-microsoft/index.html,CRYPTO:BTC,0.0686,Neutral,0.134517
950 More Employees To Lose Their Jobs As Coinbase Goes For Another Round Of Layoffs,20230118T192134,https://www.forbes.com/sites/qai/2023/01/18/950-more-employees-to-lose-their-jobs-as-coinbase-goes-for-another-round-of-layoffs/,CRYPTO:BTC,0.083833,Neutral,0.012528
"Musk pushes Twitter files, Georgia runoff election, FTX fallout ongoing top week ahead",20221204T232326,https://www.foxbusiness.com/markets/musk-twitter-georgia-runoff-election-ftx-sbf-top-week-ahead,CRYPTO:BTC,0.066784,Neutral,0.026165
Is the worst over for bitcoin and the rest of crypto?,20221204T155300,https://www.cnn.com/2022/12/04/investing/stocks-week-ahead/index.html,CRYPTO:BTC,0.333257,Neutral,-0.106019
"US Stock Futures Edge Higher; All Eyes On Fed Decision - Alpine Immune Sciences  ( NASDAQ:ALPN ) , Estee Lauder Cos  ( NYSE:EL ) ",20220921T091259,https://www.benzinga.com/news/earnings/22/09/28943897/us-stock-futures-edge-higher-all-eyes-on-fed-decision,CRYPTO:BTC,0.067919,Neutral,0.03562
"Bitcoin Surges Above This Major Level, Here Are Other Crypto Movers That Should Be On Your Radar Today - Bitcoin  ( BTC/USD ) , APE Coin  ( APE/USD ) ",20220920T075132,https://www.benzinga.com/markets/cryptocurrency/22/09/28925719/bitcoin-surges-above-this-major-level-here-are-other-crypto-movers-that-should-be-on-your-,CRYPTO:BTC,0.570165,Bullish,0.516083
Monday's Market Minute: A Busy Week for Investors and Traders,20220919T174332,https://www.benzinga.com/news/earnings/22/09/28919349/mondays-market-minute-a-busy-week-for-investors-and-traders,CRYPTO:BTC,0.138464,Neutral,0.048694
"Jobs data, Bed Bath & Beyond update, Best Buy earnings top week ahead",20220829T001226,https://www.foxbusiness.com/markets/jobs-data-bed-bath-beyond-update-best-buy-earnings-week-ahead,CRYPTO:BTC,0.092036,Somewhat-Bullish,0.15131
"Jobs report, GameStop earnings, home prices top week ahead",20220530T060359,https://www.foxbusiness.com/markets/jobs-report-gamestop-earnings-home-prices-week-ahead,CRYPTO:BTC,0.071935,Neutral,0.006568
"Top Stories Thursday, July 6a: Samsung Electronics Expects Lowest Quarterly Profits In 14 Years, Exxon Anticipates Lower Natural Gas Prices & Refining Margins To Hit Profits, Bank Of America Boosts Dividend After Stress Test",20230706T133400,https://www.benzinga.com/news/23/07/33132799/samsung-electronics-expects-lowest-quarterly-profits-in-14-years-exxon-anticipates-lower-natural-gas,CRYPTO:BTC,0.067441,Neutral,-0.065132
Cathie Wood Goes Bargain Hunting: 3 Stocks She Just Bought,20230321T141500,https://www.fool.com/investing/2023/03/21/cathie-wood-goes-bargain-hunting-3-stocks-she-just/,CRYPTO:BTC,0.124486,Neutral,-0.014734
Robert F. Kennedy Jr. Wades Further Into Crypto Following Anti-CBDC Remarks,20230502T231037,https://decrypt.co/138619/robert-f-kennedy-jr-wades-further-into-crypto-following-anti-cbdc-remarks,CRYPTO:BTC,0.083833,Neutral,-0.040094
The CFTC's suit against Binance marks a deepening crackdown on the crypto industry,20230328T101000,https://www.businessinsider.com/regulators-sec-crypto-wild-west-markets-economy-gensler-binance-stocks-2023-3,CRYPTO:BTC,0.036926,Neutral,0.058211
The SEC just warned investors that crypto assets are at risk of 'significant' losses after $2 trillion in market value was already erased,20230325T033835,https://africa.businessinsider.com/markets/the-sec-just-warned-investors-that-crypto-assets-are-at-risk-of-significant-losses/849fkg8,CRYPTO:BTC,0.097854,Neutral,0.064406
The SEC just warned investors that crypto assets are at risk of 'significant' losses after $2 trillion in market value was already erased,20230324T171411,https://markets.businessinsider.com/news/currencies/sec-warns-investors-crypto-significant-losses-risk-bitcoin-coinbase-gensler-2023-3,CRYPTO:BTC,0.079921,Neutral,0.061578
SEC cautions against investing in crypto asset securities as they may not comply with law,20230323T160100,https://www.marketwatch.com/story/sec-cautions-against-investing-in-crypto-asset-securities-as-they-may-not-comply-with-law-7c5594cc,CRYPTO:BTC,0.128822,Neutral,-0.026877
Cathie Wood: Regulators Using Crypto As 'Scapegoat For Their Own Lapses',20230316T045127,https://www.benzinga.com/markets/cryptocurrency/23/03/31373689/cathie-wood-says-regulators-using-crypto-as-scapegoat-for-their-own-lapses-as-congressman-,CRYPTO:BTC,0.371523,Neutral,-0.012923
Antelope Enterprise Announces Entry Into the Energy Supply Business to Meet High Expected Demand,20240917T124500,https://www.globenewswire.com/news-release/2024/09/17/2947448/0/en/Antelope-Enterprise-Announces-Entry-Into-the-Energy-Supply-Business-to-Meet-High-Expected-Demand.html,CRYPTO:BTC,0.09989,Neutral,0.142374
