title,time_published,url,ticker,relevance_score,ticker_sentiment_label,ticker_sentiment_score
"Cintas Reports Upbeat Earnings, Joins PaySign, Noah Holdings And Other Big Stocks Moving Higher On Wednesday - Cintas  ( NASDAQ:CTAS ) , Noah Holdings  ( NYSE:NOAH ) , PaySign  ( NASDAQ:PAYS ) ",20240327T140327,https://www.benzinga.com/news/24/03/37959584/cintas-reports-upbeat-earnings-joins-paysign-noah-holdings-and-other-big-stocks-moving-higher-on-wed,CTAS,0.391923,Bullish,0.40123
"Lululemon To Rally Around 14%? Here Are 10 Top Analyst Forecasts For Friday - Beam Therapeutics  ( NASDAQ:BEAM ) , Applied DNA Sciences  ( NASDAQ:APDN ) ",20231208T122024,https://www.benzinga.com/news/23/12/36151264/lululemon-to-rally-around-14-here-are-10-top-analyst-forecasts-for-friday,CTAS,0.238913,Somewhat-Bullish,0.181036
"Fed Inflation Gauge, Key Earnings Highlight Investing Action Plan",20240524T120000,https://www.investors.com/research/investing-action-plan/fed-inflation-gauge-key-earnings/,CTAS,0.09036,Neutral,0.107908
"Nvidia, JPMorgan Chase Lead Five Stocks Near Buy Points",20240511T152800,https://www.investors.com/news/nvidia-jpmorgan-chase-nvda-stocks-near-buy-points/,CTAS,0.276214,Somewhat-Bullish,0.180537
Dow Falls Over 50 Points; Cintas Posts Upbeat Earnings - Cintas  ( NASDAQ:CTAS ) ,20240925T135350,https://www.benzinga.com/news/earnings/24/09/41025717/dow-falls-over-50-points-cintas-posts-upbeat-earnings,CTAS,0.241284,Bullish,0.361669
