title,time_published,url,ticker,relevance_score,ticker_sentiment_label,ticker_sentiment_score
"Take the Zacks Approach to Beat the Market: Annexon, NVIDIA, Intuit in Focus",20240122T115800,https://www.zacks.com/stock/news/2213270/take-the-zacks-approach-to-beat-the-market-annexon-nvidia-intuit-in-focus,CYBR,0.067158,Neutral,0.108262
"Earnings Scheduled For May 12, 2022",20220512T085523,https://www.benzinga.com/news/earnings/22/05/27156592/earnings-scheduled-for-may-12-2022,CYBR,0.017681,Neutral,-0.122124
"Starbucks, Teleflex, Roku, Shopify And Other Big Stocks Moving Higher On Thursday - Arcellx  ( NASDAQ:ACLX ) , ADT  ( NYSE:ADT ) ",20231102T150148,https://www.benzinga.com/news/23/11/35566540/starbucks-teleflex-roku-shopify-and-other-big-stocks-moving-higher-on-thursday,CYBR,0.114409,Somewhat-Bullish,0.344365
"Alibaba, Illumina, CyberArk Software And Other Big Stocks Moving Higher On Thursday - Alarm.com Holdings  ( NASDAQ:ALRM ) , Applied Industrial  ( NYSE:AIT ) ",20230810T143943,https://www.benzinga.com/news/23/08/33711133/alibaba-illumina-cyberark-software-and-other-big-stocks-moving-higher-on-thursday,CYBR,0.222838,Neutral,0.135231
"Stocks could see more tumult next week, especially if bond yields continue to scream higher",20220506T200333,https://www.cnbc.com/2022/05/06/stocks-could-see-more-tumult-next-week-especially-if-bond-yields-continue-to-scream-higher.html,CYBR,0.853507,Neutral,0.001326
"Will Earnings Cheer Continue To Buoy Markets? Apple, Amazon, Pfizer, Coinbase Lead Flurry Of Q1 Reports This Week - Invesco QQQ Trust, Series 1  ( NASDAQ:QQQ ) , SPDR S&P 500  ( ARCA:SPY ) ",20240429T055121,https://www.benzinga.com/news/earnings/24/04/38481553/will-earnings-cheer-continue-to-buoy-markets-apple-amazon-pfizer-coinbase-lead-flurry-of-q1-reports,CYBR,0.069294,Neutral,0.0
"United Airlines To Rally Over 30%? Here Are 10 Top Analyst Forecasts For Tuesday - Five Below  ( NASDAQ:FIVE ) , CyberArk Software  ( NASDAQ:CYBR ) ",20240109T130608,https://www.benzinga.com/news/24/01/36554390/united-airlines-to-rally-over-30-here-are-10-top-analyst-forecasts-for-tuesday,CYBR,0.229149,Somewhat-Bullish,0.196139
