title,time_published,url,ticker,relevance_score,ticker_sentiment_label,ticker_sentiment_score
Stocks That Hit 52-Week Lows On Thursday,20220428T193101,https://www.benzinga.com/markets/options/22/04/26872967/52-weeks-high-and-low-article,DD,0.00644,Neutral,0.005528
Stocks That Hit 52-Week Lows On Monday,20220613T161842,https://www.benzinga.com/markets/options/22/06/27677156/52-weeks-high-and-low-article,DD,0.005366,Neutral,0.000957
Stocks That Hit 52-Week Lows On Monday,20220425T160100,https://www.benzinga.com/markets/options/22/04/26791205/52-weeks-high-and-low-article,DD,0.008154,Somewhat-Bearish,-0.218942
"Earnings Scheduled For May 3, 2022",20220503T085235,https://www.benzinga.com/news/earnings/22/05/26953640/earnings-scheduled-for-may-3-2022,DD,0.01558,Neutral,-0.003775
"Apple, Amazon, Microsoft, Meta Lead The Charge As Investors Bank On Tech Cheer For Rally's Reacceleration: Week Ahead In Earnings - SPDR S&P 500  ( ARCA:SPY ) ",20240729T102511,https://www.benzinga.com/analyst-ratings/analyst-color/24/07/40006542/apple-amazon-microsoft-meta-lead-the-charge-as-investors-bank-on-tech-cheer-for-ral,DD,0.070002,Neutral,-0.087364
"Will Earnings Cheer Continue To Buoy Markets? Apple, Amazon, Pfizer, Coinbase Lead Flurry Of Q1 Reports This Week - Invesco QQQ Trust, Series 1  ( NASDAQ:QQQ ) , SPDR S&P 500  ( ARCA:SPY ) ",20240429T055121,https://www.benzinga.com/news/earnings/24/04/38481553/will-earnings-cheer-continue-to-buoy-markets-apple-amazon-pfizer-coinbase-lead-flurry-of-q1-reports,DD,0.069294,Neutral,0.0
"Apple, AMD, Palantir Earnings On Deck This Week As Market Seeks Positive Catalysts In Fed Decision Week - Lattice Semiconductor  ( NASDAQ:LSCC ) , Exact Sciences  ( NASDAQ:EXAS ) , Amgen  ( NASDAQ:AMGN ) , STMicroelectronics  ( NYSE:STM ) ",20231030T074015,https://www.benzinga.com/analyst-ratings/analyst-color/23/10/35484208/apple-amd-palantir-earnings-on-deck-this-week-as-market-seeks-positive-catalysts-in,DD,0.0864,Neutral,0.0
"Digital Printing Market For Packaging to grow by USD 12 billion from 2022 to 2027; CCL Industries Inc., colordruck ... - PR Newswire",20231128T083500,https://www.prnewswire.com/news-releases/digital-printing-market-for-packaging-to-grow-by-usd-12-billion-from-2022-to-2027-ccl-industries-inc-colordruck-baiersbronn-ds-smith-plc-and-more-among-key-companies--technavio-301998112.html,DD,0.075635,Neutral,0.07186
Digital Printing Packaging Market Size [2023-2029] to Reach USD 46.82 Billion and Exhibit a CAGR of 13.8%,20230515T094900,https://www.prnewswire.com/news-releases/digital-printing-packaging-market-size-2023-2029-to-reach-usd-46-82-billion-and-exhibit-a-cagr-of-13-8-301824416.html,DD,0.017509,Neutral,0.067568
