title,time_published,url,ticker,relevance_score,ticker_sentiment_label,ticker_sentiment_score
"Lululemon To Rally Around 14%? Here Are 10 Top Analyst Forecasts For Friday - Beam Therapeutics  ( NASDAQ:BEAM ) , Applied DNA Sciences  ( NASDAQ:APDN ) ",20231208T122024,https://www.benzinga.com/news/23/12/36151264/lululemon-to-rally-around-14-here-are-10-top-analyst-forecasts-for-friday,DECK,0.238913,Neutral,0.099539
66 Biggest Movers From Friday,20220523T075758,https://www.benzinga.com/news/22/05/27341379/66-biggest-movers-from-friday,DECK,0.054477,Neutral,0.072434
38 Stocks Moving In Friday's Mid-Day Session,20220520T160330,https://www.benzinga.com/news/22/05/27327237/38-stocks-moving-in-fridays-mid-day-session,DECK,0.098984,Neutral,0.046185
"Why BioVie Shares Are Trading Lower By Around 42%; Here Are 20 Stocks Moving Premarket - Adial Pharmaceuticals  ( NASDAQ:ADIL ) , Aadi Bioscience  ( NASDAQ:AADI ) ",20240304T130436,https://www.benzinga.com/news/24/03/37453547/why-biovie-shares-are-trading-lower-by-around-42-here-are-20-stocks-moving-premarket,DECK,0.217508,Somewhat-Bullish,0.23018
Why Ascent Solar Technologies Shares Are Trading Lower By Around 50%? Here Are Other Stocks Moving In Wednesday's Mid-Day Session - Ascent Solar Technologies  ( NASDAQ:ASTI ) ,20240410T180705,https://www.benzinga.com/news/24/04/38189280/why-ascent-solar-technologies-shares-are-trading-lower-by-around-50-here-are-other-stocks-moving-in,DECK,0.094576,Neutral,0.027719
