title,time_published,url,ticker,relevance_score,ticker_sentiment_label,ticker_sentiment_score
"Snowflake, American Eagle, Digital Turbine And Other Big Stocks Moving Lower In Thursday's Pre-Market Session - American Eagle Outfitters  ( NYSE:AEO ) , Digital Turbine  ( NASDAQ:APPS ) ",20230525T103312,https://www.benzinga.com/news/23/05/32569285/snowflake-american-eagle-digital-turbine-and-other-big-stocks-moving-lower-in-thursdays-pre-market-s,DISH,0.410059,Somewhat-Bearish,-0.159661
"Stocks That Hit 52-Week Lows On Wednesday - Bristol-Myers Squibb Company Common Stock  ( NYSE:BMY ) , SenesTech, Inc. - Common Stock  ( NASDAQ:SNES ) ",20231004T160117,https://www.benzinga.com/markets/options/23/10/35092508/stocks-that-hit-52-week-lows-on-wednesday,DISH,0.012708,Neutral,0.002574
"DISH Network  ( DISH )  Q3 Earnings Miss, Revenues Decline Y/Y",20231107T134600,https://www.zacks.com/stock/news/2179939/dish-network-dish-q3-earnings-miss-revenues-decline-yy,DISH,0.743214,Neutral,0.054744
"Morgan Stanley, Charles Schwab, Bank of America, And Other Big Stocks Moving Higher On Tuesday - Amarin Corp  ( NASDAQ:AMRN ) , Astronics  ( NASDAQ:ATRO ) ",20230718T142201,https://www.benzinga.com/news/23/07/33268166/morgan-stanley-charles-schwab-bank-of-america-and-other-big-stocks-moving-higher-on-tuesday,DISH,0.320974,Bullish,0.667131
"Overview Of Value Stocks In The Communication Services Sector - Gray Television  ( NYSE:GTN ) , E W Scripps  ( NASDAQ:SSP ) , Emerald Holding  ( NYSE:EEX ) , DISH Network  ( NASDAQ:DISH ) , GRAVITY Co  ( NASDAQ:GRVY ) ",20230417T144411,https://www.benzinga.com/news/23/04/31833137/overview-of-value-stocks-in-the-communication-services-sector,DISH,0.167322,Somewhat-Bullish,0.263725
