title,time_published,url,ticker,relevance_score,ticker_sentiment_label,ticker_sentiment_score
"Earnings Scheduled For May 5, 2022",20220505T084322,https://www.benzinga.com/news/earnings/22/05/27012606/earnings-scheduled-for-may-5-2022,DLB,0.009774,Neutral,0.000334
3 Audio Video Stocks to Gain From Positive Industry Trends,20241021T150400,https://www.zacks.com/commentary/2354003/3-audio-video-stocks-to-gain-from-positive-industry-trends,DLB,0.087904,Neutral,0.071097
"Zacks Industry Outlook Highlights Dolby Laboratories, GoPro and LiveOne",20240514T082300,https://www.zacks.com/stock/news/2273205/zacks-industry-outlook-highlights-dolby-laboratories-gopro-and-liveone,DLB,0.143415,Neutral,0.116019
3 Audio Video Stocks Worth Watching in a Flourishing Industry,20240513T150400,https://www.zacks.com/commentary/2272722/3-audio-video-stocks-worth-watching-in-a-flourishing-industry,DLB,0.12302,Neutral,0.1128
From Taylor Swift and Beyoncé to blockchain and AI: Music ETF CEO eyes the next big thing,20231004T202900,https://www.marketwatch.com/story/from-taylor-swift-and-beyonceto-blockchain-and-ai-music-etf-ceo-eyes-the-next-big-thing-2a29be2d,DLB,0.110973,Neutral,0.049256
