title,time_published,url,ticker,relevance_score,ticker_sentiment_label,ticker_sentiment_score
Annexon Highlights Strategic Focus to Advance Four Flagship Complement Programs through Late-Stage Development and Progress Across Three Therapeutic Franchises,20230108T140000,https://www.globenewswire.com/news-release/2023/01/08/2584729/0/en/Annexon-Highlights-Strategic-Focus-to-Advance-Four-Flagship-Complement-Programs-through-Late-Stage-Development-and-Progress-Across-Three-Therapeutic-Franchises.html,DNOW,0.017573,Neutral,0.027852
Annexon Highlights Strategic Focus to Advance Four Flagship Complement Programs through Late-Stage Development and Progress Across Three Therapeutic Franchises - Annexon  ( NASDAQ:ANNX ) ,20230108T140000,https://www.benzinga.com/pressreleases/23/01/g30323708/annexon-highlights-strategic-focus-to-advance-four-flagship-complement-programs-through-late-stage,DNOW,0.017357,Neutral,0.026098
Apica Delivers Unmatched Data Management Capabilities with Additions to Ascent Platform,20240611T120000,https://www.benzinga.com/pressreleases/24/06/g39268173/apica-delivers-unmatched-data-management-capabilities-with-additions-to-ascent-platform,DNOW,0.042346,Neutral,0.040394
TTI: Which Energy Stock Will Lead Investors to Higher Returns?,20220720T204352,https://stocknews.com/news/tti-dnow-which-energy-stock-will-lead-investors-to-higher-returns/,DNOW,0.562778,Bullish,0.544509
DNOW: 3 Energy Stocks Under $15 to Buy NOW,20230915T174222,https://stocknews.com/news/dnow-soi-pfie-3-energy-stocks-under-15-to-buy-now/,DNOW,0.265217,Somewhat-Bullish,0.270528
