title,time_published,url,ticker,relevance_score,ticker_sentiment_label,ticker_sentiment_score
A Warriors-Suns Playoff Series Would Be NBA Appointment Viewing,20240211T221243,https://www.forbes.com/sites/jackmagruder/2024/02/11/golden-state-phoenix-playoff-series-would-be-nba-appointment-viewing/,DSITF,0.103109,Neutral,0.060404
Jokic Leads Nuggets Past Warriors In NBA Thriller,20231109T060900,https://www.barrons.com/news/jokic-leads-nuggets-past-warriors-in-nba-thriller-f1f153aa,DSITF,0.053749,Neutral,0.003042
Curry makes last-second layup to give Warriors 141-139 win over Thunder in tourney opener,20231104T051800,https://apnews.com/article/warriors-thunder-stephen-curry-8bddd65921f3f58e8a8f94f4ef8c55fa,DSITF,0.067919,Neutral,-0.098273
Curry Masterpiece As Warriors Square NBA Finals With Celtics Win,20220611T051251,https://www.barrons.com/news/curry-masterpiece-as-warriors-square-nba-finals-with-celtics-win-01654922407,DSITF,0.057311,Bullish,0.873146
Curry Masterpiece As Warriors Square NBA Finals With Celtics Win,20220611T041724,https://www.barrons.com/news/curry-masterpiece-as-warriors-square-nba-finals-with-celtics-win-01654918807,DSITF,0.069921,Bullish,0.873146
