title,time_published,url,ticker,relevance_score,ticker_sentiment_label,ticker_sentiment_score
Stocks That Hit 52-Week Lows On Tuesday,20220315T163235,https://www.benzinga.com/news/22/03/26148458/stocks-that-hit-52-week-lows-on-tuesday,DUOL,0.00539,Neutral,0.001068
"Why Laser Photonics Shares Surged By Around 19%; Here Are 70 Biggest Movers From Friday - Abeona Therapeutics  ( NASDAQ:ABEO ) , ACM Research  ( NASDAQ:ACMR ) ",20221017T092117,https://www.benzinga.com/news/22/10/29282399/why-laser-photonics-shares-surged-by-around-19-here-are-70-biggest-movers-from-friday,DUOL,0.063091,Somewhat-Bearish,-0.300702
"Earnings Scheduled For May 12, 2022",20220512T085523,https://www.benzinga.com/news/earnings/22/05/27156592/earnings-scheduled-for-may-12-2022,DUOL,0.017681,Neutral,-0.056046
"Why Tattooed Chef Shares Dipped Around 15%; Here Are 95 Biggest Movers From Friday - Alcoa  ( NYSE:AA ) , Aurora Cannabis  ( NASDAQ:ACB ) ",20221114T073517,https://www.benzinga.com/news/earnings/22/11/29694040/why-tattooed-chef-shares-dipped-around-15-here-are-95-biggest-movers-from-friday,DUOL,0.043698,Neutral,0.093075
"QuantaSing Group Posts Double-Digit Growth In Revenue, Registered Users In Fiscal Q2 Driven By Growing Demand For Its Senior Courses - QuantaSing Group  ( NASDAQ:QSG ) , Duolingo  ( NASDAQ:DUOL ) ",20240311T124908,https://www.benzinga.com/partner/news/24/03/37584301/quantasing-group-posts-double-digit-growth-in-revenue-registered-users-in-fiscal-q2-driven-by-growin,DUOL,0.09439,Neutral,0.115263
