title,time_published,url,ticker,relevance_score,ticker_sentiment_label,ticker_sentiment_score
StockNews.com Begins Coverage on AC Immune  ( NASDAQ:ACIU ) ,20220912T061642,https://www.etfdailynews.com/2022/09/12/stocknews-com-begins-coverage-on-ac-immune-nasdaqaciu-2/,EA,0.085022,Neutral,0.00309
StockNews.com Begins Coverage on AC Immune  ( NASDAQ:ACIU ) ,20220912T061641,https://reporter.am/2022/09/12/stocknews-com-begins-coverage-on-ac-immune-nasdaqaciu.html,EA,0.085022,Neutral,0.00309
Stocks That Hit 52-Week Lows On Friday,20220506T160650,https://www.benzinga.com/markets/options/22/05/27050916/52-weeks-high-and-low-article,EA,0.005467,Neutral,-0.012633
Stocks That Hit 52-Week Lows On Tuesday,20220315T163235,https://www.benzinga.com/news/22/03/26148458/stocks-that-hit-52-week-lows-on-tuesday,EA,0.00539,Neutral,-0.000107
99 Biggest Movers From Yesterday,20220512T082956,https://www.benzinga.com/news/22/05/27156577/99-biggest-movers-from-yesterday,EA,0.042462,Neutral,0.003479
"Stocks making the biggest moves midday: Roblox, Electronic Arts, Coinbase, RealReal and more",20220511T164243,https://www.cnbc.com/2022/05/11/stocks-making-the-biggest-moves-midday-roblox-electronic-arts-coinbase-realreal-and-more.html,EA,0.146961,Neutral,0.021874
"Earnings Scheduled For May 10, 2022",20220510T091808,https://www.benzinga.com/news/earnings/22/05/27099859/earnings-scheduled-for-may-10-2022,EA,0.015162,Neutral,0.0006
"Nvidia, Western Digital And 2 Other Stocks Executives Are Selling - NVIDIA  ( NASDAQ:NVDA ) ",20240905T123755,https://www.benzinga.com/news/24/09/40729186/nvidia-western-digital-and-2-other-stocks-executives-are-selling,EA,0.392948,Neutral,0.111606
