title,time_published,url,ticker,relevance_score,ticker_sentiment_label,ticker_sentiment_score
"Nayax Posts Weak Q1 Results, Joins GameStop, Iris Energy And Other Big Stocks Moving Lower In Thursday's Pre-Market Session - Nayax  ( NASDAQ:NYAX ) ",20240516T094017,https://www.benzinga.com/news/24/05/38866634/nayax-posts-weak-q1-results-joins-gamestop-iris-energy-and-other-big-stocks-moving-lower-in-thursday,EDU,0.230235,Somewhat-Bullish,0.30715
"Concert Pharmaceuticals, Coeur Mining And Other Big Stocks Moving Higher On Thursday",20230119T153711,https://www.benzinga.com/news/23/01/30485939/concert-pharmaceuticals-coeur-mining-and-other-big-stocks-moving-higher-on-thursday,EDU,0.456884,Neutral,0.0
"Sea, UiPath, J&J Snack Foods And Other Big Gainers From Tuesday - Evoqua Water Technologies  ( NYSE:AQUA ) , Azenta  ( NASDAQ:AZTA ) ",20221116T073308,https://www.benzinga.com/news/22/11/29742456/sea-uipath-j-j-snack-foods-and-other-big-gainers-from-tuesday,EDU,0.137278,Neutral,0.0
77 Biggest Movers From Yesterday,20220601T090222,https://www.benzinga.com/news/22/06/27492435/77-biggest-movers-from-yesterday,EDU,0.057208,Neutral,0.002005
40 Stocks Moving In Tuesday's Mid-Day Session,20220531T160405,https://www.benzinga.com/news/22/05/27478950/40-stocks-moving-in-tuesdays-mid-day-session,EDU,0.115787,Neutral,0.000142
