title,time_published,url,ticker,relevance_score,ticker_sentiment_label,ticker_sentiment_score
Why Alphabet Shares Are Trading Higher By 12%; Here Are 20 Stocks Moving Premarket - Alphabet  ( NASDAQ:GOOGL ) ,20240426T121832,https://www.benzinga.com/news/24/04/38458188/why-alphabet-shares-are-trading-higher-by-12-here-are-20-stocks-moving-premarket,ELWS,0.132733,Somewhat-Bullish,0.198737
Earlyworks and CAICA DIGITAL Entered into a Business Alliance Agreement to Support the Expansion of Web3 Business,20240919T144500,https://www.globenewswire.com/news-release/2024/09/19/2949168/0/en/Earlyworks-and-CAICA-DIGITAL-Entered-into-a-Business-Alliance-Agreement-to-Support-the-Expansion-of-Web3-Business.html,ELWS,0.251247,Somewhat-Bullish,0.28514
Earlyworks and ZenmuTech collaborate for a more secure digital society through secret splitting and blockchain,20240531T221500,https://markets.businessinsider.com/news/stocks/earlyworks-and-zenmutech-collaborate-for-a-more-secure-digital-society-through-secret-splitting-and-blockchain-1033442661,ELWS,0.283323,Neutral,0.141276
Earlyworks and ZenmuTech collaborate for a more secure digital society through secret splitting and blockchain,20240531T201500,https://www.globenewswire.com/news-release/2024/05/31/2891745/0/en/Earlyworks-and-ZenmuTech-collaborate-for-a-more-secure-digital-society-through-secret-splitting-and-blockchain.html,ELWS,0.283323,Neutral,0.141276
"Earlyworks Co., Ltd., a blockchain technology provider, forms business alliance with Relic, a business co-creation company - Earlyworks Co  ( NASDAQ:ELWS ) ",20240521T123033,https://www.benzinga.com/pressreleases/24/05/g38939116/earlyworks-co-ltd-a-blockchain-technology-provider-forms-business-alliance-with-relic-a-business-c,ELWS,0.268862,Neutral,0.141699
"Earlyworks Co., Ltd., a blockchain technology provider, forms business alliance with Relic, a business co-creation company",20240521T123000,https://www.globenewswire.com/news-release/2024/05/21/2885587/0/en/Earlyworks-Co-Ltd-a-blockchain-technology-provider-forms-business-alliance-with-Relic-a-business-co-creation-company.html,ELWS,0.227859,Neutral,0.12106
