title,time_published,url,ticker,relevance_score,ticker_sentiment_label,ticker_sentiment_score
"NIO, XPeng, MongoDB And Other Big Stocks Moving Higher On Friday - A-Mark Precious Metals  ( NASDAQ:AMRK ) , Butterfly Network  ( NYSE:BFLY ) ",20230901T144532,https://www.benzinga.com/news/23/09/34173725/nio-xpeng-mongodb-and-other-big-stocks-moving-higher-on-friday,ESTC,0.202366,Bullish,0.488527
"Why Dell Technologies Shares Are Trading Higher By 9%; Here Are 20 Stocks Moving Premarket - Acer Therapeutics  ( NASDAQ:ACER ) , Aditxt  ( NASDAQ:ADTX ) ",20230901T121610,https://www.benzinga.com/news/23/09/34169746/why-dell-technologies-shares-are-trading-higher-by-9-here-are-20-stocks-moving-premarket,ESTC,0.146469,Bullish,0.449395
"BridgeBio Pharma, Rigetti Computing, Bath & Body Works And Other Big Stocks Moving Higher On Monday - Archer Aviation  ( NYSE:ACHR ) , BridgeBio Pharma  ( NASDAQ:BBIO ) ",20241125T152128,https://www.benzinga.com/24/11/42166800/bridgebio-pharma-rigetti-computing-bath-body-works-and-other-big-stocks-moving-higher-on-monday,ESTC,0.181819,Somewhat-Bullish,0.343038
"Natural Grocers By Vitamin Cottage, Elastic, Matthews International, Gap And Other Big Stocks Moving Higher On Friday - Atkore  ( NYSE:ATKR ) , Carpenter Tech  ( NYSE:CRS ) ",20241122T155904,https://www.benzinga.com/24/11/42141440/natural-grocers-by-vitamin-cottage-elastic-matthews-international-gap-and-other-big-stocks-moving-higher-on-frida,ESTC,0.219809,Bullish,0.529476
"S&P 500 Moves Higher; Intuit Shares Fall Following Q1 Results - Aptose Biosciences  ( NASDAQ:APTO ) , Autonomix Medical  ( NASDAQ:AMIX ) ",20241122T191842,https://www.benzinga.com/24/11/42145950/s-intuit-shares-fall-following-q1-results,ESTC,0.151064,Bullish,0.382174
"Crude Oil Gains Over 1%; Ross Stores Earnings Top Views - Aptose Biosciences  ( NASDAQ:APTO ) , Autonomix Medical  ( NASDAQ:AMIX ) ",20241122T181656,https://www.benzinga.com/24/11/42144711/crude-oil-gains-over-1-ross-stores-earnings-top-views,ESTC,0.163354,Bullish,0.399332
"Why Lululemon Shares Are Trading Higher By 15%; Here Are 20 Stocks Moving Premarket - Broadcom  ( NASDAQ:AVGO ) , Ascent Solar Technologies  ( NASDAQ:ASTI ) ",20230602T115818,https://www.benzinga.com/news/23/06/32688337/why-lululemon-shares-are-trading-higher-by-15-here-are-20-stocks-moving-premarket,ESTC,0.132004,Somewhat-Bearish,-0.250634
