title,time_published,url,ticker,relevance_score,ticker_sentiment_label,ticker_sentiment_score
"Nasdaq, S&P Futures Rise As Microsoft, AMD Earnings Take Spotlight: Will Fed Provide 'Turbo Boost' For Market? Analyst Weighs In - Invesco QQQ Trust, Series 1  ( NASDAQ:QQQ ) , SPDR S&P 500  ( ARCA:SPY ) ",20240730T112749,https://www.benzinga.com/news/earnings/24/07/40033855/nasdaq-s-p-futures-rise-as-microsoft-amd-earnings-take-spotlight-will-fed-provide-turbo-boost-for-m,FFIV,0.079524,Neutral,0.0
"Nasdaq, S&P 500 Futures Rise Cautiously: What's Moving Futures - Invesco QQQ Trust, Series 1  ( NASDAQ:QQQ ) , SPDR S&P 500  ( ARCA:SPY ) ",20240429T105421,https://www.benzinga.com/news/earnings/24/04/38484884/us-stocks-set-to-approach-new-week-with-caution-ahead-of-fed-meeting-tech-earnings-analyst-says-buy,FFIV,0.092036,Neutral,0.0
"Will Earnings Cheer Continue To Buoy Markets? Apple, Amazon, Pfizer, Coinbase Lead Flurry Of Q1 Reports This Week - Invesco QQQ Trust, Series 1  ( NASDAQ:QQQ ) , SPDR S&P 500  ( ARCA:SPY ) ",20240429T055121,https://www.benzinga.com/news/earnings/24/04/38481553/will-earnings-cheer-continue-to-buoy-markets-apple-amazon-pfizer-coinbase-lead-flurry-of-q1-reports,FFIV,0.069294,Neutral,0.0
"US Stocks Set For Mixed Open As Traders Await Tech Earnings Deluge, Central Bank Meeting: Analyst Says Fed Will Talk Tough For While Longer - Invesco QQQ Trust, Series 1  ( NASDAQ:QQQ ) , SPDR S&P 500  ( ARCA:SPY ) ",20240129T122309,https://www.benzinga.com/news/earnings/24/01/36822102/us-stocks-set-for-mixed-open-as-traders-await-tech-earnings-deluge-central-bank-meeting-analyst-say,FFIV,0.098054,Neutral,0.0
"SoFi, iRobot, Tesla, Archer Daniels, McGrath RentCorp, ZoomInfo, and More Stock Market Movers",20240129T092400,https://www.barrons.com/amp/articles/stock-market-movers-149f2d69,FFIV,0.06211,Neutral,0.0
"Why Super Micro Computer Shares Are Trading Higher By Over 10%; Here Are 20 Stocks Moving Premarket - Addex Therapeutics  ( NASDAQ:ADXN ) , Agrify  ( NASDAQ:AGFY ) ",20240130T125214,https://www.benzinga.com/news/24/01/36842111/why-super-micro-computer-shares-are-trading-higher-by-over-10-here-are-20-stocks-moving-premarket,FFIV,0.141726,Somewhat-Bullish,0.291814
Why Walmart is Trading Higher By More Than 9%: Here Are 25 Stocks Moving Premarket,20220726T104214,https://www.benzinga.com/news/22/07/28200494/why-walmart-is-trading-higher-by-more-than-9-here-are-25-stocks-moving-premarket,FFIV,0.119235,Somewhat-Bullish,0.213221
