title,time_published,url,ticker,relevance_score,ticker_sentiment_label,ticker_sentiment_score
"Take the Zacks Approach to Beat the Market: Annexon, NVIDIA, Intuit in Focus",20240122T115800,https://www.zacks.com/stock/news/2213270/take-the-zacks-approach-to-beat-the-market-annexon-nvidia-intuit-in-focus,FICO,0.100588,Neutral,0.112885
"Beat the Market Like Zacks: Motorola, UnitedHealth, Virtu in Focus",20240805T120200,https://www.zacks.com/stock/news/2315824/beat-the-market-like-zacks-motorola-unitedhealth-virtu-in-focus,FICO,0.099614,Neutral,0.11258
"Take the Zacks Approach to Beat the Markets: Versus Systems, Palantir Technologies, Walmart in Focus",20241028T120100,https://www.zacks.com/stock/news/2358386/take-the-zacks-approach-to-beat-the-markets-versus-systems-palantir-technologies-walmart-in-focus,FICO,0.099614,Neutral,0.11258
"Marsh & McLennan To Rally Around 14%? Here Are 10 Other Analyst Forecasts For Thursday - Carrier Global  ( NYSE:CARR ) , Coya Therapeutics  ( NASDAQ:COYA ) ",20230608T123133,https://www.benzinga.com/news/23/06/32776878/marsh-mclennan-to-rally-around-14-here-are-10-other-analyst-forecasts-for-thursday,FICO,0.262994,Somewhat-Bullish,0.281292
"Should You Buy, Hold or Sell Upstart Stock Before Q3 Earnings?",20241104T125400,https://www.zacks.com/stock/news/2363059/should-you-buy-hold-or-sell-upstart-stock-before-q3-earnings,FICO,0.09186,Somewhat-Bullish,0.209553
Is SoFi a Millionaire Maker?,20241002T105500,https://www.fool.com/investing/2024/10/02/is-sofi-a-millionaire-maker/,FICO,0.137671,Somewhat-Bullish,0.248683
"Upstart Stock: Buy, Sell, or Hold?",20240601T071500,https://www.fool.com/investing/2024/06/01/upstart-stock-buy-sell-or-hold/,FICO,0.194242,Somewhat-Bullish,0.266863
Student Lender Sofi's Growth Story Leaves Unanswered Questions,20240112T163353,https://www.forbes.com/sites/digital-assets/2024/01/12/student-lender-sofis-growth-story-leaves-unanswered-questions/,FICO,0.043618,Neutral,0.09602
Fair Isaac  ( FICO )  Q3 Earnings and Revenues Surpass Estimates,20220803T233507,https://www.zacks.com/stock/news/1963486/fair-isaac-fico-q3-earnings-and-revenues-surpass-estimates,FICO,0.398148,Somewhat-Bullish,0.26805
