title,time_published,url,ticker,relevance_score,ticker_sentiment_label,ticker_sentiment_score
"Why Laser Photonics Shares Surged By Around 19%; Here Are 70 Biggest Movers From Friday - Abeona Therapeutics  ( NASDAQ:ABEO ) , ACM Research  ( NASDAQ:ACMR ) ",20221017T092117,https://www.benzinga.com/news/22/10/29282399/why-laser-photonics-shares-surged-by-around-19-here-are-70-biggest-movers-from-friday,FNGR,0.063091,Somewhat-Bearish,-0.300702
"Why Intelligent Bio Solutions Shares Are Trading Lower By Around 55%? Here Are Other Stocks Moving In Monday's Mid-Day Session - AERWINS Technologies  ( NASDAQ:AWIN ) , Arch Resources  ( NYSE:ARCH ) ",20231002T170027,https://www.benzinga.com/news/23/10/35037344/why-intelligent-bio-solutions-shares-are-trading-lower-by-around-55-here-are-other-stocks-moving-in,FNGR,0.113062,Bullish,0.380663
"Pitney Bowes, Marathon Digital And Other Big Stocks Moving Higher On Monday - Cipher Mining  ( NASDAQ:CIFR ) , Cleanspark  ( NASDAQ:CLSK ) ",20231002T142053,https://www.benzinga.com/news/23/10/35032992/pitney-bowes-marathon-digital-and-other-big-stocks-moving-higher-on-monday,FNGR,0.350564,Neutral,0.0
Stocks That Hit 52-Week Lows On Wednesday,20220427T184104,https://www.benzinga.com/markets/options/22/04/26844275/52-weeks-high-and-low-article,FNGR,0.006956,Neutral,0.001894
"Why Richardson Electronics Shares Surged Over 8%; Here Are 55 Biggest Movers From Friday - Angel Oak Mortgage  ( NYSE:AOMR ) , Ampco-Pittsburgh  ( NYSE:AP ) ",20221128T100924,https://www.benzinga.com/news/22/11/29866518/why-richardson-electronics-shares-surged-over-8-here-are-55-biggest-movers-from-friday,FNGR,0.075161,Somewhat-Bearish,-0.304507
99 Biggest Movers From Yesterday,20220512T082956,https://www.benzinga.com/news/22/05/27156577/99-biggest-movers-from-yesterday,FNGR,0.042462,Neutral,-0.012708
