title,time_published,url,ticker,relevance_score,ticker_sentiment_label,ticker_sentiment_score
"TETRA TECHNOLOGIES, INC. ANNOUNCES FOURTH QUARTER AND TOTAL YEAR 2023 RESULTS",20240227T220000,https://www.prnewswire.com/news-releases/tetra-technologies-inc-announces-fourth-quarter-and-total-year-2023-results-302073347.html,FOREX:UYU,0.015914,Neutral,-0.031447
"YPF Reduces Fuel Prices Amid Inflationary Pressures in Argentina - VAALCO Energy  ( NYSE:EGY ) , Archrock  ( NYSE:AROC ) ",20241003T161132,https://www.benzinga.com/m-a/24/10/41164527/ypf-reduces-fuel-prices-amid-inflationary-pressures-in-argentina,FOREX:UYU,0.070105,Neutral,0.057558
YPF Reduces Fuel Prices Amid Inflationary Pressures in Argentina,20241003T121600,https://www.zacks.com/stock/news/2345294/ypf-reduces-fuel-prices-amid-inflationary-pressures-in-argentina,FOREX:UYU,0.07423,Neutral,0.053797
Student Lender Sofi's Growth Story Leaves Unanswered Questions,20240112T163353,https://www.forbes.com/sites/digital-assets/2024/01/12/student-lender-sofis-growth-story-leaves-unanswered-questions/,FOREX:UYU,0.021817,Somewhat-Bearish,-0.157372
Knight Therapeutics Reports Fourth Quarter and Year-End 2022 Results,20230323T113000,https://www.globenewswire.com/news-release/2023/03/23/2633023/0/en/Knight-Therapeutics-Reports-Fourth-Quarter-and-Year-End-2022-Results.html,FOREX:UYU,0.014256,Neutral,0.06713
Knight Therapeutics Reports Fourth Quarter and Year-End 2022 Results,20230323T113000,https://www.benzinga.com/pressreleases/23/03/g31471797/knight-therapeutics-reports-fourth-quarter-and-year-end-2022-results,FOREX:UYU,0.015402,Neutral,0.06179
Knight Therapeutics Reports Second Quarter 2022 Results,20220811T115349,https://investingnews.com/knight-therapeutics-reports-second-quarter-2022-results/,FOREX:UYU,0.015957,Neutral,0.010269
Knight Therapeutics Reports Second Quarter 2022 Results,20220811T113000,https://www.benzinga.com/pressreleases/22/08/g28451022/knight-therapeutics-reports-second-quarter-2022-results,FOREX:UYU,0.012705,Neutral,0.010002
