title,time_published,url,ticker,relevance_score,ticker_sentiment_label,ticker_sentiment_score
"Document Outsourcing Market to grow by USD 17.79 billion from 2022 to 2027, Increased efficiency of document ... - PR Newswire",20230920T031500,https://www.prnewswire.com/news-releases/document-outsourcing-market-to-grow-by-usd-17-79-billion-from-2022-to-2027--increased-efficiency-of-document-management-using-hybrid-solutions-to-drive-market-growth--technavio-301932603.html,FUJIF,0.045743,Neutral,0.041179
"Global Tissue Banking Market to Exhibit Growth at a Considerable CAGR of ~6% by 2030, Assesses DelveInsight",20240409T214100,https://www.prnewswire.com/news-releases/global-tissue-banking-market-to-exhibit-growth-at-a-considerable-cagr-of-6-by-2030-assesses-delveinsight-302110459.html,FUJIF,0.022991,Neutral,0.033133
"Drug-Eluting Balloons Global Market is Expected to Expand at a Healthy Growth Rate of ~8% by 2028, Predicts DelveInsight",20240124T220100,https://www.prnewswire.com/news-releases/drug-eluting-balloons-global-market-is-expected-to-expand-at-a-healthy-growth-rate-of-8-by-2028-predicts-delveinsight-302042856.html,FUJIF,0.025985,Neutral,0.033663
"Heart Failure Treatment Drug Market to Accelerate Immensely by 2032, Predicts DelveInsight",20240115T220500,https://www.prnewswire.com/news-releases/heart-failure-treatment-drug-market-to-accelerate-immensely-by-2032-predicts-delveinsight-302034593.html,FUJIF,0.023441,Neutral,0.03228
"Gastroenteropancreatic Neuroendocrine Tumors Market to Showcase a Significant Growth by 2032, Evaluates DelveInsight | Key Players - Eli Lilly and Company, Phanes Therapeutics, Camurus AB, Advanced Accelerator Applications, PharmaMar",20240111T220100,https://www.prnewswire.com/news-releases/gastroenteropancreatic-neuroendocrine-tumors-market-to-showcase-a-significant-growth-by-2032-evaluates-delveinsight--key-players---eli-lilly-and-company-phanes-therapeutics-camurus-ab-advanced-accelerator-applications-pharma-302032286.html,FUJIF,0.025139,Neutral,0.019544
68 Biggest Movers From Yesterday,20220316T092445,https://www.benzinga.com/news/22/03/26159392/68-biggest-movers-from-yesterday,FUJIF,0.028733,Neutral,-0.005875
68 Biggest Movers From Yesterday,20220316T092445,https://markets.businessinsider.com/news/stocks/68-biggest-movers-from-yesterday-1031284211,FUJIF,0.029281,Neutral,-0.005076
38 Stocks Moving In Tuesday's Mid-Day Session,20220315T161110,https://www.benzinga.com/news/22/03/26149504/38-stocks-moving-in-tuesdays-mid-day-session,FUJIF,0.046552,Neutral,-0.003564
Mid-Morning Market Update: Markets Open Higher; US Producer Prices Increase 0.8% In February,20220315T140628,https://www.benzinga.com/news/earnings/22/03/26145798/mid-morning-market-update-markets-open-higher-us-producer-prices-increase-0-8-in-february,FUJIF,0.066414,Neutral,0.026327
