title,time_published,url,ticker,relevance_score,ticker_sentiment_label,ticker_sentiment_score
SFIX Leverages AI and Innovation for Growth: Key Factors for Investors,20241230T132600,https://www.zacks.com/stock/news/2389322/sfix-leverages-ai-and-innovation-for-growth-key-factors-for-investors,GAP,0.116161,Somewhat-Bullish,0.269539
"The Zacks Analyst Blog Highlights Genesco, Gap, Urban Outfitters, Abercrombie & Fitch and Stitch Fix",20241218T100600,https://www.zacks.com/stock/news/2384994/the-zacks-analyst-blog-highlights-genesco-gap-urban-outfitters-abercrombie-fitch-and-stitch-fix,GAP,0.102013,Somewhat-Bullish,0.187748
5 Apparel Stocks to Buy Before the New Year's Trends Unfold,20241217T161100,https://www.zacks.com/stock/news/2384715/5-apparel-stocks-to-buy-before-the-new-years-trends-unfold,GAP,0.073773,Somewhat-Bullish,0.296773
"SFIX Q1 Loss Narrower Than Expected, Active Clients Decline Y/Y",20241211T141200,https://www.zacks.com/stock/news/2382058/sfix-q1-loss-narrower-than-expected-active-clients-decline-yy,GAP,0.136629,Neutral,0.137392
"Natural Grocers By Vitamin Cottage, Elastic, Matthews International, Gap And Other Big Stocks Moving Higher On Friday - Atkore  ( NYSE:ATKR ) , Carpenter Tech  ( NYSE:CRS ) ",20241122T155904,https://www.benzinga.com/24/11/42141440/natural-grocers-by-vitamin-cottage-elastic-matthews-international-gap-and-other-big-stocks-moving-higher-on-frida,GAP,0.219809,Bullish,0.405731
