title,time_published,url,ticker,relevance_score,ticker_sentiment_label,ticker_sentiment_score
"Blackstone and Airbnb Set to Join S&P 500; Others to Join S&P 100, S&P MidCap 400 and S&P SmallCap 600",20230901T225100,https://markets.businessinsider.com/news/stocks/blackstone-and-airbnb-set-to-join-s-p-500-others-to-join-s-p-100-s-p-midcap-400-and-s-p-smallcap-600-1032600818,GDDY,0.057215,Neutral,0.030957
It's Spring! Get Ready to Trim Some of the Stocks in Your Portfolio.,20220421T141500,https://www.fool.com/investing/2022/04/21/its-spring-get-ready-to-trim-some-of-the-stocks-in/,GDDY,0.00683,Neutral,0.003724
From $10K to $100K: 3 Stocks to Achieve a 6-Figure Net Worth by 2030,20240704T101500,https://markets.businessinsider.com/news/stocks/from-10k-to-100k-3-stocks-to-achieve-a-6-figure-net-worth-by-2030-1033529114,GDDY,0.146618,Somewhat-Bullish,0.171359
"Cannabis Expansion, Holiday Gift Guides, and 2024 Trendspotting: Noteworthy Consumer News",20240105T205801,https://www.prnewswire.com/resources/news-trends/consumer-news-trends-nov-dec-2023,GDDY,0.034087,Bullish,0.389251
"Expedia Group, Gartner, Cloudflare, Cardinal Health And Other Big Stocks Moving Higher On Friday - Allogene Therapeutics  ( NASDAQ:ALLO ) , AMC Networks  ( NASDAQ:AMCX ) ",20231103T153022,https://www.benzinga.com/news/23/11/35594375/expedia-group-gartner-cloudflare-cardinal-health-and-other-big-stocks-moving-higher-on-friday,GDDY,0.109206,Bullish,0.390484
Fidelity  ( FIS )  Worldpay & GoDaddy to Offer Commerce 360 to SMEs,20230302T122400,https://www.zacks.com/stock/news/2060838/fidelity-fis-worldpay-godaddy-to-offer-commerce-360-to-smes,GDDY,0.38588,Bullish,0.462379
"GoDaddy To Rally Around 44%? Here Are 10 Other Analyst Forecasts For Wednesday - C.H. Robinson Worldwide  ( NASDAQ:CHRW ) , Casey's General Stores  ( NASDAQ:CASY ) ",20230913T124525,https://www.benzinga.com/news/23/09/34534477/godaddy-to-rally-around-44-here-are-10-other-analyst-forecasts-for-wednesday,GDDY,0.265859,Bullish,0.361665
"Airbnb, Blackstone Rise On News They'll Join S&P 500 Index",20230902T120200,https://www.investors.com/news/sp-500-airbnb-blackstone-rise-on-news-theyll-join-index/,GDDY,0.18967,Neutral,0.075637
ETFs in Focus on the Upcoming S&P 500 Shake-Up,20240611T150000,https://www.zacks.com/stock/news/2286753/etfs-in-focus-on-the-upcoming-sp-500-shake-up,GDDY,0.195498,Somewhat-Bullish,0.223884
"Earnings Scheduled For May 4, 2022",20220504T083630,https://www.benzinga.com/news/earnings/22/05/26983503/earnings-scheduled-for-may-4-2022,GDDY,0.010898,Neutral,0.000156
