title,time_published,url,ticker,relevance_score,ticker_sentiment_label,ticker_sentiment_score
103 Biggest Movers From Yesterday,20220511T102237,https://www.benzinga.com/news/22/05/27130447/103-biggest-movers-from-yesterday,GERN,0.042685,Neutral,0.008086
Why Recursion Pharmaceuticals Shares Are Trading Lower By Around 10%? Here Are Other Stocks Moving In Tuesday's Mid-Day Session - Intel  ( NASDAQ:INTC ) ,20240903T174109,https://www.benzinga.com/news/24/09/40693495/why-recursion-pharmaceuticals-shares-are-trading-lower-by-around-10-here-are-other-stocks-moving-in,GERN,0.090474,Bearish,-0.392516
51 Biggest Movers From Yesterday,20220331T094126,https://www.benzinga.com/news/22/03/26390922/51-biggest-movers-from-yesterday,GERN,0.071731,Neutral,0.022692
"Stocks That Hit 52-Week Lows On Wednesday - Bristol-Myers Squibb Company Common Stock  ( NYSE:BMY ) , SenesTech, Inc. - Common Stock  ( NASDAQ:SNES ) ",20231004T160117,https://www.benzinga.com/markets/options/23/10/35092508/stocks-that-hit-52-week-lows-on-wednesday,GERN,0.012708,Neutral,0.004349
"Geron  ( GERN )  Reports Q4 Loss, Misses Revenue Estimates",20230316T213505,https://www.zacks.com/stock/news/2066957/geron-gern-reports-q4-loss-misses-revenue-estimates,GERN,0.40348,Neutral,0.106851
Cowen Slashes Price Target On This Stock By Over 78%; Also Check Out Some Other Big PT Changes,20220812T131443,https://www.benzinga.com/news/22/08/28473188/cowen-slashes-price-target-on-this-stock-by-over-78-also-check-out-some-other-big-pt-changes,GERN,0.235823,Somewhat-Bullish,0.342559
"Alibaba, XPeng, Dada Nexus And Some Other Big Stocks Moving Higher On Wednesday - Altus Power  ( NYSE:AMPS ) , American Well  ( NYSE:AMWL ) ",20230104T153819,https://www.benzinga.com/news/23/01/30276087/alibaba-xpeng-dada-nexus-and-some-other-big-stocks-moving-higher-on-wednesday,GERN,0.163354,Neutral,-0.062022
"The Daily Biotech Pulse: Roche's Lung Cancer Combo Therapy Flunks Late-Stage Study, Adagio Spikes On Positive COVID Antibody Data, Amylyx Awaits Adcom Verdict",20220330T114641,https://www.benzinga.com/general/biotech/22/03/26367702/the-daily-biotech-pulse-roches-lung-cancer-combo-therapy-flunks-late-stage-study-adagio-spikes-on,GERN,0.087744,Neutral,0.003831
Balance Hires Former Marqeta Executive as VP of Customer Growth to Drive Financing and Ecommerce Payments for B2B Businesses,20221105T030504,https://apnews.com/article/technology-7358def3856541ea89e0f860af351233,GERN,0.124164,Somewhat-Bullish,0.180609
"Skechers Reports Upbeat Earnings, Joins Tutor Perini, AppFolio, Newell Brands And Other Big Stocks Moving Higher On Friday - Skechers USA  ( NYSE:SKX ) , Newell Brands  ( NASDAQ:NWL ) , Tutor Perini  ( NYSE:TPC ) , AppFolio  ( NASDAQ:APPF ) ",20240426T144517,https://www.benzinga.com/news/24/04/38462123/skechers-reports-upbeat-earnings-joins-tutor-perini-appfolio-newell-brands-and-other-big-stocks-movi,GERN,0.178459,Neutral,0.0
Why Braze Shares Are Trading Higher By 14%; Here Are 20 Stocks Moving Premarket - Braze  ( NASDAQ:BRZE ) ,20240607T091736,https://www.benzinga.com/news/24/06/39222541/why-braze-shares-are-trading-higher-by-14-here-are-20-stocks-moving-premarket,GERN,0.145145,Somewhat-Bullish,0.213266
