title,time_published,url,ticker,relevance_score,ticker_sentiment_label,ticker_sentiment_score
"Nasdaq Gains 100 Points; CarMax Earnings Top Views - Clene  ( NASDAQ:CLNN ) , Annexon  ( NASDAQ:ANNX ) ",20231221T192303,https://www.benzinga.com/news/earnings/23/12/36350420/nasdaq-gains-100-points-carmax-earnings-top-views,GILD,0.06211,Somewhat-Bullish,0.197164
"Biotech Stock Roundup: BBIO Up on BMY Deal, GILD & CMRX Offer Updates",20220518T154100,https://www.zacks.com/stock/news/1926061/biotech-stock-roundup-bbio-up-on-bmy-deal-gild-cmrx-offer-updates,GILD,0.107351,Neutral,0.008317
5 High Earnings Yield Value Picks to Buy for 2025,20241218T130600,https://www.zacks.com/stock/news/2385090/5-high-earnings-yield-value-picks-to-buy-for-2025,GILD,0.072655,Neutral,0.141102
"Earnings Scheduled For April 28, 2022",20220428T085040,https://www.benzinga.com/news/earnings/22/04/26860440/earnings-scheduled-for-april-28-2022,GILD,0.014477,Neutral,-0.011489
Stocks That Hit 52-Week Lows On Thursday,20220310T165722,https://www.benzinga.com/news/22/03/26083670/stocks-that-hit-52-week-lows-on-thursday,GILD,0.014015,Neutral,-0.016442
QURE Soars on FDA Alignment for Speedy Approval of Huntington's Drug,20241211T150200,https://www.zacks.com/stock/news/2382224/qure-soars-on-fda-alignment-for-speedy-approval-of-huntingtons-drug,GILD,0.211191,Neutral,0.125651
"Gene Therapy Market Set for 19% CAGR Surge, Reaching USD 38.34 Billion by 2031 | SkyQuest Technology",20240912T133000,https://www.benzinga.com/pressreleases/24/09/g40833623/gene-therapy-market-set-for-19-cagr-surge-reaching-usd-38-34-billion-by-2031-skyquest-technology,GILD,0.039878,Neutral,0.026899
"Fusion Pharmaceuticals Appoints Life Science Industry Leaders Jeremy Bender, Teresa Bitetti and David Meek to its Board of Directors",20231016T115000,https://www.prnewswire.com/news-releases/fusion-pharmaceuticals-appoints-life-science-industry-leaders-jeremy-bender-teresa-bitetti-and-david-meek-to-its-board-of-directors-301957344.html,GILD,0.044386,Neutral,-0.061069
"Fusion Pharmaceuticals Appoints Life Science Industry Leaders Jeremy Bender, Teresa Bitetti and David Meek to its Board of Directors",20231016T115000,https://www.newswire.ca/news-releases/fusion-pharmaceuticals-appoints-life-science-industry-leaders-jeremy-bender-teresa-bitetti-and-david-meek-to-its-board-of-directors-816998848.html,GILD,0.044386,Neutral,-0.061069
