title,time_published,url,ticker,relevance_score,ticker_sentiment_label,ticker_sentiment_score
Insurance Stocks Moving In Tuesday's Intraday Session,20220405T164128,https://www.benzinga.com/trading-ideas/movers/22/04/26481430/insurance-stocks-moving-in-tuesdays-intraday-session,GL,0.140076,Neutral,0.004442
Banzai Adds 179 Customers in August 2024 as New Technology Improvements Drive Growth,20240917T123100,https://www.globenewswire.com/news-release/2024/09/17/2947437/0/en/Banzai-Adds-179-Customers-in-August-2024-as-New-Technology-Improvements-Drive-Growth.html,GL,0.047371,Somewhat-Bullish,0.199642
Banzai Adds 179 Customers in August 2024 as New Technology Improvements Drive Growth - Banzai International  ( NASDAQ:BNZI ) ,20240917T123100,https://www.benzinga.com/pressreleases/24/09/g40897615/banzai-adds-179-customers-in-august-2024-as-new-technology-improvements-drive-growth,GL,0.042876,Somewhat-Bullish,0.198165
Banzai to Present at H.C. Wainwright 26th Annual Global Investment Conference - Banzai International  ( NASDAQ:BNZI ) ,20240904T123100,https://www.benzinga.com/pressreleases/24/09/g40706149/banzai-to-present-at-h-c-wainwright-26th-annual-global-investment-conference,GL,0.049526,Neutral,0.041536
Breaking EV Stock News: Mullen's  ( NASDAQ: MULN )  'Strikingly Different' EV Crossover Tour Heads to Texas After Completing a Successful Sold Out Stop in Las Vegas,20221115T141833,https://www.investorideas.com/CO/MULN/news/2022/11151EV-Crossover-Tour-to-Texas.asp,GL,0.034136,Neutral,0.0
Breaking EV Stock News: Overwhelmingly Positive Reactions Pour in From First Leg of Mullen Automotive's  ( NASDAQ: MULN )  'Strikingly Different' FIVE EV Crossover Tour,20221031T141033,https://www.investorideas.com/CO/MULN/news/2022/10311Positive-Reaction-FIVE-EV-Crossover-Tour.asp,GL,0.030838,Neutral,0.0
Overwhelmingly Positive Reactions Pour in From First Leg of Mullen Automotive's 'Strikingly Different' FIVE EV Crossover Tour - Mullen Automotive  ( NASDAQ:MULN ) ,20221031T120000,https://www.benzinga.com/pressreleases/22/10/g29477379/overwhelmingly-positive-reactions-pour-in-from-first-leg-of-mullen-automotives-strikingly-differen,GL,0.051999,Neutral,0.0
Breaking EV Stock News: Pre-orders for Mullen  ( NASDAQ: MULN )  FIVE Electric-SUV Crossover Exceed Expectations as the FIVE 'Strikingly Different' Tour Begins,20221028T142735,https://www.investorideas.com/CO/MULN/news/2022/10281FIVE-Electric-SUV-Crossover.asp,GL,0.034984,Neutral,0.0
Pre-orders for Mullen FIVE Electric-SUV Crossover Exceed Expectations as the FIVE 'Strikingly Different' Tour Begins - Mullen Automotive  ( NASDAQ:MULN ) ,20221028T140000,https://www.benzinga.com/pressreleases/22/10/g29459034/pre-orders-for-mullen-five-electric-suv-crossover-exceed-expectations-as-the-five-strikingly-diffe,GL,0.056011,Neutral,0.0
