title,time_published,url,ticker,relevance_score,ticker_sentiment_label,ticker_sentiment_score
Stocks That Hit 52-Week Lows On Friday,20220506T160650,https://www.benzinga.com/markets/options/22/05/27050916/52-weeks-high-and-low-article,GLTO,0.005467,Neutral,-0.008852
Stocks That Hit 52-Week Lows On Thursday,20220428T193101,https://www.benzinga.com/markets/options/22/04/26872967/52-weeks-high-and-low-article,GLTO,0.00644,Neutral,-0.039903
Stocks That Hit 52-Week Lows On Tuesday,20220524T161351,https://www.benzinga.com/markets/options/22/05/27375519/52-weeks-high-and-low-article,GLTO,0.010175,Neutral,0.007142
"Small-Cell Lung Cancer Market to Accelerate Substantially During the Study Period  ( 2019-2032 ) , Assesses DelveInsight | Leading Companies - Amgen, Novartis, AbbVie, BMS, Clovis Oncology, Cardiff Oncology, Roche, Daiichi Sankyo",20231004T210100,https://www.prnewswire.com/news-releases/small-cell-lung-cancer-market-to-accelerate-substantially-during-the-study-period-20192032-assesses-delveinsight--leading-companies----amgen-novartis-abbvie-bms-clovis-oncology-cardiff-oncology-roche-daiichi-sankyo-301946615.html,GLTO,0.021778,Neutral,-0.092267
"Nasdaq Falls 100 Points; Siyata Mobile Shares Spike Higher - Design Therapeutics  ( NASDAQ:DSGN ) , Delcath Systems  ( NASDAQ:DCTH ) ",20230815T190408,https://www.benzinga.com/news/earnings/23/08/33865408/nasdaq-falls-100-points-siyata-mobile-shares-spike-higher,GLTO,0.106778,Neutral,-0.038871
"Crude Oil Down 2%; Home Depot Posts Upbeat Earnings - Design Therapeutics  ( NASDAQ:DSGN ) , Delcath Systems  ( NASDAQ:DCTH ) ",20230815T160012,https://www.benzinga.com/news/earnings/23/08/33862485/crude-oil-down-2-home-depot-posts-upbeat-earnings,GLTO,0.107255,Neutral,-0.038927
"Dow Falls Over 200 Points; US Retail Sales Top Expectations - Design Therapeutics  ( NASDAQ:DSGN ) , Delcath Systems  ( NASDAQ:DCTH ) ",20230815T140139,https://www.benzinga.com/news/earnings/23/08/33859650/dow-falls-over-200-points-us-retail-sales-top-expectations,GLTO,0.120431,Neutral,-0.040647
"Head and Neck Squamous Cell Carcinoma Market to Witness Upsurge in Growth by 2032, Assesses DelveInsight | Key Companies in the Market - Pfizer, Merck, Eisai, AstraZeneca, Innate, Roche, GlaxoSmithKline, BeiGene, IO Biotech, Incyte",20230918T210100,https://www.prnewswire.com/news-releases/head-and-neck-squamous-cell-carcinoma-market-to-witness-upsurge-in-growth-by-2032-assesses-delveinsight--key-companies-in-the-market---pfizer-merck-eisai-astrazeneca-innate-roche-glaxosmithkline-beigene-io-biotech-incyt-301930322.html,GLTO,0.023146,Neutral,0.04357
