title,time_published,url,ticker,relevance_score,ticker_sentiment_label,ticker_sentiment_score
"6 Top Stocks For Gaming, Casinos, Sports Betting: Analyst Says This Company's Estimates Will 'Prove Conservative' - Churchill Downs  ( NASDAQ:CHDN ) , Caesars Entertainment  ( NASDAQ:CZR ) ",20241014T174539,https://www.benzinga.com/analyst-ratings/analyst-color/24/10/41318750/6-top-stocks-for-gaming-casinos-sports-betting-analyst-says-this-companys-estimates,GMVHF,0.044469,Neutral,0.103154
"NFL Week 1 Sports Betting Report: Sportsbook Logins Up 56% YoY, 1.1 Million New Customers Sign Up, Live Betting Dominates - DraftKings  ( NASDAQ:DKNG ) , Walt Disney  ( NYSE:DIS ) ",20230914T180159,https://www.benzinga.com/general/sports-betting/23/09/34588361/nfl-week-1-sports-betting-report-56-yoy-surge-in-sportsbook-logins-1-1m-new-customers-live,GMVHF,0.055492,Neutral,0.140885
"DraftKings  ( NASDAQ:DKNG ) , Caesars Entertainment  ( NASDAQ:CZR )  - Sports Betting Check-Ins Jump 77% For Opening Night: Here's How Many People Could Bet On 2022 NFL Season",20220909T202455,https://www.benzinga.com/news/22/09/28815047/sports-betting-check-ins-up-77-for-opening-night-heres-how-many-people-could-bet-in-2022-nfl-season,GMVHF,0.042496,Somewhat-Bullish,0.158142
Sports Betting Goes Live In Ontario: Why It's Important And 8 Stocks To Watch,20220404T205904,https://www.benzinga.com/news/22/04/26461629/sports-betting-goes-live-in-ontario-why-its-important-and-8-stocks-to-watch,GMVHF,0.050873,Neutral,0.001223
"11 Stocks To Watch For March Madness: AT&T, Sports Betting And Genius Sports",20220315T233950,https://www.benzinga.com/news/22/03/26146706/11-stocks-to-watch-for-march-madness-at-t-sports-betting-and-genius-sports,GMVHF,0.086121,Neutral,0.001272
