title,time_published,url,ticker,relevance_score,ticker_sentiment_label,ticker_sentiment_score
"Dow Jumps Over 150 Points; US Core PCE Price Inflation Eases - Gorilla Technology Gr  ( NASDAQ:GRRR ) , Chicken Soup for the Soul  ( NASDAQ:CSSE ) ",20230331T142529,https://www.benzinga.com/news/earnings/23/03/31609911/dow-jumps-over-150-points-us-core-pce-price-inflation-eases,GRRR,0.122269,Somewhat-Bullish,0.307568
"Concert Pharmaceuticals, Coeur Mining And Other Big Stocks Moving Higher On Thursday",20230119T153711,https://www.benzinga.com/news/23/01/30485939/concert-pharmaceuticals-coeur-mining-and-other-big-stocks-moving-higher-on-thursday,GRRR,0.456884,Neutral,0.042927
"PNC Financial, bluebird bio And Other Big Stocks Moving Lower On Wednesday",20230118T165039,https://www.benzinga.com/news/23/01/30466633/pnc-financial-bluebird-bio-and-other-big-stocks-moving-lower-on-wednesday,GRRR,0.27432,Bearish,-0.657087
"Nanobiotix, NanoString Technologies And Other Big Stocks Moving Higher In Monday's Pre-Market Session - Black Diamond Therapeutic  ( NASDAQ:BDTX ) , Gorilla Tech Gr  ( NASDAQ:GRRR ) ",20230710T104008,https://www.benzinga.com/news/23/07/33162844/nanobiotix-nanostring-technologies-and-other-big-stocks-moving-higher-in-mondays-pre-market-session,GRRR,0.423843,Bullish,0.581741
Why Ascent Solar Technologies Shares Are Trading Lower By Around 50%? Here Are Other Stocks Moving In Wednesday's Mid-Day Session - Ascent Solar Technologies  ( NASDAQ:ASTI ) ,20240410T180705,https://www.benzinga.com/news/24/04/38189280/why-ascent-solar-technologies-shares-are-trading-lower-by-around-50-here-are-other-stocks-moving-in,GRRR,0.141448,Neutral,0.0
"Why Gorilla Technology Group Are Trading Higher By 52%; Here Are 20 Stocks Moving Premarket - Aeglea BioTherapeutics  ( NASDAQ:AGLE ) , Akumin  ( NASDAQ:AKU ) ",20230707T121234,https://www.benzinga.com/news/23/07/33146206/why-gorilla-technology-group-are-trading-higher-by-52-here-are-20-stocks-moving-premarket,GRRR,0.156461,Somewhat-Bullish,0.267162
