title,time_published,url,ticker,relevance_score,ticker_sentiment_label,ticker_sentiment_score
Stocks That Hit 52-Week Lows On Wednesday,20220511T162815,https://www.benzinga.com/markets/options/22/05/27141482/52-weeks-high-and-low-article,HD,0.006905,Neutral,-0.004448
Stocks That Hit 52-Week Lows On Friday,20220506T160650,https://www.benzinga.com/markets/options/22/05/27050916/52-weeks-high-and-low-article,HD,0.005467,Neutral,0.006344
Susan G. Komen® Welcomes Three New Leaders to the Board of Directors,20230327T130000,https://www.prnewswire.com/news-releases/susan-g-komen-welcomes-three-new-leaders-to-the-board-of-directors-301780362.html,HD,0.028288,Neutral,0.139178
Here's how retailers are tackling the delivery challenges that come with skyrocketing e-commerce sales post-COVID,20220308T184700,https://www.marketwatch.com/story/heres-how-retailers-are-tackling-the-delivery-challenges-that-come-with-skyrocketing-e-commerce-sales-post-covid-11646765225,HD,0.052813,Neutral,0.018213
"HUYA, Tencent Music Entertainment, Taiwan Semiconductor Manufacturing, And Some Other Big Stocks Moving Higher In Today's Pre-Market Session - Alibaba Group Holding  ( NYSE:BABA ) , Azenta  ( NASDAQ:AZTA ) ",20221115T112903,https://www.benzinga.com/news/22/11/29723179/huya-tencent-music-entertainment-taiwan-semiconductor-manufacturing-and-some-other-big-stocks-moving,HD,0.09186,Neutral,0.0
Daily: AI Darling Nvidia Faces Sky-High Earnings Expectations,20240522T120258,https://www.forbes.com/sites/daniellechemtob/2024/05/22/forbes-daily-ai-darling-nvidia-faces-sky-high-earnings-expectations/,HD,0.024878,Neutral,-0.020889
"LVMH, Walmart And Home Depot Earnings Highlight Shift In Consumer Spending",20240521T120000,https://www.forbes.com/sites/garthfriesen/2024/05/21/walmart-and-home-depot-earnings-highlight-shift-in-consumer-spending/,HD,0.081414,Neutral,0.026138
How to Invest Confidently in Residential Housing,20220822T193000,https://www.fool.com/investing/2022/08/22/how-to-invest-confidently-in-residential-housing/,HD,0.009944,Neutral,0.038477
Executive Churn In Retail C-Suites Is Unsustainable,20220729T184043,https://www.forbes.com/sites/gregpetro/2022/07/29/executive-churn-in-retail-c-suites-is-unsustainable/,HD,0.120733,Neutral,0.009449
Target and Walmart Foot Traffic Data Suggests Strong Q1 Results,20220513T212901,https://www.forbes.com/sites/sanfordstein/2022/05/13/walmart-and-target-foot-traffic-data-suggests-strong-q1-results/,HD,0.064259,Bearish,-0.472184
5 First-Rate Retail Stocks the Pros Love,20220406T190423,https://www.kiplinger.com/investing/stocks/604511/first-rate-retail-stocks-the-pros-love,HD,0.13255,Somewhat-Bearish,-0.156803
Crude Oil Down 1%; Sweetgreen Shares Spike Higher - Macrogenics  ( NASDAQ:MGNX ) ,20240510T183023,https://www.benzinga.com/news/24/05/38768201/crude-oil-down-1-sweetgreen-shares-spike-higher,HD,0.077094,Neutral,0.0
Nasdaq Moves Lower; US Consumer Sentiment Falls In May - Novavax  ( NASDAQ:NVAX ) ,20240510T162224,https://www.benzinga.com/news/earnings/24/05/38765474/nasdaq-moves-lower-us-consumer-sentiment-falls-in-may,HD,0.081276,Neutral,0.0
"Dow Jumps Over 100 Points; DNOW Posts Downbeat Earnings - Dnow  ( NYSE:DNOW ) , Evolv Technologies  ( NASDAQ:EVLV ) ",20240510T140059,https://www.benzinga.com/news/24/05/38761518/dow-jumps-over-100-points-dnow-posts-downbeat-earnings,HD,0.075874,Neutral,0.0
Where to Invest for the Rest of 2023,20230618T163035,https://www.kiplinger.com/investing/where-to-invest,HD,0.027731,Somewhat-Bullish,0.18241
5 Best Dow Dividend Stocks to Buy Now,20221024T171822,https://www.kiplinger.com/investing/stocks/best-dow-dividend-stocks-to-buy-now,HD,0.160633,Neutral,0.14528
"Do Home Depot's Strategies Place It Well Amid Soft Demand? - Abercrombie & Fitch  ( NYSE:ANF ) , Gap  ( NYSE:GPS ) ",20240614T195907,https://www.benzinga.com/news/24/06/39337012/do-home-depots-strategies-place-it-well-amid-soft-demand,HD,0.368773,Bullish,0.353264
Do Home Depot's  ( HD )  Strategies Place It Well Amid Soft Demand?,20240614T152900,https://www.zacks.com/stock/news/2288644/do-home-depots-hd-strategies-place-it-well-amid-soft-demand,HD,0.371523,Somewhat-Bullish,0.342892
10 last-minute Father's Day gifts for procrastinators,20230614T100513,https://theweek.com/life/1024249/10-last-minute-fathers-day-gifts-for-procrastinators,HD,0.054114,Neutral,0.017057
Retailers could face cost cuts and slower sales this year,20230219T130002,https://www.cnbc.com/2023/02/19/walmart-home-depot-earnings-preview.html,HD,0.038101,Neutral,0.076902
Retail 100% Satisfaction Guarantee Policies May Be Reaching A Point Of No Return,20221002T090000,https://www.forbes.com/sites/pamdanziger/2022/10/02/retail-100-satisfaction-guarantee-policies-may-be-reaching-a-point-of-no-return/,HD,0.033006,Neutral,-0.04491
"How Ace Hardware, America's neighborhood hardware store for 100 years, is beating its big-box rivals | Business",20240524T185000,https://www.cnn.com/2024/05/24/business/ace-hardware-staying-power/index.html,HD,0.125854,Neutral,0.00953
Vera Bradley Announces Additional Corporate Reorganization and Cost Reduction Plans to Support Project Restoration - Vera Bradley  ( NASDAQ:VRA ) ,20230425T211418,https://www.benzinga.com/pressreleases/23/04/g32000510/vera-bradley-announces-additional-corporate-reorganization-and-cost-reduction-plans-to-support-pro,HD,0.03319,Somewhat-Bullish,0.167894
Vera Bradley Announces Additional Corporate Reorganization and Cost Reduction Plans to Support Project Restoration,20230425T211400,https://www.globenewswire.com/news-release/2023/04/25/2654535/17650/en/Vera-Bradley-Announces-Additional-Corporate-Reorganization-and-Cost-Reduction-Plans-to-Support-Project-Restoration.html,HD,0.03448,Somewhat-Bullish,0.168576
"This Analyst Boosts Price Target On Home Depot Following Strong Earnings, Plus Citigroup Slashes PT On This Stock By Over 60%",20220817T122748,https://www.benzinga.com/news/earnings/22/08/28533005/this-analyst-boosts-price-target-on-home-depot-following-strong-earnings-plus-citigroup-slashes-pt-,HD,0.229872,Neutral,0.119
