title,time_published,url,ticker,relevance_score,ticker_sentiment_label,ticker_sentiment_score
"Pure Storage, Rubrik to Combat Emerging Cyber Threats in Businesses",20240927T134600,https://www.zacks.com/stock/news/2342736/pure-storage-rubrik-to-combat-emerging-cyber-threats-in-businesses,HLIT,0.178459,Neutral,0.080894
NetApp Teams Up With Aruba for Enhanced Data Center Solutions,20240919T135900,https://www.zacks.com/stock/news/2338614/netapp-teams-up-with-aruba-for-enhanced-data-center-solutions,HLIT,0.245835,Somewhat-Bullish,0.272314
NetApp's AFF C-Series Storage & Other Solutions Utilized by Anaplan,20240912T131000,https://www.zacks.com/stock/news/2335301/netapps-aff-c-series-storage-other-solutions-utilized-by-anaplan,HLIT,0.236281,Somewhat-Bullish,0.163337
Western Digital's  ( WDC )  Thailand Project Reportedly Gets Approval,20240826T142100,https://www.zacks.com/stock/news/2327102/western-digitals-wdc-thailand-project-reportedly-gets-approval,HLIT,0.289576,Somewhat-Bullish,0.204764
"Alibaba, Illumina, CyberArk Software And Other Big Stocks Moving Higher On Thursday - Alarm.com Holdings  ( NASDAQ:ALRM ) , Applied Industrial  ( NYSE:AIT ) ",20230810T143943,https://www.benzinga.com/news/23/08/33711133/alibaba-illumina-cyberark-software-and-other-big-stocks-moving-higher-on-thursday,HLIT,0.222838,Bullish,0.590763
"Arista Networks, JinkoSolar, Repligen, Shutterstock And Other Big Stocks Moving Higher On Tuesday - Arista Networks  ( NYSE:ANET ) , Ardelyx  ( NASDAQ:ARDX ) ",20231031T160410,https://www.benzinga.com/news/23/10/35515963/arista-networks-jinkosolar-repligen-shutterstock-and-other-big-stocks-moving-higher-on-tuesday,HLIT,0.152983,Neutral,0.0
"McKesson, ICU Medical, Novavax And Other Big Stocks Moving Higher On Tuesday - Adeia  ( NASDAQ:ADEA ) , Aris Water Solutions  ( NYSE:ARIS ) ",20230509T144116,https://www.benzinga.com/news/23/05/32293245/mckesson-icu-medical-novavax-and-other-big-stocks-moving-higher-on-tuesday,HLIT,0.147818,Bullish,0.510113
"Stocks That Hit 52-Week Lows On Thursday - PRA Group  ( NASDAQ:PRAA ) , Perimeter Solutions  ( NYSE:PRM ) ",20231005T172202,https://www.benzinga.com/news/23/10/35111787/stocks-that-hit-52-week-lows-on-thursday,HLIT,0.013047,Neutral,-0.087261
"Why Aditxt Shares Dipped Over 58%; Here Are 82 Biggest Movers From Friday - Applied Optoelectronics  ( NASDAQ:AAOI ) , Adicet Bio  ( NASDAQ:ACET ) ",20220919T055309,https://www.benzinga.com/news/22/09/28909319/why-aditxt-shares-dipped-over-58-here-are-82-biggest-movers-from-friday,HLIT,0.084127,Neutral,0.108582
Why Aaron's Shares Are Trading Lower By Over 9%? Here Are Other Stocks Moving In Tuesday's Mid-Day Session,20230801T190537,https://markets.businessinsider.com/news/stocks/why-aaron-s-shares-are-trading-lower-by-over-9-here-are-other-stocks-moving-in-tuesday-s-mid-day-session-1032502331,HLIT,0.032961,Somewhat-Bearish,-0.212603
"Goodyear Tire, Catalent, Zebra Technologies And Some Other Big Stocks Moving Lower On Tuesday - BioCryst Pharmaceuticals  ( NASDAQ:BCRX ) , TopBuild  ( NYSE:BLD ) ",20221101T153623,https://www.benzinga.com/news/22/11/29504982/goodyear-tire-catalent-zebra-technologies-and-some-other-big-stocks-moving-lower-on-tuesday,HLIT,0.150592,Neutral,0.0
80 Biggest Movers From Yesterday,20220504T090458,https://www.benzinga.com/news/22/05/26983694/80-biggest-movers-from-yesterday,HLIT,0.045769,Neutral,-0.000323
41 Stocks Moving In Tuesday's Mid-Day Session,20220503T161447,https://www.benzinga.com/news/22/05/26969137/41-stocks-moving-in-tuesdays-mid-day-session,HLIT,0.081998,Neutral,-0.002801
"Earnings Scheduled For May 2, 2022",20220502T091616,https://www.benzinga.com/news/earnings/22/05/26923268/earnings-scheduled-for-may-2-2022,HLIT,0.037992,Neutral,0.000107
"Jim Cramer Writes Off Entire Telco, Wireless Industry: 'It's Such A Shame' - Aehr Test Systems  ( NASDAQ:AEHR ) , Carpenter Tech  ( NYSE:CRS ) ",20230922T122355,https://www.benzinga.com/trading-ideas/long-ideas/23/09/34816018/jim-cramer-writes-off-entire-telco-wireless-industry-its-such-a-shame,HLIT,0.410059,Neutral,-0.023039
