title,time_published,url,ticker,relevance_score,ticker_sentiment_label,ticker_sentiment_score
Why Stitch Fix Shares Are Trading Higher By 18%; Here Are 20 Stocks Moving Premarket - Stitch Fix  ( NASDAQ:SFIX ) ,20240605T092725,https://www.benzinga.com/news/24/06/39178410/why-stitch-fix-shares-are-trading-higher-by-18-here-are-20-stocks-moving-premarket,HPQ,0.070725,Somewhat-Bullish,0.281431
"Output Management Software Market to increase by USD 14.74 billion between 2023 to 2028; Broadcom Inc., CSG ... - PR Newswire",20240208T234200,https://www.prnewswire.com/news-releases/output-management-software-market-to-increase-by-usd-14-74-billion-between-2023-to-2028-broadcom-inc-csg-systems-international-inc-docpath-document-solutions-sl-and-more-among-key-companies--technavio-302056999.html,HPQ,0.077593,Neutral,0.012274
"Document Outsourcing Market to grow by USD 17.79 billion from 2022 to 2027, Increased efficiency of document ... - PR Newswire",20230920T031500,https://www.prnewswire.com/news-releases/document-outsourcing-market-to-grow-by-usd-17-79-billion-from-2022-to-2027--increased-efficiency-of-document-management-using-hybrid-solutions-to-drive-market-growth--technavio-301932603.html,HPQ,0.045743,Neutral,0.041179
"Why Juniper Networks Shares Are Trading Higher By Over 23%; Here Are 20 Stocks Moving Premarket - Bit Brother  ( NASDAQ:BETS ) , ARB IOT Group  ( NASDAQ:ARBB ) ",20240109T132311,https://www.benzinga.com/news/24/01/36554974/why-juniper-networks-shares-are-trading-higher-by-over-23-here-are-20-stocks-moving-premarket,HPQ,0.150122,Neutral,0.019571
Femasys Inc. Replaces Two Board Members with Seasoned Industry Leaders in the Life Sciences - Femasys  ( NASDAQ:FEMY ) ,20230615T120000,https://www.benzinga.com/pressreleases/23/06/g32871308/femasys-inc-replaces-two-board-members-with-seasoned-industry-leaders-in-the-life-sciences,HPQ,0.03786,Neutral,-0.015316
"Premium and Luxury Brand Agency Team One Welcomes Zach Baze as Executive Director, Data and Effectiveness",20240801T170000,https://www.benzinga.com/pressreleases/24/08/g40108683/premium-and-luxury-brand-agency-team-one-welcomes-zach-baze-as-executive-director-data-and-effecti,HPQ,0.170878,Somewhat-Bullish,0.271433
Integrated Marketing Agency Team One Taps Rosabel Murai as New Chief Media Officer,20240508T150000,https://www.benzinga.com/pressreleases/24/05/g38704099/integrated-marketing-agency-team-one-taps-rosabel-murai-as-new-chief-media-officer,HPQ,0.27432,Somewhat-Bullish,0.299946
Junior Achievement of Southern California Empowers the Next Generation Through New Financial Literacy-Focused Marketing Campaign,20240408T184024,https://www.benzinga.com/pressreleases/24/04/g38148716/junior-achievement-of-southern-california-empowers-the-next-generation-through-new-financial-liter,HPQ,0.084871,Somewhat-Bullish,0.202765
"TikTok ban, Supreme Court student loan hearing and Tesla Investor Day top week ahead",20230227T050559,https://www.foxbusiness.com/markets/tiktok-ban-supreme-court-student-loan-hearing-tesla-investor-day-top-week-ahead,HPQ,0.034332,Neutral,0.0
What Sheryl Sandberg's Exit Reveals About Women's Progress in Tech,20220603T215218,https://www.nytimes.com/2022/06/03/technology/sheryl-sandberg-women-in-tech.html,HPQ,0.073314,Neutral,0.058774
Full Harvest Accelerates Expansion of B2B Produce Marketplace,20220511T120500,https://www.prnewswire.com/news-releases/full-harvest-accelerates-expansion-of-b2b-produce-marketplace-301544989.html,HPQ,0.033571,Neutral,0.027922
53 Biggest Movers From Yesterday,20220408T084938,https://www.benzinga.com/news/22/04/26539460/53-biggest-movers-from-yesterday,HPQ,0.063763,Neutral,0.000635
38 Stocks Moving In Thursday's Mid-Day Session,20220407T171413,https://www.benzinga.com/news/22/04/26529716/38-stocks-moving-in-thursdays-mid-day-session,HPQ,0.087969,Neutral,0.000287
Pure Storage to Report Q3 Earnings: Here is What You Need to Know,20241129T130800,https://www.zacks.com/stock/news/2376883/pure-storage-to-report-q3-earnings-here-is-what-you-need-to-know,HPQ,0.091509,Neutral,0.147975
Should You Forget Super Micro Computer and Buy These 2 Millionaire-Maker AI Stocks Instead?,20241124T201500,https://www.fool.com/investing/2024/11/24/should-you-forget-super-micro-computer-and-buy-the/,HPQ,0.055492,Neutral,-0.058388
Better AI Stock: Super Micro Computer vs. Dell Technologies,20241015T100500,https://www.fool.com/investing/2024/10/15/ai-stock-super-micro-computer-vs-dell-technology/,HPQ,0.042196,Neutral,0.022784
"Hyperscale Data Center Market Size Worth $355.87 Billion, Globally, by 2031 - Exclusive Report by The Insight Partners",20241003T135315,https://www.benzinga.com/pressreleases/24/10/g41165229/hyperscale-data-center-market-size-worth-355-87-billion-globally-by-2031-exclusive-report-by-the-i,HPQ,0.028764,Neutral,0.0
Will Dell Technologies Be a Trillion-Dollar Stock by 2040?,20240926T130000,https://www.fool.com/investing/2024/09/26/will-dell-technologies-be-a-trillion-dollar-stock/,HPQ,0.055621,Neutral,0.125883
"Zacks Industry Outlook IBM, Hewlett Packard Enterprise and Eni SpA Agilysys",20240827T063000,https://www.zacks.com/stock/news/2327364/zacks-industry-outlook-ibm-hewlett-packard-enterprise-and-eni-spa-agilysys,HPQ,0.083179,Somewhat-Bullish,0.198386
3 Stocks to Watch From a Challenging Technology Solutions Industry,20240826T152000,https://www.zacks.com/commentary/2327100/3-stocks-to-watch-from-a-challenging-technology-solutions-industry,HPQ,0.043979,Neutral,0.115924
Goldman Sachs: 89 stocks expected to be winners as they build out AI infrastructure,20240705T100000,https://www.businessinsider.com/ai-stocks-companies-building-out-infrastructure-goldman-sachs-picks-2024-7,HPQ,0.029363,Neutral,0.021142
"Pure Storage Stock Slides After Downgrade On Competition, AI Concerns",20240702T153200,https://www.investors.com/news/technology/pure-storage-slides-on-downgrade-ai-too-much-credit/,HPQ,0.059488,Somewhat-Bullish,0.154005
"Enterprise External OEM Storage Systems Market size is set to grow by USD 4.93 billion from 2024-2028, Growing ... - PR Newswire",20240606T213500,https://www.prnewswire.com/news-releases/enterprise-external-oem-storage-systems-market-size-is-set-to-grow-by-usd-4-93-billion-from-2024-2028--growing-demand-for-non-volatile-memory-express-enabled-storage-solutions-boost-the-market-technavio-302165000.html,HPQ,0.033006,Neutral,0.0
"Stand Alone Cloud Storage Market size is set to grow by USD 97.40 billion from 2024-2028, Reduced capital and ... - PR Newswire",20240605T214000,https://www.prnewswire.com/news-releases/stand-alone-cloud-storage-market-size-is-set-to-grow-by-usd-97-40-billion-from-2024-2028--reduced-capital-and-operating-expenditure-opex-to-boost-the-market-growth-technavio-302164355.html,HPQ,0.03072,Neutral,0.0
4 Stocks to Watch From a Prospering Technology Solutions Industry,20240603T195537,https://markets.businessinsider.com/news/stocks/4-stocks-to-watch-from-a-prospering-technology-solutions-industry-1033447136,HPQ,0.057352,Somewhat-Bullish,0.205173
"4 Stocks to Watch From a Prospering Technology Solutions Industry - Hewlett Packard  ( NYSE:HPE ) , Agilysys  ( NASDAQ:AGYS ) ",20240603T193405,https://www.benzinga.com/news/24/06/39141705/4-stocks-to-watch-from-a-prospering-technology-solutions-industry,HPQ,0.056496,Somewhat-Bullish,0.201103
4 Stocks to Watch From a Prospering Technology Solutions Industry,20240603T152800,https://www.zacks.com/commentary/2282580/4-stocks-to-watch-from-a-prospering-technology-solutions-industry,HPQ,0.038253,Neutral,0.121581
"Tokenization Market Surges to USD 5.7 Billion by 2031, Propelled by 19% CAGR - Verified Market Research®",20240521T141500,https://www.benzinga.com/pressreleases/24/05/g38942628/tokenization-market-surges-to-usd-5-7-billion-by-2031-propelled-by-19-cagr-verified-market-researc,HPQ,0.029654,Neutral,0.094948
Dell surges 9% on optimism it has secured big AI server orders,20240515T182138,https://www.cnbc.com/2024/05/15/dell-stock-surges-9percent-on-optimism-company-has-big-ai-server-orders.html,HPQ,0.071784,Somewhat-Bullish,0.181001
"Ollie's Bargain Outlet Posts Upbeat Earnings, Joins Verint Systems, Guidewire Software And Other Big Stocks Moving Higher On Wednesday - Ollie's Bargain Outlet  ( NASDAQ:OLLI ) ",20240605T142346,https://www.benzinga.com/news/24/06/39186219/ollies-bargain-outlet-posts-upbeat-earnings-joins-verint-systems-guidewire-software-and-other-big-st,HPQ,0.068698,Bullish,0.426814
"Nasdaq, S&P 500 Eye Strong Open Today: What's Driving Stock Futures Up? - Invesco QQQ Trust, Series 1  ( NASDAQ:QQQ ) , SPDR S&P 500  ( ARCA:SPY ) ",20240605T112425,https://www.benzinga.com/news/earnings/24/06/39180770/wall-street-looks-to-extend-gains-as-traders-eye-more-jobs-data-why-this-analyst-sees-4-s-p-500-ris,HPQ,0.057079,Neutral,0.0
"Nasdaq, S&P 500 Futures Drop As Tech Weakens, Meme Stock Rally Sputters: Analyst Sees Rate Cuts Hinging On Key Fed Data - Invesco QQQ Trust, Series 1  ( NASDAQ:QQQ ) , SPDR S&P 500  ( ARCA:SPY ) ",20240604T112738,https://www.benzinga.com/news/earnings/24/06/39155948/nasdaq-s-p-500-futures-drop-as-tech-weakens-meme-stock-rally-sputters-analyst-sees-rate-cuts-hingin,HPQ,0.050359,Neutral,0.0
"Zuckerberg fallout, EBT tech issue, Powell speech reaction and more: Monday's 5 things to know",20220829T052643,https://www.foxbusiness.com/markets/zuckerberg-fallout-ebt-tech-issue-powell-speech-reaction-mondays-5-things-know,HPQ,0.032558,Neutral,0.0
"Jobs data, Bed Bath & Beyond update, Best Buy earnings top week ahead",20220829T001226,https://www.foxbusiness.com/markets/jobs-data-bed-bath-beyond-update-best-buy-earnings-week-ahead,HPQ,0.046095,Neutral,0.0
"Jobs report, GameStop earnings, home prices top week ahead",20220530T060359,https://www.foxbusiness.com/markets/jobs-report-gamestop-earnings-home-prices-week-ahead,HPQ,0.071935,Somewhat-Bullish,0.154216
"Ulta Beauty Posts Upbeat Results, Joins Asana, Lululemon, Hewlett Packard Enterprise And Other Big Stocks Moving Higher On Friday - AppLovin  ( NASDAQ:APP ) , Asana  ( NYSE:ASAN ) ",20241206T171541,https://www.benzinga.com/24/12/42368892/ulta-beauty-posts-upbeat-results-joins-asana-lululemon-hewlett-packard-enterprise-and-other-big-stocks-moving-hig,HPQ,0.073546,Somewhat-Bullish,0.237635
Synchronoss Technologies Announces New Management Structure for Japan Operations,20240529T115000,https://www.globenewswire.com/news-release/2024/05/29/2889770/37247/en/Synchronoss-Technologies-Announces-New-Management-Structure-for-Japan-Operations.html,HPQ,0.166169,Neutral,0.078054
Hewlett Packard Enterprise  ( HPE )  Meets Q4 Earnings Estimates,20221129T223503,https://www.zacks.com/stock/news/2023418/hewlett-packard-enterprise-hpe-meets-q4-earnings-estimates,HPQ,0.069697,Neutral,0.10444
"Best Buy, HP And 3 Stocks To Watch Heading Into Tuesday - Best Buy Co  ( NYSE:BBY ) , Dell Technologies  ( NYSE:DELL ) ",20241126T074216,https://www.benzinga.com/news/earnings/24/11/42181574/best-buy-hp-and-3-stocks-to-watch-heading-into-tuesday,HPQ,0.256989,Neutral,0.069305
"1,000 Dreams Fund's BroadcastHER Academy Esports and Gaming Fellowship Program for Women Returns for Year 5",20230315T180600,https://www.benzinga.com/pressreleases/23/03/n31367240/1-000-dreams-funds-broadcasther-academy-esports-and-gaming-fellowship-program-for-women-returns-fo,HPQ,0.065061,Somewhat-Bullish,0.276922
Practice of law: best examples in legal work,20230922T040009,https://www.ft.com/content/e3806267-281d-47b0-9b6f-dbd20a1437c1,HPQ,0.016411,Neutral,-0.03756
"Box, Ambarella, HP And Other Big Stocks Moving Lower In Wednesday's Pre-Market Session - Ambarella  ( NASDAQ:AMBA ) , Box  ( NYSE:BOX ) ",20230830T102434,https://www.benzinga.com/news/23/08/34109893/box-ambarella-hp-and-other-big-stocks-moving-lower-in-wednesdays-pre-market-session,HPQ,0.246582,Somewhat-Bearish,-0.179557
74 Biggest Movers From Yesterday,20220603T095047,https://www.benzinga.com/news/22/06/27539006/74-biggest-movers-from-yesterday,HPQ,0.02645,Bearish,-0.761817
"Shoals Technologies Posts Weak Q4 Results, Joins Butterfly Network, Schrödinger And Other Big Stocks Moving Lower In Thursday's Pre-Market Session - AMC Enter Hldgs  ( NYSE:AMC ) , Butterfly Network  ( NYSE:BFLY ) ",20240229T101643,https://www.benzinga.com/news/24/02/37386929/shoals-technologies-posts-weak-q4-results-joins-butterfly-network-schr-dinger-and-other-big-stocks-m,HPQ,0.162255,Neutral,0.078796
"Hewlett Packard Enterprise, Nvidia, Progress Software And Other Big Stocks Moving Higher On Wednesday - NVIDIA  ( NASDAQ:NVDA ) ",20240925T141323,https://www.benzinga.com/news/24/09/41026309/hewlett-packard-enterprise-nvidia-progress-software-and-other-big-stocks-moving-higher-on-wednesday,HPQ,0.198221,Neutral,0.115757
The Future Of Payments: Fintech 50 2022,20220607T101500,https://www.forbes.com/sites/jeffkauflin/2022/06/07/the-future-of-payments-fintech-50-2022/,HPQ,0.043499,Neutral,0.002438
Fintech 50 2022: The Newcomers,20220607T101500,https://www.forbes.com/sites/jeffkauflin/2022/06/07/fintech-50-2022-the-newcomers/,HPQ,0.010229,Neutral,0.002438
