title,time_published,url,ticker,relevance_score,ticker_sentiment_label,ticker_sentiment_score
Stocks That Hit 52-Week Lows On Friday,20220506T160650,https://www.benzinga.com/markets/options/22/05/27050916/52-weeks-high-and-low-article,IAS,0.005467,Neutral,-0.012214
"DouYu International Posts Q1 Results, Joins Annexon, Dollar Tree And Other Big Stocks Moving Lower In Wednesday's Pre-Market Session - DouYu Intl Hldgs  ( NASDAQ:DOYU ) ",20240605T120739,https://www.benzinga.com/news/24/06/39181909/douyu-international-posts-q1-results-joins-annexon-dollar-tree-and-other-big-stocks-moving-lower-in,IAS,0.268294,Neutral,-0.130232
Stocks That Hit 52-Week Lows On Tuesday,20220315T163235,https://www.benzinga.com/news/22/03/26148458/stocks-that-hit-52-week-lows-on-tuesday,IAS,0.00539,Neutral,-8.5e-05
Stocks That Hit 52-Week Lows On Monday,20220613T161842,https://www.benzinga.com/markets/options/22/06/27677156/52-weeks-high-and-low-article,IAS,0.005366,Neutral,0.000191
Stocks That Hit 52-Week Lows On Tuesday,20220426T174457,https://www.benzinga.com/markets/options/22/04/26818122/52-weeks-high-and-low-article,IAS,0.00928,Neutral,0.017205
Stocks That Hit 52-Week Lows On Monday,20220314T161153,https://www.benzinga.com/news/22/03/26125409/stocks-that-hit-52-week-lows-on-monday,IAS,0.003772,Neutral,-0.00462
"Why Tattooed Chef Shares Dipped Around 15%; Here Are 95 Biggest Movers From Friday - Alcoa  ( NYSE:AA ) , Aurora Cannabis  ( NASDAQ:ACB ) ",20221114T073517,https://www.benzinga.com/news/earnings/22/11/29694040/why-tattooed-chef-shares-dipped-around-15-here-are-95-biggest-movers-from-friday,IAS,0.043698,Somewhat-Bullish,0.268617
Stocks That Hit 52-Week Lows On Friday,20220311T173551,https://www.benzinga.com/news/22/03/26102456/stocks-that-hit-52-week-lows-on-friday,IAS,0.011663,Neutral,0.001858
The Benchmark Company Announces Upcoming September Conference Schedule,20240822T151153,https://www.benzinga.com/pressreleases/24/08/g40510267/the-benchmark-company-announces-upcoming-september-conference-schedule,IAS,0.050679,Neutral,0.0
"Veritone, Samsara, Lexicon Pharmaceuticals And Other Big Stocks Moving Higher On Friday - C3.ai  ( NYSE:AI ) , Ardelyx  ( NASDAQ:ARDX ) ",20230303T164036,https://www.benzinga.com/news/23/03/31195577/veritone-samsara-lexicon-pharmaceuticals-and-other-big-stocks-moving-higher-on-friday,IAS,0.195025,Somewhat-Bullish,0.317537
"Earnings Scheduled For May 11, 2022",20220511T102312,https://www.benzinga.com/news/earnings/22/05/27129387/earnings-scheduled-for-may-11-2022,IAS,0.025426,Neutral,-0.006018
Why Beyond Meat Shares Are Trading Higher By Around 56%; Here Are 20 Stocks Moving Premarket - Beyond Meat  ( NASDAQ:BYND ) ,20240228T132441,https://www.benzinga.com/news/24/02/37361651/why-beyond-meat-shares-are-trading-higher-by-around-56-here-are-20-stocks-moving-premarket,IAS,0.164468,Neutral,-0.067373
"3D Systems Posts Downbeat Q4 Results, Joins Eventbrite, Lemonade And Other Big Stocks Moving Lower In Wednesday's Pre-Market Session - Lemonade  ( NYSE:LMND ) , 3D Sys  ( NYSE:DDD ) , Eventbrite  ( NYSE:EB ) ",20240228T112352,https://www.benzinga.com/news/24/02/37358493/3d-systems-posts-downbeat-q4-results-joins-eventbrite-lemonade-and-other-big-stocks-moving-lower-in,IAS,0.24289,Neutral,-0.090241
New Strong Buy Stocks for August 4th,20230804T112200,https://www.zacks.com/commentary/2131673/new-strong-buy-stocks-for-august-4th,IAS,0.507107,Neutral,0.0
"Genpact Posts Upbeat Earnings, Joins Groupon, Natera, Funko, CarGurus And Other Big Stocks Moving Higher On Friday - Groupon  ( NASDAQ:GRPN ) ",20240510T144827,https://www.benzinga.com/news/24/05/38762708/genpact-posts-upbeat-earnings-joins-groupon-natera-funko-cargurus-and-other-big-stocks-moving-higher,IAS,0.113866,Somewhat-Bullish,0.267698
"Expedia Group, Gartner, Cloudflare, Cardinal Health And Other Big Stocks Moving Higher On Friday - Allogene Therapeutics  ( NASDAQ:ALLO ) , AMC Networks  ( NASDAQ:AMCX ) ",20231103T153022,https://www.benzinga.com/news/23/11/35594375/expedia-group-gartner-cloudflare-cardinal-health-and-other-big-stocks-moving-higher-on-friday,IAS,0.109206,Somewhat-Bullish,0.269263
"Coherus BioSciences, MicroVision, Millicom And Other Big Stocks Moving Lower On Friday - ATI Physical Therapy  ( NYSE:ATIP ) , Cabot  ( NYSE:CBT ) ",20230616T143731,https://www.benzinga.com/news/23/06/32893983/coherus-biosciences-microvision-millicom-and-other-big-stocks-moving-lower-on-friday,IAS,0.2872,Neutral,0.0
"Top 5 Tech And Telecom Stocks That Are Ticking Portfolio Bombs - Integral Ad Science  ( NASDAQ:IAS ) , AST SpaceMobile  ( NASDAQ:ASTS ) ",20230307T122012,https://www.benzinga.com/news/23/03/31234897/top-5-tech-and-telecom-stocks-that-are-ticking-portfolio-bombs,IAS,0.359447,Bullish,0.525044
