title,time_published,url,ticker,relevance_score,ticker_sentiment_label,ticker_sentiment_score
Dow Jumps Over 200 Points; NY Empire State Manufacturing Index Increases In September - Dunxin Financial Hldgs  ( AMEX:DXF ) ,20240916T134208,https://www.benzinga.com/news/earnings/24/09/40878911/dow-jumps-over-200-points-ny-empire-state-manufacturing-index-increases-in-september,IMMP,0.182506,Neutral,0.030672
"Head and Neck Squamous Cell Carcinoma Market to Witness Upsurge in Growth by 2032, Assesses DelveInsight | Key Companies in the Market - Pfizer, Merck, Eisai, AstraZeneca, Innate, Roche, GlaxoSmithKline, BeiGene, IO Biotech, Incyte",20230918T210100,https://www.prnewswire.com/news-releases/head-and-neck-squamous-cell-carcinoma-market-to-witness-upsurge-in-growth-by-2032-assesses-delveinsight--key-companies-in-the-market---pfizer-merck-eisai-astrazeneca-innate-roche-glaxosmithkline-beigene-io-biotech-incyt-301930322.html,IMMP,0.069361,Neutral,0.052186
"The Week Ahead In Biotech  ( March 27-April 2 ) : Lipocine, Akebia, Merck Await FDA Verdicts, Adcom Test For Amylyx, BioNTech Earnings And More",20220327T204003,https://www.benzinga.com/general/biotech/22/03/26313832/the-week-ahead-in-biotech-march-27-april-2-lipocine-akebia-merck-await-fda-verdicts-adcom-test-fo,IMMP,0.074856,Neutral,0.038917
"Triple-Negative Breast Cancer Market to Accelerate Substantially During the Forecast Period  ( 2023-2032 ) , Examines DelveInsight | Key Companies to Watch - Roche, AbbVie, AstraZeneca, BeiGene, GlaxoSmithKline, Genentech, Eli Lilly, Novartis",20230906T210100,https://www.prnewswire.com/news-releases/triple-negative-breast-cancer-market-to-accelerate-substantially-during-the-forecast-period-20232032-examines-delveinsight--key-companies-to-watch---roche-abbvie-astrazeneca-beigene-glaxosmithkline-genentech-eli-lilly--301918858.html,IMMP,0.022494,Neutral,-0.053504
"Rigel Pharmaceuticals  ( NASDAQ:RIGL )  Lowered to ""Hold"" at StockNews.com",20221229T065844,https://www.etfdailynews.com/2022/12/29/rigel-pharmaceuticals-nasdaqrigl-lowered-to-hold-at-stocknews-com/,IMMP,0.073321,Neutral,0.115611
