title,time_published,url,ticker,relevance_score,ticker_sentiment_label,ticker_sentiment_score
Stocks That Hit 52-Week Lows On Monday,20220613T161842,https://www.benzinga.com/markets/options/22/06/27677156/52-weeks-high-and-low-article,INFY,0.005366,Neutral,-0.010375
Stocks That Hit 52-Week Lows On Wednesday,20220525T161423,https://www.benzinga.com/markets/options/22/05/27398602/52-weeks-high-and-low-article,INFY,0.023585,Neutral,-0.015699
"Wipro posts flat Q2 profit, cuts Q3 revenue growth guidance on weak demand",20231018T161320,https://www.business-standard.com/companies/news/wipro-trims-third-quarter-revenue-growth-forecast-to-3-5-to-1-5-123101801076_1.html,INFY,0.102231,Neutral,0.118893
Why Delaporte's brave bets have failed to sustain Wipro's growth? | The Financial Express,20221127T224500,https://www.financialexpress.com/industry/why-delaportes-brave-bets-have-failed-to-sustain-wipros-growth/2893719/,INFY,0.16317,Neutral,0.049092
"At Rs 2,659 cr, Wipro Q2 profit misses estimates | The Financial Express",20221012T213000,https://www.financialexpress.com/industry/at-rs-2659-cr-wipro-q2-profit-misses-estimates/2708431/,INFY,0.062271,Neutral,0.00701
Security Assurance Market Projected to Hit USD 12.7 Billion at a 13.45% CAGR by 2030 - Report by Market Research Future  ( MRFR ) ,20230315T120452,https://www.benzinga.com/pressreleases/23/03/g31358358/security-assurance-market-projected-to-hit-usd-12-7-billion-at-a-13-45-cagr-by-2030-report-by-mark,INFY,0.033236,Neutral,0.05977
