title,time_published,url,ticker,relevance_score,ticker_sentiment_label,ticker_sentiment_score
ADBE: Goldman Sachs: These 3 Stocks Could Gain More Than 20% by Next Summer,20220628T152446,https://stocknews.com/news/adbe-glbe-invz-goldman-sachs-these-3-stocks-could-gain-more-than-20/,INVZ,0.195025,Neutral,0.016576
"Why AppLovin Shares Are Trading Higher By Over 22%; Here Are 20 Stocks Moving Premarket - AppLovin  ( NASDAQ:APP ) , Amyris  ( NASDAQ:AMRS ) ",20230810T120627,https://www.benzinga.com/news/23/08/33704412/why-applovin-shares-are-trading-higher-by-over-22-here-are-20-stocks-moving-premarket,INVZ,0.155451,Neutral,0.147386
"Toro Posts Upbeat Results, Joins Clear Channel Outdoor, Marathon Digital And Other Big Stocks Moving Higher On Wednesday - Canaan  ( NASDAQ:CAN ) , Clear Channel Outdoor  ( NYSE:CCO ) ",20231220T151022,https://www.benzinga.com/news/23/12/36326451/toro-posts-upbeat-results-joins-clear-channel-outdoor-marathon-digital-and-other-big-stocks-moving-h,INVZ,0.233556,Bullish,0.55773
Stocks That Hit 52-Week Lows On Friday,20220422T162629,https://www.benzinga.com/markets/options/22/04/26764450/52-weeks-high-and-low-article,INVZ,0.012589,Neutral,0.003278
"Earnings Scheduled For May 11, 2022",20220511T102312,https://www.benzinga.com/news/earnings/22/05/27129387/earnings-scheduled-for-may-11-2022,INVZ,0.025426,Neutral,-0.141185
66 Biggest Movers From Yesterday,20220503T100824,https://www.benzinga.com/news/22/05/26954454/66-biggest-movers-from-yesterday,INVZ,0.056748,Neutral,0.048636
