title,time_published,url,ticker,relevance_score,ticker_sentiment_label,ticker_sentiment_score
Stocks That Hit 52-Week Lows On Wednesday,20220511T162815,https://www.benzinga.com/markets/options/22/05/27141482/52-weeks-high-and-low-article,IREN,0.006905,Neutral,-0.009064
Stocks That Hit 52-Week Lows On Monday,20220613T161842,https://www.benzinga.com/markets/options/22/06/27677156/52-weeks-high-and-low-article,IREN,0.005366,Neutral,0.076716
71 Biggest Movers From Yesterday,20220520T082731,https://www.benzinga.com/news/22/05/27318002/71-biggest-movers-from-yesterday,IREN,0.055946,Neutral,0.011779
73 Biggest Movers From Yesterday,20220517T084925,https://www.benzinga.com/news/22/05/27243846/73-biggest-movers-from-yesterday,IREN,0.052564,Neutral,-0.026197
Mid-Afternoon Market Update: Dow Jumps 300 Points; Crude Oil Rises Over 3%,20220516T183449,https://www.benzinga.com/news/earnings/22/05/27232138/mid-afternoon-market-update-dow-jumps-300-points-crude-oil-rises-over-3,IREN,0.17402,Neutral,-0.01078
Stocks That Hit 52-Week Lows On Monday,20220516T175917,https://www.benzinga.com/markets/options/22/05/27226401/52-weeks-high-and-low-article,IREN,0.026147,Neutral,-0.003521
Mid-Day Market Update: Dow Edges Higher; Data Storage Shares Surge,20220516T165122,https://www.benzinga.com/news/earnings/22/05/27228816/mid-day-market-update-dow-edges-higher-data-storage-shares-surge,IREN,0.174713,Neutral,-0.007528
41 Stocks Moving In Monday's Mid-Day Session,20220516T161047,https://www.benzinga.com/news/22/05/27227706/41-stocks-moving-in-mondays-mid-day-session,IREN,0.094427,Neutral,-0.007497
Mid-Morning Market Update: Markets Open Lower; Dow Drops 70 Points,20220516T142615,https://www.benzinga.com/news/earnings/22/05/27223381/mid-morning-market-update-markets-open-lower-dow-drops-70-points,IREN,0.169318,Neutral,0.000822
"Nayax Posts Weak Q1 Results, Joins GameStop, Iris Energy And Other Big Stocks Moving Lower In Thursday's Pre-Market Session - Nayax  ( NASDAQ:NYAX ) ",20240516T094017,https://www.benzinga.com/news/24/05/38866634/nayax-posts-weak-q1-results-joins-gamestop-iris-energy-and-other-big-stocks-moving-lower-in-thursday,IREN,0.230235,Neutral,-0.032312
"Bragar Eagel & Squire, P.C. Reminds Investors That Class Action Lawsuits Have Been Filed Against AMMO, Paragon 28, Iris Energy, and Terran and Encourages Investors to Contact the Firm - Iris Energy  ( NASDAQ:IREN ) , Paragon 28  ( NYSE:FNA ) ",20241023T010000,https://www.benzinga.com/pressreleases/24/10/g41477949/bragar-eagel-squire-p-c-reminds-investors-that-class-action-lawsuits-have-been-filed-against-ammo-,IREN,0.164468,Neutral,0.00271
"Bragar Eagel & Squire, P.C. Reminds Investors That Class Action Lawsuits Have Been Filed Against AMMO, Iris Energy, and Terran and Encourages Investors to Contact the Firm - Iris Energy  ( NASDAQ:IREN ) , Terran Orbital  ( NYSE:LLAP ) ",20241017T010000,https://www.benzinga.com/pressreleases/24/10/g41371834/bragar-eagel-squire-p-c-reminds-investors-that-class-action-lawsuits-have-been-filed-against-ammo-,IREN,0.185662,Neutral,0.001477
"Bragar Eagel & Squire, P.C. Reminds Investors That Class Action Lawsuits Have Been Filed Against AMMO, Iris Energy, and Terran and Encourages Investors to Contact the Firm - Iris Energy  ( NASDAQ:IREN ) , Terran Orbital  ( NYSE:LLAP ) ",20241010T010000,https://www.benzinga.com/pressreleases/24/10/g41263531/bragar-eagel-squire-p-c-reminds-investors-that-class-action-lawsuits-have-been-filed-against-ammo-,IREN,0.185662,Neutral,0.001477
"Stocks That Hit 52-Week Lows On Tuesday - SoundHound AI  ( NASDAQ:SOUN ) , Sonnet BioTherapeutics  ( NASDAQ:SONN ) ",20221122T154845,https://www.benzinga.com/news/22/11/29825126/stocks-that-hit-52-week-lows-on-tuesday,IREN,0.028072,Neutral,-0.09609
"Yelp Reports Q4 Results, Joins Roku, Dropbox And Other Big Stocks Moving Lower In Friday's Pre-Market Session - Roku  ( NASDAQ:ROKU ) , Yelp  ( NYSE:YELP ) , Dropbox  ( NASDAQ:DBX ) ",20240216T095412,https://www.benzinga.com/news/24/02/37175355/yelp-reports-q4-results-joins-roku-dropbox-and-other-big-stocks-moving-lower-in-fridays-pre-market-s,IREN,0.210274,Bearish,-0.476878
"Delta Air Lines Reports Q4 Results, Joins United Airlines, American Airlines And Other Big Stocks Moving Lower On Friday - Alaska Air Gr  ( NYSE:ALK ) , American Airlines Group  ( NASDAQ:AAL ) ",20240112T153901,https://www.benzinga.com/news/24/01/36612655/delta-air-lines-reports-q4-results-joins-united-airlines-american-airlines-and-other-big-stocks-movi,IREN,0.230235,Bearish,-0.734374
"Earnings Scheduled For May 11, 2022",20220511T102312,https://www.benzinga.com/news/earnings/22/05/27129387/earnings-scheduled-for-may-11-2022,IREN,0.025426,Neutral,0.005771
"DEADLINE ALERT for AILE, IREN, EW, AIXI: Law Offices of Howard G. Smith Reminds Investors of Class Actions on Behalf of Shareholders - XIAO-I  ( NASDAQ:AIXI ) , iLearningEngines  ( NASDAQ:AILE ) ",20241126T174832,https://www.benzinga.com/pressreleases/24/11/g42196636/deadline-alert-for-aile-iren-ew-aixi-law-offices-of-howard-g-smith-reminds-investors-of-class-acti,IREN,0.096671,Neutral,0.00654
"DEADLINE ALERT for AILE, IREN, EW, AIXI: Law Offices of Howard G. Smith Reminds Investors of Class Actions on Behalf of Shareholders - XIAO-I  ( NASDAQ:AIXI ) , iLearningEngines  ( NASDAQ:AILE ) ",20241119T184031,https://www.benzinga.com/pressreleases/24/11/g42071425/deadline-alert-for-aile-iren-ew-aixi-law-offices-of-howard-g-smith-reminds-investors-of-class-acti,IREN,0.096671,Neutral,0.00654
"DEADLINE ALERT for AILE, IREN, EW, AIXI: Law Offices of Howard G. Smith Reminds Investors of Class Actions on Behalf of Shareholders - XIAO-I  ( NASDAQ:AIXI ) , iLearningEngines  ( NASDAQ:AILE ) ",20241114T194155,https://www.benzinga.com/pressreleases/24/11/g41986166/deadline-alert-for-aile-iren-ew-aixi-law-offices-of-howard-g-smith-reminds-investors-of-class-acti,IREN,0.096671,Neutral,0.00654
"DEADLINE ALERT for AILE, IREN, EW, AIXI: Law Offices of Howard G. Smith Reminds Investors of Class Actions on Behalf of Shareholders - XIAO-I  ( NASDAQ:AIXI ) , iLearningEngines  ( NASDAQ:AILE ) ",20241104T181018,https://www.benzinga.com/pressreleases/24/11/g41722809/deadline-alert-for-aile-iren-ew-aixi-law-offices-of-howard-g-smith-reminds-investors-of-class-acti,IREN,0.096671,Neutral,0.00654
"Why Kellanova Shares Are Trading Higher By Around 15%; Here Are 20 Stocks Moving Premarket - XIAO-I  ( NASDAQ:AIXI ) , Applied Digital  ( NASDAQ:APLD ) ",20240805T125432,https://www.benzinga.com/news/24/08/40159545/why-kellanova-shares-are-trading-higher-by-around-15-here-are-20-stocks-moving-premarket,IREN,0.163909,Bearish,-0.365392
"Global Mofy Metaverse Reports Follow-on Offering, Joins Lyft, Coinbase Global And Other Big Stocks Moving Lower On Friday - Applied Optoelectronics  ( NASDAQ:AAOI ) , Avalo Therapeutics  ( NASDAQ:AVTX ) ",20231229T154503,https://www.benzinga.com/news/23/12/36429147/global-mofy-metaverse-reports-follow-on-offering-joins-lyft-coinbase-global-and-other-big-stocks-mov,IREN,0.247838,Bearish,-0.757675
30 Stocks Moving in Monday's Pre-Market Session,20220516T105756,https://www.benzinga.com/news/22/05/27214770/30-stocks-moving-in-mondays-pre-market-session,IREN,0.11818,Neutral,-0.129751
