title,time_published,url,ticker,relevance_score,ticker_sentiment_label,ticker_sentiment_score
"Geographic Atrophy Market to Boost Significantly, Assesses DelveInsight | Key Companies Active in the Domain - Novartis, Annexon, Apellis, Ionis, Astellas, Gyroscope, Genentech, Aviceda, Iveric Bio",20230628T210100,https://www.prnewswire.com/news-releases/geographic-atrophy-market-to-boost-significantly-assesses-delveinsight--key-companies-active-in-the-domain---novartis-annexon-apellis-ionis-astellas-gyroscope-genentech-aviceda-iveric-bio-301865699.html,ISEE,0.051663,Neutral,0.002
Annexon  ( ANNX )  Stock Down More Than 50% Last Week: Here's Why,20230530T144000,https://www.zacks.com/stock/news/2101444/annexon-annx-stock-down-more-than-50-last-week-heres-why,ISEE,0.229872,Somewhat-Bullish,0.314994
Why Shares of Annexon Are Plummeting Thursday,20230525T155231,https://www.fool.com/investing/2023/05/25/why-shares-of-annexon-are-plummeting-thursday/,ISEE,0.126784,Neutral,0.116041
"AutoNation, HubSpot, AMC Networks And Other Big Stocks Moving Higher On Friday - AutoNation  ( NYSE:AN ) , AMC Networks  ( NASDAQ:AMCX ) ",20230217T150719,https://www.benzinga.com/news/23/02/30960969/autonation-hubspot-amc-networks-and-other-big-stocks-moving-higher-on-friday,ISEE,0.230235,Somewhat-Bullish,0.189498
"Gap, Palo Alto Networks And Some Other Big Stocks Moving Higher In Today's Pre-Market Session - Applied Materials  ( NASDAQ:AMAT ) , Foot Locker  ( NYSE:FL ) ",20221118T111100,https://www.benzinga.com/news/22/11/29781391/gap-palo-alto-networks-and-some-other-big-stocks-moving-higher-in-todays-pre-market-session,ISEE,0.364275,Somewhat-Bullish,0.195301
