title,time_published,url,ticker,relevance_score,ticker_sentiment_label,ticker_sentiment_score
Stocks That Hit 52-Week Lows On Wednesday,20220511T162815,https://www.benzinga.com/markets/options/22/05/27141482/52-weeks-high-and-low-article,KGC,0.006905,Neutral,0.012165
New Strong Buy Stocks for November 11th,20241111T115800,https://www.zacks.com/commentary/2367142/new-strong-buy-stocks-for-november-11th,KGC,0.546745,Somewhat-Bullish,0.207604
Best Value Stocks to Buy for November 11th,20241111T081500,https://www.zacks.com/commentary/2367818/best-value-stocks-to-buy-for-november-11th,KGC,0.767202,Somewhat-Bullish,0.247926
Best Income Stocks to Buy for November 11th,20241111T080000,https://www.zacks.com/commentary/2367816/best-income-stocks-to-buy-for-november-11th,KGC,0.739411,Somewhat-Bullish,0.215095
"Earnings Scheduled For May 10, 2022",20220510T091808,https://www.benzinga.com/news/earnings/22/05/27099859/earnings-scheduled-for-may-10-2022,KGC,0.015162,Neutral,0.000344
"Illumina, Seagen And Other Big Stocks Moving Higher On Monday - Agenus  ( NASDAQ:AGEN ) , First Majestic Silver  ( NYSE:AG ) ",20230313T145550,https://www.benzinga.com/news/23/03/31322709/illumina-seagen-and-other-big-stocks-moving-higher-on-monday,KGC,0.162802,Somewhat-Bullish,0.21126
5 PEG-Based GARP Stocks to Buy Ahead of Elections,20240717T124300,https://www.zacks.com/stock/news/2303207/5-peg-based-garp-stocks-to-buy-ahead-of-elections,KGC,0.173333,Somewhat-Bullish,0.255782
Best Penny Stocks to Watch as the Market Crashes Again,20220616T193724,https://pennystocks.com/featured/2022/06/16/best-penny-stocks-watch-market-crashes-again/,KGC,0.197534,Neutral,-0.136619
