title,time_published,url,ticker,relevance_score,ticker_sentiment_label,ticker_sentiment_score
Legible Announces Cancellation of $0.14 Private Placement Unit Offering,20241126T232500,https://www.globenewswire.com/news-release/2024/11/26/2987896/0/en/Legible-Announces-Cancellation-of-0-14-Private-Placement-Unit-Offering.html,LEBGF,0.05654,Neutral,0.082
"Legible's Thanksgiving ""Living Cookbook"" with AI Sous Chef by Celebrity Cristina Ferrare to be Featured on Drew Barrymore Show - Legible  ( OTC:LEBGF ) ",20241125T175154,https://www.benzinga.com/pressreleases/24/11/g42170898/legibles-thanksgiving-living-cookbook-with-ai-sous-chef-by-celebrity-cristina-ferrare-to-be-featur,LEBGF,0.439186,Somewhat-Bullish,0.337866
Legible Releases FrankensteinAI with Spellbinding AI Chat Feature Just in Time for Halloween - Legible  ( OTC:LEBGF ) ,20241028T110450,https://www.benzinga.com/pressreleases/24/10/g41570055/legible-releases-frankensteinai-with-spellbinding-ai-chat-feature-just-in-time-for-halloween,LEBGF,0.49894,Bullish,0.403024
Legible Releases FrankensteinAI with Spellbinding AI Chat Feature Just in Time for Halloween,20241028T110400,https://www.globenewswire.com/news-release/2024/10/28/2969953/0/en/Legible-Releases-FrankensteinAI-with-Spellbinding-AI-Chat-Feature-Just-in-Time-for-Halloween.html,LEBGF,0.418262,Bullish,0.376124
Legible Increases Size of $0.14 Unit Offering to $3.08 Million Along With Clarifications -  ( LEBGF ) ,20241024T172334,https://www.benzinga.com/pressreleases/24/10/g41525865/legible-increases-size-of-0-14-unit-offering-to-3-08-million-along-with-clarifications,LEBGF,0.538572,Somewhat-Bullish,0.27801
Legible Increases Size of $0.14 Unit Offering to $3.08 Million Along With Clarifications,20241024T172300,https://www.globenewswire.com/news-release/2024/10/24/2969001/0/en/Legible-Increases-Size-of-0-14-Unit-Offering-to-3-08-Million-Along-With-Clarifications.html,LEBGF,0.041901,Neutral,0.061587
Legible Announces $2.1 Million Private Placement Unit Offering and Appointment of Chief Technology Officer - Legible  ( OTC:LEBGF ) ,20241024T103000,https://www.benzinga.com/pressreleases/24/10/g41511854/legible-announces-2-1-million-private-placement-unit-offering-and-appointment-of-chief-technology-,LEBGF,0.623538,Bullish,0.435484
"LiveOne  ( NASDAQ:LVO )  and Slacker Radio Partner with Legible to Launch ""Book of the Month"" Program",20240816T130000,https://www.globenewswire.com/news-release/2024/08/16/2931539/0/en/LiveOne-NASDAQ-LVO-and-Slacker-Radio-Partner-with-Legible-to-Launch-Book-of-the-Month-Program.html,LEBGF,0.31482,Bullish,0.534654
LiveOne and Legible Enter into Exclusive Multi Year Strategic Partnership to Deliver First Ever In-Car Book Streaming Service,20230615T135900,https://www.globenewswire.com/news-release/2023/06/15/2689035/0/en/LiveOne-and-Legible-Enter-into-Exclusive-Multi-Year-Strategic-Partnership-to-Deliver-First-Ever-In-Car-Book-Streaming-Service.html,LEBGF,0.331024,Somewhat-Bullish,0.289756
