title,time_published,url,ticker,relevance_score,ticker_sentiment_label,ticker_sentiment_score
"Disney earnings, Fed's Powell speech, SBF bail backers? top week ahead",20230205T220127,https://www.foxbusiness.com/markets/disney-earnings-feds-powell-speech-sbf-bail-backers-top-week-ahead,LGF-A,0.052112,Neutral,0.0
Should Investors Buy Shopify Stock at its 14.02X Price/Sales?,20241206T163100,https://www.zacks.com/stock/news/2380447/should-investors-buy-shopify-stock-at-its-1402x-pricesales,LGF-A,0.055236,Neutral,0.094992
Shopify  ( SHOP )  Shares Surge After Q3 Earnings: Time to Buy?,20241112T232700,https://www.zacks.com/commentary/2369306/shopify-shop-shares-surge-after-q3-earnings-time-to-buy,LGF-A,0.086556,Somewhat-Bullish,0.150508
"Lionsgate  ( LGF.A )  Q2 Earnings Top Estimates, Revenues Rise Y/Y",20231110T172000,https://www.zacks.com/stock/news/2182507/lionsgate-lgfa-q2-earnings-top-estimates-revenues-rise-yy,LGF-A,0.137278,Neutral,0.0
The Benchmark Company Announces Upcoming September Conference Schedule,20230823T142553,https://www.benzinga.com/pressreleases/23/08/g34005661/the-benchmark-company-announces-upcoming-september-conference-schedule,LGF-A,0.055109,Neutral,0.0
