title,time_published,url,ticker,relevance_score,ticker_sentiment_label,ticker_sentiment_score
Stocks That Hit 52-Week Lows On Tuesday,20220315T163235,https://www.benzinga.com/news/22/03/26148458/stocks-that-hit-52-week-lows-on-tuesday,LULU,0.00539,Neutral,0.001392
"Lululemon To Rally Around 14%? Here Are 10 Top Analyst Forecasts For Friday - Beam Therapeutics  ( NASDAQ:BEAM ) , Applied DNA Sciences  ( NASDAQ:APDN ) ",20231208T122024,https://www.benzinga.com/news/23/12/36151264/lululemon-to-rally-around-14-here-are-10-top-analyst-forecasts-for-friday,LULU,0.160633,Somewhat-Bullish,0.15054
Nasdaq Bear Market: 4 Unstoppable Growth Stocks You'll Regret Not Buying on the Dip,20220625T154600,https://www.fool.com/investing/2022/06/25/nasdaq-bear-market-4-unstoppable-growth-stocks-you/,LULU,0.074785,Bullish,0.387012
Stocks That Hit 52-Week Lows On Tuesday,20220524T161351,https://www.benzinga.com/markets/options/22/05/27375519/52-weeks-high-and-low-article,LULU,0.010175,Neutral,-0.002405
Why FedEx Shares Are Trading Higher By Around 12%; Here Are 20 Stocks Moving Premarket - FedEx  ( NYSE:FDX ) ,20240322T121057,https://www.benzinga.com/news/24/03/37889416/why-fedex-shares-are-trading-higher-by-around-12-here-are-20-stocks-moving-premarket,LULU,0.151539,Somewhat-Bearish,-0.181582
"Why Shift Technologies Shares Are Trading Lower By 15%; Here Are 20 Stocks Moving Premarket - Ault Alliance  ( AMEX:AULT ) , Arcturus Therapeutics  ( NASDAQ:ARCT ) ",20230329T120556,https://www.benzinga.com/news/23/03/31545940/why-shift-technologies-shares-are-trading-lower-by-15-here-are-20-stocks-moving-premarket,LULU,0.154455,Bullish,0.441069
51 Biggest Movers From Yesterday,20220331T094126,https://www.benzinga.com/news/22/03/26390922/51-biggest-movers-from-yesterday,LULU,0.071731,Neutral,0.006148
"Why Streamline Health Solutions Shares Are Trading Lower By Over 68%? Here Are Other Stocks Moving In Monday's Mid-Day Session - Aldeyra Therapeutics  ( NASDAQ:ALDX ) , Alignment Healthcare  ( NASDAQ:ALHC ) ",20231016T170953,https://www.benzinga.com/news/23/10/35272489/why-streamline-health-solutions-shares-are-trading-lower-by-over-68-here-are-other-stocks-moving-in,LULU,0.076236,Neutral,0.122434
Snap-on  ( SNA )  Looks Well Placed on RCI Initiative & Cost Plans,20240108T134700,https://www.zacks.com/stock/news/2206849/snap-on-sna-looks-well-placed-on-rci-initiative-cost-plans,LULU,0.155118,Somewhat-Bullish,0.19977
"Retail Trends Unwrapped: Analyst Unveils Surprising Shifts In Consumer Spending As 2023 Looms - Nordstrom  ( NYSE:JWN ) , Target  ( NYSE:TGT ) , Dollar Gen  ( NYSE:DG ) , Dollar Tree  ( NASDAQ:DLTR ) ",20231229T182106,https://www.benzinga.com/analyst-ratings/analyst-color/23/12/36430219/retail-trends-unwrapped-analyst-unveils-surprising-shifts-in-consumer-spending-as-2,LULU,0.178459,Neutral,-0.017724
Stocks That Hit 52-Week Lows On Wednesday,20220525T161423,https://www.benzinga.com/markets/options/22/05/27398602/52-weeks-high-and-low-article,LULU,0.023585,Neutral,-0.001527
"Nasdaq, S&P 500 Eye Strong Open Today: What's Driving Stock Futures Up? - Invesco QQQ Trust, Series 1  ( NASDAQ:QQQ ) , SPDR S&P 500  ( ARCA:SPY ) ",20240605T112425,https://www.benzinga.com/news/earnings/24/06/39180770/wall-street-looks-to-extend-gains-as-traders-eye-more-jobs-data-why-this-analyst-sees-4-s-p-500-ris,LULU,0.113866,Neutral,0.0
"Wall Street grows pessimistic about holiday season, but record profit still expected",20221205T182600,https://www.marketwatch.com/story/wall-street-grows-pessimistic-about-holiday-season-but-record-profit-still-expected-11670264782,LULU,0.057977,Neutral,0.019
"Musk pushes Twitter files, Georgia runoff election, FTX fallout ongoing top week ahead",20221204T232326,https://www.foxbusiness.com/markets/musk-twitter-georgia-runoff-election-ftx-sbf-top-week-ahead,LULU,0.066784,Neutral,0.0
Stitch Fix  ( SFIX )  to Report Q1 Earnings: What's in the Cards?,20221202T174500,https://www.zacks.com/stock/news/2025025/stitch-fix-sfix-to-report-q1-earnings-whats-in-the-cards,LULU,0.197011,Somewhat-Bullish,0.157393
Why Stitch Fix Stock Slumped on Thursday,20220922T174000,https://www.fool.com/investing/2022/09/22/why-stitch-fix-stock-slumped-on-thursday/,LULU,0.124164,Neutral,-0.050317
Stitch Fix Delivers a Weak Earnings Report: 6 Key Metrics Investors Should See,20220921T151500,https://www.fool.com/investing/2022/09/21/sfix-stock-sfix-earnings/,LULU,0.138464,Somewhat-Bullish,0.275455
"Zuckerberg fallout, EBT tech issue, Powell speech reaction and more: Monday's 5 things to know",20220829T052643,https://www.foxbusiness.com/markets/zuckerberg-fallout-ebt-tech-issue-powell-speech-reaction-mondays-5-things-know,LULU,0.032558,Neutral,0.0
"Jobs report, GameStop earnings, home prices top week ahead",20220530T060359,https://www.foxbusiness.com/markets/jobs-report-gamestop-earnings-home-prices-week-ahead,LULU,0.143287,Neutral,0.020185
Why Smartsheet Shares Are Trading Higher By 13%; Here Are 20 Stocks Moving Premarket - Smartsheet  ( NYSE:SMAR ) ,20240606T121655,https://www.benzinga.com/news/24/06/39204134/why-smartsheet-shares-are-trading-higher-by-13-here-are-20-stocks-moving-premarket,LULU,0.137278,Somewhat-Bullish,0.248317
"Why Gritstone bio Shares Are Trading Higher By Around 37%; Here Are 20 Stocks Moving Premarket - Actelis Networks  ( NASDAQ:ASNS ) , Asset Entities  ( NASDAQ:ASST ) ",20230928T125453,https://www.benzinga.com/news/23/09/34974158/why-gritstone-bio-shares-are-trading-higher-by-around-37-here-are-20-stocks-moving-premarket,LULU,0.135347,Somewhat-Bullish,0.212771
"Ulta Beauty Posts Upbeat Results, Joins Asana, Lululemon, Hewlett Packard Enterprise And Other Big Stocks Moving Higher On Friday - AppLovin  ( NASDAQ:APP ) , Asana  ( NYSE:ASAN ) ",20241206T171541,https://www.benzinga.com/24/12/42368892/ulta-beauty-posts-upbeat-results-joins-asana-lululemon-hewlett-packard-enterprise-and-other-big-stocks-moving-hig,LULU,0.146469,Somewhat-Bullish,0.313181
"Beat the Market the Zacks Way: Shopify, Lululemon, Telos in Focus",20231211T125600,https://www.zacks.com/stock/news/2195999/beat-the-market-the-zacks-way-shopify-lululemon-telos-in-focus,LULU,0.069697,Neutral,0.087342
"Lululemon, Li Auto, Hackett Group And Some Other Big Stocks Moving Lower On Friday - Beyond Meat  ( NASDAQ:BYND ) , Torrid Holdings  ( NYSE:CURV ) ",20221209T155510,https://www.benzinga.com/news/22/12/30023835/lululemon-li-auto-hackett-group-and-some-other-big-stocks-moving-lower-on-friday,LULU,0.238133,Somewhat-Bearish,-0.176395
Crude Oil Jumps 2%; Lululemon Posts Upbeat Earnings - Lululemon Athletica  ( NASDAQ:LULU ) ,20240606T162251,https://www.benzinga.com/news/24/06/39211280/crude-oil-jumps-2-lululemon-posts-upbeat-earnings,LULU,0.112008,Somewhat-Bullish,0.223716
"J.M. SmuckerPosts Upbeat Earnings, Joins Toro Company, United Natural Foods, Semtech And Other Big Stocks Moving Higher On Thursday - JM Smucker  ( NYSE:SJM ) ",20240606T144448,https://www.benzinga.com/news/24/06/39208649/j-m-smuckerposts-upbeat-earnings-joins-toro-company-united-natural-foods-semtech-and-other-big-stock,LULU,0.178459,Bullish,0.403771
My Top 10 Stocks to Buy in 2023 Beat the Market by 160%. Should You Buy Them for 2024?,20231216T134500,https://www.fool.com/investing/2023/12/16/my-top-10-stocks-to-buy-in-2023-beat-the-market-by/,LULU,0.115509,Neutral,0.054453
" ( AGRI ) , Amplify YieldShares Oil Hedged MLP Income ETF  ( AMLX )  - Why PolyPid Dipped Over 73%; Here Are 60 Biggest Movers From Friday",20220906T065525,https://www.benzinga.com/news/22/09/28751095/why-polypid-dipped-over-73-here-are-60-biggest-movers-from-friday,LULU,0.060771,Somewhat-Bullish,0.236153
