title,time_published,url,ticker,relevance_score,ticker_sentiment_label,ticker_sentiment_score
"Earnings Scheduled For April 28, 2022",20220428T085040,https://www.benzinga.com/news/earnings/22/04/26860440/earnings-scheduled-for-april-28-2022,MA,0.007239,Neutral,-0.000642
Alipay partners with Trip.com to launch selected China tour packages and travel guide for international tourists,20231213T142700,https://www.newswire.ca/news-releases/alipay-partners-with-trip-com-to-launch-selected-china-tour-packages-and-travel-guide-for-international-tourists-814885601.html,MA,0.046543,Neutral,0.075165
E-commerce stocks plummet as consumers pull back online spending,20220505T162719,https://www.cnbc.com/2022/05/05/e-commerce-stocks-plummet-as-consumers-pull-back-online-spending.html,MA,0.101453,Neutral,-0.0593
IBA to take up overseas banks' local data storage issue with RBI,20240821T150044,https://www.business-standard.com/finance/news/iba-to-take-up-overseas-banks-local-data-storage-issue-with-rbi-124082101161_1.html,MA,0.106541,Neutral,-0.026654
"Look Out For These 6 Stocks As Analysts Predicts Major Gains, One Up To 82% - Shift4 Payments  ( NYSE:FOUR ) , Hyundai Motor  ( OTC:HYMTF ) ",20240405T061554,https://www.benzinga.com/markets/equities/24/04/38104998/look-out-for-these-6-stocks-as-analysts-predicts-major-gains-one-up-to-82,MA,0.077593,Neutral,0.088192
Strategic Innovation: 5 Point Plan To Renew Successful Organizations,20240502T142055,https://www.forbes.com/sites/andrewbinns/2024/05/02/strategic-innovation-5-point-plan-to-renew-successful-organizations/,MA,0.053569,Neutral,0.146944
JetBlue Airways  ( JBLU )  Q3 2023 Earnings Call Transcript,20231031T210022,https://www.fool.com/earnings/call-transcripts/2023/10/31/jetblue-airways-jblu-q3-2023-earnings-call-transcr/,MA,0.004224,Neutral,0.045459
Visa  ( V )  Q1 2023 Earnings Call Transcript,20230127T023022,https://www.fool.com/earnings/call-transcripts/2023/01/26/visa-v-q1-2023-earnings-call-transcript/,MA,0.008476,Neutral,0.070583
Walmart takes a cautious approach to holiday hiring,20220921T132255,https://apnews.com/article/holidays-124ff5082390a8abf05e698d15e3e9ab,MA,0.076115,Neutral,0.06235
Walmart takes a cautious approach to holiday hiring,20220921T132255,https://apnews.com/article/holidays-124ff5082390a8abf05e698d15e3e9ab,MA,0.074692,Neutral,0.061371
The Quantum Computing Revolution is Here: 3 Top Stocks to Watch,20241018T172300,https://www.zacks.com/commentary/2352670/the-quantum-computing-revolution-is-here-3-top-stocks-to-watch,MA,0.089129,Neutral,0.067141
"D-Wave Quantum Inc.  ( NYSE: QBTS )  Featured in Syndicated Broadcast Highlighting Extended Product Roadmap, Enhancements to Quantum Cloud Service",20240812T123500,https://www.globenewswire.com/news-release/2024/08/12/2928419/0/en/D-Wave-Quantum-Inc-NYSE-QBTS-Featured-in-Syndicated-Broadcast-Highlighting-Extended-Product-Roadmap-Enhancements-to-Quantum-Cloud-Service.html,MA,0.044141,Neutral,0.039532
"IBN Announces Latest Episode of The Stock2Me Podcast featuring Murray Thom, Vice President of Quantum Technology Evangelism at D-Wave Quantum Inc. - D-Wave Quantum  ( NYSE:QBTS ) ",20240620T110000,https://www.benzinga.com/pressreleases/24/06/g39407590/ibn-announces-latest-episode-of-the-stock2me-podcast-featuring-murray-thom-vice-president-of-quant,MA,0.033144,Neutral,0.029991
"IBN Announces Latest Episode of The Stock2Me Podcast featuring Dr. Alan Baratz, CEO of D-Wave Quantum Inc. - D-Wave Quantum  ( NYSE:QBTS ) ",20240125T120000,https://www.benzinga.com/pressreleases/24/01/g36776634/ibn-announces-latest-episode-of-the-stock2me-podcast-featuring-dr-alan-baratz-ceo-of-d-wave-quantu,MA,0.038468,Neutral,0.038964
"IBN Announces Latest Episode of The Bell2Bell Podcast Featuring Return of Dr. Alan Baratz, CEO of D-Wave Quantum Inc. - D-Wave Quantum  ( NYSE:QBTS ) ",20230222T131700,https://www.benzinga.com/pressreleases/23/02/g31005511/ibn-announces-latest-episode-of-the-bell2bell-podcast-featuring-return-of-dr-alan-baratz-ceo-of-d-,MA,0.025379,Neutral,0.126999
"D-Wave Quantum  ( NYSE:QBTS )  - IBN  ( InvestorBrandNetwork )  Announces Latest Episode of The Bell2Bell Podcast Featuring Dr. Alan Baratz, CEO of D-Wave Quantum Inc.",20220913T121700,https://www.benzinga.com/pressreleases/22/09/g28845859/ibn-investorbrandnetwork-announces-latest-episode-of-the-bell2bell-podcast-featuring-dr-alan-barat,MA,0.03798,Neutral,0.134581
"Costco Goes Netflix Way To Stop Sharing Of Subscriptions, Satya Nadella Wants To Ditch Console Exclusives, Investors Cheer Rite Aid Q1 Performance: Today's Top Stories",20230629T133618,https://markets.businessinsider.com/news/stocks/costco-goes-netflix-way-to-stop-sharing-of-subscriptions-satya-nadella-wants-to-ditch-console-exclusives-investors-cheer-rite-aid-q1-performance-today-s-top-stories-1032418049,MA,0.033421,Neutral,0.125634
"Ticket Market to grow by USD 228.52 billion  ( 2024-2028 ) , driven by animated movies' success; Report on AI's role in redefining market trends - Technavio",20241203T220600,https://www.benzinga.com/pressreleases/24/12/n42303974/ticket-market-to-grow-by-usd-228-52-billion-2024-2028-driven-by-animated-movies-success-report-on-,MA,0.065446,Somewhat-Bullish,0.212097
"Where And How To Watch The NYC Fireworks On July 4, 2024",20240610T193227,https://www.forbes.com/sites/irenelevine/2024/06/10/where-and-how-to-watch-the-nyc-fireworks-on-july-4-2024/,MA,0.046907,Neutral,0.05809
Breaking Down the Proposed Capital One-Discover Financial Services Deal,20240302T123000,https://www.fool.com/investing/2024/03/02/breaking-down-the-capital-one-discover-financial-s/,MA,0.015343,Neutral,-0.009596
"Amid Fintech Slowdown, Goldman Sachs-Backed Startup Considers Sale, Sources Say",20240325T155706,https://www.forbes.com/sites/jeffkauflin/2024/03/25/amid-fintech-slowdown-goldman-sachs-backed-startup-considers-sale-sources-say/,MA,0.031738,Neutral,0.014498
"The War on Cash, Revisited",20231213T082900,https://www.fool.com/investing/2023/12/13/the-war-on-cash-revisited/,MA,0.098622,Neutral,0.041118
"Credit Card Issuance Services Market Analysis 2023-2027: Market Size, Major Drivers And Key Trends As Per The Business Research Company's Credit Card Issuance Services Global Market Report 2023",20231206T163000,https://www.benzinga.com/pressreleases/23/12/g36116491/credit-card-issuance-services-market-analysis-2023-2027-market-size-major-drivers-and-key-trends-a,MA,0.056943,Somewhat-Bullish,0.223
1 Reason to Buy and 1 Reason to Avoid This Fintech Up 83% From Its 52-Week Low,20230908T093100,https://www.fool.com/investing/2023/09/08/1-reason-to-buy-and-1-reason-to-avoid-this-fintech/,MA,0.046006,Neutral,-0.112969
Marqeta's Revenue Is About to Be Cut in Half. Here's Why It's a Screaming Buy.,20230827T104500,https://www.fool.com/investing/2023/08/27/why-marqeta-is-a-screaming-buy/,MA,0.069194,Neutral,0.005042
"Fintech as a Service  ( FaaS )  Market worth $676.9 billion by 2028, growing at a CAGR of 16.9%: Report by MarketsandMarkets™",20230811T143000,https://www.benzinga.com/pressreleases/23/08/g33751391/fintech-as-a-service-faas-market-worth-676-9-billion-by-2028-growing-at-a-cagr-of-16-9-report-by-m,MA,0.02065,Neutral,-0.009542
Marqeta  ( MQ )  Q2 2023 Earnings Call Transcript,20230809T043118,https://www.fool.com/earnings/call-transcripts/2023/08/09/marqeta-mq-q2-2023-earnings-call-transcript/,MA,0.005063,Neutral,0.081019
Europe Loyalty Programs Market Intelligence Report 2023-2027: Retailers are Trimming the Value of their Loyalty Points to Aid Margin Growth Amid the Economic Downturn,20230728T180000,https://www.prnewswire.com/news-releases/europe-loyalty-programs-market-intelligence-report-2023-2027-retailers-are-trimming-the-value-of-their-loyalty-points-to-aid-margin-growth-amid-the-economic-downturn-301888202.html,MA,0.051221,Somewhat-Bullish,0.184449
Fintech as a Service  ( FaaS )  Market worth $676.9 billion by 2028 - Exclusive Report by MarketsandMarkets™,20230608T153000,https://www.prnewswire.com/news-releases/fintech-as-a-service-faas-market-worth-676-9-billion-by-2028---exclusive-report-by-marketsandmarkets-301846012.html,MA,0.088309,Neutral,-0.007284
MasterCard  ( MA )  Surpasses Q1 Earnings and Revenue Estimates,20230427T131506,https://www.zacks.com/stock/news/2085839/mastercard-ma-surpasses-q1-earnings-and-revenue-estimates,MA,0.335367,Somewhat-Bullish,0.15271
Marqeta  ( MQ )  Q4 2022 Earnings Call Transcript,20230301T033039,https://www.fool.com/earnings/call-transcripts/2023/02/28/marqeta-mq-q4-2022-earnings-call-transcript/,MA,0.004786,Neutral,0.143954
What Marqeta's First-Ever Acquisition Means for Investors,20230206T142000,https://www.fool.com/investing/2023/02/06/what-marqetas-first-ever-acquisition-means-for-inv/,MA,0.04823,Neutral,0.009926
"KeyBanc Upgrades Visa And Downgrades PayPal, Names Top Fintech Stock Picks For 2023 - Visa  ( NYSE:V ) ",20230109T182331,https://www.benzinga.com/analyst-ratings/analyst-color/23/01/30337749/keybanc-upgrades-visa-and-downgrades-paypal-names-top-fintech-stock-picks-for-2023,MA,0.175859,Bullish,0.369221
"This Week In Credit Card News: Apple, Walmart Go Big Into Financial Services; Delinquencies, Charge-Offs Rise",20221208T193848,https://www.forbes.com/sites/billhardekopf/2022/12/08/this-week-in-credit-card-news-apple-walmart-go-big-into-financial-services-delinquencies-charge-offs-rise/,MA,0.051111,Neutral,0.092878
Mastercard  ( MA )  & Marqeta Join Forces on Quick Supplier Payments,20221208T144700,https://www.zacks.com/stock/news/2026808/mastercard-ma-marqeta-join-forces-on-quick-supplier-payments,MA,0.502693,Bullish,0.438647
One Growth Stock Down 83% You'll Wish You Own When the Bear Market Ends,20221130T121000,https://www.fool.com/investing/2022/11/30/one-growth-stock-down-83-youll-wish-you-own-when-t/,MA,0.100518,Neutral,0.097882
"Marqeta, Inc.  ( MQ )  Q3 2022 Earnings Call Transcript",20221110T030053,https://www.fool.com/earnings/call-transcripts/2022/11/09/marqeta-inc-mq-q3-2022-earnings-call-transcript/,MA,0.009407,Neutral,0.136639
Zilch to 3 Million: Fintech Passes 3 Million Users and Turns a Gross Profit,20221103T045613,https://apnews.com/article/technology-europe-business-f8867a58ee214d8a917a660448cd308e,MA,0.129284,Somewhat-Bullish,0.161556
The Big Banks Report Earnings and We Dig In,20221029T120000,https://www.fool.com/investing/2022/10/29/the-big-banks-report-earnings-and-we-dig-in/,MA,0.021967,Neutral,0.096428
This Week In Credit Card News: Amazon Testing Venmo Payments; Mastercard Sees Growth Slow Due To Inflation,20221027T214155,https://www.forbes.com/sites/billhardekopf/2022/10/27/this-week-in-credit-card-news-amazon-testing-venmo-payments-mastercard-sees-growth-slow-due-to-inflation/,MA,0.053509,Neutral,-0.104012
Mastercard  ( MA )  Q3 2022 Earnings Call Transcript,20221027T193016,https://www.fool.com/earnings/call-transcripts/2022/10/27/mastercard-ma-q3-2022-earnings-call-transcript/,MA,0.12593,Somewhat-Bullish,0.159605
Blockchain.com partners with Visa to offer crypto debit card,20221027T014626,https://cointelegraph.com/news/blockchain-com-partners-with-visa-to-offer-crypto-debit-card,MA,0.133841,Neutral,0.141935
Mastercard  ( MA )  Gears Up for Q3 Earnings: What Lies Ahead?,20221024T172000,https://www.zacks.com/stock/news/1996305/mastercard-ma-gears-up-for-q3-earnings-what-lies-ahead,MA,0.441315,Somewhat-Bullish,0.306613
"Mastercard  ( MA ) , Hamilton Reserve to Offer Cross-Border Solutions",20220926T155000,https://www.zacks.com/stock/news/1984967/mastercard-ma-hamilton-reserve-to-offer-cross-border-solutions,MA,0.481177,Bullish,0.410417
Mastercard  ( MA )  Partners With Netcetera for Faster Payments,20220920T153900,https://www.zacks.com/stock/news/1982699/mastercard-ma-partners-with-netcetera-for-faster-payments,MA,0.349329,Somewhat-Bullish,0.265423
"Exclusive: Fidel API appoints COO, opens San Francisco office",20220908T150038,https://www.axios.com/pro/fintech-deals/2022/09/08/exclusive-fidel-api-names-coo-opens-san-francisco-office,MA,0.099476,Somewhat-Bullish,0.279932
"Mastercard  ( MA ) , Ajman Bank Float Touch Card for Vision Impaired",20220905T143100,https://www.zacks.com/stock/news/1976530/mastercard-ma-ajman-bank-float-touch-card-for-vision-impaired,MA,0.47672,Bullish,0.398389
"Visa  ( V )  Sees Growth in August US Payments, Travel Rebound Aids",20220901T161100,https://www.zacks.com/stock/news/1975434/visa-v-sees-growth-in-august-us-payments-travel-rebound-aids,MA,0.17715,Somewhat-Bullish,0.224825
"Marqeta, Inc.  ( MQ )  Q2 2022 Earnings Call Transcript",20220811T023053,https://www.fool.com/earnings/call-transcripts/2022/08/10/marqeta-inc-mq-q2-2022-earnings-call-transcript/,MA,0.00933,Neutral,0.118599
This Growth Stock Could 10x in 10 Years,20220809T110000,https://www.fool.com/investing/2022/08/09/this-growth-stock-could-10x-in-10-years/,MA,0.040011,Neutral,0.03464
"Jobs report, 2Q earnings, insurer shuts offices in California and more: Tuesday's 5 things to know",20220802T074526,https://www.foxbusiness.com/markets/jobs-report-2q-earnings-insurer-shuts-offices-california-more-tuesdays-5-things-know,MA,0.043264,Somewhat-Bullish,0.211313
Uber will let drivers see how much they make from rides before accepting them,20220801T203053,https://www.foxbusiness.com/technology/uber-drivers-see-make-rides-accepting,MA,0.110973,Somewhat-Bullish,0.236309
"1 Green Flag for Marqeta in 2022, and 1 Red Flag",20220717T111500,https://www.fool.com/investing/2022/07/17/1-green-flag-for-marqeta-in-2022-and-1-red-flag/,MA,0.06623,Neutral,0.110209
2 Risks You Need to Know Before You Buy Marqeta,20220630T115000,https://www.fool.com/investing/2022/06/30/2-risks-you-need-to-know-before-you-buy-marqeta/,MA,0.046148,Neutral,-0.004187
"After a golden decade, fintech faces its first true test",20220623T104718,https://www.economist.com/finance-and-economics/2022/06/23/after-a-golden-decade-fintech-faces-its-first-true-test,MA,0.057907,Neutral,-0.07287
"Why beaten-down fintech stocks may be worth a new look, according to this analyst",20220616T161400,https://www.marketwatch.com/story/why-beaten-down-fintech-stocks-may-be-worth-a-new-look-according-to-this-analyst-11655396094,MA,0.078277,Neutral,-0.030047
Fintech 50 2022: The Newcomers,20220607T101500,https://www.forbes.com/sites/jeffkauflin/2022/06/07/fintech-50-2022-the-newcomers/,MA,0.010229,Neutral,0.009125
Here's a Fast-Growing Fintech You Can Buy for Under $15 Today,20220531T154539,https://www.fool.com/investing/2022/05/31/heres-a-fast-growing-fintech-you-can-buy-for-under/,MA,0.045699,Neutral,0.041945
4 No-Brainer Stocks Down 32% to 71% That You Can Buy Today,20220401T112500,https://www.fool.com/investing/2022/04/01/4-no-brainer-stocks-down-that-you-can-buy-today/,MA,0.036239,Somewhat-Bullish,0.179966
"Marqeta, Inc.  ( MQ )  Q4 2021 Earnings Call Transcript",20220310T043028,https://www.fool.com/earnings/call-transcripts/2022/03/09/marqeta-inc-mq-q4-2021-earnings-call-transcript/,MA,0.004088,Bullish,0.548732
