title,time_published,url,ticker,relevance_score,ticker_sentiment_label,ticker_sentiment_score
"Earnings Scheduled For April 28, 2022",20220428T085040,https://www.benzinga.com/news/earnings/22/04/26860440/earnings-scheduled-for-april-28-2022,MA,0.007239,Neutral,-0.000642
Alipay partners with Trip.com to launch selected China tour packages and travel guide for international tourists,20231213T142700,https://www.newswire.ca/news-releases/alipay-partners-with-trip-com-to-launch-selected-china-tour-packages-and-travel-guide-for-international-tourists-814885601.html,MA,0.046543,Neutral,0.075165
E-commerce stocks plummet as consumers pull back online spending,20220505T162719,https://www.cnbc.com/2022/05/05/e-commerce-stocks-plummet-as-consumers-pull-back-online-spending.html,MA,0.101453,Neutral,-0.0593
IBA to take up overseas banks' local data storage issue with RBI,20240821T150044,https://www.business-standard.com/finance/news/iba-to-take-up-overseas-banks-local-data-storage-issue-with-rbi-124082101161_1.html,MA,0.106541,Neutral,-0.026654
"Look Out For These 6 Stocks As Analysts Predicts Major Gains, One Up To 82% - Shift4 Payments  ( NYSE:FOUR ) , Hyundai Motor  ( OTC:HYMTF ) ",20240405T061554,https://www.benzinga.com/markets/equities/24/04/38104998/look-out-for-these-6-stocks-as-analysts-predicts-major-gains-one-up-to-82,MA,0.077593,Neutral,0.088192
Strategic Innovation: 5 Point Plan To Renew Successful Organizations,20240502T142055,https://www.forbes.com/sites/andrewbinns/2024/05/02/strategic-innovation-5-point-plan-to-renew-successful-organizations/,MA,0.053569,Neutral,0.146944
JetBlue Airways  ( JBLU )  Q3 2023 Earnings Call Transcript,20231031T210022,https://www.fool.com/earnings/call-transcripts/2023/10/31/jetblue-airways-jblu-q3-2023-earnings-call-transcr/,MA,0.004224,Neutral,0.045459
Visa  ( V )  Q1 2023 Earnings Call Transcript,20230127T023022,https://www.fool.com/earnings/call-transcripts/2023/01/26/visa-v-q1-2023-earnings-call-transcript/,MA,0.008476,Neutral,0.070583
Walmart takes a cautious approach to holiday hiring,20220921T132255,https://apnews.com/article/holidays-124ff5082390a8abf05e698d15e3e9ab,MA,0.076115,Neutral,0.06235
Walmart takes a cautious approach to holiday hiring,20220921T132255,https://apnews.com/article/holidays-124ff5082390a8abf05e698d15e3e9ab,MA,0.074692,Neutral,0.061371
The Quantum Computing Revolution is Here: 3 Top Stocks to Watch,20241018T172300,https://www.zacks.com/commentary/2352670/the-quantum-computing-revolution-is-here-3-top-stocks-to-watch,MA,0.089129,Neutral,0.067141
"D-Wave Quantum Inc.  ( NYSE: QBTS )  Featured in Syndicated Broadcast Highlighting Extended Product Roadmap, Enhancements to Quantum Cloud Service",20240812T123500,https://www.globenewswire.com/news-release/2024/08/12/2928419/0/en/D-Wave-Quantum-Inc-NYSE-QBTS-Featured-in-Syndicated-Broadcast-Highlighting-Extended-Product-Roadmap-Enhancements-to-Quantum-Cloud-Service.html,MA,0.044141,Neutral,0.039532
"IBN Announces Latest Episode of The Stock2Me Podcast featuring Murray Thom, Vice President of Quantum Technology Evangelism at D-Wave Quantum Inc. - D-Wave Quantum  ( NYSE:QBTS ) ",20240620T110000,https://www.benzinga.com/pressreleases/24/06/g39407590/ibn-announces-latest-episode-of-the-stock2me-podcast-featuring-murray-thom-vice-president-of-quant,MA,0.033144,Neutral,0.029991
"IBN Announces Latest Episode of The Stock2Me Podcast featuring Dr. Alan Baratz, CEO of D-Wave Quantum Inc. - D-Wave Quantum  ( NYSE:QBTS ) ",20240125T120000,https://www.benzinga.com/pressreleases/24/01/g36776634/ibn-announces-latest-episode-of-the-stock2me-podcast-featuring-dr-alan-baratz-ceo-of-d-wave-quantu,MA,0.038468,Neutral,0.038964
"IBN Announces Latest Episode of The Bell2Bell Podcast Featuring Return of Dr. Alan Baratz, CEO of D-Wave Quantum Inc. - D-Wave Quantum  ( NYSE:QBTS ) ",20230222T131700,https://www.benzinga.com/pressreleases/23/02/g31005511/ibn-announces-latest-episode-of-the-bell2bell-podcast-featuring-return-of-dr-alan-baratz-ceo-of-d-,MA,0.025379,Neutral,0.126999
"D-Wave Quantum  ( NYSE:QBTS )  - IBN  ( InvestorBrandNetwork )  Announces Latest Episode of The Bell2Bell Podcast Featuring Dr. Alan Baratz, CEO of D-Wave Quantum Inc.",20220913T121700,https://www.benzinga.com/pressreleases/22/09/g28845859/ibn-investorbrandnetwork-announces-latest-episode-of-the-bell2bell-podcast-featuring-dr-alan-barat,MA,0.03798,Neutral,0.134581
"Costco Goes Netflix Way To Stop Sharing Of Subscriptions, Satya Nadella Wants To Ditch Console Exclusives, Investors Cheer Rite Aid Q1 Performance: Today's Top Stories",20230629T133618,https://markets.businessinsider.com/news/stocks/costco-goes-netflix-way-to-stop-sharing-of-subscriptions-satya-nadella-wants-to-ditch-console-exclusives-investors-cheer-rite-aid-q1-performance-today-s-top-stories-1032418049,MA,0.033421,Neutral,0.125634
"Ticket Market to grow by USD 228.52 billion  ( 2024-2028 ) , driven by animated movies' success; Report on AI's role in redefining market trends - Technavio",20241203T220600,https://www.benzinga.com/pressreleases/24/12/n42303974/ticket-market-to-grow-by-usd-228-52-billion-2024-2028-driven-by-animated-movies-success-report-on-,MA,0.065446,Somewhat-Bullish,0.212097
"Where And How To Watch The NYC Fireworks On July 4, 2024",20240610T193227,https://www.forbes.com/sites/irenelevine/2024/06/10/where-and-how-to-watch-the-nyc-fireworks-on-july-4-2024/,MA,0.046907,Neutral,0.05809
Breaking Down the Proposed Capital One-Discover Financial Services Deal,20240302T123000,https://www.fool.com/investing/2024/03/02/breaking-down-the-capital-one-discover-financial-s/,MA,0.015343,Neutral,-0.009596
