title,time_published,url,ticker,relevance_score,ticker_sentiment_label,ticker_sentiment_score
"Rapid Advancements of Innovative Antiviral - COVID-19 Drugs Generating Major Growth in Global Antiviral Drugs Market - Nanoviricides  ( AMEX:NNVC ) , Chimerix  ( NASDAQ:CMRX ) ",20240806T124500,https://www.benzinga.com/pressreleases/24/08/g40188357/rapid-advancements-of-innovative-antiviral-covid-19-drugs-generating-major-growth-in-global-antivi,META,0.019829,Neutral,-0.067186
Demand for Comprehensive Cleaning Services Grow Post-Pandemic,20220826T130000,https://www.prnewswire.com/news-releases/demand-for-comprehensive-cleaning-services-grow-post-pandemic-301612967.html,META,0.019731,Neutral,0.0
Location-Based Service  ( LBS )  and Real-Time Location Systems  ( RTLS )  Market worth $60.4 billion by 2028 - Exclusive Report by MarketsandMarkets™,20240202T151500,https://www.prnewswire.com/news-releases/location-based-service-lbs-and-real-time-location-systems-rtls-market-worth-60-4-billion-by-2028---exclusive-report-by-marketsandmarkets-302051809.html,META,0.060161,Somewhat-Bullish,0.175065
"The Traditional Lending Segment to Witness a Remarkable Growth in The Peer-To-Peer Lending Market, Boasting A Substantial Market Share and Projected to Advance at CAGR of 29.3%",20231107T131500,https://www.benzinga.com/pressreleases/23/11/g35642617/the-traditional-lending-segment-to-witness-a-remarkable-growth-in-the-peer-to-peer-lending-market-,META,0.046543,Neutral,0.053102
UPS Contract Talks Go Down to the Wire as a Possible Strike Looms,20230722T070025,https://www.nytimes.com/2023/07/22/business/economy/ups-teamsters-strike.html,META,0.029008,Neutral,0.0
"Hello Group Soars as Investors Snap Up Stock on China Covid Easing - Alibaba Group Holding  ( NYSE:BABA ) , Bumble  ( NASDAQ:BMBL ) ",20221209T143841,https://www.benzinga.com/markets/penny-stocks/22/12/30022500/hello-group-soars-as-investors-snap-up-stock-on-china-covid-easing,META,0.036091,Neutral,0.065706
"This market is a 'bear trap' so here's what to buy, strategist says",20240129T113300,https://www.marketwatch.com/story/this-market-is-a-bear-trap-and-so-heres-what-to-buy-strategist-says-7914fe5c,META,0.065685,Neutral,0.0
"Pinduoduo Crushes Analyst Expectations, Week In Review",20230526T151356,https://www.forbes.com/sites/brendanahern/2023/05/26/pinduoduo-crushes-analyst-expectations-week-in-review/,META,0.071145,Neutral,-0.135648
The US Treasury Is Running Out Of Cash - Deere  ( NYSE:DE ) ,20230522T134440,https://www.benzinga.com/news/23/05/32508509/the-us-treasury-is-running-out-of-cash,META,0.033375,Somewhat-Bearish,-0.192281
"Why Meta Shares Are Trading Higher By Over 16%; Here Are 20 Stocks Moving Premarket - Apple  ( NASDAQ:AAPL ) , AgriFORCE Growing Systems  ( NASDAQ:AGRI ) ",20240202T132113,https://www.benzinga.com/news/24/02/36908482/why-meta-shares-are-trading-higher-by-over-16-here-are-20-stocks-moving-premarket,META,0.139669,Somewhat-Bullish,0.205387
"Why Taysha Gene Therapies Shares Are Trading Higher By Around 27%; Here Are 20 Stocks Moving Premarket - BYND Cannasoft Enterprise  ( NASDAQ:BCAN ) , Aquestive Therapeutics  ( NASDAQ:AQST ) ",20240320T122039,https://www.benzinga.com/news/24/03/37844820/why-taysha-gene-therapies-shares-are-trading-higher-by-around-27-here-are-20-stocks-moving-premarket,META,0.062434,Neutral,-0.033042
"Femasys Inc. Announces Financial Results for the Second Quarter Ended June 30, 2023 and Provides Corporate Update",20230810T120000,https://www.globenewswire.com/news-release/2023/08/10/2722590/0/en/Femasys-Inc-Announces-Financial-Results-for-the-Second-Quarter-Ended-June-30-2023-and-Provides-Corporate-Update.html,META,0.018257,Neutral,0.059622
Femasys Inc. Replaces Two Board Members with Seasoned Industry Leaders in the Life Sciences - Femasys  ( NASDAQ:FEMY ) ,20230615T120000,https://www.benzinga.com/pressreleases/23/06/g32871308/femasys-inc-replaces-two-board-members-with-seasoned-industry-leaders-in-the-life-sciences,META,0.03786,Neutral,0.029907
