title,time_published,url,ticker,relevance_score,ticker_sentiment_label,ticker_sentiment_score
Why Zoom Video Is Trading Lower By 11%; Here Are 28 Stocks Moving Premarket,20220823T113633,https://www.benzinga.com/news/22/08/28597728/why-zoom-video-is-trading-lower-by-11-here-are-28-stocks-moving-premarket,MRIN,0.081001,Somewhat-Bullish,0.204374
50 Biggest Movers From Yesterday,20220329T091148,https://www.benzinga.com/news/22/03/26340073/50-biggest-movers-from-yesterday,MRIN,0.074437,Neutral,0.002928
Why Ascent Solar Technologies Shares Are Trading Lower By Around 50%? Here Are Other Stocks Moving In Wednesday's Mid-Day Session - Ascent Solar Technologies  ( NASDAQ:ASTI ) ,20240410T180705,https://www.benzinga.com/news/24/04/38189280/why-ascent-solar-technologies-shares-are-trading-lower-by-around-50-here-are-other-stocks-moving-in,MRIN,0.094576,Neutral,0.120587
Why Doximity Shares Are Trading Higher By Over 28%; Here Are 20 Stocks Moving Premarket - Doximity  ( NYSE:DOCS ) ,20240809T090452,https://www.benzinga.com/news/24/08/40277872/why-doximity-shares-are-trading-higher-by-over-28-here-are-20-stocks-moving-premarket,MRIN,0.142565,Neutral,0.130674
24 Stocks Moving in Thursday's Pre-Market Session,20220505T101835,https://www.benzinga.com/news/22/05/27013789/24-stocks-moving-in-thursdays-pre-market-session,MRIN,0.145672,Neutral,0.001038
