title,time_published,url,ticker,relevance_score,ticker_sentiment_label,ticker_sentiment_score
"Earnings Scheduled For June 9, 2022",20220609T084930,https://www.benzinga.com/news/earnings/22/06/27622227/earnings-scheduled-for-june-9-2022,MTN,0.213988,Neutral,-0.001054
"Blackstone and Airbnb Set to Join S&P 500; Others to Join S&P 100, S&P MidCap 400 and S&P SmallCap 600",20230901T225100,https://markets.businessinsider.com/news/stocks/blackstone-and-airbnb-set-to-join-s-p-500-others-to-join-s-p-100-s-p-midcap-400-and-s-p-smallcap-600-1032600818,MTN,0.057215,Neutral,0.030957
"Week Ahead: Oil Cuts, Jobless Claims, and Consumer Packaged Goods Earnings",20230605T132601,https://moneymorning.com/2023/06/05/week-ahead-oil-cuts-jobless-claims-and-consumer-packaged-goods-earnings/,MTN,0.098659,Neutral,0.115483
"Apple conference, OPEC's oil cut, Nasdaq at 2023 high in week ahead",20230604T223822,https://www.foxbusiness.com/markets/apple-conference-saudis-oil-cut-nasdaq-hits-2023-high-top-week-ahead,MTN,0.073546,Neutral,0.0
"Big Tech is driving corporate earnings, and buoying expectations for coming months",20230604T171400,https://www.marketwatch.com/story/big-tech-is-driving-corporate-earnings-and-buoying-expectations-for-coming-months-b66b2c0c,MTN,0.109206,Neutral,0.07955
"Apple investor day, Powell testimony, jobs report top week ahead",20230305T185259,https://www.foxbusiness.com/markets/apple-investor-day-powell-testimony-jobs-report-top-week-ahead,MTN,0.047278,Neutral,0.0
"Musk pushes Twitter files, Georgia runoff election, FTX fallout ongoing top week ahead",20221204T232326,https://www.foxbusiness.com/markets/musk-twitter-georgia-runoff-election-ftx-sbf-top-week-ahead,MTN,0.066784,Neutral,0.0
"Consumer inflation data, Amazon stock split, Yellen testimony top week ahead",20220606T001406,https://www.foxbusiness.com/markets/amazon-stock-split-consumer-price-index-yellen-testimony-week-ahead,MTN,0.083107,Neutral,0.046761
Investors set their sights on upcoming inflation report as the bear market rally falters,20220603T174655,https://www.cnbc.com/2022/06/03/investors-set-their-sights-on-upcoming-inflation-report-as-the-bear-market-rally-falters.html,MTN,0.048611,Neutral,-0.007935
"On Heels Of Amex Acquisition, Tock Announces New Hotel Partnership",20240712T135106,https://www.forbes.com/sites/jenniferleighparker/2024/07/12/on-heels-of-amex-acquisition-tock-announces-new-hotel-partnership/,MTN,0.020491,Somewhat-Bullish,0.171456
"Billionaire Ron Baron Is 'Incredibly Bullish' On Tesla, SpaceX And This Apparel Company He Calls 'The Lululemon Of Healthcare'",20220825T202838,https://www.benzinga.com/trading-ideas/long-ideas/22/08/28639478/billionaire-ron-baron-is-incredibly-bullish-on-tesla-spacex-and-this-apparel-company-he-,MTN,0.128478,Neutral,0.093296
"Vail Resorts Posts Downbeat Q3 Results, Joins Concrete Pumping, DocuSign And Other Big Stocks Moving Lower In Friday's Pre-Market Session - Vail Resorts  ( NYSE:MTN ) ",20240607T122235,https://www.benzinga.com/news/24/06/39225632/vail-resorts-posts-downbeat-q3-results-joins-concrete-pumping-docusign-and-other-big-stocks-moving-l,MTN,0.320279,Somewhat-Bearish,-0.237168
Why Braze Shares Are Trading Higher By 14%; Here Are 20 Stocks Moving Premarket - Braze  ( NASDAQ:BRZE ) ,20240607T091736,https://www.benzinga.com/news/24/06/39222541/why-braze-shares-are-trading-higher-by-14-here-are-20-stocks-moving-premarket,MTN,0.145145,Neutral,-0.041973
"Earnings Scheduled For March 14, 2022",20220314T091110,https://www.benzinga.com/news/earnings/22/03/26116901/earnings-scheduled-for-march-14-2022,MTN,0.038925,Neutral,-0.000217
"Airbnb, Blackstone Rise On News They'll Join S&P 500 Index",20230902T120200,https://www.investors.com/news/sp-500-airbnb-blackstone-rise-on-news-theyll-join-index/,MTN,0.18967,Neutral,0.075637
