title,time_published,url,ticker,relevance_score,ticker_sentiment_label,ticker_sentiment_score
"Why Nutanix Shares Are Trading Higher By 16%; Here Are 20 Stocks Moving Premarket - American Eagle Outfitters  ( NYSE:AEO ) , Digital Turbine  ( NASDAQ:APPS ) ",20230525T123154,https://www.benzinga.com/news/23/05/32572038/why-nutanix-shares-are-trading-higher-by-16-here-are-20-stocks-moving-premarket,,0.158519,Somewhat-Bullish,0.257538
"Why MindMed Is Trading Lower By Around 35%; Here Are 31 Stocks Moving Premarket - AIM ImmunoTech  ( AMEX:AIM ) , Acumen Pharmaceuticals  ( NASDAQ:ABOS ) ",20220928T111722,https://www.benzinga.com/news/22/09/29048520/why-mindmed-is-trading-lower-by-around-35-here-are-31-stocks-moving-premarket,,0.102013,Neutral,-0.128405
Why Ascent Solar Technologies Shares Are Trading Lower By Around 50%? Here Are Other Stocks Moving In Wednesday's Mid-Day Session - Ascent Solar Technologies  ( NASDAQ:ASTI ) ,20240410T180705,https://www.benzinga.com/news/24/04/38189280/why-ascent-solar-technologies-shares-are-trading-lower-by-around-50-here-are-other-stocks-moving-in,,0.141448,Neutral,0.0
"Why Aditxt Shares Dipped Over 58%; Here Are 82 Biggest Movers From Friday - Applied Optoelectronics  ( NASDAQ:AAOI ) , Adicet Bio  ( NASDAQ:ACET ) ",20220919T055309,https://www.benzinga.com/news/22/09/28909319/why-aditxt-shares-dipped-over-58-here-are-82-biggest-movers-from-friday,,0.056143,Neutral,0.0
This Communication Services Stock Jumped 149%; Here Are 90 Biggest Movers From Friday,20220801T092759,https://www.benzinga.com/news/22/08/28283022/this-communication-services-stock-jumped-149-here-are-90-biggest-movers-from-friday,,0.043303,Neutral,0.024887
