title,time_published,url,ticker,relevance_score,ticker_sentiment_label,ticker_sentiment_score
"Dow Jumps Over 150 Points; US Core PCE Price Inflation Eases - Gorilla Technology Gr  ( NASDAQ:GRRR ) , Chicken Soup for the Soul  ( NASDAQ:CSSE ) ",20230331T142529,https://www.benzinga.com/news/earnings/23/03/31609911/dow-jumps-over-150-points-us-core-pce-price-inflation-eases,NAAS,0.122269,Somewhat-Bullish,0.1763
"Why Green Giant Shares Are Trading Lower By Around 37%; Here Are 20 Stocks Moving Premarket - African Agriculture Hldgs  ( NASDAQ:AAGR ) , AcelRx Pharmaceuticals  ( NASDAQ:ACRX ) ",20231211T125928,https://www.benzinga.com/news/23/12/36174622/why-green-giant-shares-are-trading-lower-by-around-37-here-are-20-stocks-moving-premarket,NAAS,0.210579,Somewhat-Bullish,0.213474
Why Selective Insurance Group Shares Are Trading Lower By Around 15%? Here Are Other Stocks Moving In Friday's Mid-Day Session - Selective Insurance Gr  ( NASDAQ:SIGI ) ,20240719T172454,https://www.benzinga.com/news/24/07/39864633/why-selective-insurance-group-shares-are-trading-lower-by-around-15-here-are-other-stocks-moving-in,NAAS,0.097062,Somewhat-Bullish,0.3444
"Top 5 Consumer Stocks That Are Ticking Portfolio Bombs - Solo Brands  ( NYSE:DTC ) , Torrid Holdings  ( NYSE:CURV ) ",20230411T121714,https://www.benzinga.com/news/23/04/31741539/top-5-consumer-stocks-that-are-ticking-portfolio-bombs,NAAS,0.304428,Neutral,-0.055854
"Dollar Tree Reports Weak Earnings, Joins Tesla, Arcos Dorados And Other Big Stocks Moving Lower On Wednesday - Tesla  ( NASDAQ:TSLA ) , Dollar Tree  ( NASDAQ:DLTR ) ",20240313T142200,https://www.benzinga.com/news/24/03/37662379/dollar-tree-reports-weak-earnings-joins-tesla-arcos-dorados-and-other-big-stocks-moving-lower-on-wed,NAAS,0.244109,Somewhat-Bearish,-0.298602
