title,time_published,url,ticker,relevance_score,ticker_sentiment_label,ticker_sentiment_score
"Why Intelligent Bio Solutions Shares Are Trading Lower By Around 55%? Here Are Other Stocks Moving In Monday's Mid-Day Session - AERWINS Technologies  ( NASDAQ:AWIN ) , Arch Resources  ( NYSE:ARCH ) ",20231002T170027,https://www.benzinga.com/news/23/10/35037344/why-intelligent-bio-solutions-shares-are-trading-lower-by-around-55-here-are-other-stocks-moving-in,NEP,0.113062,Somewhat-Bearish,-0.278179
Dow Dips More Than 200 Points; Crude Oil Moves Lower,20220722T185928,https://www.benzinga.com/news/earnings/22/07/28174160/dow-dips-more-than-200-points-crude-oil-moves-lower,NEP,0.148731,Somewhat-Bullish,0.211306
Nasdaq Drops Around 200 Points; Hanger Shares Spike Higher,20220722T164959,https://www.benzinga.com/news/earnings/22/07/28172512/nasdaq-drops-around-200-points-hanger-shares-spike-higher,NEP,0.150122,Somewhat-Bullish,0.212455
"General Electric, Verizon, Cleveland-Cliffs And Other Big Stocks Moving Higher On Tuesday - Amneal Pharmaceuticals  ( NYSE:AMRX ) , Agilysys  ( NASDAQ:AGYS ) ",20231024T154050,https://www.benzinga.com/news/23/10/35396872/general-electric-verizon-cleveland-cliffs-and-other-big-stocks-moving-higher-on-tuesday,NEP,0.12645,Bullish,0.476696
"Stocks That Hit 52-Week Lows On Thursday - PRA Group  ( NASDAQ:PRAA ) , Perimeter Solutions  ( NYSE:PRM ) ",20231005T172202,https://www.benzinga.com/news/23/10/35111787/stocks-that-hit-52-week-lows-on-thursday,NEP,0.013047,Neutral,0.003524
