title,time_published,url,ticker,relevance_score,ticker_sentiment_label,ticker_sentiment_score
"Why Tattooed Chef Shares Dipped Around 15%; Here Are 95 Biggest Movers From Friday - Alcoa  ( NYSE:AA ) , Aurora Cannabis  ( NASDAQ:ACB ) ",20221114T073517,https://www.benzinga.com/news/earnings/22/11/29694040/why-tattooed-chef-shares-dipped-around-15-here-are-95-biggest-movers-from-friday,NOTE,0.043698,Neutral,0.0
Why Doximity Shares Are Trading Higher By Over 28%; Here Are 20 Stocks Moving Premarket - Doximity  ( NYSE:DOCS ) ,20240809T090452,https://www.benzinga.com/news/24/08/40277872/why-doximity-shares-are-trading-higher-by-over-28-here-are-20-stocks-moving-premarket,NOTE,0.142565,Neutral,-0.061422
"Dada Nexus, Bilibili And Other Big Stocks Moving Lower On Monday",20230130T163633,https://www.benzinga.com/news/23/01/30625599/dada-nexus-bilibili-and-other-big-stocks-moving-lower-on-monday,NOTE,0.436009,Bullish,0.478973
New Stocks and Trading Ideas;  ( NYSE: NOTE )   ( CSE: PXE )   ( NYSE: EPAM )   ( NYSE: GETY )   ( NASDAQ: BZFD )   ( Nasdaq: ONFO ) ,20230421T132941,https://www.investorideas.com/news/2023/main/04211Stocks.asp,NOTE,0.115899,Neutral,0.038257
"Why NVIDIA, Microsoft And Amazon Shares Traded Lower; Here Are 73 Biggest Movers From Friday - Apple  ( NASDAQ:AAPL ) , Abeona Therapeutics  ( NASDAQ:ABEO ) ",20221010T092851,https://www.benzinga.com/news/22/10/29198222/why-nvidia-microsoft-and-amazon-shares-traded-lower-here-are-73-biggest-movers-from-friday,NOTE,0.047092,Somewhat-Bearish,-0.29887
4 Top Penny Stocks To Buy According To Insiders In May 2023,20230522T172235,https://pennystocks.com/featured/2023/05/22/4-top-penny-stocks-to-buy-according-to-insiders-in-may-2023/,NOTE,0.094514,Somewhat-Bullish,0.194558
"Moderna, BioNTech And Some Other Big Stocks Moving Higher On Wednesday - AZZ  ( NYSE:AZZ ) , BioNTech  ( NASDAQ:BNTX ) ",20221012T142846,https://www.benzinga.com/news/22/10/29237483/moderna-biontech-and-some-other-big-stocks-moving-higher-on-wednesday,NOTE,0.252987,Bullish,0.584954
