title,time_published,url,ticker,relevance_score,ticker_sentiment_label,ticker_sentiment_score
"Why Laser Photonics Shares Surged By Around 19%; Here Are 70 Biggest Movers From Friday - Abeona Therapeutics  ( NASDAQ:ABEO ) , ACM Research  ( NASDAQ:ACMR ) ",20221017T092117,https://www.benzinga.com/news/22/10/29282399/why-laser-photonics-shares-surged-by-around-19-here-are-70-biggest-movers-from-friday,NTNX,0.063091,Neutral,0.120072
Stocks That Hit 52-Week Lows On Monday,20220613T161842,https://www.benzinga.com/markets/options/22/06/27677156/52-weeks-high-and-low-article,NTNX,0.005366,Neutral,0.005841
Stocks That Hit 52-Week Lows On Monday,20220314T161153,https://www.benzinga.com/news/22/03/26125409/stocks-that-hit-52-week-lows-on-monday,NTNX,0.003772,Neutral,-0.023894
"NIO, XPeng, MongoDB And Other Big Stocks Moving Higher On Friday - A-Mark Precious Metals  ( NASDAQ:AMRK ) , Butterfly Network  ( NYSE:BFLY ) ",20230901T144532,https://www.benzinga.com/news/23/09/34173725/nio-xpeng-mongodb-and-other-big-stocks-moving-higher-on-friday,NTNX,0.202366,Somewhat-Bullish,0.268585
Stocks That Hit 52-Week Lows On Thursday,20220526T161527,https://www.benzinga.com/markets/options/22/05/27422270/52-weeks-high-and-low-article,NTNX,0.048646,Neutral,-0.002322
"Why Nutanix Shares Are Trading Higher By 16%; Here Are 20 Stocks Moving Premarket - American Eagle Outfitters  ( NYSE:AEO ) , Digital Turbine  ( NASDAQ:APPS ) ",20230525T123154,https://www.benzinga.com/news/23/05/32572038/why-nutanix-shares-are-trading-higher-by-16-here-are-20-stocks-moving-premarket,NTNX,0.158519,Somewhat-Bullish,0.335292
"Why Dell Technologies Shares Are Trading Higher By 9%; Here Are 20 Stocks Moving Premarket - Acer Therapeutics  ( NASDAQ:ACER ) , Aditxt  ( NASDAQ:ADTX ) ",20230901T121610,https://www.benzinga.com/news/23/09/34169746/why-dell-technologies-shares-are-trading-higher-by-9-here-are-20-stocks-moving-premarket,NTNX,0.146469,Somewhat-Bullish,0.194367
"Stocks Fall As Salesforce, Dell Dive On Earnings: Weekly Review",20240531T154000,https://www.investors.com/news/stock-market-retreats-salesforce-dell-earnings-losers/,NTNX,0.08687,Neutral,-0.080749
Futures: Fed's Inflation Report Due; AI Winner Dell Dives Late,20240530T205100,https://www.investors.com/market-trend/stock-market-today/dow-jones-futures-fed-inflation-report-due-key-sector-dives-dell-plunges/,NTNX,0.096412,Neutral,-0.133492
"Fed Inflation Gauge, Key Earnings Highlight Investing Action Plan",20240524T120000,https://www.investors.com/research/investing-action-plan/fed-inflation-gauge-key-earnings/,NTNX,0.060312,Neutral,0.054015
"Nvidia, JPMorgan Chase Lead Five Stocks Near Buy Points",20240511T152800,https://www.investors.com/news/nvidia-jpmorgan-chase-nvda-stocks-near-buy-points/,NTNX,0.062597,Neutral,0.0
"Zuckerberg fallout, EBT tech issue, Powell speech reaction and more: Monday's 5 things to know",20220829T052643,https://www.foxbusiness.com/markets/zuckerberg-fallout-ebt-tech-issue-powell-speech-reaction-mondays-5-things-know,NTNX,0.032558,Neutral,0.0
"Jobs data, Bed Bath & Beyond update, Best Buy earnings top week ahead",20220829T001226,https://www.foxbusiness.com/markets/jobs-data-bed-bath-beyond-update-best-buy-earnings-week-ahead,NTNX,0.046095,Neutral,0.0
