title,time_published,url,ticker,relevance_score,ticker_sentiment_label,ticker_sentiment_score
"Why Intelligent Bio Solutions Shares Are Trading Lower By Around 55%? Here Are Other Stocks Moving In Monday's Mid-Day Session - AERWINS Technologies  ( NASDAQ:AWIN ) , Arch Resources  ( NYSE:ARCH ) ",20231002T170027,https://www.benzinga.com/news/23/10/35037344/why-intelligent-bio-solutions-shares-are-trading-lower-by-around-55-here-are-other-stocks-moving-in,NXL,0.168884,Somewhat-Bearish,-0.319125
Why Tuesday Morning Shares Are Trading Lower By 38%; Here Are 31 Stocks Moving Premarket - Neptune Wellness Solns  ( NASDAQ:NEPT ) ,20221227T114014,https://www.benzinga.com/news/22/12/30201324/why-tuesday-morning-shares-are-trading-lower-by-38-here-are-31-stocks-moving-premarket,NXL,0.113062,Somewhat-Bullish,0.196523
"Why Streamline Health Solutions Shares Are Trading Lower By Over 68%? Here Are Other Stocks Moving In Monday's Mid-Day Session - Aldeyra Therapeutics  ( NASDAQ:ALDX ) , Alignment Healthcare  ( NASDAQ:ALHC ) ",20231016T170953,https://www.benzinga.com/news/23/10/35272489/why-streamline-health-solutions-shares-are-trading-lower-by-over-68-here-are-other-stocks-moving-in,NXL,0.114137,Neutral,0.148778
"Why SpringWorks Shares Are Trading Higher By Around 14%; Here Are 20 Stocks Moving Premarket - argenx  ( NASDAQ:ARGX ) , Alithya Group  ( NASDAQ:ALYA ) ",20231128T125649,https://www.benzinga.com/news/23/11/35976269/why-springworks-shares-are-trading-higher-by-around-14-here-are-20-stocks-moving-premarket,NXL,0.147366,Neutral,-0.084068
Why Adobe Shares Are Trading Higher By Around 15%; Here Are 20 Stocks Moving Premarket - Adobe  ( NASDAQ:ADBE ) ,20240614T121925,https://www.benzinga.com/news/24/06/39331171/why-adobe-shares-are-trading-higher-by-around-15-here-are-20-stocks-moving-premarket,NXL,0.204647,Neutral,0.108429
Why Oracle Shares Are Trading Higher By Around 13%; Here Are 20 Stocks Moving Premarket - Oracle  ( NYSE:ORCL ) ,20240312T121102,https://www.benzinga.com/news/24/03/37613941/why-oracle-shares-are-trading-higher-by-around-13-here-are-20-stocks-moving-premarket,NXL,0.20997,Neutral,0.052999
Best Penny Stocks To Buy Now? 5 Biotech Stocks To Watch This Week,20221121T175936,https://pennystocks.com/featured/2022/11/21/best-penny-stocks-to-buy-now-5-biotech-stocks-to-watch-this-week/,NXL,0.104835,Neutral,0.023454
"Why Rogers Shares Are Trading Sharply Lower; Here Are 33 Stocks Moving Premarket - Airbnb  ( NASDAQ:ABNB ) , Arcturus Therapeutics  ( NASDAQ:ARCT ) ",20221102T115858,https://www.benzinga.com/news/22/11/29519517/why-rogers-shares-are-trading-sharply-lower-here-are-33-stocks-moving-premarket,NXL,0.09402,Neutral,-0.067395
