title,time_published,url,ticker,relevance_score,ticker_sentiment_label,ticker_sentiment_score
"NIO Reports Upbeat Earnings, Joins Dave, V2X, Riskified And Other Big Stocks Moving Higher On Tuesday - Dave  ( NASDAQ:DAVE ) , NIO  ( NYSE:NIO ) , Riskified  ( NYSE:RSKD ) ",20240305T155657,https://www.benzinga.com/news/24/03/37486513/nio-reports-upbeat-earnings-joins-dave-v2x-riskified-and-other-big-stocks-moving-higher-on-tuesday,NYCB,0.229149,Somewhat-Bearish,-0.232844
"'The Big Short' Investor Is Going Big Short: Burry's 13F Says The Bull Run Of 2023 Is Over With 40,000 Puts On The SPY, QQQ",20230814T183354,https://markets.businessinsider.com/news/etf/the-big-short-investor-is-going-big-short-burry-s-13f-says-the-bull-of-2023-is-over-with-40-000-puts-on-the-spy-and-qqq-1032552634,NYCB,0.158,Neutral,0.102133
"'The Big Short' Investor Is Going Big Short: Burry's 13F Says The Bull Of 2023 Is Over With 40,000 Puts On The SPY And QQQ - NexTier Oilfield  ( NYSE:NEX ) , Invesco QQQ Trust, Series 1  ( NASDAQ:QQQ ) , NVIDIA  ( NASDAQ:NVDA ) , iHeartMedia  ( NASDAQ:IHRT ) , RealReal  ( NASDAQ:REAL ) , Star Bulk Carriers  ( NASDAQ:SBLK ) , Warner Bros. Discovery  ( NASDAQ:WBD ) , SPDR S&P 500  ( ARCA:SPY ) , Crescent Energy  ( NYSE:CRGY ) ",20230814T181523,https://www.benzinga.com/markets/equities/23/08/33841151/the-big-short-investor-is-going-big-short-burrys-13f-says-the-bull-of-2023-is-over-with-40-000-p,NYCB,0.237358,Neutral,0.136071
'Big Short' investor Michael Burry reveals bets against the S&P 500 and Nasdaq-100 - and sweeping changes to his stock portfolio,20230814T180200,https://markets.businessinsider.com/news/stocks/big-short-michael-burry-scion-stock-portfolio-q2-spx-nasdaq-2023-8,NYCB,0.108466,Neutral,0.0
3 Beaten-Up Stocks,20240314T171145,https://www.fool.com/investing/2024/03/14/3-beaten-up-stocks/,NYCB,0.039894,Neutral,-0.031321
Why Paymentus Shares Are Trading Higher By Around 18%; Here Are 20 Stocks Moving Premarket - Paymentus Holdings  ( NYSE:PAY ) ,20240305T130627,https://www.benzinga.com/news/24/03/37479548/why-paymentus-shares-are-trading-higher-by-around-18-here-are-20-stocks-moving-premarket,NYCB,0.166935,Neutral,-0.061298
Why Science Applications International Shares Are Trading Lower By Over 10%? Here Are Other Stocks Moving In Monday's Mid-Day Session - Science Applications Intl  ( NASDAQ:SAIC ) ,20240318T183743,https://www.benzinga.com/news/24/03/37797097/why-science-applications-international-shares-are-trading-lower-by-over-10-here-are-other-stocks-mov,NYCB,0.07887,Neutral,0.0
"Stocks Handle Huge Earnings, Fed, Jobs Report: Weekly Review",20240202T171500,https://www.investors.com/news/stock-market-handles-huge-earnings-week-fed-powell-jobs-report-weekly-review/,NYCB,0.082963,Neutral,-0.121209
"Stocks making the biggest moves midday: SoFi, ON Semiconductor, Disney, Sweetgreen and more",20230731T161850,https://www.cnbc.com/2023/07/31/stocks-making-the-biggest-moves-midday-sofi-on-dis-sg-and-more.html,NYCB,0.059194,Somewhat-Bullish,0.299169
