title,time_published,url,ticker,relevance_score,ticker_sentiment_label,ticker_sentiment_score
Stocks That Hit 52-Week Lows On Wednesday,20220511T162815,https://www.benzinga.com/markets/options/22/05/27141482/52-weeks-high-and-low-article,OLO,0.006905,Neutral,-0.01167
Stocks That Hit 52-Week Lows On Friday,20220506T160650,https://www.benzinga.com/markets/options/22/05/27050916/52-weeks-high-and-low-article,OLO,0.005467,Neutral,-0.012228
Why Embark Technology Jumped Around 85%; Here Are 108 Biggest Movers From Friday,20220815T074324,https://www.benzinga.com/news/22/08/28488766/why-embark-technology-jumped-around-85-here-are-108-biggest-movers-from-friday,OLO,0.033942,Neutral,0.044399
Stocks That Hit 52-Week Lows On Thursday,20220421T175401,https://www.benzinga.com/markets/options/22/04/26742233/52-weeks-high-and-low-article,OLO,0.021637,Neutral,-0.022497
"Illumina, Poshmark, Olo And Some Other Big Losers From Friday",20220815T091711,https://www.benzinga.com/news/22/08/28489203/illumina-poshmark-olo-and-some-other-big-losers-from-friday,OLO,0.115509,Neutral,0.053245
Cowen Slashes Price Target On This Stock By Over 78%; Also Check Out Some Other Big PT Changes,20220812T131443,https://www.benzinga.com/news/22/08/28473188/cowen-slashes-price-target-on-this-stock-by-over-78-also-check-out-some-other-big-pt-changes,OLO,0.235823,Somewhat-Bearish,-0.165674
"Earnings Scheduled For May 10, 2022",20220510T091808,https://www.benzinga.com/news/earnings/22/05/27099859/earnings-scheduled-for-may-10-2022,OLO,0.015162,Neutral,-0.027218
"Bragar Eagel & Squire, P.C. Is Investigating Olo, Cognyte, Vintage Wine, and the WWE and Encourages Investors to Contact the Firm - Olo  ( NYSE:OLO ) , Cognyte Software  ( NASDAQ:CGNT ) ",20220917T010000,https://www.benzinga.com/pressreleases/22/09/g28905048/bragar-eagel-squire-p-c-is-investigating-olo-cognyte-vintage-wine-and-the-wwe-and-encourages-inves,OLO,0.377142,Neutral,-0.03389
"Cognyte Software  ( NASDAQ:CGNT ) , EyePoint Pharmaceuticals  ( NASDAQ:EYPT )  - Bragar Eagel & Squire, P.C. Is Investigating EyePoint, Olo, Cognyte, and the WWE and Encourages Investors to Contact the Firm",20220912T010000,https://www.benzinga.com/pressreleases/22/09/g28822689/bragar-eagel-squire-p-c-is-investigating-eyepoint-olo-cognyte-and-the-wwe-and-encourages-investors,OLO,0.398939,Neutral,-0.035299
90 Biggest Movers From Yesterday,20220513T094449,https://www.benzinga.com/news/22/05/27184008/90-biggest-movers-from-yesterday,OLO,0.06528,Neutral,0.003964
"On Heels Of Amex Acquisition, Tock Announces New Hotel Partnership",20240712T135106,https://www.forbes.com/sites/jenniferleighparker/2024/07/12/on-heels-of-amex-acquisition-tock-announces-new-hotel-partnership/,OLO,0.020491,Neutral,0.097984
