title,time_published,url,ticker,relevance_score,ticker_sentiment_label,ticker_sentiment_score
"Blackstone and Airbnb Set to Join S&P 500; Others to Join S&P 100, S&P MidCap 400 and S&P SmallCap 600",20230901T225100,https://markets.businessinsider.com/news/stocks/blackstone-and-airbnb-set-to-join-s-p-500-others-to-join-s-p-100-s-p-midcap-400-and-s-p-smallcap-600-1032600818,OPI,0.057215,Neutral,0.030957
New Strong Buy Stocks for October 27th,20231027T100700,https://www.zacks.com/commentary/2172359/new-strong-buy-stocks-for-october-27th,OPI,0.535653,Somewhat-Bullish,0.279134
Best Penny Stocks To Buy Now? 4 Under $5 To Watch This Week,20230605T162512,https://pennystocks.com/featured/2023/06/05/best-penny-stocks-to-buy-now-4-under-5-to-watch-this-week/,OPI,0.057907,Neutral,0.025025
"Crude Oil Moves Higher; Clearmind Medicine Shares Plummet - First Financial Northwest  ( NASDAQ:FFNW ) , Clearmind Medicine  ( NASDAQ:CMND ) ",20240111T193251,https://www.benzinga.com/news/earnings/24/01/36600288/crude-oil-moves-higher-clearmind-medicine-shares-plummet,OPI,0.146025,Neutral,0.037906
"Dow Dips Over 200 Points; First Financial Northwest Shares Spike Higher - First Financial Northwest  ( NASDAQ:FFNW ) , Clearmind Medicine  ( NASDAQ:CMND ) ",20240111T171136,https://www.benzinga.com/news/earnings/24/01/36598234/dow-dips-over-200-points-first-financial-northwest-shares-spike-higher,OPI,0.148273,Neutral,0.038263
"Aspen Aerogels Issues Business Update, Joins Plug Power, SunPower And Other Big Stocks Moving Lower On Thursday - Applied Optoelectronics  ( NASDAQ:AAOI ) , C3.ai  ( NYSE:AI ) ",20240111T153232,https://www.benzinga.com/news/24/01/36596069/aspen-aerogels-issues-business-update-joins-plug-power-sunpower-and-other-big-stocks-moving-lower-on,OPI,0.220809,Neutral,0.113383
