title,time_published,url,ticker,relevance_score,ticker_sentiment_label,ticker_sentiment_score
Earnings Preview: Qiagen  ( QGEN )  Q3 Earnings Expected to Decline,20231023T140038,https://www.zacks.com/stock/news/2170302/earnings-preview-qiagen-qgen-q3-earnings-expected-to-decline,QGEN,0.258808,Neutral,-0.015929
"Illumina's Q3 Earnings Coming Up: Time to Buy, Sell or Hold the Stock?",20241024T155200,https://www.zacks.com/stock/news/2357071/illuminas-q3-earnings-coming-up-time-to-buy-sell-or-hold-the-stock,QGEN,0.067727,Somewhat-Bullish,0.154539
"ILMN Stock Trading Near 52-Week High: Should You Buy, Sell or Hold?",20241018T130500,https://www.zacks.com/stock/news/2352964/ilmn-stock-trading-near-52-week-high-should-you-buy-sell-or-hold,QGEN,0.078354,Somewhat-Bullish,0.150332
OPK Gets Additional BARDA Funding to Develop Multispecific Antibodies,20241011T131800,https://www.zacks.com/stock/news/2349214/opk-gets-additional-barda-funding-to-develop-multispecific-antibodies,QGEN,0.245835,Neutral,0.047249
"Next Generation Sequencing  ( NGS )  Market Surges to USD 39.15 Billion by 2031, Propelled by 20.39% CAGR - Verified Market Research®",20240813T141500,https://www.benzinga.com/pressreleases/24/08/g40340435/next-generation-sequencing-ngs-market-surges-to-usd-39-15-billion-by-2031-propelled-by-20-39-cagr-,QGEN,0.029113,Neutral,0.094696
Next Generation Sequencing Market to Witness 18.5% CAGR by 2031 | SkyQuest Technology,20240724T123000,https://www.benzinga.com/pressreleases/24/07/g39930416/next-generation-sequencing-market-to-witness-18-5-cagr-by-2031-skyquest-technology,QGEN,0.048425,Neutral,0.0
"DNA Sequencing Market size is set to grow by USD 17.34 billion from 2024-2028, Growing adoption of ngs to boost the ... - PR Newswire",20240607T180000,https://www.prnewswire.com/news-releases/dna-sequencing-market-size-is-set-to-grow-by-usd-17-34-billion-from-2024-2028--growing-adoption-of-ngs-to-boost-the-market-growth-technavio-302165939.html,QGEN,0.028833,Neutral,0.02218
"Epigenetics Market size is set to grow by USD 1.47 billion from 2024-2028, Rising epigenetic applications in non ... - PR Newswire",20240524T180000,https://www.prnewswire.com/news-releases/epigenetics-market-size-is-set-to-grow-by-usd-1-47-billion-from-2024-2028--rising-epigenetic-applications-in-non-oncology-diseases-to-boost-the-market-growth-technavio-302154241.html,QGEN,0.038162,Neutral,0.057527
Here's Why You Should Retain Illumina  ( ILMN )  Stock for Now,20231228T180200,https://www.zacks.com/stock/news/2203319/heres-why-you-should-retain-illumina-ilmn-stock-for-now,QGEN,0.046184,Somewhat-Bullish,0.233216
"Global Precision Medicine Market Size Demonstrates Consistent Growth with a CAGR of 11.12%, with North America Taking a Leading Role - Illumina  ( NASDAQ:ILMN ) , Bristol-Myers Squibb  ( NYSE:BMY ) ",20231108T145000,https://www.benzinga.com/pressreleases/23/11/g35674541/global-precision-medicine-market-size-demonstrates-consistent-growth-with-a-cagr-of-11-12-with-nor,QGEN,0.039353,Neutral,0.0
"Genomics Market Size to Grow by USD 18,244.34 million from 2022 to 2027, North America is estimated to contribute 37% to the global market growth - Technavio",20230619T071500,https://www.prnewswire.com/news-releases/genomics-market-size-to-grow-by-usd-18-244-34-million-from-2022-to-2027--north-america-is-estimated-to-contribute-37-to-the-global-market-growth---technavio-301853361.html,QGEN,0.026155,Neutral,-0.041644
"Epigenetics Market size to grow by USD 1,148.2 million from 2022-2027 with 40% of the market growth originate from North America - Technavio",20230616T141500,https://www.prnewswire.com/news-releases/epigenetics-market-size-to-grow-by-usd-1-148-2-million-from-2022-2027-with-40-of-the-market-growth-originate-from-north-america---technavio-301852330.html,QGEN,0.033098,Neutral,0.02861
Here's Why You Should Retain Illumina  ( ILMN )  Stock for Now,20230614T152200,https://www.zacks.com/stock/news/2108381/heres-why-you-should-retain-illumina-ilmn-stock-for-now,QGEN,0.045139,Somewhat-Bullish,0.232975
Genomics Market to be Worth $72.62 Billion by 2030 - Exclusive Report by Meticulous Research®,20230413T150000,https://www.benzinga.com/pressreleases/23/04/g31790465/genomics-market-to-be-worth-72-62-billion-by-2030-exclusive-report-by-meticulous-research,QGEN,0.022686,Neutral,0.0
Next-Generation Sequencing Data Analysis Market to Reach USD 5.4 Bn by 2032 | Transparency Market Research,20230412T143000,https://www.benzinga.com/pressreleases/23/04/g31770310/next-generation-sequencing-data-analysis-market-to-reach-usd-5-4-bn-by-2032-transparency-market-re,QGEN,0.03878,Neutral,0.066392
PacBio's  ( PACB )  Latest Offering to Enhance Genome Sequencing,20221024T141000,https://www.zacks.com/stock/news/1996240/pacbios-pacb-latest-offering-to-enhance-genome-sequencing,QGEN,0.170576,Neutral,0.068123
PacBio's  ( PACB )  Latest Offering to Enhance Disease Discoveries,20221024T132000,https://www.zacks.com/stock/news/1996135/pacbios-pacb-latest-offering-to-enhance-disease-discoveries,QGEN,0.208017,Neutral,0.07891
"Global Long-Acting Beta-Agonists Market to Grow at a CAGR of ~9% During 2022-2031; Prevalence of Lung Diseases, such as, Chronic Obstructive Pulmonary Disease  ( COPD )  to Drive the Market Growth",20220728T141211,https://www.benzinga.com/pressreleases/22/07/g28247616/global-long-acting-beta-agonists-market-to-grow-at-a-cagr-of-9-during-2022-2031-prevalence-of-lung,QGEN,0.021504,Neutral,0.149513
"Global Immune Repertoire Sequencing Market to Grow at a CAGR 0f ~6% During 2022-2031; Prevalence of Cancer and Autoimmune Disorders, along with Increasing Novel Products Development to drive the Market Growth",20220725T134929,https://www.benzinga.com/pressreleases/22/07/g28187680/global-immune-repertoire-sequencing-market-to-grow-at-a-cagr-0f-6-during-2022-2031-prevalence-of-c,QGEN,0.023579,Somewhat-Bullish,0.151176
Next Generation Sequencing Market to Reach $33.73 billion By 2028 Thanks to Increased Attention Early Disease Diagnosis and High Prevalence of Cancer,20220713T124943,https://www.benzinga.com/pressreleases/22/07/g28048698/next-generation-sequencing-market-to-reach-33-73-billion-by-2028-thanks-to-increased-attention-ear,QGEN,0.018861,Neutral,0.0
PACB: Is Pacific Biosciences of California a Winner in the Diagnostics & Research Industry?,20220426T122905,https://stocknews.com/news/pacb-co-qgen-a-is-pacific-biosciences-of-california-a-winner-in-the-diagnostics/,QGEN,0.141351,Neutral,0.13371
"Illumina  ( ILMN )  Hurt by Rising Costs, Tough Competition",20220414T124400,https://www.zacks.com/stock/news/1899454/illumina-ilmn-hurt-by-rising-costs-tough-competition,QGEN,0.052836,Neutral,0.009935
Illumina  ( ILMN )  Invests in Seven Additional Genomics Startups,20220318T140800,https://www.zacks.com/stock/news/1884021/illumina-ilmn-invests-in-seven-additional-genomics-startups,QGEN,0.20279,Neutral,-0.006842
"Nasdaq, S&P 500 Futures Rise Cautiously: What's Moving Futures - Invesco QQQ Trust, Series 1  ( NASDAQ:QQQ ) , SPDR S&P 500  ( ARCA:SPY ) ",20240429T105421,https://www.benzinga.com/news/earnings/24/04/38484884/us-stocks-set-to-approach-new-week-with-caution-ahead-of-fed-meeting-tech-earnings-analyst-says-buy,QGEN,0.092036,Neutral,0.0
"Will Earnings Cheer Continue To Buoy Markets? Apple, Amazon, Pfizer, Coinbase Lead Flurry Of Q1 Reports This Week - Invesco QQQ Trust, Series 1  ( NASDAQ:QQQ ) , SPDR S&P 500  ( ARCA:SPY ) ",20240429T055121,https://www.benzinga.com/news/earnings/24/04/38481553/will-earnings-cheer-continue-to-buoy-markets-apple-amazon-pfizer-coinbase-lead-flurry-of-q1-reports,QGEN,0.069294,Neutral,0.0
