title,time_published,url,ticker,relevance_score,ticker_sentiment_label,ticker_sentiment_score
Stocks That Hit 52-Week Lows On Friday,20220506T160650,https://www.benzinga.com/markets/options/22/05/27050916/52-weeks-high-and-low-article,RARE,0.005467,Neutral,-0.014996
This Healthcare Stock Is Trading Lower By 29%: Here Are 29 Stocks Moving Premarket,20220818T112324,https://www.benzinga.com/news/22/08/28547830/this-healthcare-stock-is-trading-lower-by-29-here-are-29-stocks-moving-premarket,RARE,0.070414,Neutral,0.098464
"The Week Ahead In Biotech: Gene & Cell Therapy Conference, Tapering Earnings News, OKYO Pharma IPO And More",20220516T133825,https://www.benzinga.com/general/biotech/22/05/27217168/the-week-ahead-in-biotech-may-16-21-gene-cell-therapy-conference-presentations-tapering-earnings-,RARE,0.122362,Neutral,0.000545
Biotech ETFs to Watch,20240311T211500,https://investingnews.com/daily/life-science-investing/biotech-investing/small-biotech-etfs/,RARE,0.075635,Neutral,0.042374
"Stocks That Hit 52-Week Lows On Tuesday - SoundHound AI  ( NASDAQ:SOUN ) , Sonnet BioTherapeutics  ( NASDAQ:SONN ) ",20221122T154845,https://www.benzinga.com/news/22/11/29825126/stocks-that-hit-52-week-lows-on-tuesday,RARE,0.028072,Neutral,-0.107471
"Stocks That Hit 52-Week Lows On Monday - Tesla  ( NASDAQ:TSLA ) , ALFI  ( NASDAQ:ALF ) ",20221024T154117,https://www.benzinga.com/news/22/10/29381725/stocks-that-hit-52-week-lows-on-monday,RARE,0.011989,Neutral,-0.113048
Alkermes Issues Letter to Shareholders Highlighting Skills and Experience of Refreshed Board of Directors - Alkermes  ( NASDAQ:ALKS ) ,20230613T110000,https://www.benzinga.com/pressreleases/23/06/n32831446/alkermes-issues-letter-to-shareholders-highlighting-skills-and-experience-of-refreshed-board-of-di,RARE,0.019102,Neutral,0.0
"The Daily Biotech Pulse: Pfizer-BioNTech's COVID-19 Booster For Kids 5-11 Coming Soon, Ultragenyx In-Licenses Gene Therapy For Genetic Disorder, Ampio's AP-013 Trial Under Independent Investigation",20220517T130455,https://www.benzinga.com/general/biotech/22/05/27249090/the-daily-biotech-pulse-pfizer-biontechs-covid-19-booster-for-5-11-year-kids-soon-ultragenyx-in-l,RARE,0.178426,Neutral,0.016429
