title,time_published,url,ticker,relevance_score,ticker_sentiment_label,ticker_sentiment_score
Why Luxury Brands Must Control Their Own Recommerce Channel,20220408T133000,https://www.forbes.com/sites/patrickbousquet-chavanne/2022/04/08/why-luxury-brands-must-control-their-own-recommerce-channel/,REAL,0.112322,Neutral,-0.01036
5 First-Rate Retail Stocks the Pros Love,20220406T190423,https://www.kiplinger.com/investing/stocks/604511/first-rate-retail-stocks-the-pros-love,REAL,0.154384,Neutral,0.024731
"Teens are worried about the U.S. economy, but they're still spending on Nike and Lululemon",20220406T080002,https://www.cnbc.com/2022/04/06/teens-spend-on-nike-and-lululemon-despite-concerns-about-us-economy.html,REAL,0.049598,Neutral,0.002275
A Sea of Fakes? Combating Counterfeit NFTs on OpenSea,20220405T144805,https://decrypt.co/96913/a-sea-of-fakes-combating-counterfeit-nfts-on-opensea,REAL,0.035619,Neutral,0.112537
Evening gowns are the latest supply chain victim,20220326T110029,https://www.fastcompany.com/90734896/evening-gown-shortage-supply-chain-oscars,REAL,0.037604,Somewhat-Bearish,-0.255448
"Here's Why These Ultra-Rare Eminem Nike Air Max 97s Cost $50,000  ( Photos ) ",20220322T211501,https://www.forbes.com/sites/carlieporterfield/2022/03/22/heres-why-these-ultra-rare-eminem-nike-air-max-97s-cost-50000-photos/,REAL,0.295599,Neutral,0.111154
RealReal Reveals 2025 Financial Goals; Sees $5B GMV,20220322T160809,https://www.benzinga.com/news/22/03/26242687/realreal-reveals-2025-financial-goals-sees-5b-gmv,REAL,0.742397,Neutral,-0.00775
The RealReal Announces Vision 2025 Financial Targets at Investor Day 2022,20220322T130500,https://www.globenewswire.com/news-release/2022/03/22/2407713/0/en/The-RealReal-Announces-Vision-2025-Financial-Targets-at-Investor-Day-2022.html,REAL,0.301825,Somewhat-Bullish,0.313214
Strength Seen in The RealReal  ( REAL ) : Can Its 7.8% Jump Turn into More Strength?,20220321T091800,https://www.zacks.com/stock/news/1884469/strength-seen-in-the-realreal-real-can-its-78-jump-turn-into-more-strength,REAL,0.543935,Neutral,0.129033
Marrying Consumer Expectations With Values,20220318T194142,https://www.forbes.com/sites/gregpetro/2022/03/18/marrying-consumer-expectations-with-values/,REAL,0.045786,Neutral,-0.023019
"Stocks making the biggest moves midday: GameStop, Tesla, FedEx and more",20220318T163340,https://www.cnbc.com/2022/03/18/stocks-making-the-biggest-moves-midday-gamestop-tesla-and-more.html,REAL,0.086807,Neutral,0.007789
"After Earnings Whiff, Maybe Warby Parker Can Learn Something From Old-School DTC Brands",20220317T195545,https://www.forbes.com/sites/stevendennis/2022/03/17/after-earnings-whiff-maybe-warby-parker-can-learn-something-from-old-school-dtc-brands/,REAL,0.06141,Somewhat-Bearish,-0.252673
Why The RealReal Faces Real Challenges,20220311T125900,https://www.fool.com/investing/2022/03/11/why-the-realreal-faces-real-challenges/,REAL,0.633961,Neutral,-0.123837
Cramer cautions investors to avoid these 4 retail stocks that recently went public,20220304T234957,https://www.cnbc.com/2022/03/04/cramer-cautions-investors-to-avoid-these-4-retail-stocks-that-recently-went-public.html,REAL,0.089965,Bearish,-0.756545
