title,time_published,url,ticker,relevance_score,ticker_sentiment_label,ticker_sentiment_score
"The Daily Biotech Pulse: Pfizer Inks Pact With Africa For COVID-19 Pills, Emergent Bio & Ridgeback To Increase Access To Ebola Treatment, ADC Therapeutics & Sobi In European Pact For Lymphoma Drug",20220708T121902,https://www.benzinga.com/general/biotech/22/07/27998206/the-daily-biotech-pulse-pfizer-inks-pact-with-africa-for-covid-19-pills-emergent-bio-ridgeback-to,RVLP,0.126985,Neutral,0.001252
"Earnings Scheduled For May 12, 2022",20220512T085523,https://www.benzinga.com/news/earnings/22/05/27156592/earnings-scheduled-for-may-12-2022,RVLP,0.017681,Neutral,-0.009918
"Why Intelligent Bio Solutions Shares Are Trading Lower By Around 55%? Here Are Other Stocks Moving In Monday's Mid-Day Session - AERWINS Technologies  ( NASDAQ:AWIN ) , Arch Resources  ( NYSE:ARCH ) ",20231002T170027,https://www.benzinga.com/news/23/10/35037344/why-intelligent-bio-solutions-shares-are-trading-lower-by-around-55-here-are-other-stocks-moving-in,RVLP,0.113062,Somewhat-Bullish,0.347349
"Why Streamline Health Solutions Shares Are Trading Lower By Over 68%? Here Are Other Stocks Moving In Monday's Mid-Day Session - Aldeyra Therapeutics  ( NASDAQ:ALDX ) , Alignment Healthcare  ( NASDAQ:ALHC ) ",20231016T170953,https://www.benzinga.com/news/23/10/35272489/why-streamline-health-solutions-shares-are-trading-lower-by-over-68-here-are-other-stocks-moving-in,RVLP,0.114137,Neutral,-0.118813
"The Week Ahead In Biotech  ( March 27-April 2 ) : Lipocine, Akebia, Merck Await FDA Verdicts, Adcom Test For Amylyx, BioNTech Earnings And More",20220327T204003,https://www.benzinga.com/general/biotech/22/03/26313832/the-week-ahead-in-biotech-march-27-april-2-lipocine-akebia-merck-await-fda-verdicts-adcom-test-fo,RVLP,0.074856,Neutral,0.003282
"Why Talaris Therapeutics Shares Are Trading Higher By Around 8%; Here Are 20 Stocks Moving Premarket - Biocept  ( NASDAQ:BIOC ) , Advent Technologies Hldgs  ( NASDAQ:ADN ) ",20231018T121855,https://www.benzinga.com/news/23/10/35305719/why-talaris-therapeutics-shares-are-trading-higher-by-around-8-here-are-20-stocks-moving-premarket,RVLP,0.213048,Neutral,0.026662
"US Stocks Edge Lower; Consumer Price Index Increases 0.4% For September - OpGen  ( NASDAQ:OPGN ) , RVL Pharmaceuticals  ( NASDAQ:RVLP ) ",20231012T134642,https://www.benzinga.com/news/earnings/23/10/35220688/us-stocks-edge-lower-consumer-price-index-increases-0-4-for-september,RVLP,0.208764,Somewhat-Bullish,0.201516
