title,time_published,url,ticker,relevance_score,ticker_sentiment_label,ticker_sentiment_score
"C.H. Robinson Worldwide Posts Upbeat Results, Joins Avis Budget Group, Qualcomm, BorgWarner, Moderna And Other Big Stocks Moving Higher On Thursday - C.H. Robinson Worldwide  ( NASDAQ:CHRW ) , Qualcomm  ( NASDAQ:QCOM ) ",20240502T142829,https://www.benzinga.com/news/24/05/38586333/c-h-robinson-worldwide-posts-upbeat-results-joins-avis-budget-group-qualcomm-borgwarner-moderna-and,SEE,0.124164,Somewhat-Bullish,0.271436
"Starbucks, Teleflex, Roku, Shopify And Other Big Stocks Moving Higher On Thursday - Arcellx  ( NASDAQ:ACLX ) , ADT  ( NYSE:ADT ) ",20231102T150148,https://www.benzinga.com/news/23/11/35566540/starbucks-teleflex-roku-shopify-and-other-big-stocks-moving-higher-on-thursday,SEE,0.114409,Somewhat-Bullish,0.273787
"Earnings Scheduled For May 3, 2022",20220503T085235,https://www.benzinga.com/news/earnings/22/05/26953640/earnings-scheduled-for-may-3-2022,SEE,0.01558,Neutral,-0.001404
"Stocks That Hit 52-Week Lows On Wednesday - Bristol-Myers Squibb Company Common Stock  ( NYSE:BMY ) , SenesTech, Inc. - Common Stock  ( NASDAQ:SNES ) ",20231004T160117,https://www.benzinga.com/markets/options/23/10/35092508/stocks-that-hit-52-week-lows-on-wednesday,SEE,0.012708,Neutral,-0.07919
"Apple investor day, Powell testimony, jobs report top week ahead",20230305T185259,https://www.foxbusiness.com/markets/apple-investor-day-powell-testimony-jobs-report-top-week-ahead,SEE,0.047278,Neutral,0.0
"Stocks That Hit 52-Week Lows On Thursday - PRA Group  ( NASDAQ:PRAA ) , Perimeter Solutions  ( NYSE:PRM ) ",20231005T172202,https://www.benzinga.com/news/23/10/35111787/stocks-that-hit-52-week-lows-on-thursday,SEE,0.013047,Neutral,0.00436
