title,time_published,url,ticker,relevance_score,ticker_sentiment_label,ticker_sentiment_score
Stocks That Hit 52-Week Lows On Monday,20220613T161842,https://www.benzinga.com/markets/options/22/06/27677156/52-weeks-high-and-low-article,SF,0.005366,Neutral,-0.023907
StockNews.com Issues Hold Rating for United Fire Group  ( NASDAQ:UFCS ) : A Closer Look at the Insurance Provider's Latest Earnings Report and Resilient Fundamentals,20230519T064026,https://beststocks.com/stocknews-com-issues-hold-rating-for-united-fire-g/,SF,0.042876,Somewhat-Bullish,0.168887
CB Financial Services  ( NASDAQ:CBFV )  Research Coverage Started at StockNews.com,20230609T055846,https://www.defenseworld.net/2023/06/09/cb-financial-services-nasdaqcbfv-research-coverage-started-at-stocknews-com.html,SF,0.110462,Somewhat-Bullish,0.152461
"KBW Announces Index Rebalancing for Fourth-Quarter 2023 - American Assets Trust  ( NYSE:AAT ) , Ares Comml Real Est  ( NYSE:ACRE ) ",20231209T013000,https://www.benzinga.com/pressreleases/23/12/g36164737/kbw-announces-index-rebalancing-for-fourth-quarter-2023,SF,0.082963,Neutral,0.04385
"Premarket Movers: Asana, CrowdStrike Holdings, Rockwell Automation",20220310T123000,https://www.barrons.com/articles/premarket-movers-asana-crowdstrike-holdings-rockwell-automation-01646915437,SF,0.800175,Neutral,-0.001149
