title,time_published,url,ticker,relevance_score,ticker_sentiment_label,ticker_sentiment_score
Stitch Fix  ( SFIX )  Q3 2023 Earnings Call Transcript,20230607T043028,https://www.fool.com/earnings/call-transcripts/2023/06/07/stitch-fix-sfix-q3-2023-earnings-call-transcript/,SFIX,0.030277,Neutral,0.081836
Stitch Fix to explore exiting UK market in 2024,20230606T222400,https://www.reuters.com/business/retail-consumer/stitch-fix-explore-exiting-uk-market-2024-2023-06-06/,SFIX,0.512093,Neutral,0.035937
"Stitch Fix  ( SFIX )  Reports Q3 Loss, Tops Revenue Estimates",20230606T212507,https://www.zacks.com/stock/news/2104718/stitch-fix-sfix-reports-q3-loss-tops-revenue-estimates,SFIX,0.397098,Neutral,0.097088
"Stitch Fix stock rallies as results beat, and company takes further steps to pare back",20230606T203400,https://www.marketwatch.com/story/stitch-fix-stock-rallies-as-results-beat-and-company-takes-further-steps-to-pare-back-1ae1bc0,SFIX,0.461283,Neutral,0.04554
Stitch Fix Announces Third Quarter of Fiscal Year 2023 Financial Results,20230606T200500,https://www.globenewswire.com/news-release/2023/06/06/2683319/0/en/Stitch-Fix-Announces-Third-Quarter-of-Fiscal-Year-2023-Financial-Results.html,SFIX,0.182921,Somewhat-Bullish,0.17254
Bernstein just released one of its famous 'blackbook' research reports. This one is about how to invest in AI. Here are the highlights.,20230606T090000,https://www.businessinsider.com/how-to-invest-in-ai-bernstein-blackbook-2023-6,SFIX,0.056011,Neutral,0.038061
"EPAM Systems, Amyris, Blueprint Medicines And Other Big Stocks Moving Lower On Monday - Amyris  ( NASDAQ:AMRS ) , DMC Glb  ( NASDAQ:BOOM ) ",20230605T153030,https://www.benzinga.com/news/23/06/32718538/epam-systems-amyris-blueprint-medicines-and-other-big-stocks-moving-lower-on-monday,SFIX,0.245339,Neutral,0.0
"Week Ahead: Oil Cuts, Jobless Claims, and Consumer Packaged Goods Earnings",20230605T132601,https://moneymorning.com/2023/06/05/week-ahead-oil-cuts-jobless-claims-and-consumer-packaged-goods-earnings/,SFIX,0.098659,Neutral,-0.134676
"Apple conference, OPEC's oil cut, Nasdaq at 2023 high in week ahead",20230604T223822,https://www.foxbusiness.com/markets/apple-conference-saudis-oil-cut-nasdaq-hits-2023-high-top-week-ahead,SFIX,0.073546,Neutral,0.0
"Big Tech is driving corporate earnings, and buoying expectations for coming months",20230604T171400,https://www.marketwatch.com/story/big-tech-is-driving-corporate-earnings-and-buoying-expectations-for-coming-months-b66b2c0c,SFIX,0.109206,Neutral,-0.023908
3 Cheap Tech Stocks to Buy Right Now,20230604T124300,https://www.fool.com/investing/2023/06/04/3-cheap-tech-stocks-to-buy-right-now/,SFIX,0.269181,Somewhat-Bullish,0.276122
"Tilly's  ( TLYS )  Reports Q1 Loss, Misses Revenue Estimates",20230601T213507,https://www.zacks.com/stock/news/2102831/tillys-tlys-reports-q1-loss-misses-revenue-estimates,SFIX,0.138863,Neutral,0.0
Hibbett  ( HIBB )  Lags Q1 Earnings Estimates,20230526T114503,https://www.zacks.com/stock/news/2100074/hibbett-hibb-lags-q1-earnings-estimates,SFIX,0.138863,Neutral,0.0
Stitch Fix Announces Date for Third Quarter 2023 Earnings Release and Conference Call - Stitch Fix  ( NASDAQ:SFIX ) ,20230523T200539,https://www.benzinga.com/pressreleases/23/05/g32539987/stitch-fix-announces-date-for-third-quarter-2023-earnings-release-and-conference-call,SFIX,0.705799,Bullish,0.434582
Stitch Fix Announces Date for Third Quarter 2023 Earnings Release and Conference Call,20230523T200500,https://www.globenewswire.com/news-release/2023/05/23/2674791/0/en/Stitch-Fix-Announces-Date-for-Third-Quarter-2023-Earnings-Release-and-Conference-Call.html,SFIX,0.733479,Bullish,0.447224
Get trendy clothes dropped off at your door each week with Charlotte clothing company Adla,20230517T082935,https://charlotte.axios.com/329396/get-trendy-clothes-dropped-off-at-your-door-each-week-with-charlotte-clothing-company-adla/,SFIX,0.055881,Neutral,0.012
"Top 5 Consumer Stocks That May Rocket Higher This Month - 1-800-Flowers.com  ( NASDAQ:FLWS ) , GoPro  ( NASDAQ:GPRO ) ",20230505T124636,https://www.benzinga.com/trading-ideas/long-ideas/23/05/32237936/top-5-consumer-stocks-that-may-rocket-higher-this-month,SFIX,0.402941,Neutral,0.108029
2 Absurdly Cheap Stocks That Could Double Your Money,20230428T090500,https://moneymorning.com/investing/2-absurdly-cheap-stocks-that-could-double-your-money/,SFIX,0.526455,Somewhat-Bullish,0.273527
2 Absurdly Cheap Stocks That Could Double Your Money,20230428T090500,https://www.fool.com/investing/2023/04/28/2-absurdly-cheap-stocks-could-double-money/,SFIX,0.288408,Somewhat-Bullish,0.167087
2023 layoff tracker: The latest on which companies have announced job cuts | Business,20230425T190700,https://www.cnn.com/2023/04/25/business/layoffs-2023/index.html,SFIX,0.026241,Neutral,0.061698
Gap  ( GPS )  Partners with Mattel to Enhance Collection,20230420T202000,https://www.zacks.com/stock/news/2082394/gap-gps-partners-with-mattel-to-enhance-collection,SFIX,0.222327,Neutral,0.13428
Five Below  ( FIVE )  Rides High on Strategies: Should You Retain?,20230420T121500,https://www.zacks.com/stock/news/2081912/five-below-five-rides-high-on-strategies-should-you-retain,SFIX,0.221819,Neutral,0.134038
"Signet  ( SIG )  Rides on Omnichannel Efforts, Up 42.5% in 6 Months",20230419T142900,https://www.zacks.com/stock/news/2081424/signet-sig-rides-on-omnichannel-efforts-up-425-in-6-months,SFIX,0.206245,Neutral,0.126639
Big Lots'  ( BIG )  Omnichannel Endeavors Appear Encouraging,20230414T140200,https://www.zacks.com/stock/news/2078919/big-lots-big-omnichannel-endeavors-appear-encouraging,SFIX,0.136888,Neutral,0.107103
Macy's  ( M )  Omnichannel Initiatives Appear Encouraging,20230414T135500,https://www.zacks.com/stock/news/2078910/macys-m-omnichannel-initiatives-appear-encouraging,SFIX,0.153145,Neutral,0.114369
"Sportsman's Warehouse  ( SPWH )  Earnings Beat in Q4, Sales Down",20230413T162700,https://www.zacks.com/stock/news/2078464/sportsmans-warehouse-spwh-earnings-beat-in-q4-sales-down,SFIX,0.162437,Neutral,0.129643
Best Buy's  ( BBY )  Omnichannel Moves Appear Encouraging,20230413T140700,https://www.zacks.com/stock/news/2078316/best-buys-bby-omnichannel-moves-appear-encouraging,SFIX,0.142847,Neutral,0.10969
Buckle  ( BKE )  Comparable Store Net Sales Fall 10.1% in March,20230411T121500,https://www.zacks.com/stock/news/2076824/buckle-bke-comparable-store-net-sales-fall-101-in-march,SFIX,0.179788,Neutral,0.139011
Why Is Stitch Fix  ( SFIX )  Down 5.3% Since Last Earnings Report?,20230406T153009,https://www.zacks.com/stock/news/2075653/why-is-stitch-fix-sfix-down-53-since-last-earnings-report,SFIX,0.682689,Neutral,-0.124284
Nasdaq ETFs Log Best Quarter Since 2020: What Lies Ahead?,20230406T140000,https://www.zacks.com/stock/news/2075579/nasdaq-etfs-log-best-quarter-since-2020-what-lies-ahead,SFIX,0.064973,Neutral,0.123611
It's Early Days for Alibaba's Potential Breakup,20230401T130000,https://www.fool.com/investing/2023/04/01/its-early-days-for-alibabas-potential-breakup/,SFIX,0.011169,Neutral,0.069801
Are Tech ETFs Safe Bets Amid Banking Crisis?,20230329T130000,https://www.zacks.com/stock/news/2071779/are-tech-etfs-safe-bets-amid-banking-crisis,SFIX,0.069294,Neutral,0.011181
American Eagle  ( AEO )  Progresses on Growth Plans: Apt to Hold?,20230328T131600,https://www.zacks.com/stock/news/2071373/american-eagle-aeo-progresses-on-growth-plans-apt-to-hold,SFIX,0.153715,Neutral,0.058151
Proceed With Caution When Considering These 5 Ultra-Popular Stocks,20230327T162539,https://www.fool.com/investing/2023/03/27/proceed-with-caution-on-ultra-popular-stocks/,SFIX,0.144275,Somewhat-Bullish,0.171644
Silicon Valley Bank Bust Ripples Through Retail Industry,20230324T142319,https://www.forbes.com/sites/gregpetro/2023/03/24/silicon-valley-bank-bust-ripples-through-retail-industry/,SFIX,0.087824,Neutral,-0.052156
"Nordstrom, Neiman Marcus and other brands were buying clothes from a 'sweatshop' that paid just $1.58 an hour - in California",20230323T230242,https://www.businessinsider.com/nordstrom-neiman-marcus-supplier-paid-california-workers-158hour-2023-3,SFIX,0.057907,Neutral,-0.041
The CTO of a climate-tech company shares a 3-part approach to technology that can improve employee recruitment and performance,20230323T161500,https://www.businessinsider.com/employee-recruitment-performance-technology-nick-reavill-interview-2023-3,SFIX,0.040416,Neutral,0.070676
SVB collapse is double-whammy for tech startups already navigating brutal market,20230319T130001,https://www.cnbc.com/2023/03/19/svb-fail-is-double-whammy-for-startups-dealing-with-plunge-in-venture-.html,SFIX,0.023981,Neutral,0.037257
Consumers Have Strained From Non-Necessity Retailers - Macy's  ( NYSE:M ) ,20230313T143622,https://www.benzinga.com/markets/penny-stocks/23/03/31322193/consumers-have-strained-from-non-necessity-retailers,SFIX,0.216473,Neutral,-0.005289
"Regional banks pace decliners, as biotech deals lift Seagen and Provention Bio",20230313T143200,https://www.marketwatch.com/story/regional-banks-pace-decliners-as-biotech-deals-lift-seagen-and-provention-bio-78a5d161,SFIX,0.485711,Bullish,0.43989
3 Stocks to Avoid This Week,20230313T121500,https://www.fool.com/investing/2023/03/13/3-stocks-to-avoid-this-week/,SFIX,0.064449,Neutral,-0.088339
Stitch Fix Stock Is Down 95% From Its High. Time to Buy?,20230310T103500,https://www.fool.com/investing/2023/03/10/stitch-fix-stock-is-down-95-from-its-high-time-to/,SFIX,0.378572,Neutral,-0.021499
"Why Shopify, CrowdStrike, and Roku Slumped Thursday -- but Shouldn't Have",20230309T203506,https://www.fool.com/investing/2023/03/09/why-shopify-crowdstrike-and-roku-slumped-thursday/,SFIX,0.053749,Neutral,0.110014
Stock Market Today: Stocks Choppy After Strong Jobs Data,20230308T211510,https://www.kiplinger.com/investing/stocks/stock-market-today-030823-stocks-choppy-after-strong-jobs-data,SFIX,0.101797,Neutral,-0.049941
Dow and S&P 500: Stocks close mixed after Powell's testimony and fresh jobs data,20230308T192100,https://www.cnn.com/business/live-news/stock-market-house-testimony-jerome-powell-030823/index.html,SFIX,0.020866,Neutral,-0.052149
"Stitch Fix 'Is Not the Stock You're Looking for,' Analyst Says. Here's Why.",20230308T183200,https://www.barrons.com/articles/stitch-fix-earnings-stock-price-analyst-rating-1bc2f4d0,SFIX,0.608634,Neutral,0.0
"Stocks making the biggest moves midday: Stitch Fix, Tesla, WeWork, Campbell Soup and more",20230308T180631,https://www.cnbc.com/2023/03/08/stocks-making-the-biggest-moves-midday-stitch-fix-tesla-wework-campbell-soup-and-more.html,SFIX,0.082677,Neutral,-0.004283
Why These Stitch Fix Analysts Are Disappointed With Fiscal Q2 Print - Stitch Fix  ( NASDAQ:SFIX ) ,20230308T161006,https://www.benzinga.com/analyst-ratings/analyst-color/23/03/31258753/why-these-stitch-fix-analysts-are-disappointed-with-fiscal-q2-print,SFIX,0.73856,Somewhat-Bullish,0.256096
Roku Ropes In Stitch Fix's Dan Jedda As New CFO; The Former Amazon Veteran Succeeds Steve Loudon - Roku  ( NASDAQ:ROKU ) ,20230308T160822,https://www.benzinga.com/news/23/03/31259088/roku-ropes-in-stitch-fixs-dan-jedda-as-new-cfo-the-former-amazon-veteran-succeeds-steve-loudon,SFIX,0.751437,Somewhat-Bullish,0.231255
"Stitch Fix 'Is Not the Stock You're Looking for,' Analyst Says. Here's Why.",20230308T144900,https://www.barrons.com/articles/stitch-fix-stock-earnings-outlook-1bc2f4d0,SFIX,0.608634,Neutral,0.0
"Jim Cramer's top 10 things to watch in the stock market Wednesday: Powell Day 2, strong jobs",20230308T142532,https://www.cnbc.com/2023/03/08/jim-cramers-top-10-things-wednesday-powell-day-2-strong-jobs.html,SFIX,0.116914,Neutral,-0.14534
Stitch Fix  ( SFIX )  Q2 Loss Widens & Revenues Decrease Y/Y,20230308T134800,https://www.zacks.com/stock/news/2062899/stitch-fix-sfix-q2-loss-widens-revenues-decrease-yy,SFIX,0.626755,Somewhat-Bearish,-0.231159
"Stocks making the biggest premarket moves: CrowdStrike, Occidental Petroleum, Tesla and more",20230308T130232,https://www.cnbc.com/2023/03/08/stocks-making-the-biggest-premarket-moves-crwd-oxy-tsla.html,SFIX,0.267804,Neutral,0.102119
"Stitch Fix, SoundHound And Other Big Stocks Moving Lower In Wednesday's Pre-Market Session - New Oriental Education  ( NYSE:EDU ) , Etao International Co  ( NASDAQ:ETAO ) ",20230308T112216,https://www.benzinga.com/news/23/03/31253716/stitch-fix-soundhound-and-other-big-stocks-moving-lower-in-wednesdays-pre-market-session,SFIX,0.380978,Neutral,-0.044961
"Campbell Soup, United Natural Foods And 3 Stocks To Watch Heading Into Wednesday - ABM Indus  ( NYSE:ABM ) , Couchbase  ( NASDAQ:BASE ) ",20230308T090324,https://www.benzinga.com/news/earnings/23/03/31252673/campbell-soup-united-natural-foods-and-3-stocks-to-watch-heading-into-wednesday,SFIX,0.47379,Neutral,-0.05214
Stitch Fix  ( SFIX )  Q2 2023 Earnings Call Transcript,20230308T043028,https://www.fool.com/earnings/call-transcripts/2023/03/07/stitch-fix-sfix-q2-2023-earnings-call-transcript/,SFIX,0.110462,Somewhat-Bullish,0.15804
2 After-Hours Stock Movers You Can't Afford to Miss,20230308T001000,https://www.fool.com/investing/2023/03/07/2-after-hours-stock-movers-you-cant-afford-to-miss/,SFIX,0.395012,Somewhat-Bullish,0.25483
"Stitch Fix  ( SFIX )  Reports Q2 Loss, Lags Revenue Estimates",20230307T222507,https://www.zacks.com/stock/news/2062673/stitch-fix-sfix-reports-q2-loss-lags-revenue-estimates,SFIX,0.398148,Somewhat-Bullish,0.178305
"Stocks making the biggest moves after hours: CrowdStrike, Stitch Fix and more",20230307T221309,https://www.cnbc.com/2023/03/07/stocks-moving-big-after-hours-crwd-sfix-crct.html,SFIX,0.149656,Neutral,-0.092631
"Stitch Fix Misses On Q2 Earnings: Restructuring Details, Guidance Updates, The Plan For 'Return To Growth' And More - Stitch Fix  ( NASDAQ:SFIX ) ",20230307T214028,https://www.benzinga.com/news/earnings/23/03/31246884/stitch-fix-misses-on-q2-earnings-restructuring-details-guidance-updates-the-plan-for-return-to-grow,SFIX,0.89767,Somewhat-Bullish,0.305428
"Stitch Fix stock falls on weaker-than-expected sales outlook, executive shake-up",20230307T213000,https://www.marketwatch.com/story/stitch-fix-stock-falls-on-weaker-than-expected-sales-outlook-executive-shake-up-4a7ca8ce,SFIX,0.724687,Neutral,-0.120294
Stitch Fix Announces Second Quarter of Fiscal Year 2023 Financial Results: Raises Full Year FY23 Adj. EBITDA Guidance; Announces CFO Transition,20230307T210500,https://www.globenewswire.com/news-release/2023/03/07/2622566/0/en/Stitch-Fix-Announces-Second-Quarter-of-Fiscal-Year-2023-Financial-Results-Raises-Full-Year-FY23-Adj-EBITDA-Guidance-Announces-CFO-Transition.html,SFIX,0.240291,Somewhat-Bullish,0.220277
"Can Stitch Fix Sew Together An Upside Earnings Surprise, Or Will It Miss Estimates For The Fourth Quarter In A Row? - Stitch Fix  ( NASDAQ:SFIX ) ",20230307T141433,https://www.benzinga.com/news/earnings/23/03/31225408/can-stitch-fix-sew-together-an-upside-earnings-surprise-or-miss-estimates-for-the-fourth-quarter-in,SFIX,0.716023,Somewhat-Bullish,0.212486
Monday's Market Minute: Another Busy Week,20230306T192332,https://www.benzinga.com/markets/23/03/31224309/mondays-market-minute-another-busy-week,SFIX,0.234684,Neutral,0.056014
Stitch Fix  ( SFIX )  to Report Q2 Earnings: What's in the Offing?,20230306T160200,https://www.zacks.com/stock/news/2062230/stitch-fix-sfix-to-report-q2-earnings-whats-in-the-offing,SFIX,0.407844,Neutral,0.019867
"Apple investor day, Powell testimony, jobs report top week ahead",20230305T185259,https://www.foxbusiness.com/markets/apple-investor-day-powell-testimony-jobs-report-top-week-ahead,SFIX,0.047278,Neutral,0.0
3 Stocks to Avoid This Week,20230305T140000,https://www.fool.com/investing/2023/03/05/3-stocks-to-avoid-this-week/,SFIX,0.400531,Neutral,0.113408
Best Penny Stocks This Week? 4 Short Squeeze Stocks To Watch,20230222T173500,https://pennystocks.com/featured/2023/02/22/best-penny-stocks-this-week-4-short-squeeze-stocks-to-watch-february-2023/,SFIX,0.167787,Neutral,-0.124535
Stitch Fix Announces Date for Second Quarter 2023 Earnings Release and Conference Call - Stitch Fix  ( NASDAQ:SFIX ) ,20230221T210551,https://www.benzinga.com/pressreleases/23/02/g30995835/stitch-fix-announces-date-for-second-quarter-2023-earnings-release-and-conference-call,SFIX,0.705799,Bullish,0.434582
Retailers could face cost cuts and slower sales this year,20230219T130002,https://www.cnbc.com/2023/02/19/walmart-home-depot-earnings-preview.html,SFIX,0.038101,Neutral,-0.091633
Retailers are hoarding labor even as tech layoffs mount,20230214T110000,https://www.businessinsider.com/retailers-labor-hoarding-layoffs-economic-downturn-explained-2023-2,SFIX,0.046184,Neutral,-0.09987
"What a typical game day looks like for an NFL cheerleader, from a 4:30 a.m. wake up call to a full glam team",20230212T211724,https://africa.businessinsider.com/sports/what-a-typical-game-day-looks-like-for-an-nfl-cheerleader-from-a-430-am-wake-up-call/6kfhk99,SFIX,0.085324,Neutral,0.115019
"Stitch Fix  ( SFIX )  May Find a Bottom Soon, Here's Why You Should Buy the Stock Now",20230208T145502,https://www.zacks.com/stock/news/2051663/stitch-fix-sfix-may-find-a-bottom-soon-heres-why-you-should-buy-the-stock-now,SFIX,0.420316,Bullish,0.386763
"Despite Fast-paced Momentum, Stitch Fix  ( SFIX )  Is Still a Bargain Stock",20230208T135008,https://www.zacks.com/stock/news/2051520/despite-fast-paced-momentum-stitch-fix-sfix-is-still-a-bargain-stock,SFIX,0.657566,Bullish,0.471482
Why Stitch Fix Is Sewing Up a 9% Gain This Week,20230203T163440,https://www.fool.com/investing/2023/02/03/why-stitch-fix-is-sewing-up-a-9-gain-this-week/,SFIX,0.672712,Somewhat-Bullish,0.349602
Here's Why Stitch Fix Stock Skyrocketed Nearly 68% Last Month,20230202T200626,https://www.fool.com/investing/2023/02/02/heres-why-stitch-fix-stock-skyrocketed-nearly-68-l/,SFIX,0.845094,Neutral,0.098919
1 Sleeper Stock That Could Win Big in 2023,20230202T102000,https://www.fool.com/investing/2023/02/02/1-sleeper-stock-that-could-win-big-in-2023/,SFIX,0.507331,Neutral,0.101259
Why Stitch Fix Stock Popped Today,20230131T182100,https://www.fool.com/investing/2023/01/31/why-stitch-fix-stock-popped-today/,SFIX,0.533481,Bullish,0.451515
Dow Turns Higher; Nasdaq Jumps 100 Points,20230131T172024,https://www.benzinga.com/news/earnings/23/01/30648138/dow-turns-higher-nasdaq-jumps-100-points,SFIX,0.105372,Neutral,0.083476
"General Motors, Spotify, A. O. Smith And Other Big Stocks Moving Higher On Tuesday",20230131T165458,https://www.benzinga.com/news/23/01/30647636/general-motors-spotify-a-o-smith-and-other-big-stocks-moving-higher-on-tuesday,SFIX,0.185306,Bullish,0.484913
"Dada Nexus, Bilibili And Other Big Stocks Moving Lower On Monday",20230130T163633,https://www.benzinga.com/news/23/01/30625599/dada-nexus-bilibili-and-other-big-stocks-moving-lower-on-monday,SFIX,0.299478,Neutral,0.0
Could This Be Why Stitch Fix Stock Is Down Today?,20230125T194638,https://www.fool.com/investing/2023/01/25/could-this-be-why-stitch-fix-stock-is-down-today/,SFIX,0.868327,Somewhat-Bullish,0.309221
ETFs to Play Nasdaq's Fastest Start Since 2019,20230124T180000,https://www.zacks.com/stock/news/2043530/etfs-to-play-nasdaqs-fastest-start-since-2019,SFIX,0.069495,Neutral,0.009128
"Sharpie, Yankee Candle parent Newell Brands reducing its office jobs by 13%",20230123T200442,https://www.foxbusiness.com/economy/sharpie-yankee-candle-parent-newell-brands-reducing-office-jobs-13-percent-layoffs,SFIX,0.081552,Neutral,-0.08865
The Party Is Over: Party City Files For Chapter 11 Bankruptcy,20230123T184834,https://www.forbes.com/sites/qai/2023/01/23/the-party-is-over-party-city-files-for-chapter-11-bankruptcy/,SFIX,0.031241,Neutral,-0.005886
3 Bear Market Tech Stocks That Growth Investors Should Avoid,20230122T130000,https://www.fool.com/investing/2023/01/22/3-bear-market-tech-stocks-growth-investors-avoid/,SFIX,0.322608,Neutral,0.1303
Here are the companies that have laid off employees this year -- so far | Business,20230121T224300,https://www.cnn.com/2023/01/21/business/layoffs-google-vox-microsoft/,SFIX,0.0686,Neutral,0.065355
Here are the companies that have laid off employees this year -- so far | Business,20230121T224300,https://www.cnn.com/2023/01/21/business/layoffs-google-vox-microsoft/index.html,SFIX,0.0686,Neutral,0.065355
Wells Fargo Steps Back From Mortgage Market,20230121T131800,https://www.fool.com/investing/2023/01/21/wells-fargo-steps-back-from-mortgage-market/,SFIX,0.02561,Neutral,0.012985
"Google Cuts 12,000 Workers - 2023 Tech Layoffs Roundup",20230120T143908,https://www.forbes.com/sites/qai/2023/01/20/2023-tech-layoffs-roundupthe-cuts-so-far/,SFIX,0.089909,Neutral,0.004293
950 More Employees To Lose Their Jobs As Coinbase Goes For Another Round Of Layoffs,20230118T192134,https://www.forbes.com/sites/qai/2023/01/18/950-more-employees-to-lose-their-jobs-as-coinbase-goes-for-another-round-of-layoffs/,SFIX,0.02799,Neutral,0.090533
Stitch Fix's Unraveling Should Sow Broader Tech Doubts,20230117T120000,https://www.wsj.com/articles/stitch-fixs-unraveling-should-sow-broader-tech-doubts-11673756689,SFIX,0.240489,Neutral,0.148729
Stitch Fix  ( SFIX )  Gains 37.8% in Past 3 Months: Here's Why,20230116T140400,https://www.zacks.com/stock/news/2039604/stitch-fix-sfix-gains-378-in-past-3-months-heres-why,SFIX,0.419927,Bullish,0.520893
Layoff News: Stitch Fix To Replace CEO And Cut 20% Of Workforce,20230113T134500,https://www.forbes.com/sites/qai/2023/01/13/layoff-news-stitch-fix-to-replace-ceo-and-cut-20-of-workforce/,SFIX,0.407844,Neutral,0.050168
"The Zacks Analyst Blog Highlights SPDR S&P Semiconductor ETF, First Trust NASDAQ Technology Dividend Index Fund, Invesco S&P SmallCap Information Technology ETF, Defiance Quantum ETF and First Trust Indxx Metaverse ETF",20230113T100000,https://www.zacks.com/stock/news/2038831/the-zacks-analyst-blog-highlights-spdr-sp-semiconductor-etf-first-trust-nasdaq-technology-dividend-index-fund-invesco-sp-smallcap-information-technology-etf-defiance-quantum-etf-and-first-trust-indxx-metaverse-etf,SFIX,0.058188,Neutral,0.011034
3 Reasons Why Tech ETFs May Rebound in 2023,20230112T180000,https://www.zacks.com/stock/news/2038671/3-reasons-why-tech-etfs-may-rebound-in-2023,SFIX,0.068896,Neutral,0.011173
Why Stitch Fix Was Running 12% Higher This Week,20230112T170820,https://www.fool.com/investing/2023/01/12/why-stitch-fix-was-running-12-higher-this-week/,SFIX,0.7887,Neutral,0.089221
Major Layoffs 2023: BlackRock Reportedly Plans To Cut 500 Jobs,20230111T180549,https://www.forbes.com/sites/brianbushard/2023/01/11/major-layoffs-2023-blackrock-reportedly-plans-to-cut-500-jobs/,SFIX,0.051221,Neutral,-0.087633
Major Layoffs 2023: Crypto Giant Coinbase Cuts 950 Jobs,20230110T142036,https://www.forbes.com/sites/brianbushard/2023/01/10/major-layoffs-2023-crypto-giant-coinbase-cuts-950-jobs/,SFIX,0.057767,Neutral,-0.076997
Bruised tech investors are hedging their bets | Business,20230110T131800,https://www.cnn.com/2023/01/10/investing/premarket-stocks-trading/index.html,SFIX,0.031529,Neutral,-0.043561
The debate swirling inside HR departments: how to lay off workers,20230109T195434,https://www.foxbusiness.com/economy/debate-swirling-inside-hr-departments-lay-off-workers,SFIX,0.033562,Somewhat-Bearish,-0.231088
Silicon Valley layoffs go from bad to worse | Business,20230109T163700,https://www.cnn.com/2023/01/09/tech/silicon-valley-layoffs-continue/index.html,SFIX,0.0428,Neutral,-0.020756
Stitch Fix Just Took the First Step in Its Turnaround. Will It Pay Off for Investors?,20230107T141000,https://www.fool.com/investing/2023/01/07/stitch-fix-first-step-turnaround-will-it-pay-off/,SFIX,0.343279,Neutral,-0.050013
"Stitch Fix Layoffs, CEO Change Prove Digital Won't Fix Bad Ideas",20230106T200500,https://www.thestreet.com/retail/stitch-fix-layoffs-ceo-change-prove-digital-wont-fix-bad-ideas,SFIX,0.314151,Neutral,0.131348
"Tech stocks headed for 'bloodbath' in 2023, more 'job threats' expected",20230106T184411,https://www.foxbusiness.com/markets/tech-stocks-headed-bloodbath-2023-threats-expected,SFIX,0.141726,Neutral,-0.064895
"Even as US job growth solid in December, signs of cooling",20230106T165724,https://www.aljazeera.com/economy/2023/1/6/even-as-us-job-growth-solid-in-december-signs-of-cooling,SFIX,0.041394,Neutral,0.014723
Unemployment Rate Falls To 3.5%-But Job Quality Is Deteriorating-As Fed Works To Fight Inflation,20230106T140744,https://www.forbes.com/sites/jonathanponciano/2023/01/06/unemployment-rate-falls-to-35--but-job-quality-is-deteriorating-as-fed-works-to-fight-inflation/,SFIX,0.070935,Neutral,-0.099518
Another strong month of hiring would put Fed in tough spot,20230106T114924,https://apnews.com/article/us-jobs-report-jan6-2023-78943d9829087d93e9681426ca0c8ae2,SFIX,0.049424,Neutral,0.014953
Another strong month of hiring would put Fed in tough spot,20230106T050129,https://apnews.com/article/inflation-business-jobs-and-careers-federal-reserve-system-amazoncom-inc-78943d9829087d93e9681426ca0c8ae2,SFIX,0.049424,Neutral,0.014953
Microsoft CEO: Next two years will be 'most challenging',20230105T224856,https://www.axios.com/2023/01/05/microsoft-nadella-tech-recession,SFIX,0.129516,Somewhat-Bearish,-0.183368
Stock Market Today: Jobs Data Sparks More Selling for Stocks,20230105T211400,https://www.kiplinger.com/investing/stocks/stock-market-today-010523-jobs-data-sparks-more-selling-for-stocks,SFIX,0.118064,Neutral,-0.092132
Why Stitch Fix Stock Was Up on Thursday,20230105T203000,https://www.fool.com/investing/2023/01/05/why-stitch-fix-stock-was-up-on-thursday/,SFIX,0.499789,Somewhat-Bearish,-0.197937
Why Stitch Fix Stock Is Soaring Higher During Thursday's Session - Stitch Fix  ( NASDAQ:SFIX ) ,20230105T185259,https://www.benzinga.com/markets/penny-stocks/23/01/30299301/why-stitch-fix-stock-is-soaring-higher-during-thursdays-session,SFIX,0.733479,Bullish,0.482451
