title,time_published,url,ticker,relevance_score,ticker_sentiment_label,ticker_sentiment_score
Stocks That Hit 52-Week Lows On Wednesday,20220511T162815,https://www.benzinga.com/markets/options/22/05/27141482/52-weeks-high-and-low-article,SFIX,0.006905,Neutral,0.000996
Why Stitch Fix Shares Are Trading Higher By 18%; Here Are 20 Stocks Moving Premarket - Stitch Fix  ( NASDAQ:SFIX ) ,20240605T092725,https://www.benzinga.com/news/24/06/39178410/why-stitch-fix-shares-are-trading-higher-by-18-here-are-20-stocks-moving-premarket,SFIX,0.277433,Neutral,0.113761
Stocks That Hit 52-Week Lows On Monday,20220613T161842,https://www.benzinga.com/markets/options/22/06/27677156/52-weeks-high-and-low-article,SFIX,0.005366,Neutral,0.006081
71 Biggest Movers From Yesterday,20220525T083352,https://www.benzinga.com/news/22/05/27388332/71-biggest-movers-from-yesterday,SFIX,0.056869,Neutral,0.000167
"Earnings Scheduled For June 9, 2022",20220609T084930,https://www.benzinga.com/news/earnings/22/06/27622227/earnings-scheduled-for-june-9-2022,SFIX,0.213988,Neutral,-0.016521
"Earnings Scheduled For March 8, 2022",20220308T084513,https://www.benzinga.com/news/earnings/22/03/26032610/earnings-scheduled-for-march-8-2022,SFIX,0.024658,Neutral,-0.113536
Latest Retail Trend: Men as C.E.O.s,20230814T151832,https://www.nytimes.com/2023/08/14/business/women-chief-executives-retail-companies.html,SFIX,0.03463,Neutral,0.092239
Neiman Marcus and The RealReal are the latest to cut jobs as layoffs creep into the retail world. Here's the full list of major retailers that have laid off workers in 2023.,20230216T194801,https://www.businessinsider.com/retail-layoffs-2023-full-list-2023-2,SFIX,0.079656,Neutral,0.0
Top Retail Jobs Are Going Begging. Boards Have Nobody To Blame But Themselves.,20230212T100000,https://www.forbes.com/sites/pamdanziger/2023/02/12/top-retail-jobs-are-going-begging-boards-have-nobody-to-blame-but-themselves/,SFIX,0.023035,Neutral,0.041321
"Author Julia Boorstin Talks About ""When Women Lead""",20221119T150000,https://www.fool.com/investing/2022/11/19/author-julia-boorstin-talks-about-when-women-lead/,SFIX,0.009288,Neutral,0.030871
What Sheryl Sandberg's Exit Reveals About Women's Progress in Tech,20220603T215218,https://www.nytimes.com/2022/06/03/technology/sheryl-sandberg-women-in-tech.html,SFIX,0.024469,Neutral,0.019915
The Rise of the 'Power Casual' Wardrobe,20220429T090026,https://www.nytimes.com/2022/04/29/business/casual-workwear-clothes-office.html,SFIX,0.034265,Neutral,0.040348
It's Spring! Get Ready to Trim Some of the Stocks in Your Portfolio.,20220421T141500,https://www.fool.com/investing/2022/04/21/its-spring-get-ready-to-trim-some-of-the-stocks-in/,SFIX,0.027316,Somewhat-Bearish,-0.261552
"After Earnings Whiff, Maybe Warby Parker Can Learn Something From Old-School DTC Brands",20220317T195545,https://www.forbes.com/sites/stevendennis/2022/03/17/after-earnings-whiff-maybe-warby-parker-can-learn-something-from-old-school-dtc-brands/,SFIX,0.06141,Somewhat-Bearish,-0.252673
"Why ECMOHO Is Trading Lower By 29%; Here Are 28 Stocks Moving Premarket - AgriFORCE Growing Systems  ( NASDAQ:AGRI ) , AcelRx Pharmaceuticals  ( NASDAQ:ACRX ) ",20220921T101648,https://www.benzinga.com/news/22/09/28944466/why-ecmoho-is-trading-lower-by-29-here-are-28-stocks-moving-premarket,SFIX,0.121343,Somewhat-Bearish,-0.228238
Stocks That Hit 52-Week Lows On Friday,20220610T154524,https://www.benzinga.com/markets/options/22/06/27650434/52-weeks-high-and-low-article,SFIX,0.013393,Neutral,0.009814
"Stitch Fix, Rubicon Technologies And 3 Stocks To Watch Heading Into Monday",20230918T074941,https://markets.businessinsider.com/news/stocks/stitch-fix-rubicon-technologies-and-3-stocks-to-watch-heading-into-monday-1032635681,SFIX,0.366061,Neutral,0.13405
"Stitch Fix, Rubicon Technologies And 3 Stocks To Watch Heading Into Monday - Chewy  ( NYSE:CHWY ) , Five Point Holdings  ( NYSE:FPH ) ",20230918T065905,https://www.benzinga.com/news/earnings/23/09/34674148/stitch-fix-rubicon-technologies-and-3-stocks-to-watch-heading-into-monday,SFIX,0.532043,Bullish,0.389492
Big Tech CEOs Give Investors Something to Think About,20230114T144400,https://www.fool.com/investing/2023/01/14/big-tech-ceos-give-investors-something-to-think-ab/,SFIX,0.031671,Neutral,-0.03714
SFIX Leverages AI and Innovation for Growth: Key Factors for Investors,20241230T132600,https://www.zacks.com/stock/news/2389322/sfix-leverages-ai-and-innovation-for-growth-key-factors-for-investors,SFIX,0.192387,Somewhat-Bullish,0.315759
"Warby Parker, RH, Bath & Body Works Are 'Stocks With Potential,' Analyst Says - Bath & Body Works  ( NYSE:BBWI ) ",20241225T180043,https://www.benzinga.com/analyst-ratings/analyst-color/24/12/42678827/warby-parker-rh-bath-body-works-are-stocks-with-potential-analyst-says,SFIX,0.193465,Neutral,0.097911
Why Stitch Fix's 42% Rally Didn't Last,20241221T083000,https://www.fool.com/investing/2024/12/21/why-stitch-fixs-42-rally-didnt-last/,SFIX,0.339978,Neutral,-0.060681
"The Zacks Analyst Blog Highlights Genesco, Gap, Urban Outfitters, Abercrombie & Fitch and Stitch Fix",20241218T100600,https://www.zacks.com/stock/news/2384994/the-zacks-analyst-blog-highlights-genesco-gap-urban-outfitters-abercrombie-fitch-and-stitch-fix,SFIX,0.1692,Bullish,0.352745
5 Apparel Stocks to Buy Before the New Year's Trends Unfold,20241217T161100,https://www.zacks.com/stock/news/2384715/5-apparel-stocks-to-buy-before-the-new-years-trends-unfold,SFIX,0.110462,Somewhat-Bullish,0.309138
Here Is Why Bargain Hunters Would Love Fast-paced Mover Stitch Fix  ( SFIX ) ,20241217T135006,https://www.zacks.com/stock/news/2384452/here-is-why-bargain-hunters-would-love-fast-paced-mover-stitch-fix-sfix,SFIX,0.659096,Bullish,0.471929
Should Value Investors Buy Stitch Fix  ( SFIX )  Stock?,20241216T203414,https://www.zacks.com/stock/news/2384176/should-value-investors-buy-stitch-fix-sfix-stock,SFIX,0.666827,Bullish,0.522975
"Photronics Posts Upbeat Results, Joins Stitch Fix, Patterson Companies And Other Big Stocks Moving Higher On Wednesday - Destiny Tech100  ( NYSE:DXYZ ) , FIGS  ( NYSE:FIGS ) ",20241211T182117,https://www.benzinga.com/24/12/42444739/photronics-posts-upbeat-results-joins-stitch-fix-patterson-companies-and-other-big-stocks-moving-higher-on-wednes,SFIX,0.195814,Bullish,0.596486
"Stitch Fix Shares Jump On Solid Q1 Beat, Transformation Efforts Take Hold: Analyst - Stitch Fix  ( NASDAQ:SFIX ) ",20241211T172337,https://www.benzinga.com/news/earnings/earnings-beats/24/12/42443430/stitch-fix-shares-jump-on-solid-q1-beat-transformation-efforts-analyst,SFIX,0.716023,Somewhat-Bullish,0.321237
Stitch Fix Stock Is Rallying Wednesday: What's Going On? - Stitch Fix  ( NASDAQ:SFIX ) ,20241211T141932,https://www.benzinga.com/24/12/42438027/stitch-fix-stock-is-rallying-wednesday-whats-going-on,SFIX,0.868327,Somewhat-Bullish,0.342651
"SFIX Q1 Loss Narrower Than Expected, Active Clients Decline Y/Y",20241211T141200,https://www.zacks.com/stock/news/2382058/sfix-q1-loss-narrower-than-expected-active-clients-decline-yy,SFIX,0.433771,Neutral,-0.020532
"Macy's, Adobe And 3 Stocks To Watch Heading Into Wednesday - Adobe  ( NASDAQ:ADBE ) , Macy's  ( NYSE:M ) ",20241211T045235,https://www.benzinga.com/news/earnings/24/12/42429181/macys-adobe-and-3-stocks-to-watch-heading-into-wednesday,SFIX,0.379051,Bullish,0.569688
Stitch Fix  ( SFIX )  Q1 2025 Earnings Call Transcript,20241211T023016,https://www.fool.com/earnings/call-transcripts/2024/12/10/stitch-fix-sfix-q1-2025-earnings-call-transcript/,SFIX,0.088442,Somewhat-Bullish,0.211745
"Stitch Fix  ( SFIX )  Reports Q1 Loss, Tops Revenue Estimates",20241210T222002,https://www.zacks.com/stock/news/2381804/stitch-fix-sfix-reports-q1-loss-tops-revenue-estimates,SFIX,0.387875,Neutral,0.132352
Stitch Fix Announces First Quarter of Fiscal Year 2025 Financial Results,20241210T210500,https://www.globenewswire.com/news-release/2024/12/10/2994953/0/en/Stitch-Fix-Announces-First-Quarter-of-Fiscal-Year-2025-Financial-Results.html,SFIX,0.251981,Somewhat-Bullish,0.235184
Lands' End  ( LE )  Surpasses Q3 Earnings and Revenue Estimates,20241205T130004,https://www.zacks.com/stock/news/2379355/lands-end-le-surpasses-q3-earnings-and-revenue-estimates,SFIX,0.134968,Neutral,0.0
Is Abercrombie & Fitch  ( ANF )  Stock Outpacing Its Retail-Wholesale Peers This Year?,20241127T144008,https://www.zacks.com/stock/news/2375999/is-abercrombie-fitch-anf-stock-outpacing-its-retail-wholesale-peers-this-year,SFIX,0.395012,Somewhat-Bullish,0.28804
"Torrid Stock Up 19% in a Month: Is it Time to Buy, Hold or Cash Out?",20241126T200000,https://www.zacks.com/stock/news/2375643/torrid-stock-up-19-in-a-month-is-it-time-to-buy-hold-or-cash-out,SFIX,0.068896,Somewhat-Bullish,0.183241
Stitch Fix Announces Date for First Quarter 2025 Financial Results and Conference Call,20241119T210500,https://www.globenewswire.com/news-release/2024/11/19/2984014/0/en/Stitch-Fix-Announces-Date-for-First-Quarter-2025-Financial-Results-and-Conference-Call.html,SFIX,0.777888,Bullish,0.52143
Capri Holdings  ( CPRI )  Lags Q2 Earnings and Revenue Estimates,20241107T233005,https://www.zacks.com/stock/news/2366965/capri-holdings-cpri-lags-q2-earnings-and-revenue-estimates,SFIX,0.137671,Neutral,0.0
Hanesbrands Q3 Earnings on the Horizon: Key Insights for Investors,20241105T173700,https://www.zacks.com/stock/news/2364672/hanesbrands-q3-earnings-on-the-horizon-key-insights-for-investors,SFIX,0.166169,Neutral,0.053792
Stitch Fix  ( SFIX )  Up 26.9% Since Last Earnings Report: Can It Continue?,20241024T153006,https://www.zacks.com/stock/news/2357044/stitch-fix-sfix-up-269-since-last-earnings-report-can-it-continue,SFIX,0.548805,Somewhat-Bullish,0.183866
"Prediction: This Fashion Retail Stock Is Down 97% From Its Highs, and It Might Be Acquired Within the Next Year. Here's Why.",20241015T001700,https://www.fool.com/investing/2024/10/14/prediction-this-fashion-retail-stock-is-down-97-fr/,SFIX,0.751437,Bullish,0.433585
"Should You Buy, Hold or Sell Stitch Fix Stock Post Q4 Earnings?",20241008T150600,https://www.zacks.com/stock/news/2347712/should-you-buy-hold-or-sell-stitch-fix-stock-post-q4-earnings,SFIX,0.472672,Bullish,0.437259
Why Stitch Fix Stock Slumped 25% in September,20241007T114812,https://www.fool.com/investing/2024/10/07/why-stitch-fix-stock-slumped-25-in-september/,SFIX,0.396574,Neutral,0.104946
How to Fix Stitch Fix,20241001T172100,https://www.fool.com/investing/2024/10/01/how-to-fix-stitch-fix/,SFIX,0.126879,Neutral,0.042903
SFIX's Client Experience Builds Path to Long-Term Profitability,20240930T162900,https://www.zacks.com/stock/news/2343618/sfixs-client-experience-builds-path-to-long-term-profitability,SFIX,0.426007,Bullish,0.470801
"Dow Tumbles Nearly 300 Points: Investor Optimism Improves Slightly, But Fear Index Remains In 'Greed' Zone - Stitch Fix  ( NASDAQ:SFIX ) ",20240926T065226,https://www.benzinga.com/news/earnings/24/09/41039697/dow-tumbles-nearly-300-points-investor-optimism-improves-slightly-but-fear-index-remains-in-greed-z,SFIX,0.223866,Somewhat-Bullish,0.193736
"Dow Tumbles Over 200 Points; CERo Therapeutics Shares Jump - CERo Therapeutics Hldgs  ( NASDAQ:CERO ) , Capricor Therapeutics  ( NASDAQ:CAPR ) ",20240925T184911,https://www.benzinga.com/markets/equities/24/09/41032868/dow-tumbles-over-200-points-cero-therapeutics-shares-jump,SFIX,0.163909,Somewhat-Bullish,0.162447
Why Stitch Fix Stock Crashed 36% on Wednesday,20240925T180100,https://www.fool.com/investing/2024/09/25/why-stitch-fix-stock-crashed-36-on-wednesday/,SFIX,0.664604,Neutral,0.007716
Crude Oil Down Over 1%; Stitch Fix Shares Plummet - Stitch Fix  ( NASDAQ:SFIX ) ,20240925T155429,https://www.benzinga.com/news/earnings/24/09/41028887/crude-oil-down-over-1-stitch-fix-shares-plummet,SFIX,0.15697,Somewhat-Bullish,0.158019
Dow Falls Over 50 Points; Cintas Posts Upbeat Earnings - Cintas  ( NASDAQ:CTAS ) ,20240925T135350,https://www.benzinga.com/news/earnings/24/09/41025717/dow-falls-over-50-points-cintas-posts-upbeat-earnings,SFIX,0.162255,Somewhat-Bullish,0.16138
"Stitch Fix Reports Weak Earnings, Joins KB Home And Other Big Stocks Moving Lower In Wednesday's Pre-Market Session - Stitch Fix  ( NASDAQ:SFIX ) ",20240925T123206,https://www.benzinga.com/news/24/09/41023374/stitch-fix-reports-weak-earnings-joins-kb-home-and-other-big-stocks-moving-lower-in-wednesdays-pre-m,SFIX,0.490323,Somewhat-Bearish,-0.245261
"SFIX Q4 Loss Narrower Than Expected, Client-Centric Innovation Drives Growth",20240925T120700,https://www.zacks.com/stock/news/2341119/sfix-q4-loss-narrower-than-expected-client-centric-innovation-drives-growth,SFIX,0.449322,Neutral,0.006027
Stitch Fix  ( SFIX )  Q4 2024 Earnings Call Transcript,20240925T014510,https://www.fool.com/earnings/call-transcripts/2024/09/24/stitch-fix-sfix-q4-2024-earnings-call-transcript/,SFIX,0.061644,Somewhat-Bullish,0.177167
Stitch Fix: Revenue Hits Guidance High,20240925T011549,https://www.fool.com/data-news/2024/09/25/stitch-fix-revenue-hits-guidance-high/,SFIX,0.412619,Somewhat-Bullish,0.257287
"Stitch Fix  ( SFIX )  Reports Q4 Loss, Tops Revenue Estimates",20240924T211502,https://www.zacks.com/stock/news/2340820/stitch-fix-sfix-reports-q4-loss-tops-revenue-estimates,SFIX,0.401331,Neutral,0.097822
Stitch Fix Stock Falls After Q4 Results: Here's Why - Stitch Fix  ( NASDAQ:SFIX ) ,20240924T202330,https://www.benzinga.com/news/earnings/24/09/41014297/stitch-fix-stock-falls-after-q4-results-heres-why,SFIX,0.839535,Bullish,0.388433
Stitch Fix Announces Fourth Quarter and Full Fiscal Year 2024 Financial Results,20240924T200500,https://www.globenewswire.com/news-release/2024/09/24/2952594/0/en/Stitch-Fix-Announces-Fourth-Quarter-and-Full-Fiscal-Year-2024-Financial-Results.html,SFIX,0.264146,Somewhat-Bullish,0.213813
"Case-Shiller Home Prices Tick in Lower Than Expectations - KB Home  ( NYSE:KBH ) , AutoZone  ( NYSE:AZO ) ",20240924T191757,https://www.benzinga.com/news/earnings/24/09/41009047/case-shiller-home-prices-tick-in-lower-than-expectations,SFIX,0.218817,Neutral,0.04134
Case-Shiller Home Prices Tick in Lower Than Expectations,20240924T145400,https://www.zacks.com/stock/news/2340641/case-shiller-home-prices-tick-in-lower-than-expectations,SFIX,0.242084,Neutral,0.03947
Pre-Markets Swing to Green; Case-Shiller Home Prices +5%,20240924T142100,https://www.zacks.com/stock/news/2340628/pre-markets-swing-to-green-case-shiller-home-prices-5,SFIX,0.234307,Neutral,0.038433
"Nasdaq, S&P 500 On Track To Rise Yet Again: What's Driving Futures - Invesco QQQ Trust, Series 1  ( NASDAQ:QQQ ) , SPDR S&P 500  ( ARCA:SPY ) ",20240924T105848,https://www.benzinga.com/news/earnings/24/09/40998340/nasdaq-s-p-500-futures-firm-chinas-economic-stimulus-fuels-commodities-bitcoin-steady-heres-what-tr,SFIX,0.071145,Neutral,0.0
Why Maison Solutions Shares Are Trading Higher By Around 91%; Here Are 20 Stocks Moving Premarket - Fresh2 Group  ( NASDAQ:FRES ) ,20240924T094025,https://www.benzinga.com/news/24/09/40997306/why-maison-solutions-shares-are-trading-higher-by-around-91-here-are-20-stocks-moving-premarket,SFIX,0.148731,Somewhat-Bullish,0.183404
La-Z-Boy Incorporated Appoints Stitch Fix CEO Matt Baer to Board of Directors,20240916T201500,https://www.globenewswire.com/news-release/2024/09/16/2947024/0/en/La-Z-Boy-Incorporated-Appoints-Stitch-Fix-CEO-Matt-Baer-to-Board-of-Directors.html,SFIX,0.156123,Neutral,0.078216
"La-Z-Boy Incorporated Appoints Stitch Fix CEO Matt Baer to Board of Directors - Stitch Fix  ( NASDAQ:SFIX ) , La-Z-Boy  ( NYSE:LZB ) ",20240916T201500,https://www.benzinga.com/pressreleases/24/09/g40886700/la-z-boy-incorporated-appoints-stitch-fix-ceo-matt-baer-to-board-of-directors,SFIX,0.147216,Neutral,0.075426
Kroger  ( KR )  Q2 Earnings Surpass Estimates,20240912T131002,https://www.zacks.com/stock/news/2335120/kroger-kr-q2-earnings-surpass-estimates,SFIX,0.137671,Neutral,0.0
Designer Brands  ( DBI )  Q2 Earnings and Revenues Miss Estimates,20240911T120002,https://www.zacks.com/stock/news/2334420/designer-brands-dbi-q2-earnings-and-revenues-miss-estimates,SFIX,0.138066,Neutral,0.0
"Should You Invest in Stitch Fix Stock After a 45% Rise in Six Months? - Abercrombie & Fitch  ( NYSE:ANF ) , Boot Barn Holdings  ( NYSE:BOOT ) ",20240909T200328,https://www.benzinga.com/news/earnings/24/09/40775876/should-you-invest-in-stitch-fix-stock-after-a-45-rise-in-six-months,SFIX,0.409503,Bullish,0.662027
Should You Invest in Stitch Fix Stock After a 45% Rise in Six Months?,20240909T135500,https://www.zacks.com/stock/news/2333466/should-you-invest-in-stitch-fix-stock-after-a-45-rise-in-six-months,SFIX,0.389429,Bullish,0.55418
Torrid Holdings  ( CURV )  Surpasses Q2 Earnings and Revenue Estimates,20240904T121003,https://www.zacks.com/stock/news/2331158/torrid-holdings-curv-surpasses-q2-earnings-and-revenue-estimates,SFIX,0.137278,Neutral,0.0
Back to School Checklist 2024,20240829T161328,https://www.benzinga.com/pressreleases/24/08/g40629828/back-to-school-checklist-2024,SFIX,0.13637,Somewhat-Bullish,0.159074
Back-To-School Checklist 2024,20240821T194942,https://www.benzinga.com/pressreleases/24/08/g40493702/back-to-school-checklist-2024,SFIX,0.17813,Somewhat-Bullish,0.170319
Stitch Fix  ( SFIX )  Gains From Client Experience Enhancement,20240812T160400,https://www.zacks.com/stock/news/2320898/stitch-fix-sfix-gains-from-client-experience-enhancement,SFIX,0.41608,Bullish,0.648135
Are Investors Undervaluing Stitch Fix  ( SFIX )  Right Now?,20240812T134016,https://www.zacks.com/stock/news/2320630/are-investors-undervaluing-stitch-fix-sfix-right-now,SFIX,0.608634,Bullish,0.550801
Urban Outfitters  ( URBN )  Gains on Strategic Growth Initiatives,20240812T122800,https://www.zacks.com/stock/news/2320465/urban-outfitters-urbn-gains-on-strategic-growth-initiatives,SFIX,0.181819,Somewhat-Bullish,0.154178
Here's Why Stitch Fix  ( SFIX )  Stock is an Investor Favorite,20240729T134300,https://www.zacks.com/stock/news/2311054/heres-why-stitch-fix-sfix-stock-is-an-investor-favorite,SFIX,0.507601,Bullish,0.714297
"Skechers Q2 Earnings Miss Estimates, Sales Rise Y/Y - Abercrombie & Fitch  ( NYSE:ANF ) , Gap  ( NYSE:GPS ) ",20240726T200818,https://www.benzinga.com/news/earnings/24/07/39991423/skechers-q2-earnings-miss-estimates-sales-rise-yy,SFIX,0.162255,Neutral,0.131945
"Skechers  ( SKX )  Q2 Earnings Miss Estimates, Sales Rise Y/Y",20240726T170700,https://www.zacks.com/stock/news/2310318/skechers-skx-q2-earnings-miss-estimates-sales-rise-yy,SFIX,0.163909,Neutral,0.111276
Urban Outfitters  ( URBN )  Gains 26% YTD: How to Play Ahead?,20240725T125500,https://www.zacks.com/stock/news/2308679/urban-outfitters-urbn-gains-26-ytd-how-to-play-ahead,SFIX,0.164749,Somewhat-Bullish,0.330305
New Strong Buy Stocks for July 25th,20240725T105100,https://www.zacks.com/commentary/2307506/new-strong-buy-stocks-for-july-25th,SFIX,0.558244,Neutral,0.0
Stitch Fix  ( SFIX )  Up 92% in 3 Months: Did You Miss the Rally?,20240723T113700,https://www.zacks.com/stock/news/2306647/stitch-fix-sfix-up-92-in-3-months-did-you-miss-the-rally,SFIX,0.422268,Bullish,0.70278
Looking for a Fast-paced Momentum Stock at a Bargain? Consider Stitch Fix  ( SFIX ) ,20240718T125003,https://www.zacks.com/stock/news/2304196/looking-for-a-fast-paced-momentum-stock-at-a-bargain-consider-stitch-fix-sfix,SFIX,0.636698,Bullish,0.465205
"Zacks Investment Ideas feature highlights: IWM, EZCORP, LendingTree and Stitch Fix",20240715T084300,https://www.zacks.com/stock/news/2301308/zacks-investment-ideas-feature-highlights-iwm-ezcorp-lendingtree-and-stitch-fix,SFIX,0.211652,Somewhat-Bullish,0.220677
AI's Double-Edged Sword: Managing Risks While Seizing Opportunities,20240714T100000,https://www.forbes.com/sites/glenngow/2024/07/14/ais-double-edged-sword-managing-risks-while-seizing-opportunities/,SFIX,0.029545,Somewhat-Bullish,0.190285
Small Caps Roar: 3 Stocks to Ride the Momentum,20240712T141500,https://www.zacks.com/commentary/2300307/small-caps-roar-3-stocks-to-ride-the-momentum,SFIX,0.274628,Somewhat-Bullish,0.324792
Is Stitch Fix  ( SFIX )  Stock Undervalued Right Now?,20240712T134016,https://www.zacks.com/stock/news/2300750/is-stitch-fix-sfix-stock-undervalued-right-now,SFIX,0.589793,Bullish,0.472801
All You Need to Know About Stitch Fix  ( SFIX )  Rating Upgrade to Strong Buy,20240710T160009,https://www.zacks.com/stock/news/2299440/all-you-need-to-know-about-stitch-fix-sfix-rating-upgrade-to-strong-buy,SFIX,0.360752,Bullish,0.359378
Stitch Fix's Strategic AI & Data Analytics Drive Growth - Stitch Fix  ( NASDAQ:SFIX ) ,20240708T171200,https://www.benzinga.com/news/earnings/24/07/39668568/stitch-fixs-strategic-ai-data-analytics-drive-growth,SFIX,0.43526,Bullish,0.639315
Stitch Fix's  ( SFIX )  Strategic AI & Data Analytics Drive Growth,20240708T130600,https://www.zacks.com/stock/news/2297658/stitch-fixs-sfix-strategic-ai-data-analytics-drive-growth,SFIX,0.355588,Bullish,0.563875
"Intapp, ServiceNow And Other Big Stocks Moving Lower In Monday's Pre-Market Session - Intapp  ( NASDAQ:INTA ) ",20240708T122250,https://www.benzinga.com/news/24/07/39664841/intapp-servicenow-and-other-big-stocks-moving-lower-in-mondays-pre-market-session,SFIX,0.275867,Neutral,-0.024131
Halfway Through 2024: Why I'm Not Panicking About the 2 Worst-Performing Growth Stocks in My Retirement Account,20240628T114000,https://www.fool.com/investing/2024/06/28/halfway-through-2024-why-im-not-panicking-about-th/,SFIX,0.040899,Neutral,0.0663
Fast-Paced Momentum Stock Stitch Fix Is Still Trading at a Bargain - Stitch Fix  ( NASDAQ:SFIX ) ,20240625T193955,https://www.benzinga.com/news/earnings/24/06/39481097/fast-paced-momentum-stock-stitch-fix-is-still-trading-at-a-bargain,SFIX,0.582526,Bullish,0.447362
Fast-paced Momentum Stock Stitch Fix  ( SFIX )  Is Still Trading at a Bargain,20240625T125004,https://www.zacks.com/stock/news/2292724/fast-paced-momentum-stock-stitch-fix-sfix-is-still-trading-at-a-bargain,SFIX,0.656041,Bullish,0.471036
Are Investors Undervaluing J.Jill  ( JILL )  Right Now?,20240624T134015,https://www.zacks.com/stock/news/2292169/are-investors-undervaluing-jjill-jill-right-now,SFIX,0.627119,Bullish,0.532366
"The Zacks Analyst Blog Highlights The Gap, Abercrombie & Fitch, J.Jill, Canada Goose and Stitch Fix",20240618T133400,https://www.zacks.com/stock/news/2289868/the-zacks-analyst-blog-highlights-the-gap-abercrombie-fitch-jjill-canada-goose-and-stitch-fix,SFIX,0.161494,Neutral,0.123539
5 Must-Buy Retailers With Solid Earnings Estimate Revisions,20240617T120400,https://www.zacks.com/stock/news/2289034/5-must-buy-retailers-with-solid-earnings-estimate-revisions,SFIX,0.138663,Somewhat-Bullish,0.213018
"Do Home Depot's Strategies Place It Well Amid Soft Demand? - Abercrombie & Fitch  ( NYSE:ANF ) , Gap  ( NYSE:GPS ) ",20240614T195907,https://www.benzinga.com/news/24/06/39337012/do-home-depots-strategies-place-it-well-amid-soft-demand,SFIX,0.18967,Neutral,0.144102
Do Home Depot's  ( HD )  Strategies Place It Well Amid Soft Demand?,20240614T152900,https://www.zacks.com/stock/news/2288644/do-home-depots-hd-strategies-place-it-well-amid-soft-demand,SFIX,0.19117,Neutral,0.101943
Is Stitch Fix  ( SFIX )  a Great Value Stock Right Now?,20240607T134013,https://www.zacks.com/stock/news/2285267/is-stitch-fix-sfix-a-great-value-stock-right-now,SFIX,0.680008,Bullish,0.583117
Why Fast-paced Mover Stitch Fix  ( SFIX )  Is a Great Choice for Value Investors,20240607T125004,https://www.zacks.com/stock/news/2285170/why-fast-paced-mover-stitch-fix-sfix-is-a-great-choice-for-value-investors,SFIX,0.645516,Bullish,0.423754
Why Stitch Fix Shares Are Trading Higher Wednesday  ( CORRECTED )  - Stitch Fix  ( NASDAQ:SFIX ) ,20240606T124722,https://www.benzinga.com/news/24/06/39188848/why-stitch-fix-shares-are-trading-higher-wednesday,SFIX,0.852206,Bullish,0.603224
Why Stitch Fix Stock Is Up Big Today,20240605T185333,https://www.fool.com/investing/2024/06/05/why-stitch-fix-is-up-big-today/,SFIX,0.713878,Bullish,0.512916
Stitch Fix's Results Show 'Green Shoots' Emerging: Analysts Take A Look While Stock Jumps Higher - Stitch Fix  ( NASDAQ:SFIX ) ,20240605T182934,https://www.benzinga.com/analyst-ratings/analyst-color/24/06/39191746/stitch-fixs-results-show-green-shoots-emerging-analysts-take-a-look-while-stock-jum,SFIX,0.496597,Somewhat-Bullish,0.349345
"Stitch Fix Reports Q3 Loss, Tops Revenue Estimates",20240605T172604,https://markets.businessinsider.com/news/stocks/stitch-fix-reports-q3-loss-tops-revenue-estimates-1033454846,SFIX,0.348592,Neutral,0.037066
"Stitch Fix Reports Q3 Loss, Tops Revenue Estimates - Stitch Fix  ( NASDAQ:SFIX ) , Levi Strauss  ( NYSE:LEVI ) ",20240605T164805,https://www.benzinga.com/news/earnings/24/06/39174071/stitch-fix-reports-q3-loss-tops-revenue-estimates,SFIX,0.390904,Neutral,0.037641
"Stitch Fix  ( SFIX )  Q3 Loss Narrows, Revenues Decline Y/Y",20240605T155500,https://www.zacks.com/stock/news/2284244/stitch-fix-sfix-q3-loss-narrows-revenues-decline-yy,SFIX,0.405215,Neutral,0.14532
"Ollie's Bargain Outlet Posts Upbeat Earnings, Joins Verint Systems, Guidewire Software And Other Big Stocks Moving Higher On Wednesday - Ollie's Bargain Outlet  ( NASDAQ:OLLI ) ",20240605T142346,https://www.benzinga.com/news/24/06/39186219/ollies-bargain-outlet-posts-upbeat-earnings-joins-verint-systems-guidewire-software-and-other-big-st,SFIX,0.136888,Bullish,0.505126
Analyst Claims Bitcoin Is Excelling In Its Current Cycle Based On Three Metrics; Michael Cohen's Family Doxxed After Trump's Hush Money Conviction - Top Headlines Today While US Slept,20240605T131324,https://www.benzinga.com/markets/cryptocurrency/24/06/39184122/analyst-claims-bitcoin-is-excelling-in-its-current-cycle-based-on-three-metrics-michael-co,SFIX,0.060848,Neutral,0.145026
Top 4 Consumer Stocks That May Implode In Q2 - Stitch Fix  ( NASDAQ:SFIX ) ,20240605T122031,https://www.benzinga.com/news/24/06/39182518/top-4-consumer-stocks-that-may-implode-in-q2,SFIX,0.381755,Bullish,0.679869
