title,time_published,url,ticker,relevance_score,ticker_sentiment_label,ticker_sentiment_score
Why FedEx Shares Are Trading Higher By Around 12%; Here Are 20 Stocks Moving Premarket - FedEx  ( NYSE:FDX ) ,20240322T121057,https://www.benzinga.com/news/24/03/37889416/why-fedex-shares-are-trading-higher-by-around-12-here-are-20-stocks-moving-premarket,SLNA,0.151539,Somewhat-Bearish,-0.240485
"Why MediaAlpha Shares Jumped Around 30%; Here Are 112 Biggest Movers From Friday - Alcoa  ( NYSE:AA ) , Adient  ( NYSE:ADNT ) ",20221107T080741,https://www.benzinga.com/news/22/11/29586663/why-mediaalpha-shares-jumped-around-30-here-are-112-biggest-movers-from-friday,SLNA,0.03443,Somewhat-Bearish,-0.292714
Why Selective Insurance Group Shares Are Trading Lower By Around 15%? Here Are Other Stocks Moving In Friday's Mid-Day Session - Selective Insurance Gr  ( NASDAQ:SIGI ) ,20240719T172454,https://www.benzinga.com/news/24/07/39864633/why-selective-insurance-group-shares-are-trading-lower-by-around-15-here-are-other-stocks-moving-in,SLNA,0.097062,Neutral,0.0
"Why FAT Brands Shares Are Trading Sharply Lower; Here Are 24 Stocks Moving Premarket - Ambow Education Holding  ( AMEX:AMBO ) , Clear Channel Outdoor  ( NYSE:CCO ) ",20221107T111000,https://www.benzinga.com/news/22/11/29587771/why-fat-brands-shares-are-trading-sharply-lower-here-are-24-stocks-moving-premarket,SLNA,0.143415,Somewhat-Bullish,0.158479
"Why Pinterest Shares Jumped Around 14%; Here Are 69 Biggest Movers From Friday - Aeglea BioTherapeutics  ( NASDAQ:AGLE ) , Avista Public Acquisition  ( NASDAQ:AHPA ) ",20221031T081300,https://www.benzinga.com/news/22/10/29474596/why-pinterest-shares-jumped-around-14-here-are-69-biggest-movers-from-friday,SLNA,0.056674,Neutral,-0.067116
