title,time_published,url,ticker,relevance_score,ticker_sentiment_label,ticker_sentiment_score
Arias Resource Capital Proposes Five Nominees for Sierra Metals Board,20230502T210000,https://www.newswire.ca/news-releases/arias-resource-capital-proposes-five-nominees-for-sierra-metals-board-864013491.html,SLVMF,0.009438,Neutral,0.010898
Arias Resource Capital Proposes Five Nominees for Sierra Metals Board,20230501T121600,https://www.newswire.ca/news-releases/arias-resource-capital-proposes-five-nominees-for-sierra-metals-board-813973873.html,SLVMF,0.008666,Neutral,0.010816
"Earnings Scheduled For May 11, 2022",20220511T102312,https://www.benzinga.com/news/earnings/22/05/27129387/earnings-scheduled-for-may-11-2022,SLVMF,0.012715,Neutral,0.002677
"Creso Pharma  ( COPHF ) ,  ( IXHL )  - Proactive news headlines including Great Boulder Resources, Aurumin Ltd, Silver Mines and New Century Resources",20220905T075137,https://www.benzinga.com/pressreleases/22/09/g28746343/proactive-news-headlines-including-great-boulder-resources-aurumin-ltd-silver-mines-and-new-centur,SLVMF,0.051663,Neutral,0.0
New Strong Buy Stocks for April 23rd,20240423T111100,https://www.zacks.com/commentary/2258935/new-strong-buy-stocks-for-april-23rd,SLVMF,0.40348,Somewhat-Bullish,0.254231
