title,time_published,url,ticker,relevance_score,ticker_sentiment_label,ticker_sentiment_score
Why JanOne Shares Are Trading Higher By 19%; Here Are 20 Stocks Moving Premarket - JanOne  ( NASDAQ:JAN ) ,20240513T094610,https://www.benzinga.com/news/24/05/38783309/why-janone-shares-are-trading-higher-by-19-here-are-20-stocks-moving-premarket,SNY,0.067536,Somewhat-Bullish,0.200818
"Earnings Scheduled For April 28, 2022",20220428T085040,https://www.benzinga.com/news/earnings/22/04/26860440/earnings-scheduled-for-april-28-2022,SNY,0.014477,Neutral,-0.001809
"Global Tissue Banking Market to Exhibit Growth at a Considerable CAGR of ~6% by 2030, Assesses DelveInsight",20240409T214100,https://www.prnewswire.com/news-releases/global-tissue-banking-market-to-exhibit-growth-at-a-considerable-cagr-of-6-by-2030-assesses-delveinsight-302110459.html,SNY,0.022991,Neutral,0.037011
"Biotech Stock Roundup: KYMR, IDYA, QURE Soar on Study Data, HLVX Tanks on Study Failure",20240711T131200,https://www.zacks.com/stock/news/2300042/biotech-stock-roundup-kymr-idya-qure-soar-on-study-data-hlvx-tanks-on-study-failure,SNY,0.156207,Somewhat-Bullish,0.15601
"Biotech Stock Roundup: BMY Grabs MRTX, AKRO Down on Study Data, ALNY Faces Setback",20231012T122400,https://www.zacks.com/stock/news/2164807/biotech-stock-roundup-bmy-grabs-mrtx-akro-down-on-study-data-alny-faces-setback,SNY,0.033751,Neutral,0.032519
"Dow Tumbles 200 Points; Darden Restaurants Posts Upbeat Profit - Cisco Systems  ( NASDAQ:CSCO ) , Darden Restaurants  ( NYSE:DRI ) ",20230921T183004,https://www.benzinga.com/news/earnings/23/09/34803375/dow-tumbles-200-points-darden-restaurants-posts-upbeat-profit,SNY,0.107255,Neutral,0.129334
"Nasdaq Down Over 1%; US Initial Jobless Claims Fall More Than Expected - MSP Recovery  ( NASDAQ:LIFW ) , Neptune Wellness Solns  ( NASDAQ:NEPT ) ",20230921T135921,https://www.benzinga.com/news/earnings/23/09/34793343/nasdaq-down-over-1-us-initial-jobless-claims-fall-more-than-expected,SNY,0.124809,Neutral,0.137247
Neuromuscular Disease Therapeutics Market size to grow by USD 65.13 billion from 2022-2027| Aquestive ... - PR Newswire,20231201T183000,https://www.prnewswire.com/news-releases/neuromuscular-disease-therapeutics-market-size-to-grow-by-usd-65-13-billion-from-2022-2027-aquestive-therapeutics-inc-bausch-health-companies-inc-biogen-inc-and-more-among-the-major-companies-in-the-market--technavio-302002042.html,SNY,0.059636,Neutral,0.014995
"DBV Technologies Announces Appointment of New Chair of its Audit Committee and Appointment of Daniele Guyot-Caparros to Board of Directors - DBV Technologies  ( NASDAQ:DBVT ) , Aquestive Therapeutics  ( NASDAQ:AQST ) ",20221003T203000,https://www.benzinga.com/pressreleases/22/10/g29126135/dbv-technologies-announces-appointment-of-new-chair-of-its-audit-committee-and-appointment-of-dani,SNY,0.038284,Neutral,0.047891
DBV Technologies Announces Appointment of New Chair of its Audit Committee and Appointment of Daniele Guyot-Caparros to Board of Directors,20221003T203000,https://www.globenewswire.com/news-release/2022/10/03/2527329/0/en/DBV-Technologies-Announces-Appointment-of-New-Chair-of-its-Audit-Committee-and-Appointment-of-Daniele-Guyot-Caparros-to-Board-of-Directors.html,SNY,0.033656,Neutral,0.047894
