title,time_published,url,ticker,relevance_score,ticker_sentiment_label,ticker_sentiment_score
Stocks That Hit 52-Week Lows On Monday,20220613T161842,https://www.benzinga.com/markets/options/22/06/27677156/52-weeks-high-and-low-article,SPR,0.005366,Neutral,-0.002043
"Poor quality control, race for profits behind Boeing's troubles",20240123T222342,https://www.aljazeera.com/economy/2024/1/23/poor-quality-control-race-for-profits-behind-boeings-troubles,SPR,0.022389,Somewhat-Bearish,-0.178931
"Super Micro, Nvidia, Taiwan Semi, Macy's, Apple, Li Auto, Lyft, and More Stock Market Movers",20240304T092800,https://www.barrons.com/amp/articles/stock-market-movers-bd49873d,SPR,0.218817,Somewhat-Bullish,0.260426
"Stitch Fix, Dave & Buster's Entertainment, Affirm Holdings And Other Big Stocks Moving Higher On Wednesday - Affirm Holdings  ( NASDAQ:AFRM ) , Aurora Innovation  ( NASDAQ:AUR ) ",20230607T141539,https://www.benzinga.com/news/23/06/32759311/stitch-fix-dave-busters-entertainment-affirm-holdings-and-other-big-stocks-moving-higher-on-wednesda,SPR,0.163354,Neutral,-0.053153
"BP, Hertz Global, Take-Two Interactive Software And Other Big Stocks Moving Higher On Tuesday - Amarin Corp  ( NASDAQ:AMRN ) , Alvarium Tiedemann Hldgs  ( NASDAQ:ALTI ) ",20230207T190121,https://www.benzinga.com/news/23/02/30775070/bp-hertz-global-take-two-interactive-software-and-other-big-stocks-moving-higher-on-tuesday,SPR,0.285526,Neutral,-0.011101
"Pool Lowers FY24 EPS Forecast, Joins SolarEdge Technologies, Spirit AeroSystems And Other Big Stocks Moving Lower In Tuesday'S Pre-Market Session - Pool  ( NASDAQ:POOL ) ",20240625T094517,https://www.benzinga.com/news/24/06/39472961/pool-lowers-fy24-eps-forecast-joins-solaredge-technologies-spirit-aerosystems-and-other-big-stocks-m,SPR,0.401331,Neutral,0.128523
"Boeing, Pacific Biosciences of California And Other Big Stocks Moving Lower On Monday - AAR  ( NYSE:AIR ) , Boeing  ( NYSE:BA ) ",20240108T164604,https://www.benzinga.com/news/24/01/36538431/boeing-pacific-biosciences-of-california-and-other-big-stocks-moving-lower-on-monday,SPR,0.318897,Bearish,-0.358068
"Earnings Scheduled For May 4, 2022",20220504T083630,https://www.benzinga.com/news/earnings/22/05/26983503/earnings-scheduled-for-may-4-2022,SPR,0.010898,Neutral,-0.145862
"Stocks making the biggest moves before the bell: JPMorgan Chase, Wells Fargo, PNC, Lucid, Express & more",20230414T121656,https://www.cnbc.com/2023/04/14/stocks-making-the-biggest-moves-before-the-bell-jpm-wfc-lcid-more.html,SPR,0.11983,Neutral,-0.143259
