title,time_published,url,ticker,relevance_score,ticker_sentiment_label,ticker_sentiment_score
Why Is Marker Therapeutics Trading Higher By 119%: Here Are 42 Stocks Moving Premarket,20220805T113501,https://www.benzinga.com/news/22/08/28373054/why-is-marker-therapeutics-trading-higher-by-119-here-are-42-stocks-moving-premarket,SQ,0.062926,Neutral,-0.130081
99 Biggest Movers From Yesterday,20220512T082956,https://www.benzinga.com/news/22/05/27156577/99-biggest-movers-from-yesterday,SQ,0.021239,Neutral,0.050338
"Why MediaAlpha Shares Jumped Around 30%; Here Are 112 Biggest Movers From Friday - Alcoa  ( NYSE:AA ) , Adient  ( NYSE:ADNT ) ",20221107T080741,https://www.benzinga.com/news/22/11/29586663/why-mediaalpha-shares-jumped-around-30-here-are-112-biggest-movers-from-friday,SQ,0.03443,Somewhat-Bullish,0.183053
Why Growth Stocks Popped on Tuesday,20221213T191149,https://www.fool.com/investing/2022/12/13/why-growth-stocks-popped-on-tuesday/,SQ,0.340915,Somewhat-Bullish,0.303487
Is the worst over for bitcoin and the rest of crypto?,20221204T155300,https://www.cnn.com/2022/12/04/investing/stocks-week-ahead/index.html,SQ,0.076236,Neutral,-0.038434
Cathie Wood Goes Bargain Hunting: 3 Stocks She Just Bought,20230321T141500,https://www.fool.com/investing/2023/03/21/cathie-wood-goes-bargain-hunting-3-stocks-she-just/,SQ,0.416516,Neutral,0.014261
"Stocks That Hit 52-Week Lows On Thursday - PRA Group  ( NASDAQ:PRAA ) , Perimeter Solutions  ( NYSE:PRM ) ",20231005T172202,https://www.benzinga.com/news/23/10/35111787/stocks-that-hit-52-week-lows-on-thursday,SQ,0.013047,Neutral,0.004444
Why Is Disney Higher By More Than 7%: Here Are 40 Stocks Moving Premarket,20220811T111757,https://www.benzinga.com/news/22/08/28450774/why-is-disney-higher-by-more-than-7-here-are-40-stocks-moving-premarket,SQ,0.039944,Neutral,0.095995
"Etsy, eBay Want IRS 1099-K Relief for Online Sellers",20230316T140000,https://www.kiplinger.com/taxes/etsy-ebay-want-irs-1099-k-relief,SQ,0.069094,Neutral,0.081273
"Marqeta is a 'future fintech powerhouse,' analyst says",20220405T165800,https://www.marketwatch.com/story/marqeta-is-a-future-fintech-powerhouse-analyst-says-11649177938,SQ,0.419037,Somewhat-Bullish,0.182463
"Genpact Posts Upbeat Earnings, Joins Groupon, Natera, Funko, CarGurus And Other Big Stocks Moving Higher On Friday - Groupon  ( NASDAQ:GRPN ) ",20240510T144827,https://www.benzinga.com/news/24/05/38762708/genpact-posts-upbeat-earnings-joins-groupon-natera-funko-cargurus-and-other-big-stocks-moving-higher,SQ,0.057079,Bullish,0.355111
"Expedia Group, Gartner, Cloudflare, Cardinal Health And Other Big Stocks Moving Higher On Friday - Allogene Therapeutics  ( NASDAQ:ALLO ) , AMC Networks  ( NASDAQ:AMCX ) ",20231103T153022,https://www.benzinga.com/news/23/11/35594375/expedia-group-gartner-cloudflare-cardinal-health-and-other-big-stocks-moving-higher-on-friday,SQ,0.109206,Bullish,0.372928
"Wall Street May Be Selling This Fintech Stock, but I'm Buying. Here's Why",20240901T113500,https://www.fool.com/investing/2024/09/01/wall-street-selling-fintech-stock-buy-marqeta/,SQ,0.512933,Neutral,-0.042882
"Marqeta's stock is now a buy as it sits in an 'enviable' spot, BofA says",20240212T214400,https://www.marketwatch.com/story/marqetas-stock-is-now-a-buy-as-it-sits-in-an-enviable-spot-bofa-says-0802f807,SQ,0.445569,Somewhat-Bullish,0.239717
"Deutsche Bank Bullish On SQ, Fintech Stocks In 2024",20240102T181500,https://www.investors.com/news/technology/deutsche-bank-bullish-sq-stock-fintech-stocks-in-2024/,SQ,0.508593,Neutral,0.132422
Ready for the Next Bull Market? Discover 3 Undervalued Tech Stocks Set to Soar in the Economic Upswing,20231218T125700,https://www.fool.com/investing/2023/12/18/3-undervalued-stocks-could-soar-in-the-bull-market/,SQ,0.082582,Somewhat-Bullish,0.154892
"The War on Cash, Revisited",20231213T082900,https://www.fool.com/investing/2023/12/13/the-war-on-cash-revisited/,SQ,0.134189,Neutral,0.076061
This Beaten-Down Fintech Transformed Itself This Year. Now It's Primed to Soar in 2024,20231212T111500,https://www.fool.com/investing/2023/12/12/this-beaten-down-fintech-transformed-itself-this-y/,SQ,0.17112,Neutral,0.104062
Why Marqeta Is Skyrocketing Today,20231108T195018,https://www.fool.com/investing/2023/11/08/why-marqeta-is-skyrocketing-today/,SQ,0.315628,Somewhat-Bullish,0.177233
3 Supercharged Tech Stocks to Buy Without Any Hesitation,20231023T100000,https://www.fool.com/investing/2023/10/23/3-supercharged-tech-stocks-to-buy-without-any-hesi/,SQ,0.040553,Neutral,0.086015
"Block's stock could double, analyst says, as an exciting milestone may be in view",20231012T180400,https://www.marketwatch.com/story/blocks-stock-could-double-analyst-says-as-an-exciting-milestone-may-be-in-view-8b9a2431,SQ,0.412861,Bullish,0.466088
3 Cash-Cow Stocks That Can Thrive With Higher Interest Rates,20231001T111300,https://www.fool.com/investing/2023/10/01/3-cash-cow-stocks-can-handle-higher-interest-rates/,SQ,0.104115,Neutral,0.08984
You Don't Have to Pick a Winner in Fintech Stocks. Here's Why.,20230930T130000,https://www.fool.com/investing/2023/09/30/you-dont-have-to-pick-a-winner-in-fintech-stocks/,SQ,0.190043,Somewhat-Bullish,0.239164
Marqeta's Revenue Is About to Be Cut in Half. Here's Why It's a Screaming Buy.,20230827T104500,https://www.fool.com/investing/2023/08/27/why-marqeta-is-a-screaming-buy/,SQ,0.397622,Neutral,0.030618
3 Tech Stocks Already Using Artificial Intelligence to Their Advantage,20230821T103000,https://www.fool.com/investing/2023/08/21/3-stocks-already-using-artificial-intelligence/,SQ,0.093897,Neutral,0.137235
"Penn Entertainment shares surge on ESPN deal, ZipRecruiter stock slumps and other stocks on the move",20230809T091600,https://www.marketwatch.com/story/penn-entertainment-shares-surge-on-espn-deal-ziprecruiter-stock-slumps-and-other-stocks-on-the-move-75cbef99,SQ,0.208464,Neutral,0.0
"Marqeta scores long-awaited Cash App renewal, and its stock is surging",20230808T205400,https://www.marketwatch.com/story/marqeta-scores-long-awaited-cash-app-renewal-and-its-stock-is-surging-c364d944,SQ,0.470174,Neutral,0.018084
"Fintech Stocks like Affirm, SoFi Tech, Marqeta and Others Are Moving Today - Here's Why - Jack Henry & Associates  ( NASDAQ:JKHY ) , PayPal Holdings  ( NASDAQ:PYPL ) , Open Lending  ( NASDAQ:LPRO ) , Green Dot  ( NYSE:GDOT ) , Marqeta  ( NASDAQ:MQ ) , Oportun Financial  ( NASDAQ:OPRT ) , SoFi Techs  ( NASDAQ:SOFI ) , Upstart Hldgs  ( NASDAQ:UPST ) , Affirm Holdings  ( NASDAQ:AFRM ) , Block  ( NYSE:SQ ) ",20230614T154234,https://www.benzinga.com/fintech/23/06/32857789/fintech-stocks-like-affirm-sofi-tech-marqeta-and-others-are-moving-today-heres-why,SQ,0.502693,Somewhat-Bearish,-0.303937
"Marqeta stock carries a 'meaningful amount of uncertainty,' Morgan Stanley says in downgrade",20230403T212800,https://www.marketwatch.com/story/marqeta-stock-carries-a-meaningful-amount-of-uncertainty-morgan-stanley-says-in-downgrade-3c69b5e,SQ,0.795859,Neutral,-0.112871
Marqeta's stock pops as analyst says it presents 'too compelling' an opportunity,20230327T163400,https://www.marketwatch.com/story/marqetas-stock-pops-as-analyst-says-it-presents-too-compelling-an-opportunity-ce602963,SQ,0.159569,Neutral,0.038852
"Marqeta Analyst Turns Bullish, Sees 'Clear Path To Profitability' - Marqeta  ( NASDAQ:MQ ) , Block  ( NYSE:SQ ) ",20230327T142811,https://www.benzinga.com/analyst-ratings/analyst-color/23/03/31512113/marqeta-analyst-turns-bullish-sees-clear-path-to-profitability,SQ,0.662945,Bullish,0.64718
Is Marqeta Stock a Buy Right Now?,20230308T140300,https://www.fool.com/investing/2023/03/08/is-marqeta-stock-a-buy-right-now/,SQ,0.286193,Somewhat-Bullish,0.273562
"Marqeta Gets 33% Price Target Cut By Analysts, Cite Block Renewal Uncertainty - Marqeta  ( NASDAQ:MQ ) ",20230301T184135,https://www.benzinga.com/analyst-ratings/analyst-color/23/03/31133600/marqeta-gets-33-price-target-cut-by-analysts-cite-block-renewal-uncertainty,SQ,0.43789,Somewhat-Bullish,0.160442
Here's Why Marqeta Can Be a Long-Term Winner,20230216T104500,https://www.fool.com/investing/2023/02/16/heres-why-marqeta-can-be-a-long-term-winner-10/,SQ,0.119235,Neutral,-0.005751
2 Fintechs to Buy in 2023 Before the Next Bull Market Starts,20230206T112300,https://www.fool.com/investing/2023/02/06/2-fintechs-to-buy-in-2023-before-the-next-bull-mar/,SQ,0.118647,Neutral,0.025775
Why Marqeta Stock Rose 8% This Week,20230203T162943,https://www.fool.com/investing/2023/02/03/why-marqeta-stock-rose-8-this-week/,SQ,0.343279,Neutral,-0.002456
Marqeta Had a Momentous Week: Here's What It Could Mean for the Stock,20230201T121200,https://www.fool.com/investing/2023/02/01/marqeta-had-a-momentous-week-heres-what-it-could-m/,SQ,0.092748,Neutral,-0.118998
PayPal's 'baggage' sparks downgrade of its stock,20230119T125200,https://www.marketwatch.com/story/paypals-baggage-sparks-downgrade-of-its-stock-11674078622,SQ,0.113597,Somewhat-Bullish,0.175594
"KeyBanc Upgrades Visa And Downgrades PayPal, Names Top Fintech Stock Picks For 2023 - Visa  ( NYSE:V ) ",20230109T182331,https://www.benzinga.com/analyst-ratings/analyst-color/23/01/30337749/keybanc-upgrades-visa-and-downgrades-paypal-names-top-fintech-stock-picks-for-2023,SQ,0.261117,Bullish,0.500039
One Growth Stock Down 83% You'll Wish You Own When the Bear Market Ends,20221130T121000,https://www.fool.com/investing/2022/11/30/one-growth-stock-down-83-youll-wish-you-own-when-t/,SQ,0.341587,Neutral,-0.019744
"Got $5,000? These 3 Growth Stocks Are Trading Near Their 52-Week Lows",20221122T105700,https://www.fool.com/investing/2022/11/22/got-5000-growth-stocks-trading-near-lows/,SQ,0.263231,Neutral,0.093591
Why Marqeta Stock Was Falling on Wednesday,20221109T212640,https://www.fool.com/investing/2022/11/09/why-marqeta-stock-was-falling-on-wednesday/,SQ,0.317527,Somewhat-Bullish,0.151866
The Big Banks Report Earnings and We Dig In,20221029T120000,https://www.fool.com/investing/2022/10/29/the-big-banks-report-earnings-and-we-dig-in/,SQ,0.021967,Neutral,0.097884
Why Marqeta Stock Was Up 11.7% This Week,20221022T140800,https://www.fool.com/investing/2022/10/22/why-marqeta-stock-was-up-117-this-week/,SQ,0.193465,Neutral,0.132648
Why Marqeta Stock Was Up Monday,20221017T170440,https://www.fool.com/investing/2022/10/17/why-marqeta-stock-was-up-monday/,SQ,0.640873,Somewhat-Bullish,0.177386
Is Now the Time to Buy Fintech Stocks?,20221016T093000,https://www.fool.com/investing/2022/10/16/is-now-the-time-to-buy-fintech-stocks/,SQ,0.273807,Somewhat-Bullish,0.243196
Why Shares of Marqeta Dropped 18.8% in August,20220906T201900,https://www.fool.com/investing/2022/09/06/why-shares-of-marqeta-dropped-188-in-august/,SQ,0.250386,Neutral,-0.059226
" ( MQ )  - Marqeta Has Opportunity To Add More Digital Banking Product & Services, This Analyst Says",20220831T171304,https://www.benzinga.com/news/22/08/28705039/marqeta-is-an-attractive-way-to-gain-exposure-to-one-of-the-most-critical-themes-within-his-coverage,SQ,0.297661,Somewhat-Bullish,0.334722
1 Fintech Stock Wall Street Thinks Could Soar,20220830T104500,https://www.fool.com/investing/2022/08/30/1-fintech-stock-wall-street-thinks-could-soar/,SQ,0.067919,Neutral,0.121379
Marqeta 's Q2 Beat Earns It Price Target Bump By Analysts Who See Long Term Opportunity,20220811T190238,https://www.benzinga.com/news/22/08/28458248/analysts-maintained-optimism-over-marqeta-post-q2-beat,SQ,0.199584,Neutral,0.053382
This Growth Stock Could 10x in 10 Years,20220809T110000,https://www.fool.com/investing/2022/08/09/this-growth-stock-could-10x-in-10-years/,SQ,0.236588,Somewhat-Bullish,0.239861
Why Marqetaʻs Stock Price Sank Then Recovered Thursday,20220804T211000,https://www.fool.com/investing/2022/08/04/why-marqetas-stock-price-sank-then-recovered-thurs/,SQ,0.663719,Somewhat-Bullish,0.319082
Why Marqeta Stock Rocked the Market Today,20220801T215616,https://www.fool.com/investing/2022/08/01/why-marqeta-stock-rocked-the-market-today/,SQ,0.395012,Neutral,0.138959
What Do Analyst Expect From Earnings of Fintech Stocks Block and Marqeta,20220801T191433,https://www.benzinga.com/news/22/08/28293447/read-keybancs-take-on-these-2-fintech-stocks-block-marqeta,SQ,0.573213,Somewhat-Bullish,0.154107
"1 Green Flag for Marqeta in 2022, and 1 Red Flag",20220717T111500,https://www.fool.com/investing/2022/07/17/1-green-flag-for-marqeta-in-2022-and-1-red-flag/,SQ,0.06623,Neutral,0.121747
2 Risks You Need to Know Before You Buy Marqeta,20220630T115000,https://www.fool.com/investing/2022/06/30/2-risks-you-need-to-know-before-you-buy-marqeta/,SQ,0.356609,Somewhat-Bearish,-0.239487
"Why beaten-down fintech stocks may be worth a new look, according to this analyst",20220616T161400,https://www.marketwatch.com/story/why-beaten-down-fintech-stocks-may-be-worth-a-new-look-according-to-this-analyst-11655396094,SQ,0.155803,Neutral,-0.013801
Why Marqeta Rose 12.6% in May,20220607T130000,https://www.fool.com/investing/2022/06/07/why-marqeta-rose-126-in-may/,SQ,0.14947,Neutral,0.088475
"Here's Why Barclays, Credit Suisse Analysts Were Positive On Marqeta",20220606T164457,https://www.benzinga.com/news/22/06/27570601/heres-why-barclays-credit-suisse-analysts-were-positive-on-marqeta,SQ,0.596651,Neutral,0.004707
Here's a Fast-Growing Fintech You Can Buy for Under $15 Today,20220531T154539,https://www.fool.com/investing/2022/05/31/heres-a-fast-growing-fintech-you-can-buy-for-under/,SQ,0.136499,Neutral,0.004097
Michael Lewis on How to Spot the Real Expert,20220526T213300,https://www.fool.com/investing/2022/05/26/michael-lewis-on-how-to-spot-the-real-expert/,SQ,0.012718,Somewhat-Bullish,0.1568
7 Stocks Moved By Traders On 'Fast Money: Halftime Report',20220526T175036,https://www.benzinga.com/media/22/05/27425096/7-stocks-moved-by-traders-on-fast-money-halftime-report,SQ,0.248343,Neutral,0.000852
PreMarket Prep Stock Of The Day: Affirm's Q3 Earnings Rip,20220513T203520,https://www.benzinga.com/news/earnings/22/05/27199242/premarket-prep-stock-of-the-day-affirm,SQ,0.169022,Neutral,0.045549
Marqeta Shares Shoot Higher On Positive Analyst View Post Q1,20220512T182840,https://www.benzinga.com/news/22/05/27170319/marqeta-shares-shoot-up-on-positive-analyst-view-post-q1,SQ,0.17484,Somewhat-Bullish,0.249862
H&R Block  ( HRB )  to Report Q3 Earnings: What's in the Cards?,20220506T152400,https://www.zacks.com/stock/news/1917985/hr-block-hrb-to-report-q3-earnings-whats-in-the-cards,SQ,0.308117,Neutral,-0.018755
Got $100? Here's 1 Great Stock to Buy and Hold,20220425T112000,https://www.fool.com/investing/2022/04/25/got-100-heres-1-great-stock-to-buy-and-hold/,SQ,0.115676,Neutral,0.05891
Fintech Stocks Look Cheap. Wells Fargo Says It's Time to Buy.,20220405T162600,https://www.barrons.com/articles/fintech-stocks-buy-paypal-block-51649175923,SQ,0.167438,Neutral,0.001542
Who Benefits From Amazon's Stock Split?,20220316T162750,https://www.fool.com/investing/2022/03/16/who-benefits-from-amazons-stock-split/,SQ,0.012761,Somewhat-Bullish,0.150379
"Cathie Wood Buys Amazon, AMD Stock - Trims Palantir, Block Holdings Amid AI And Bitcoin Euphoria - Advanced Micro Devices  ( NASDAQ:AMD ) ",20241128T014238,https://www.benzinga.com/24/11/42227834/cathie-wood-buys-amazon-amd-stock-trims-palantir-block-holdings-amid-ai-and-bitcoin-euphoria,SQ,0.235823,Somewhat-Bullish,0.18789
Cathie Wood Buys $9M In Roblox Shares Following Q2 Miss - Dumps This Bitcoin-Linked Stock,20220811T110425,https://www.benzinga.com/trading-ideas/long-ideas/22/08/28447421/cathie-wood-buys-9-million-worth-roblox-corp-shares-makes-a-major-sale-in-this-financial,SQ,0.335367,Bullish,0.422265
