title,time_published,url,ticker,relevance_score,ticker_sentiment_label,ticker_sentiment_score
"Earnings Scheduled For May 12, 2022",20220512T085523,https://www.benzinga.com/news/earnings/22/05/27156592/earnings-scheduled-for-may-12-2022,SQSP,0.017681,Neutral,0.000134
GGV Capital Launches the SMBTech 50,20220426T110000,https://www.prnewswire.com/news-releases/ggv-capital-launches-the-smbtech-50-301532632.html,SQSP,0.070105,Neutral,0.085063
It's Spring! Get Ready to Trim Some of the Stocks in Your Portfolio.,20220421T141500,https://www.fool.com/investing/2022/04/21/its-spring-get-ready-to-trim-some-of-the-stocks-in/,SQSP,0.00683,Neutral,0.003724
90 Biggest Movers From Yesterday,20220513T094449,https://www.benzinga.com/news/22/05/27184008/90-biggest-movers-from-yesterday,SQSP,0.043547,Neutral,0.020634
"On Heels Of Amex Acquisition, Tock Announces New Hotel Partnership",20240712T135106,https://www.forbes.com/sites/jenniferleighparker/2024/07/12/on-heels-of-amex-acquisition-tock-announces-new-hotel-partnership/,SQSP,0.020491,Neutral,0.075293
A new crop of startups wants to help solve loneliness among millennials and Gen Z. Here's how they're connecting strangers and making money.,20240510T141800,https://www.businessinsider.com/irl-social-startups-combat-loneliness-among-millennials-gen-z-2024-5,SQSP,0.02546,Neutral,0.069651
12 Information Technology Stocks Moving In Thursday's Intraday Session,20220512T175323,https://www.benzinga.com/trading-ideas/movers/22/05/27171851/12-information-technology-stocks-moving-in-thursdays-intraday-session,SQSP,0.11897,Neutral,0.002136
"Stocks could see more tumult next week, especially if bond yields continue to scream higher",20220506T200333,https://www.cnbc.com/2022/05/06/stocks-could-see-more-tumult-next-week-especially-if-bond-yields-continue-to-scream-higher.html,SQSP,0.938084,Neutral,0.001326
