title,time_published,url,ticker,relevance_score,ticker_sentiment_label,ticker_sentiment_score
51 Biggest Movers From Yesterday,20220331T094126,https://www.benzinga.com/news/22/03/26390922/51-biggest-movers-from-yesterday,SRAD,0.071731,Neutral,0.045001
"Nasdaq Drops Over 100 Points; US Retail Sales Rise 1.3% - BrainsWay  ( NASDAQ:BWAY ) , Consolidated Water Co  ( NASDAQ:CWCO ) ",20221116T152238,https://www.benzinga.com/news/22/11/29750591/nasdaq-drops-over-100-points-us-retail-sales-rise-1-3,SRAD,0.14131,Bullish,0.393036
Market Cap Game Show: Andy Cross vs. Bill Mann,20240330T114500,https://www.fool.com/investing/2024/03/30/market-cap-game-show-andy-cross-vs-bill-mann/,SRAD,0.017745,Neutral,0.0
AI in Sports Market worth $2.61 billion by 2030 - Exclusive Report by MarketsandMarkets™,20241128T150100,https://www.benzinga.com/pressreleases/24/11/n42233772/ai-in-sports-market-worth-2-61-billion-by-2030-exclusive-report-by-marketsandmarkets,SRAD,0.057215,Neutral,0.02796
The Benchmark Company Announces Upcoming September Conference Schedule,20240822T151153,https://www.benzinga.com/pressreleases/24/08/g40510267/the-benchmark-company-announces-upcoming-september-conference-schedule,SRAD,0.050679,Neutral,0.0
Sports Betting Goes Live In Ontario: Why It's Important And 8 Stocks To Watch,20220404T205904,https://www.benzinga.com/news/22/04/26461629/sports-betting-goes-live-in-ontario-why-its-important-and-8-stocks-to-watch,SRAD,0.101539,Neutral,0.051365
35 Stocks Moving In Wednesday's Mid-Day Session,20220330T162417,https://www.benzinga.com/news/22/03/26378615/35-stocks-moving-in-wednesdays-mid-day-session,SRAD,0.104683,Neutral,0.024443
