title,time_published,url,ticker,relevance_score,ticker_sentiment_label,ticker_sentiment_score
Why Alcon Shares Are Trading Higher By Over 10%; Here Are 20 Stocks Moving Premarket - Alcon  ( NYSE:ALC ) ,20240514T123032,https://www.benzinga.com/news/24/05/38814828/why-alcon-shares-are-trading-higher-by-over-10-here-are-20-stocks-moving-premarket,STNE,0.156461,Neutral,-0.055875
"Monday.Com Reports Q3 Beat, Joins Fortrea Holdings, Henry Schein And Other Big Stocks Moving Higher On Monday - Consensus Cloud Solutions  ( NASDAQ:CCSI ) , Boeing  ( NYSE:BA ) ",20231113T163049,https://www.benzinga.com/news/23/11/35753005/monday-com-reports-q3-beat-joins-fortrea-holdings-henry-schein-and-other-big-stocks-moving-higher-on,STNE,0.202366,Somewhat-Bullish,0.233382
"TeraWulf Posts Weak Results, Joins StoneCo And Other Big Stocks Moving Lower In Tuesday's Pre-Market Session - TeraWulf  ( NASDAQ:WULF ) ",20240514T092446,https://www.benzinga.com/news/24/05/38808973/terawulf-posts-weak-results-joins-stoneco-and-other-big-stocks-moving-lower-in-tuesdays-pre-market-s,STNE,0.241684,Neutral,-0.077179
Why Fusion Pharmaceuticals Shares Are Trading Higher By Around 95%; Here Are 20 Stocks Moving Premarket - Fusion Pharmaceuticals  ( NASDAQ:FUSN ) ,20240319T121056,https://www.benzinga.com/news/24/03/37819142/why-fusion-pharmaceuticals-shares-are-trading-higher-by-around-95-here-are-20-stocks-moving-premarke,STNE,0.135729,Neutral,-0.051204
2 Stocks Down 73% and 83% to Buy Right Now,20240321T111000,https://www.fool.com/investing/2024/03/21/2-stocks-down-73-and-825-to-buy-right-now/,STNE,0.3964,Neutral,-0.080435
"Even As Bitcoin Charts New All-Time Highs, Cathie Wood's Ark Invest Keeps Selling Coinbase Shares - Offloads $68.7M Worth Of Stock - ARK Fintech Innovation ETF  ( ARCA:ARKF ) ",20240312T032523,https://www.benzinga.com/markets/cryptocurrency/24/03/37605087/even-as-bitcoin-charts-new-all-time-highs-cathie-woods-ark-invest-keeps-selling-coinbase-s,STNE,0.244109,Bullish,0.441039
Cathie Wood's Ark Invest Sells Nearly $31M Worth Of Coinbase Shares Amid Searing Bitcoin Rally - Loads Up On Mark Zuckerberg's Meta Platforms - Coinbase Glb  ( NASDAQ:COIN ) ,20240305T041734,https://www.benzinga.com/markets/cryptocurrency/24/03/37473687/cathie-woods-ark-invest-sells-nearly-31m-worth-of-coinbase-shares-amid-searing-bitcoin-ral,STNE,0.164468,Somewhat-Bullish,0.236785
