title,time_published,url,ticker,relevance_score,ticker_sentiment_label,ticker_sentiment_score
"Smart Parcel Locker Market Size Worth USD 1,833.9 Million by 2029 | Report by Fortune Business Insights",20230110T115004,https://www.benzinga.com/pressreleases/23/01/g30348901/smart-parcel-locker-market-size-worth-usd-1-833-9-million-by-2029-report-by-fortune-business-insig,SZIHF,0.039745,Neutral,-0.003883
"With 12.5% CAGR, Smart Parcel Locker Market Worth USD 1833.9 Million by 2029",20220712T120501,https://www.benzinga.com/pressreleases/22/07/g28030942/with-12-5-cagr-smart-parcel-locker-market-worth-usd-1833-9-million-by-2029,SZIHF,0.03478,Neutral,-0.00381
DAO: 3 Trending China Stocks to Consider,20240223T140330,https://stocknews.com/news/dao-xnet-tour-3-trending-china-stocks-to-consider/,SZIHF,0.025734,Neutral,-0.05319
"EHang Reports Second Quarter 2023 Unaudited Financial Results - EHang Holdings  ( NASDAQ:EH ) , Tarena International  ( NASDAQ:TEDU ) ",20230817T090000,https://www.benzinga.com/pressreleases/23/08/g33890532/ehang-reports-second-quarter-2023-unaudited-financial-results,SZIHF,0.049255,Somewhat-Bullish,0.161244
EHang Reports Second Quarter 2023 Unaudited Financial Results,20230817T090000,https://www.globenewswire.com/news-release/2023/08/17/2727011/0/en/EHang-Reports-Second-Quarter-2023-Unaudited-Financial-Results.html,SZIHF,0.048953,Somewhat-Bullish,0.153151
Tuniu Announces Unaudited Third Quarter 2022 Financial Results,20221201T100000,https://www.prnewswire.com/news-releases/tuniu-announces-unaudited-third-quarter-2022-financial-results-301691176.html,SZIHF,0.02162,Neutral,-0.034892
Geely's Zeekr raises US$441 million in biggest Chinese IPO in US since mid-2021,20240510T061906,https://www.scmp.com/business/china-business/article/3262148/geelys-ev-unit-zeekr-raises-us441-million-top-end-new-york-ipo-price-range-biggest-chinese-stock,SZIHF,0.061473,Neutral,-0.064002
"Pinduoduo Crushes Analyst Expectations, Week In Review",20230526T151356,https://www.forbes.com/sites/brendanahern/2023/05/26/pinduoduo-crushes-analyst-expectations-week-in-review/,SZIHF,0.071145,Neutral,0.10173
"US-China Relations To Improve ""Very Shortly"", Examining The Micron ""Ban"", Full Truck & Kuaishou Beat",20230522T141625,https://www.forbes.com/sites/brendanahern/2023/05/22/us-china-relations-to-improve-very-shortly-examining-the-micron-ban-full-truck--kuaishou-beat/,SZIHF,0.098456,Neutral,0.117531
"Baidu Beats, Retail Sales Up +18% Year-Over-Year",20230516T143925,https://www.forbes.com/sites/brendanahern/2023/05/16/baidu-beats-retail-sales-up-18-year-over-year/,SZIHF,0.043979,Neutral,0.059634
"MSCI Announces Index Review Results, Week In Review",20230512T150352,https://www.forbes.com/sites/brendanahern/2023/05/12/msci-announces-index-review-results-week-in-review/,SZIHF,0.064276,Neutral,0.092344
JD.com Beats Estimates In Q1,20230511T151620,https://www.forbes.com/sites/brendanahern/2023/05/11/jdcom-beats-estimates-in-q1/,SZIHF,0.05339,Neutral,0.111687
Hot Pot Chain Haidilao Issues Hot Forecast,20230227T170313,https://www.forbes.com/sites/brendanahern/2023/02/27/hot-pot-chain-haidilao-issues-hot-forecast/,SZIHF,0.041901,Neutral,0.116304
Foreign Investors Buy China In Size,20230119T154853,https://www.forbes.com/sites/brendanahern/2023/01/19/foreign-investors-buy-china-in-size/,SZIHF,0.27432,Neutral,0.080784
"Unimpressive Hong Kong Keeps No. 3 Spot In Global IPO Race - Alibaba Group Holding  ( NYSE:BABA ) , KE Holdings  ( NYSE:BEKE ) ",20230109T135150,https://www.benzinga.com/news/small-cap/23/01/30332489/unimpressive-hong-kong-keeps-no-3-spot-in-global-ipo-race,SZIHF,0.063425,Neutral,0.017097
"Alibaba Bounces As China Outperforms On Muted Inflation, Week In Review",20220610T150056,https://www.forbes.com/sites/brendanahern/2022/06/10/alibaba-bounces-as-china-outperforms-on-muted-inflation-week-in-review/,SZIHF,0.115927,Neutral,0.127444
"Meituan Motors, EVs Electrify, Didi To Relist In Hong Kong",20220606T162150,https://www.forbes.com/sites/brendanahern/2022/06/06/meituan-motors-evs-electrify-didi-to-relist-in-hong-kong/,SZIHF,0.083687,Neutral,0.026997
"Small-Cell Lung Cancer Market to Accelerate Substantially During the Study Period  ( 2019-2032 ) , Assesses DelveInsight | Leading Companies - Amgen, Novartis, AbbVie, BMS, Clovis Oncology, Cardiff Oncology, Roche, Daiichi Sankyo",20231004T210100,https://www.prnewswire.com/news-releases/small-cell-lung-cancer-market-to-accelerate-substantially-during-the-study-period-20192032-assesses-delveinsight--leading-companies----amgen-novartis-abbvie-bms-clovis-oncology-cardiff-oncology-roche-daiichi-sankyo-301946615.html,SZIHF,0.021778,Neutral,-0.092267
Jayud Global Logistics Regains Compliance with Nasdaq's Minimum Bid Price Requirement,20241127T173800,https://www.globenewswire.com/news-release/2024/11/27/2988378/0/en/Jayud-Global-Logistics-Regains-Compliance-with-Nasdaq-s-Minimum-Bid-Price-Requirement.html,SZIHF,0.319933,Somewhat-Bullish,0.262061
Jayud Global Logistics Announces Receipt of Nasdaq Notification Letter Regarding Minimum Bid Price Deficiency,20240607T201500,https://www.globenewswire.com/news-release/2024/06/07/2895571/0/en/Jayud-Global-Logistics-Announces-Receipt-of-Nasdaq-Notification-Letter-Regarding-Minimum-Bid-Price-Deficiency.html,SZIHF,0.213048,Neutral,0.116951
Jayud Announces New Certification and Launch of Longgang E-Commerce Operation Center,20240521T113000,https://www.globenewswire.com/news-release/2024/05/21/2885476/0/en/Jayud-Announces-New-Certification-and-Launch-of-Longgang-E-Commerce-Operation-Center.html,SZIHF,0.346884,Somewhat-Bullish,0.341329
Jayud Global Logistics Receives Nasdaq Notification of Non-Compliance with Listing Rule 5550 ( b )  ( 1 ) ,20240503T203000,https://www.globenewswire.com/news-release/2024/05/03/2875362/0/en/Jayud-Global-Logistics-Receives-Nasdaq-Notification-of-Non-Compliance-with-Listing-Rule-5550-b-1.html,SZIHF,0.282234,Somewhat-Bullish,0.166272
Jayud Announces New Air Charter Service Agreement with JD Airlines - Jayud Global Logistics  ( NASDAQ:JYD ) ,20231219T130000,https://www.benzinga.com/pressreleases/23/12/n36301289/jayud-announces-new-air-charter-service-agreement-with-jd-airlines,SZIHF,0.468029,Bullish,0.46703
"Jayud Announces Agreement with Zhuhai Xiaomi Communications, the World-Renowned Smartphone Maker Xiaomi's Subsidiary, to Provide Customs Services - Jayud Global Logistics  ( NASDAQ:JYD ) ",20230905T110000,https://www.benzinga.com/pressreleases/23/09/n34228894/jayud-announces-agreement-with-zhuhai-xiaomi-communications-the-world-renowned-smartphone-maker-xi,SZIHF,0.219312,Somewhat-Bullish,0.217105
Jayud Global Logistics Limited Announces the Engagement of Strategic Investor Relations LLC to Lead Investor Engagement and Financial Communications Efforts - Jayud Global Logistics  ( NASDAQ:JYD ) ,20230712T113000,https://www.benzinga.com/pressreleases/23/07/n33196123/jayud-global-logistics-limited-announces-the-engagement-of-strategic-investor-relations-llc-to-lea,SZIHF,0.230017,Somewhat-Bullish,0.232044
"ATRenew Posts Market-Defying Growth As Partnerships With JD.com, Apple Advance - Apple  ( NASDAQ:AAPL ) , Carvana  ( NYSE:CVNA ) ",20240826T133523,https://www.benzinga.com/markets/penny-stocks/24/08/40553340/atrenew-posts-market-defying-growth-as-partnerships-with-jd-com-apple-advance,SZIHF,0.034039,Neutral,0.123016
"ATRenew Polishes Recycling Credentials To Record First Profit - RealReal  ( NASDAQ:REAL ) , Carvana  ( NYSE:CVNA ) ",20240320T153034,https://www.benzinga.com/markets/penny-stocks/24/03/37850859/atrenew-polishes-recycling-credentials-to-record-first-profit,SZIHF,0.03468,Somewhat-Bullish,0.164462
"Chinese snap up used Rolexes, Birkins to satisfy luxury cravings amid slowdown",20220928T010800,https://www.reuters.com/business/retail-consumer/chinese-snap-up-used-rolexes-birkins-satisfy-luxury-cravings-amid-slowdown-2022-09-28/,SZIHF,0.059636,Neutral,0.025008
"Data centres, EVs bring growth and climate challenges to Hong Kong utility CLP",20241106T003008,https://www.scmp.com/business/article/3285317/data-centres-evs-bring-growth-and-climate-challenges-hong-kong-utility-clp-ceo-says,SZIHF,0.114682,Neutral,0.053191
46% of Warren Buffett's $410 Billion Portfolio Is Invested in 4 Artificial Intelligence  ( AI )  Stocks,20240712T073400,https://www.fool.com/investing/2024/07/12/46-warren-buffett-portfolio-invested-4-ai-stocks/,SZIHF,0.035555,Neutral,-0.003895
"Agility & Resilience, Leading Finance Digital Infrastructure Innovation - PR Newswire",20240607T130900,https://www.prnewswire.com/apac/news-releases/agility--resilience-leading-finance-digital-infrastructure-innovation-302167099.html,SZIHF,0.130926,Somewhat-Bullish,0.196427
