title,time_published,url,ticker,relevance_score,ticker_sentiment_label,ticker_sentiment_score
Stocks That Hit 52-Week Lows On Monday,20220613T161842,https://www.benzinga.com/markets/options/22/06/27677156/52-weeks-high-and-low-article,THC,0.005366,Neutral,0.001967
This Technology Stock Surged 235%; Here Are 77 Biggest Movers From Friday,20220725T083855,https://www.benzinga.com/news/22/07/28182325/this-technology-stock-surged-235-here-are-77-biggest-movers-from-friday,THC,0.086245,Somewhat-Bullish,0.228297
New Strong Buy Stocks for July 23rd,20240723T104300,https://www.zacks.com/commentary/2305797/new-strong-buy-stocks-for-july-23rd,THC,0.52759,Somewhat-Bullish,0.203397
Tenet Healthcare and Skyworks Solutions have been highlighted as Zacks Bull and Bear of the Day,20240606T130900,https://www.zacks.com/stock/news/2284705/tenet-healthcare-and-skyworks-solutions-have-been-highlighted-as-zacks-bull-and-bear-of-the-day,THC,0.137671,Neutral,0.103442
"Why Huntington Bancshares Shares Surged Around 10%; Here Are 72 Biggest Movers From Friday - Amprius Technologies  ( NYSE:AMPX ) , ALFI  ( NASDAQ:ALF ) ",20221024T093702,https://www.benzinga.com/news/22/10/29374553/why-huntington-bancshares-shares-surged-around-10-here-are-72-biggest-movers-from-friday,THC,0.062761,Neutral,0.069016
"US Stocks Set To Bounce Back Strongly From Oversold Levels As Earnings, Fed Decision Take The Spotlight - Lattice Semiconductor  ( NASDAQ:LSCC ) , General Motors  ( NYSE:GM ) , Rambus  ( NASDAQ:RMBS ) , Tenet Healthcare  ( NYSE:THC ) ",20231030T112214,https://www.benzinga.com/news/earnings/23/10/35486931/us-stocks-set-to-bounce-back-strongly-from-oversold-levels-as-earnings-fed-decision-take-the-spotli,THC,0.090816,Neutral,0.0
"Apple, AMD, Palantir Earnings On Deck This Week As Market Seeks Positive Catalysts In Fed Decision Week - Lattice Semiconductor  ( NASDAQ:LSCC ) , Exact Sciences  ( NASDAQ:EXAS ) , Amgen  ( NASDAQ:AMGN ) , STMicroelectronics  ( NYSE:STM ) ",20231030T074015,https://www.benzinga.com/analyst-ratings/analyst-color/23/10/35484208/apple-amd-palantir-earnings-on-deck-this-week-as-market-seeks-positive-catalysts-in,THC,0.0864,Neutral,0.0
