title,time_published,url,ticker,relevance_score,ticker_sentiment_label,ticker_sentiment_score
This Healthcare Stock Is Trading Lower By 29%: Here Are 29 Stocks Moving Premarket,20220818T112324,https://www.benzinga.com/news/22/08/28547830/this-healthcare-stock-is-trading-lower-by-29-here-are-29-stocks-moving-premarket,TLSA,0.105449,Neutral,-0.038264
50 Stocks Moving In Wednesday's Mid-Day Session,20220608T162921,https://www.benzinga.com/news/22/06/27612909/50-stocks-moving-in-wednesdays-mid-day-session,TLSA,0.125264,Neutral,0.051692
CD3 Antibody Clinical Trials Market Opportunity Insight,20231012T062602,https://www.benzinga.com/pressreleases/23/10/g35212251/cd3-antibody-clinical-trials-market-opportunity-insight,TLSA,0.047278,Neutral,-0.087996
"Proactive news headlines including Haleon, GSK, Pfizer, Québec Nickel, Thunderbird Entertainment Group, GoviEx Uranium, Belmont Resources, Canada Silver Cobalt and Tocvan Ventures",20220920T175413,https://www.benzinga.com/pressreleases/22/09/g28937162/proactive-news-headlines-including-haleon-gsk-pfizer-qu-bec-nickel-thunderbird-entertainment-group,TLSA,0.050359,Somewhat-Bullish,0.326664
This Healthcare Stock is Surging By Over 21%: Here's 24 Biggest Movers In Tuesday's Pre-Market,20220712T101430,https://www.benzinga.com/news/22/07/28028863/this-healthcare-stock-is-surging-by-over-21-heres-24-biggest-movers-in-tuesdays-pre-market,TLSA,0.11894,Neutral,0.0
"Proactive news headlines including American Resources, HighGold Mining, Harbor Custom Development, Fireweed Zinc, Dalrada and Recruiter.com",20220310T184659,https://www.benzinga.com/pressreleases/22/03/g26087764/proactive-news-headlines-including-american-resources-highgold-mining-harbor-custom-development-fi,TLSA,0.054545,Somewhat-Bullish,0.234141
