title,time_published,url,ticker,relevance_score,ticker_sentiment_label,ticker_sentiment_score
Best Momentum Stocks to Buy for December 1st,20231201T150000,https://www.zacks.com/commentary/2191909/best-momentum-stocks-to-buy-for-december-1st,TM,0.680008,Neutral,0.0
New Strong Buy Stocks for December 1st,20231201T110200,https://www.zacks.com/commentary/2191273/new-strong-buy-stocks-for-december-1st,TM,0.52759,Neutral,0.0
"Toyota Motor, SEALSQ, KULR Technology And Other Big Stocks Moving Higher On Thursday - Exodus Movement  ( AMEX:EXOD ) ",20241226T152118,https://www.benzinga.com/24/12/42686714/toyota-motor-sealsq-kulr-technology-and-other-big-stocks-moving-higher-on-thursday,TM,0.428632,Somewhat-Bullish,0.333973
"Costco Goes Netflix Way To Stop Sharing Of Subscriptions, Satya Nadella Wants To Ditch Console Exclusives, Investors Cheer Rite Aid Q1 Performance: Today's Top Stories",20230629T133618,https://markets.businessinsider.com/news/stocks/costco-goes-netflix-way-to-stop-sharing-of-subscriptions-satya-nadella-wants-to-ditch-console-exclusives-investors-cheer-rite-aid-q1-performance-today-s-top-stories-1032418049,TM,0.033421,Neutral,0.099187
"Top Stories Thursday, June 29: Costco Goes Netflix Way To Stop Sharing Of Subscriptions, Satya Nadella Wants To Ditch Console Exclusives, Investors Cheer Rite Aid Q1 Performance - Costco Wholesale  ( NASDAQ:COST ) , Amazon.com  ( NASDAQ:AMZN ) ",20230629T133617,https://www.benzinga.com/news/23/06/33059187/costco-goes-netflix-way-to-stop-sharing-of-subscriptions-satya-nadella-wants-to-ditch-console-exclus,TM,0.074692,Somewhat-Bullish,0.168841
"Earnings Scheduled For May 11, 2022",20220511T102312,https://www.benzinga.com/news/earnings/22/05/27129387/earnings-scheduled-for-may-11-2022,TM,0.025426,Neutral,0.004358
Better Energy Stock: QuantumScape vs. NuScale Power,20241217T093500,https://www.fool.com/investing/2024/12/17/better-energy-stock-quantumscape-vs-nuscale-power/,TM,0.049732,Neutral,0.031028
