title,time_published,url,ticker,relevance_score,ticker_sentiment_label,ticker_sentiment_score
Microsoft  ( MSFT )  Q1 2023 Earnings Call Transcript,20221026T033040,https://www.fool.com/earnings/call-transcripts/2022/10/25/microsoft-msft-q1-2023-earnings-call-transcript/,TTRAF,0.00437,Somewhat-Bullish,0.195699
"OTT Market to Grow by USD 630.5 Billion  ( 2024-2028 )  with Cloud Streaming Boost, AI-Powered Market Evolution Report- Technavio",20240917T210500,https://www.benzinga.com/pressreleases/24/09/n40909922/ott-market-to-grow-by-usd-630-5-billion-2024-2028-with-cloud-streaming-boost-ai-powered-market-evo,TTRAF,0.022794,Neutral,0.075826
Over The Top  ( OTT )  Market size is to grow by USD 439.12 billion from 2022 to 2027; the growing preference for cloud streaming services drives the market - Technavio,20230620T081434,https://www.benzinga.com/pressreleases/23/06/n32917141/over-the-top-ott-market-size-is-to-grow-by-usd-439-12-billion-from-2022-to-2027-the-growing-prefer,TTRAF,0.012447,Neutral,0.0
Over the top  ( OTT )  market size to grow by USD 439.12 billion between 2022 and 2027; APAC will account for 34% of market growth - Technavio,20230227T083000,https://www.benzinga.com/pressreleases/23/02/n31064134/over-the-top-ott-market-size-to-grow-by-usd-439-12-billion-between-2022-and-2027-apac-will-account,TTRAF,0.014332,Neutral,0.0
Over-the-top  ( OTT )  market to grow by 21.42% Y-O-Y from 2022 to 2023: Growing preference for cloud streaming services will drive growth - Technavio,20221205T200000,https://www.benzinga.com/pressreleases/22/12/n29963599/over-the-top-ott-market-to-grow-by-21-42-y-o-y-from-2022-to-2023-growing-preference-for-cloud-stre,TTRAF,0.015255,Neutral,0.0
