title,time_published,url,ticker,relevance_score,ticker_sentiment_label,ticker_sentiment_score
Stocks That Hit 52-Week Lows On Wednesday,20220511T162815,https://www.benzinga.com/markets/options/22/05/27141482/52-weeks-high-and-low-article,UBER,0.006905,Neutral,0.025491
Stocks That Hit 52-Week Lows On Friday,20220506T160650,https://www.benzinga.com/markets/options/22/05/27050916/52-weeks-high-and-low-article,UBER,0.005467,Neutral,-0.001654
UniUni Closes Oversubscribed US$50 Million Series C Round Led by DCM,20240416T130000,https://www.newswire.ca/news-releases/uniuni-closes-oversubscribed-us-50-million-series-c-round-led-by-dcm-855806439.html,UBER,0.043818,Neutral,0.100024
How Pitney Bowes' Newly Launched No-Box/No-Label Returns Service Works,20240105T130054,https://www.kiplinger.com/personal-finance/online-shopping/pitney-bowes-no-box-no-label-returns,UBER,0.213048,Neutral,-0.019839
What the potential UPS strike could mean for your packages | Business,20230617T110300,https://www.cnn.com/2023/06/17/business/ups-strike-workers-retail-online-shopping/index.html,UBER,0.042122,Neutral,0.0
Nasdaq Bear Market: 4 Unstoppable Growth Stocks You'll Regret Not Buying on the Dip,20220625T154600,https://www.fool.com/investing/2022/06/25/nasdaq-bear-market-4-unstoppable-growth-stocks-you/,UBER,0.037434,Somewhat-Bullish,0.259383
Stocks That Hit 52-Week Lows On Tuesday,20220524T161351,https://www.benzinga.com/markets/options/22/05/27375519/52-weeks-high-and-low-article,UBER,0.010175,Neutral,-0.007079
Zara's Move Suggests Free Returns May Become Rare,20220524T160439,https://www.forbes.com/sites/retailwire/2022/05/24/zaras-move-suggests-free-returns-may-become-rare/,UBER,0.044852,Neutral,-0.044656
"Online to Offline Commerce Market 2022 | Impressive Growth in Size to Reach US$ 422.62 Billion By 2027 | Report Focuses on Top Companies and Crucial Drivers, Current Growth Dynamics, Size, Futuristic Opportunities, and New Product Launch",20220616T123714,https://www.benzinga.com/pressreleases/22/06/g27738140/online-to-offline-commerce-market-2022-impressive-growth-in-size-to-reach-us-422-62-billion-by-202,UBER,0.024464,Neutral,0.009507
"Full Truck Alliance Goes Full Throttle On User Acquisitions - Baidu  ( NASDAQ:BIDU ) , Full Truck Alliance Co  ( NYSE:YMM ) ",20240311T171922,https://www.benzinga.com/24/03/37594809/full-truck-alliance-goes-full-throttle-on-user-acquisitions,UBER,0.034039,Neutral,0.034107
Alibaba cuts stake in loss-making logistics services firm GoGoX,20240104T150010,https://www.scmp.com/tech/big-tech/article/3247308/alibaba-reduces-stake-gogox-amid-hong-kong-logistics-services-firms-mounting-losses-it-faces,UBER,0.055109,Somewhat-Bullish,0.252974
Exclusive: Self-driving startup Plus splits US and China operations amid tensions,20231011T001744,https://www.reuters.com/business/autos-transportation/self-driving-startup-plus-splits-us-china-operations-amid-tensions-2023-10-11/,UBER,0.066784,Neutral,-0.122588
Webus Rides Bumpy Road To IPO Even As Travel In China Returns - Uber Technologies  ( NYSE:UBER ) ,20230412T134133,https://www.benzinga.com/23/04/31769021/webus-rides-bumpy-road-to-ipo-even-as-travel-in-china-returns,UBER,0.068016,Neutral,0.116362
"With DiDi Reprieve, Is China Taking the Handbrake off the Tech Sector?",20220613T164624,https://www.benzinga.com/markets/penny-stocks/22/06/27679256/with-didi-reprieve-is-china-taking-the-handbrake-off-the-tech-sector,UBER,0.034194,Neutral,0.016862
Chinese tech ADRs rise as end of Didi probe raises hope of easing crackdowns,20220606T145800,https://www.reuters.com/markets/europe/chinese-tech-adrs-rise-end-didi-probe-raises-hope-easing-crackdowns-2022-06-06/,UBER,0.110768,Neutral,0.006064
"Didi set to resume app downloads, new user registrations as probe nears end",20220606T093007,https://www.scmp.com/tech/policy/article/3180607/didi-resume-app-downloads-and-new-user-registrations-beijing-security,UBER,0.080674,Somewhat-Bullish,0.22965
Hong Kong new listings volume sinks to 9-year low on China slowdown,20220519T080700,https://www.reuters.com/markets/deals/hong-kong-new-listings-volume-sinks-9-year-low-china-slowdown-2022-05-19/,UBER,0.069094,Neutral,0.005284
SVF Investment Corp. 3 Announces Effectiveness of Registration Statement for Business Combination with Symbotic,20220510T100000,https://www.prnewswire.com/news-releases/svf-investment-corp-3-announces-effectiveness-of-registration-statement-for-business-combination-with-symbotic-301543432.html,UBER,0.018568,Neutral,0.008457
Full Truck Alliance Shift Up a Gear on Regulatory Easing Reports,20220503T160915,https://www.benzinga.com/markets/penny-stocks/22/05/26968936/full-truck-alliance-shift-up-a-gear-on-regulatory-easing-reports,UBER,0.036304,Neutral,0.007681
China's Full Truck Alliance pauses $1 billion Hong Kong listing - sources,20220428T080100,https://www.reuters.com/business/autos-transportation/chinas-full-truck-alliance-pauses-1-billion-hong-kong-listing-sources-2022-04-28/,UBER,0.067214,Neutral,-0.016118
"U.S.-Bound China IPO Train Could Resume by Summer, Latest Signals Show",20220404T161412,https://www.benzinga.com/markets/asia/22/04/26455197/u-s-bound-china-ipo-train-could-resume-by-summer-latest-signals-show,UBER,0.035529,Somewhat-Bearish,-0.150904
Stocks That Hit 52-Week Lows On Wednesday,20220504T162909,https://www.benzinga.com/markets/options/22/05/26995541/52-weeks-high-and-low-article,UBER,0.012359,Neutral,0.004613
"With Resale App TipTop, Postmates Founder Bastian Lehmann Wants To Turn Your Junk Into Cash",20230921T150010,https://www.forbes.com/sites/alexkonrad/2023/09/21/with-resale-app-tiptop-postmates-founder-bastian-lehmann-wants-to-turn-your-junk-into-cash/,UBER,0.023464,Neutral,0.054248
This startup wants to curb fast fashion by helping you rent out your closet,20230531T211808,https://www.cnbc.com/2023/05/31/by-rotation-fashion-startup-wants-to-help-you-rent-out-your-closet.html,UBER,0.029951,Neutral,0.0
"Disney earnings, Fed's Powell speech, SBF bail backers? top week ahead",20230205T220127,https://www.foxbusiness.com/markets/disney-earnings-feds-powell-speech-sbf-bail-backers-top-week-ahead,UBER,0.052112,Neutral,0.046699
How to build an emergency savings fund during an era of inflation,20221013T142239,https://www.cnbc.com/2022/10/13/how-to-build-an-emergency-savings-fund-during-an-era-of-inflation.html,UBER,0.039878,Neutral,0.026503
Uber Runs on Oracle Cloud Infrastructure - Oracle  ( NYSE:ORCL ) ,20240911T120200,https://www.benzinga.com/pressreleases/24/09/n40812023/uber-runs-on-oracle-cloud-infrastructure,UBER,0.651499,Bullish,0.467678
"Graph Database Market Size is Projected to Reach USD 14.53 Billion by 2032, Growing at a CAGR of 22.6%: Straits Research",20240822T142500,https://www.benzinga.com/pressreleases/24/08/g40509064/graph-database-market-size-is-projected-to-reach-usd-14-53-billion-by-2032-growing-at-a-cagr-of-22,UBER,0.040969,Neutral,0.090404
Rahul Chaturvedi Wins a 2024 Global Recognition Award,20240706T064958,https://markets.businessinsider.com/news/stocks/rahul-chaturvedi-wins-a-2024-global-recognition-award-1033533153,UBER,0.210457,Somewhat-Bullish,0.295017
7 Best Stocks For Magnificent Earnings Growth Next Year,20240621T200000,https://www.investors.com/research/best-stocks-sp500-sp400-sp600-magnificent-earnings-growth/,UBER,0.23281,Somewhat-Bullish,0.156597
7 Best Stocks For Magnificent Earnings Growth Next Year,20240620T181200,https://www.investors.com/news/best-stocks-sp500-sp400-sp600-magnificent-earnings-growth/,UBER,0.232439,Somewhat-Bullish,0.152935
"'Go Long on Large-Caps,' Says Oppenheimer - Here Are 2 Stocks to Consider",20240616T151756,https://markets.businessinsider.com/news/stocks/go-long-on-large-caps-says-oppenheimer-%E2%80%94-here-are-2-stocks-to-consider-1033481618,UBER,0.253646,Somewhat-Bullish,0.239218
I was laid off one day before my 2nd child was born. I landed a job at Meta in a month thanks to 5 habits I practiced even before the layoff.,20240607T003700,https://www.businessinsider.com/how-to-find-job-after-tech-layoff-meta-cruise-engineer-2024-6,UBER,0.057215,Neutral,0.14312
Stocks That Hit 52-Week Lows On Wednesday,20220525T161423,https://www.benzinga.com/markets/options/22/05/27398602/52-weeks-high-and-low-article,UBER,0.023585,Neutral,0.000661
Let's Help Big Corporates Trust The Freelance Revolution,20240424T122322,https://www.forbes.com/sites/jonyounger/2024/04/24/lets-help-big-corporates-to-trust-the-freelance-revolution/,UBER,0.028422,Neutral,-0.049934
Market Cap Game Show: Andy Cross vs. Bill Mann,20240330T114500,https://www.fool.com/investing/2024/03/30/market-cap-game-show-andy-cross-vs-bill-mann/,UBER,0.056741,Neutral,0.015002
Two experts predict AI will transform companies' understanding of themselves,20240212T103010,https://www.economist.com/by-invitation/2024/02/12/two-experts-predict-ai-will-transform-companies-understanding-of-themselves,UBER,0.045139,Neutral,0.087465
11 parent-tested tips that make traveling with kids easier,20230518T110448,https://www.cnn.com/cnn-underscored/travel/traveling-with-babies-infants,UBER,0.035164,Neutral,0.031548
Toast  ( TOST )  Q1 2023 Earnings Call Transcript,20230510T050021,https://www.fool.com/earnings/call-transcripts/2023/05/10/toast-tost-q1-2023-earnings-call-transcript/,UBER,0.004621,Neutral,0.099658
Global People Analytics Leader Visier Ranks First In Customer Satisfaction and User Experience by Leading HR Tech Market Survey,20230117T140000,https://www.prnewswire.com/news-releases/global-people-analytics-leader-visier-ranks-first-in-customer-satisfaction-and-user-experience-by-leading-hr-tech-market-survey-301722554.html,UBER,0.079656,Neutral,0.12565
Inside Elon Musk's Phone,20220930T190728,https://www.theatlantic.com/technology/archive/2022/09/elon-musk-texts-twitter-trial-jack-dorsey/671619/,UBER,0.025596,Neutral,0.087141
"Stitch Fix Cuts Over 2,000 Employees And Replaces Them With ChatGPT, Giving Them Option For Part-Time Or To Leave - Stitch Fix  ( NASDAQ:SFIX ) ",20240417T124024,https://www.benzinga.com/general/24/04/38290785/stitch-fix-cuts-over-2-000-employees-and-replaces-them-with-chatgpt-giving-them-option-for-part-time,UBER,0.074926,Somewhat-Bullish,0.167877
"Catching Up on the News at Macy's and ""Sports Illustrated",20240129T174000,https://www.fool.com/investing/2024/01/29/catching-up-on-the-news-at-macys-and-sports-illust/,UBER,0.024069,Neutral,0.086255
Zillow Group Reappoints Bill Gurley to Board of Directors - PR Newswire,20240109T210500,https://www.prnewswire.com/news-releases/zillow-group-reappoints-bill-gurley-to-board-of-directors-302030365.html,UBER,0.1172,Neutral,0.0
"Casey's  ( CASY )  Details New Strategic Plan, Up 27.3% in a Year",20230629T115900,https://www.zacks.com/stock/news/2114684/caseys-casy-details-new-strategic-plan-up-273-in-a-year,UBER,0.054983,Somewhat-Bullish,0.290993
SVB collapse is double-whammy for tech startups already navigating brutal market,20230319T130001,https://www.cnbc.com/2023/03/19/svb-fail-is-double-whammy-for-startups-dealing-with-plunge-in-venture-.html,UBER,0.023981,Neutral,0.037257
Qurate Retail Group Names Linda Aiello Chief People Officer,20221014T130000,https://www.prnewswire.com/news-releases/qurate-retail-group-names-linda-aiello-chief-people-officer-301649044.html,UBER,0.112269,Neutral,0.139198
"Qurate Retail Group Names Linda Aiello Chief People Officer - Qurate Retail  ( NASDAQ:QRTEA ) , Qurate Retail  ( NASDAQ:QRTEB ) ",20221014T130000,https://www.benzinga.com/pressreleases/22/10/n29268187/qurate-retail-group-names-linda-aiello-chief-people-officer,UBER,0.109455,Neutral,0.13133
Shopify  ( SHOP )  Q3 2024 Earnings Call Transcript,20241112T171511,https://www.fool.com/earnings/call-transcripts/2024/11/12/shopify-shop-q3-2024-earnings-call-transcript/,UBER,0.004032,Neutral,0.0
Crude Oil Moves Higher; Vera Bradley Shares Slide - Avidity Biosciences  ( NASDAQ:RNA ) ,20240612T183859,https://www.benzinga.com/news/24/06/39298443/crude-oil-moves-higher-vera-bradley-shares-slide,UBER,0.066784,Neutral,0.101213
The Entrepreneurial CMO List: 2022,20220426T103000,https://www.forbes.com/sites/sethmatlins/2022/04/26/the-forbes-entrepreneurial-cmo-list-2022/,UBER,0.00747,Neutral,0.099831
The Character of the Market Is Shifting: Here's What to Watch,20230803T160000,https://realmoney.thestreet.com/investing/the-character-of-the-market-is-shifting-here-s-what-to-watch-16130247,UBER,0.14131,Somewhat-Bullish,0.22258
3 Stocks Cathie Wood Is Buying That Should Be on Your List Too,20230716T123000,https://www.fool.com/investing/2023/07/16/3-stocks-cathie-wood-is-buying-that-should-be-on/,UBER,0.050679,Neutral,0.0
Agents Are The Future Of AI. Where Are The Startup Opportunities?,20240709T140000,https://www.forbes.com/sites/robtoews/2024/07/09/agents-are-the-future-of-ai-where-are-the-startup-opportunities/,UBER,0.018153,Neutral,0.06752
Is 'shareholder supremacy' driving the layoffs in tech?,20230517T160701,https://www.aljazeera.com/economy/2023/5/17/is-shareholder-supremacy-driving-the-layoffs-in-tech,UBER,0.24289,Neutral,-0.058513
The Easy Company secures $14.2M funding for new crypto wallet with social features,20230110T180000,https://cointelegraph.com/news/the-easy-company-secures-14-2m-funding-for-new-crypto-wallet-with-social-features,UBER,0.107016,Neutral,0.12596
Taylor Swift Tour Sparks A New Round Of Ticketmaster Backlash,20221116T202600,https://www.thestreet.com/personalities/taylor-swift-tour-sparks-a-new-round-of-ticketmaster-backlash,UBER,0.044551,Neutral,-0.03585
Uber Technologies  ( UBER )  Expected to Beat Earnings Estimates: Can the Stock Move Higher?,20220726T140125,https://www.zacks.com/stock/news/1957960/uber-technologies-uber-expected-to-beat-earnings-estimates-can-the-stock-move-higher,UBER,0.260189,Neutral,0.149177
