title,time_published,url,ticker,relevance_score,ticker_sentiment_label,ticker_sentiment_score
"Zacks Investment Ideas feature highlights: Virax Biolabs Group, GeoVax Labs, Applied DNA Sciences and Emergent BioSolutions",20240820T090000,https://www.zacks.com/stock/news/2324099/zacks-investment-ideas-feature-highlights-virax-biolabs-group-geovax-labs-applied-dna-sciences-and-emergent-biosolutions,VRAX,0.323078,Neutral,0.0
WHO Declares Monkeypox Public Emergency: 5 Mpox Stocks to Watch,20240819T150900,https://www.zacks.com/commentary/2323835/who-declares-monkeypox-public-emergency-5-mpox-stocks-to-watch,VRAX,0.271777,Neutral,0.0
Dow Jumps Over 100 Points; Estee Lauder Shares Edge Lower After Q4 Results - Estee Lauder Cos  ( NYSE:EL ) ,20240819T135610,https://www.benzinga.com/news/24/08/40441126/dow-jumps-over-100-points-estee-lauder-shares-edge-lower-after-q4-results,VRAX,0.170878,Neutral,0.094163
Why Xperi Shares Are Trading Higher By Around 12%; Here Are 20 Stocks Moving Premarket - Xperi  ( NYSE:XPER ) ,20240819T091815,https://www.benzinga.com/news/24/08/40435537/why-xperi-shares-are-trading-higher-by-around-12-here-are-20-stocks-moving-premarket,VRAX,0.142144,Neutral,0.052595
"Why Leggett & Platt Shares Are Trading Lower; Here Are 24 Stocks Moving Premarket - Blue Hat Interactive  ( NASDAQ:BHAT ) , Applied DNA Sciences  ( NASDAQ:APDN ) ",20221011T113020,https://www.benzinga.com/news/22/10/29213113/why-leggett-platt-shares-are-trading-lower-here-are-24-stocks-moving-premarket,VRAX,0.185781,Neutral,-0.069691
This Technology Stock Surged 235%; Here Are 77 Biggest Movers From Friday,20220725T083855,https://www.benzinga.com/news/22/07/28182325/this-technology-stock-surged-235-here-are-77-biggest-movers-from-friday,VRAX,0.086245,Neutral,0.075179
3 Cheap Stocks On Robinhood To Buy For Under $5,20230103T185332,https://pennystocks.com/featured/2023/01/03/3-cheap-stocks-on-robinhood-to-buy-for-under-5/,VRAX,0.085173,Neutral,0.101324
