title,time_published,url,ticker,relevance_score,ticker_sentiment_label,ticker_sentiment_score
Stocks That Hit 52-Week Lows On Wednesday,20220511T162815,https://www.benzinga.com/markets/options/22/05/27141482/52-weeks-high-and-low-article,WIT,0.006905,Neutral,-0.01328
Stocks That Hit 52-Week Lows On Monday,20220613T161842,https://www.benzinga.com/markets/options/22/06/27677156/52-weeks-high-and-low-article,WIT,0.005366,Neutral,-0.000777
Stocks That Hit 52-Week Lows On Monday,20220425T160100,https://www.benzinga.com/markets/options/22/04/26791205/52-weeks-high-and-low-article,WIT,0.008154,Neutral,0.005477
Stocks That Hit 52-Week Lows On Wednesday,20220427T184104,https://www.benzinga.com/markets/options/22/04/26844275/52-weeks-high-and-low-article,WIT,0.006956,Neutral,-0.01839
Stocks That Hit 52-Week Lows On Wednesday,20220504T162909,https://www.benzinga.com/markets/options/22/05/26995541/52-weeks-high-and-low-article,WIT,0.012359,Neutral,-0.011254
Wipro Q4 revenue growth projected at -1.5-0.5%; Q3 net profit falls 12%,20240112T155051,https://www.business-standard.com/companies/news/wipro-q4-revenue-growth-projected-at-1-5-0-5-q3-net-profit-falls-12-124011200980_1.html,WIT,0.420483,Bullish,0.431825
"Wipro posts flat Q2 profit, cuts Q3 revenue growth guidance on weak demand",20231018T161320,https://www.business-standard.com/companies/news/wipro-trims-third-quarter-revenue-growth-forecast-to-3-5-to-1-5-123101801076_1.html,WIT,0.695974,Bullish,0.361638
"Wipro beats estimates, Q3 profit rises 15% to Rs 3,053 crore | The Financial Express",20230113T191000,https://www.financialexpress.com/industry/wipro-beats-estimates-q3-profit-rises-15-to-rs-3053-crore/2947742/,WIT,0.425541,Bullish,0.494031
Why Delaporte's brave bets have failed to sustain Wipro's growth? | The Financial Express,20221127T224500,https://www.financialexpress.com/industry/why-delaportes-brave-bets-have-failed-to-sustain-wipros-growth/2893719/,WIT,0.417131,Neutral,0.07472
"At Rs 2,659 cr, Wipro Q2 profit misses estimates | The Financial Express",20221012T213000,https://www.financialexpress.com/industry/at-rs-2659-cr-wipro-q2-profit-misses-estimates/2708431/,WIT,0.468029,Bullish,0.368368
Why Selective Insurance Group Shares Are Trading Lower By Around 15%? Here Are Other Stocks Moving In Friday's Mid-Day Session - Selective Insurance Gr  ( NASDAQ:SIGI ) ,20240719T172454,https://www.benzinga.com/news/24/07/39864633/why-selective-insurance-group-shares-are-trading-lower-by-around-15-here-are-other-stocks-moving-in,WIT,0.097062,Bearish,-0.40415
Will Lower Business Revenues Dent Verizon  ( VZ )  Q4 Earnings?,20230120T140300,https://www.zacks.com/stock/news/2041914/will-lower-business-revenues-dent-verizon-vz-q4-earnings,WIT,0.059194,Neutral,0.020053
Stocks That Hit 52-Week Lows On Friday,20220429T164424,https://www.benzinga.com/markets/options/22/04/26902449/52-weeks-high-and-low-article,WIT,0.02594,Neutral,0.002653
"Third-party Banking Software Market Report- USD 12.31 billion from 2022 to 2028; Industry Trends, Share, Size ... - PR Newswire",20240111T233000,https://www.prnewswire.com/news-releases/third-party-banking-software-market-report--usd-12-31-billion-from-2022-to-2028-industry-trends-share-size-growth-opportunity-and-forecasts-302032188.html,WIT,0.046999,Neutral,0.067998
Stocks That Hit 52-Week Lows On Tuesday,20220419T153817,https://www.benzinga.com/news/22/04/26693085/stocks-that-hit-52-week-lows-on-tuesday,WIT,0.009731,Neutral,0.004785
"Business Process Outsourcing  ( BPO )  Market worth USD 293.650 Billion by 2029 Global Outsourcing Trends, Competitive Analysis, Business Environment, Regional Analysis",20230125T063608,https://www.benzinga.com/pressreleases/23/01/g30562117/business-process-outsourcing-bpo-market-worth-usd-293-650-billion-by-2029-global-outsourcing-trend,WIT,0.025596,Neutral,-0.002751
Global Business Process Outsourcing  ( BPO )  Market to Generate Sales of $492.45 Billion By 2028 | Top 10 Players Generate 60% Market Revenue,20220919T162953,https://www.benzinga.com/pressreleases/22/09/g28918336/global-business-process-outsourcing-bpo-market-to-generate-sales-of-492-45-billion-by-2028-top-10-,WIT,0.203786,Somewhat-Bullish,0.212588
"Global GDPR Services Market Size is Projected to Reach USD 13.00 billion by 2030, Growing at a CAGR of 25.2%: Straits Research",20240305T121000,https://www.benzinga.com/pressreleases/24/03/g37478109/global-gdpr-services-market-size-is-projected-to-reach-usd-13-00-billion-by-2030-growing-at-a-cagr,WIT,0.030292,Neutral,-0.0821
Managed Security Services Market will value to USD 46.4 billion by 2029 : GreyViews,20221220T163000,https://www.benzinga.com/pressreleases/22/12/g30148228/managed-security-services-market-will-value-to-usd-46-4-billion-by-2029-greyviews,WIT,0.019764,Neutral,0.062893
Managed Services Market worth $354.8 billion by 2026 - Exclusive Report by MarketsandMarkets™,20220725T143000,https://www.prnewswire.com/news-releases/managed-services-market-worth-354-8-billion-by-2026---exclusive-report-by-marketsandmarkets-301592478.html,WIT,0.03798,Neutral,0.061913
Managed Services Market worth $354.8 billion by 2026 - Exclusive Report by MarketsandMarkets™,20220617T140000,https://www.prnewswire.com/news-releases/managed-services-market-worth-354-8-billion-by-2026--exclusive-report-by-marketsandmarkets-301570228.html,WIT,0.027483,Neutral,0.002067
VMware's  ( VMW )  New Solution to Aid in Multi-Cloud Security,20220606T141800,https://www.zacks.com/stock/news/1935004/vmwares-vmw-new-solution-to-aid-in-multi-cloud-security,WIT,0.293741,Neutral,0.04672
