title,time_published,url,ticker,relevance_score,ticker_sentiment_label,ticker_sentiment_score
Demand for Comprehensive Cleaning Services Grow Post-Pandemic,20220826T130000,https://www.prnewswire.com/news-releases/demand-for-comprehensive-cleaning-services-grow-post-pandemic-301612967.html,WM,0.137446,Neutral,0.087725
The RealReal Urges Congress to Consider Circularity in the Fight Against Climate Crisis,20220802T141210,https://www.benzinga.com/pressreleases/22/08/g28311919/the-realreal-urges-congress-to-consider-circularity-in-the-fight-against-climate-crisis,WM,0.044469,Neutral,0.02392
The RealReal Urges Congress to Consider Circularity in the Fight Against Climate Crisis,20220802T141200,https://www.globenewswire.com/news-release/2022/08/02/2490595/0/en/The-RealReal-Urges-Congress-to-Consider-Circularity-in-the-Fight-Against-Climate-Crisis.html,WM,0.045224,Neutral,0.023938
Council Post: Environmental Monitoring With IoT: Five Essential Steps To Integrate IoT Sensors For Real-Time Monitoring,20240712T133000,https://www.forbes.com/sites/forbestechcouncil/2024/07/12/environmental-monitoring-with-iot-five-essential-steps-to-integrate-iot-sensors-for-real-time-monitoring/,WM,0.046363,Neutral,0.084734
Golioth Launches Pipelines: Real-time Data Streams from Device to Cloud,20240528T100000,https://www.benzinga.com/pressreleases/24/05/g39034170/golioth-launches-pipelines-real-time-data-streams-from-device-to-cloud,WM,0.056674,Neutral,0.029997
Pure Storage  ( PSTG )  Data Storage Platform Leveraged by NMSU,20240521T134900,https://www.zacks.com/stock/news/2276710/pure-storage-pstg-data-storage-platform-leveraged-by-nmsu,WM,0.046633,Somewhat-Bullish,0.234505
Why Science Applications International Shares Are Trading Lower By 11%? Here Are Other Stocks Moving In Monday's Mid-Day Session - Science Applications Intl  ( NASDAQ:SAIC ) ,20240603T175653,https://www.benzinga.com/news/24/06/39143340/why-science-applications-international-shares-are-trading-lower-by-11-here-are-other-stocks-moving-i,WM,0.037504,Somewhat-Bullish,0.219588
