title,time_published,url,ticker,relevance_score,ticker_sentiment_label,ticker_sentiment_score
Stocks That Hit 52-Week Lows On Wednesday,20220511T162815,https://www.benzinga.com/markets/options/22/05/27141482/52-weeks-high-and-low-article,WMG,0.006905,Bearish,-0.435265
Stocks That Hit 52-Week Lows On Wednesday,20220504T162909,https://www.benzinga.com/markets/options/22/05/26995541/52-weeks-high-and-low-article,WMG,0.012359,Neutral,-0.004517
4 Solid Stocks to Buy as Inflation Continues to Cool,20231214T143000,https://www.zacks.com/stock/news/2197969/4-solid-stocks-to-buy-as-inflation-continues-to-cool,WMG,0.27432,Somewhat-Bullish,0.185984
"Disney earnings, Fed's Powell speech, SBF bail backers? top week ahead",20230205T220127,https://www.foxbusiness.com/markets/disney-earnings-feds-powell-speech-sbf-bail-backers-top-week-ahead,WMG,0.052112,Neutral,0.0
"Earnings Scheduled For May 10, 2022",20220510T091808,https://www.benzinga.com/news/earnings/22/05/27099859/earnings-scheduled-for-may-10-2022,WMG,0.015162,Neutral,0.000481
"Live Music Market size is set to grow by USD 35.56 billion from 2024-2028, growing demand for live music experiences to boost the market growth, Technavio",20241125T232000,https://www.benzinga.com/pressreleases/24/11/n42178343/live-music-market-size-is-set-to-grow-by-usd-35-56-billion-from-2024-2028-growing-demand-for-live-,WMG,0.021013,Somewhat-Bullish,0.163345
"Sound Investments: 8 Stocks That Could Help You Get Your Lollapalooza Ticket Money Back - Warner Music Gr  ( NASDAQ:WMG ) , Alphabet  ( NASDAQ:GOOG ) , Alphabet  ( NASDAQ:GOOGL ) , Apple  ( NASDAQ:AAPL ) , Spotify Technology  ( NYSE:SPOT ) , Live Nation Entertainment  ( NYSE:LYV ) , Sirius XM Holdings  ( NASDAQ:SIRI ) , Eventbrite  ( NYSE:EB ) , Tencent Music Enter Gr  ( NYSE:TME ) ",20230327T135718,https://www.benzinga.com/general/entertainment/23/03/31483217/sound-investments-8-stocks-that-could-help-you-get-your-lollapalooza-money-back,WMG,0.167904,Neutral,0.108973
"Stocks could see more tumult next week, especially if bond yields continue to scream higher",20220506T200333,https://www.cnbc.com/2022/05/06/stocks-could-see-more-tumult-next-week-especially-if-bond-yields-continue-to-scream-higher.html,WMG,0.123632,Neutral,0.000386
