title,time_published,url,ticker,relevance_score,ticker_sentiment_label,ticker_sentiment_score
Self Service Kiosk Industry August 2024,20240813T110000,https://www.benzinga.com/pressreleases/24/08/n40333357/self-service-kiosk-industry-august-2024,WMT,0.104683,Neutral,0.0
Startup Gatik Lands Partnership - And $30 Million - From Isuzu To Scale Up Robot Trucks,20240514T110000,https://www.forbes.com/sites/alanohnsman/2024/05/14/startup-gatik-lands-partnership--and-30-million--from-isuzu-to-scale-up-robot-trucks/,WMT,0.077094,Neutral,0.027377
$24.5 Billion Of Fraudulent Returns This Holiday Season Shakes Major Retailers - Now They're Fighting Back - Kohl's  ( NYSE:KSS ) ,20240205T173606,https://www.benzinga.com/general/24/02/36937463/24-5-billion-of-fraudulent-returns-this-holiday-season-shakes-major-retailers-now-theyre-fighting-ba,WMT,0.062597,Somewhat-Bearish,-0.219267
What the potential UPS strike could mean for your packages | Business,20230617T110300,https://www.cnn.com/2023/06/17/business/ups-strike-workers-retail-online-shopping/index.html,WMT,0.042122,Neutral,0.0
"Self-driving startup Gatik to double workforce, strikes Kroger deal",20230315T092200,https://www.reuters.com/business/autos-transportation/self-driving-startup-gatik-double-workforce-strikes-kroger-deal-2023-03-15/,WMT,0.083251,Neutral,-0.05205
Microsoft to invest in autonomous trucking startup Gatik -sources,20230104T120300,https://www.reuters.com/business/autos-transportation/microsoft-invest-autonomous-trucking-startup-gatik-sources-2023-01-04/,WMT,0.104683,Neutral,0.049392
Brink's Expands Board of Directors with Appointment of Keith R. Wyche - Brink's  ( NYSE:BCO ) ,20220929T201638,https://www.benzinga.com/pressreleases/22/09/g29086537/brinks-expands-board-of-directors-with-appointment-of-keith-r-wyche,WMT,0.19117,Neutral,0.06517
Brink's Expands Board of Directors with Appointment of Keith R. Wyche,20220929T201600,https://www.globenewswire.com/news-release/2022/09/29/2525633/35146/en/Brink-s-Expands-Board-of-Directors-with-Appointment-of-Keith-R-Wyche.html,WMT,0.198221,Neutral,0.066996
"Gatik Notches Yet Another Major Customer In Pitney Bowes, With Latest Automated Trucking Deployment In Dallas",20220831T111500,https://www.forbes.com/sites/richardbishop1/2022/08/31/gatik-notches-yet-another-major-customer-in-pitney-bowes-with-latest-automated-trucking-deployment-in-dallas/,WMT,0.088472,Somewhat-Bullish,0.17509
Autonomous delivery company Gatik wins new pilot program with Pitney Bowes in Dallas,20220831T110001,https://www.cnbc.com/2022/08/31/autonomous-delivery-company-gatik-wins-new-pilot-program-with-pitney-bowes-in-dallas.html,WMT,0.101154,Neutral,0.042503
Shopify Stock-Split: 3 E-Commerce Companies to Buy Now,20220625T094500,https://www.fool.com/investing/2022/06/25/shopify-stock-split-3-e-commerce-companies-to-buy/,WMT,0.043714,Neutral,-0.055659
Cheap Stocks To Buy Now? 4 E-Commerce Stocks In Focus,20220623T190000,https://stockmarket.com/featured/cheap-stocks-to-buy-now-4-e-commerce-stocks-in-focus-2022-06-23,WMT,0.076248,Somewhat-Bullish,0.18366
"Customer Engagement Solutions Market Size to Grow by USD 7.69 Billion | By Component and Geography | Growth, Trends, and Forecasts  ( 2022 - 2026 ) ",20220519T093000,https://www.prnewswire.com/news-releases/customer-engagement-solutions-market-size-to-grow-by-usd-7-69-billion--by-component-and-geography--growth-trends-and-forecasts-2022---2026-301550217.html,WMT,0.038849,Neutral,0.010534
Why 'free' shipping isn't free,20220331T134926,https://www.cnbc.com/2022/03/31/why-free-shipping-isnt-free.html,WMT,0.166455,Somewhat-Bearish,-0.167734
Here's how retailers are tackling the delivery challenges that come with skyrocketing e-commerce sales post-COVID,20220308T184700,https://www.marketwatch.com/story/heres-how-retailers-are-tackling-the-delivery-challenges-that-come-with-skyrocketing-e-commerce-sales-post-covid-11646765225,WMT,0.208959,Neutral,0.133227
"HUYA, Tencent Music Entertainment, Taiwan Semiconductor Manufacturing, And Some Other Big Stocks Moving Higher In Today's Pre-Market Session - Alibaba Group Holding  ( NYSE:BABA ) , Azenta  ( NASDAQ:AZTA ) ",20221115T112903,https://www.benzinga.com/news/22/11/29723179/huya-tencent-music-entertainment-taiwan-semiconductor-manufacturing-and-some-other-big-stocks-moving,WMT,0.09186,Neutral,0.0
"Here's Why Kanzhun, Full Truck Alliance Shares Are Trading Higher Today",20220629T130247,https://www.benzinga.com/government/22/06/27898939/heres-why-kanzhun-full-truck-alliance-shares-are-trading-higher-today,WMT,0.351309,Neutral,0.000705
StockNews.com Begins Coverage on Yiren Digital  ( NYSE:YRD ) ,20220809T064048,https://www.etfdailynews.com/2022/08/09/stocknews-com-begins-coverage-on-yiren-digital-nyseyrd/,WMT,0.096283,Neutral,0.097472
"Nasdaq Drops Over 100 Points; Walmart Issues Cautious Forecast - Aileron Therapeutics  ( NASDAQ:ALRN ) , Arbe Robotics  ( NASDAQ:ARBE ) ",20230221T151506,https://www.benzinga.com/news/earnings/23/02/30989395/nasdaq-drops-over-100-points-walmart-issues-cautious-forecast,WMT,0.170075,Neutral,0.023149
Daily: AI Darling Nvidia Faces Sky-High Earnings Expectations,20240522T120258,https://www.forbes.com/sites/daniellechemtob/2024/05/22/forbes-daily-ai-darling-nvidia-faces-sky-high-earnings-expectations/,WMT,0.024878,Neutral,-0.020889
"LVMH, Walmart And Home Depot Earnings Highlight Shift In Consumer Spending",20240521T120000,https://www.forbes.com/sites/garthfriesen/2024/05/21/walmart-and-home-depot-earnings-highlight-shift-in-consumer-spending/,WMT,0.161982,Neutral,0.122224
"Retail Trends Unwrapped: Analyst Unveils Surprising Shifts In Consumer Spending As 2023 Looms - Nordstrom  ( NYSE:JWN ) , Target  ( NYSE:TGT ) , Dollar Gen  ( NYSE:DG ) , Dollar Tree  ( NASDAQ:DLTR ) ",20231229T182106,https://www.benzinga.com/analyst-ratings/analyst-color/23/12/36430219/retail-trends-unwrapped-analyst-unveils-surprising-shifts-in-consumer-spending-as-2,WMT,0.178459,Somewhat-Bullish,0.307179
"EBay, Losing Shoppers To Amazon, Keeps Trying To Woo Superfans",20231108T151802,https://www.forbes.com/sites/laurendebter/2023/11/08/ebay-losing-shoppers-to-amazon-keeps-trying-to-woo-superfans/,WMT,0.094204,Neutral,0.029503
Winmark CEO Brett Heffes on the Business of Resale,20230715T120000,https://www.fool.com/investing/2023/07/15/winmark-ceo-brett-heffes-on-the-business-of-resale/,WMT,0.008806,Neutral,0.005687
"GoodwillFinds, The Online Thrift Store, Expands To Meet Strong Demand For Resale",20230329T130000,https://www.forbes.com/sites/joanverdon/2023/03/29/goodwillfinds-the-online-thrift-store-expands-to-meet-strong-demand-for-resale/,WMT,0.042571,Somewhat-Bullish,0.17709
"TikTok ban, Supreme Court student loan hearing and Tesla Investor Day top week ahead",20230227T050559,https://www.foxbusiness.com/markets/tiktok-ban-supreme-court-student-loan-hearing-tesla-investor-day-top-week-ahead,WMT,0.034332,Neutral,0.0
Goodwill launches resale site featuring luxury brands such as Gucci and Prada | The Financial Express,20221004T115000,https://www.financialexpress.com/brandwagon/goodwill-launches-resale-site-featuring-luxury-brands-such-as-gucci-and-prada/2700018/,WMT,0.072876,Neutral,0.105994
Executive Churn In Retail C-Suites Is Unsustainable,20220729T184043,https://www.forbes.com/sites/gregpetro/2022/07/29/executive-churn-in-retail-c-suites-is-unsustainable/,WMT,0.120733,Somewhat-Bullish,0.220069
"From Gap to GameStop, there's a retail executive exodus underway - and more departures are coming",20220720T120001,https://www.cnbc.com/2022/07/20/three-reasons-why-retail-executives-are-quitting-getting-fired.html,WMT,0.029149,Neutral,0.0468
McDonald's wants frequent but smaller price increases to manage inflation without hurting customers too much,20220610T135300,https://www.marketwatch.com/story/mcdonalds-wants-frequent-but-smaller-price-increases-to-manage-inflation-without-hurting-customers-too-much-11654869197,WMT,0.273968,Somewhat-Bearish,-0.223883
RealReal announces its founder's departure as the luxury reseller moves on to the next stage of business growth,20220607T203800,https://www.marketwatch.com/story/realreal-announces-its-founders-departure-as-the-luxury-reseller-moves-on-to-the-next-stage-of-business-growth-11654634286,WMT,0.104364,Neutral,0.07973
Target and Walmart Foot Traffic Data Suggests Strong Q1 Results,20220513T212901,https://www.forbes.com/sites/sanfordstein/2022/05/13/walmart-and-target-foot-traffic-data-suggests-strong-q1-results/,WMT,0.313138,Neutral,-0.033441
Full Harvest Accelerates Expansion of B2B Produce Marketplace,20220511T120500,https://www.prnewswire.com/news-releases/full-harvest-accelerates-expansion-of-b2b-produce-marketplace-301544989.html,WMT,0.033571,Neutral,0.050173
"Target tiptoes back into resale with new ThredUp deal, as it makes sustainability push",20220408T201457,https://www.cnbc.com/2022/04/08/target-tiptoes-back-into-resale-with-new-thredup-deal.html,WMT,0.091474,Neutral,0.014018
"'s 'Stock Whisper' Index: 5 Stocks Investors Secretly Monitor But Don't Talk About Yet - Eaton Corp  ( NYSE:ETN ) , Dutch Bros  ( NYSE:BROS ) ",20240809T133744,https://www.benzinga.com/top-stories/24/08/40284758/benzingas-stock-whisper-index-5-stocks-investors-secretly-monitor-but-dont-talk-about-yet,WMT,0.224383,Neutral,-0.021365
AT&T Board Gifted 100 Million Customers' Privacy To Hackers,20240713T110020,https://www.forbes.com/sites/noahbarsky/2024/07/13/att-board-gifted-100-million-customers-privacy-to-hackers/,WMT,0.037213,Neutral,-0.100657
"Fed Inflation Gauge, Key Earnings Highlight Investing Action Plan",20240524T120000,https://www.investors.com/research/investing-action-plan/fed-inflation-gauge-key-earnings/,WMT,0.060312,Neutral,-0.013058
Grocery Outlet  ( GO )  Q4 2023 Earnings Call Transcript,20240228T021518,https://www.fool.com/earnings/call-transcripts/2024/02/27/grocery-outlet-go-q4-2023-earnings-call-transcript/,WMT,0.004932,Neutral,0.11702
Walmart and Amazon face legal trouble for using a points system to track and fire employees over absences: lawyers,20240221T100001,https://www.businessinsider.com/walmart-amazon-lawsuits-employee-attendance-tracking-points-system-policy-2024-2,WMT,0.325794,Neutral,-0.104507
Cleveland police reveal blueprint for aggressive recruitment,20230413T101900,https://www.axios.com/local/cleveland/2023/04/13/cleveland-police-recruitment,WMT,0.097457,Neutral,0.14701
"Warning issued for baby stroller sold at major retailers after death, injury reported",20230210T192050,https://www.foxbusiness.com/lifestyle/warning-issued-baby-trend-strollers-death-injury-reported,WMT,0.114137,Neutral,0.0
"Baby killed, another injured in strollers sold by major retailers, CPSC says",20230209T212112,https://www.cnbc.com/2023/02/09/child-killed-another-injured-in-baby-trend-strollers.html,WMT,0.120431,Neutral,0.002476
Microsoft  ( MSFT )  Q1 2023 Earnings Call Transcript,20221026T033040,https://www.fool.com/earnings/call-transcripts/2022/10/25/microsoft-msft-q1-2023-earnings-call-transcript/,WMT,0.00437,Neutral,0.144379
"Coca-Cola  ( KO )  Exceeds Earnings Estimates, but Here Are the 5 Best Consumer Staples Stocks to Buy Now",20221025T154908,https://www.kiplinger.com/investing/stocks/coca-cola-ko-exceeds-earnings-estimates-but-these-are-the-5-best-consumer-staples-stocks-to-buy-now,WMT,0.148273,Neutral,-0.094394
Trailblazing English Learning Platform Recognized as a 2022 Best For The World™ B Corporation in Workplace Category,20220713T100000,https://www.prnewswire.com/news-releases/trailblazing-english-learning-platform-recognized-as-a-2022-best-for-the-world-b-corporation-in-workplace-category-301585431.html,WMT,0.037504,Neutral,0.12286
Stocks That Hit 52-Week Lows On Wednesday,20220518T160908,https://www.benzinga.com/markets/options/22/05/27281415/52-weeks-high-and-low-article,WMT,0.046563,Neutral,0.032585
Stitch Fix  ( SFIX )  Q4 2024 Earnings Call Transcript,20240925T014510,https://www.fool.com/earnings/call-transcripts/2024/09/24/stitch-fix-sfix-q4-2024-earnings-call-transcript/,WMT,0.005142,Somewhat-Bullish,0.17349
La-Z-Boy Incorporated Appoints Stitch Fix CEO Matt Baer to Board of Directors,20240916T201500,https://www.globenewswire.com/news-release/2024/09/16/2947024/0/en/La-Z-Boy-Incorporated-Appoints-Stitch-Fix-CEO-Matt-Baer-to-Board-of-Directors.html,WMT,0.05234,Somewhat-Bullish,0.290828
"La-Z-Boy Incorporated Appoints Stitch Fix CEO Matt Baer to Board of Directors - Stitch Fix  ( NASDAQ:SFIX ) , La-Z-Boy  ( NYSE:LZB ) ",20240916T201500,https://www.benzinga.com/pressreleases/24/09/g40886700/la-z-boy-incorporated-appoints-stitch-fix-ceo-matt-baer-to-board-of-directors,WMT,0.049322,Somewhat-Bullish,0.290365
Back to School Checklist 2024,20240829T161328,https://www.benzinga.com/pressreleases/24/08/g40629828/back-to-school-checklist-2024,WMT,0.045655,Somewhat-Bullish,0.257272
Back-To-School Checklist 2024,20240821T194942,https://www.benzinga.com/pressreleases/24/08/g40493702/back-to-school-checklist-2024,WMT,0.044885,Somewhat-Bullish,0.257011
Stitch Fix Impressively Stitched Up Its Costs But Revenue Continues To Tear - Stitch Fix  ( NASDAQ:SFIX ) ,20230919T190441,https://www.benzinga.com/markets/penny-stocks/23/09/34739540/stitch-fix-impressively-stitched-up-its-costs-but-revenue-continues-to-tear,WMT,0.136888,Neutral,0.033266
Why Stitch Fix Stock Jumped 33% in July,20230803T122534,https://www.fool.com/investing/2023/08/03/why-stitch-fix-stock-jumped-33-in-july/,WMT,0.10607,Neutral,0.103825
Stitch Fix announces appointment of Matt Baer as Chief Executive Officer; Founder and interim Chief Executive Officer Katrina Lake will continue on in her role as Executive Chairperson of the Board - Stitch Fix  ( NASDAQ:SFIX ) ,20230614T131548,https://www.benzinga.com/pressreleases/23/06/g32855029/stitch-fix-announces-appointment-of-matt-baer-as-chief-executive-officer-founder-and-interim-chief,WMT,0.041828,Neutral,-0.011932
Stitch Fix announces appointment of Matt Baer as Chief Executive Officer; Founder and interim Chief Executive Officer Katrina Lake will continue on in her role as Executive Chairperson of the Board,20230614T131500,https://www.globenewswire.com/news-release/2023/06/14/2688168/0/en/Stitch-Fix-announces-appointment-of-Matt-Baer-as-Chief-Executive-Officer-Founder-and-interim-Chief-Executive-Officer-Katrina-Lake-will-continue-on-in-her-role-as-Executive-Chairper.html,WMT,0.043342,Neutral,-0.011956
Executives are talking less about their environmental and social-justice goals - and more about AI,20230611T140100,https://www.marketwatch.com/story/executives-are-talking-less-about-their-environmental-and-social-justice-goals-and-more-about-ai-ebf505ec,WMT,0.121959,Neutral,0.140445
"Big Tech is driving corporate earnings, and buoying expectations for coming months",20230604T171400,https://www.marketwatch.com/story/big-tech-is-driving-corporate-earnings-and-buoying-expectations-for-coming-months-b66b2c0c,WMT,0.109206,Neutral,0.07955
2023 layoff tracker: The latest on which companies have announced job cuts | Business,20230425T190700,https://www.cnn.com/2023/04/25/business/layoffs-2023/index.html,WMT,0.039353,Neutral,0.086553
Nasdaq ETFs Log Best Quarter Since 2020: What Lies Ahead?,20230406T140000,https://www.zacks.com/stock/news/2075579/nasdaq-etfs-log-best-quarter-since-2020-what-lies-ahead,WMT,0.064973,Neutral,0.097154
Proceed With Caution When Considering These 5 Ultra-Popular Stocks,20230327T162539,https://www.fool.com/investing/2023/03/27/proceed-with-caution-on-ultra-popular-stocks/,WMT,0.036255,Neutral,-0.052288
Silicon Valley Bank Bust Ripples Through Retail Industry,20230324T142319,https://www.forbes.com/sites/gregpetro/2023/03/24/silicon-valley-bank-bust-ripples-through-retail-industry/,WMT,0.087824,Neutral,-0.010369
Consumers Have Strained From Non-Necessity Retailers - Macy's  ( NYSE:M ) ,20230313T143622,https://www.benzinga.com/markets/penny-stocks/23/03/31322193/consumers-have-strained-from-non-necessity-retailers,WMT,0.087503,Somewhat-Bearish,-0.175241
Retailers could face cost cuts and slower sales this year,20230219T130002,https://www.cnbc.com/2023/02/19/walmart-home-depot-earnings-preview.html,WMT,0.076115,Neutral,0.079831
The Party Is Over: Party City Files For Chapter 11 Bankruptcy,20230123T184834,https://www.forbes.com/sites/qai/2023/01/23/the-party-is-over-party-city-files-for-chapter-11-bankruptcy/,WMT,0.031241,Somewhat-Bullish,0.183932
Why Stitch Fix Stock Was Up 15% on Tuesday,20221115T181300,https://www.fool.com/investing/2022/11/15/why-stitch-fix-stock-was-up-15-on-tuesday/,WMT,0.213048,Somewhat-Bullish,0.163836
Who needs another subscription service? Walmart is betting its millions of customers do,20221002T120001,https://www.cnbc.com/2022/10/02/walmart-inflation-walmart-plus-subscriptions.html,WMT,0.854205,Somewhat-Bullish,0.274164
Retail 100% Satisfaction Guarantee Policies May Be Reaching A Point Of No Return,20221002T090000,https://www.forbes.com/sites/pamdanziger/2022/10/02/retail-100-satisfaction-guarantee-policies-may-be-reaching-a-point-of-no-return/,WMT,0.033006,Neutral,-0.04491
Consumer Goods Stocks to Watch,20220924T130000,https://www.fool.com/investing/2022/09/24/consumer-goods-stocks-to-watch/,WMT,0.018539,Neutral,0.074238
Walmart takes a cautious approach to holiday hiring,20220921T132255,https://apnews.com/article/holidays-124ff5082390a8abf05e698d15e3e9ab,WMT,0.151539,Neutral,0.072256
Walmart takes a cautious approach to holiday hiring,20220921T132255,https://apnews.com/article/holidays-124ff5082390a8abf05e698d15e3e9ab,WMT,0.148731,Neutral,0.071439
Gap Lays Off 500 as Fast-Fashion-Focused Consumers Snub Its Brands,20220921T114800,https://www.thestreet.com/investing/gap-lays-off-workers-as-consumers-snub-its-once-popular-brands,WMT,0.125134,Somewhat-Bearish,-0.166483
Beyond Meat Stock Slides As COO Suspended Following Weekend Arrest For Alleged 'Nose Biting' Incident,20220921T103100,https://www.thestreet.com/markets/beyond-meat-stock-slides-as-coo-suspended-following-weekend-arrest,WMT,0.199037,Somewhat-Bearish,-0.150914
Gap is cutting 500 corporate jobs,20220920T165544,https://www.foxbusiness.com/retail/gap-cutting-500-corporate-jobs,WMT,0.139265,Neutral,-0.04936
Walmart  ( WMT )  Q1 Earnings and Revenues Beat Estimates,20240516T151511,https://www.zacks.com/stock/news/2274890/walmart-wmt-q1-earnings-and-revenues-beat-estimates,WMT,0.399204,Somewhat-Bullish,0.207657
Here are all the best back-to-school sales for the whole family,20230728T174458,https://www.cnn.com/cnn-underscored/deals/best-back-to-school-sales-2023-07-28,WMT,0.022264,Neutral,-0.068288
The Entrepreneurial CMO List: 2022,20220426T103000,https://www.forbes.com/sites/sethmatlins/2022/04/26/the-forbes-entrepreneurial-cmo-list-2022/,WMT,0.00747,Neutral,0.105054
"This Analyst Boosts Price Target On Home Depot Following Strong Earnings, Plus Citigroup Slashes PT On This Stock By Over 60%",20220817T122748,https://www.benzinga.com/news/earnings/22/08/28533005/this-analyst-boosts-price-target-on-home-depot-following-strong-earnings-plus-citigroup-slashes-pt-,WMT,0.229872,Neutral,-0.056515
Kroger Customers Feel the Price Pinch and Other Market News,20220627T205700,https://www.fool.com/investing/2022/06/27/kroger-customers-feel-the-price-pinch-and-other-ma/,WMT,0.019134,Somewhat-Bullish,0.287436
Here's Why Walmart Heir Rob Walton Has An Edge In Bidding War For The Denver Broncos,20220419T234606,https://www.forbes.com/sites/justinbirnbaum/2022/04/19/heres-why-walmart-heir-rob-walton-has-an-edge-in-bidding-war-for-the-denver-broncos/,WMT,0.193813,Neutral,0.04027
"MiMedx Group  ( NASDAQ:MDXG )  Lowered to ""Hold"" at StockNews.com",20220809T100244,https://www.defenseworld.net/2022/08/09/mimedx-group-nasdaqmdxg-lowered-to-hold-at-stocknews-com.html,WMT,0.090134,Neutral,0.109628
Asset Entities Acquires TikTok Money Machine Community Entering the New Multi-Billion TikTok Creator and Seller Market,20241125T130000,https://www.globenewswire.com/news-release/2024/11/25/2986629/0/en/Asset-Entities-Acquires-TikTok-Money-Machine-Community-Entering-the-New-Multi-Billion-TikTok-Creator-and-Seller-Market.html,WMT,0.042048,Neutral,0.078893
Asset Entities Acquires TikTok Money Machine Community Entering the New Multi-Billion TikTok Creator and Seller Market - Asset Entities  ( NASDAQ:ASST ) ,20241125T130000,https://www.benzinga.com/pressreleases/24/11/g42161660/asset-entities-acquires-tiktok-money-machine-community-entering-the-new-multi-billion-tiktok-creat,WMT,0.038407,Neutral,0.07796
Rewriting Wall Street's Rulebook,20220608T130024,https://www.nytimes.com/2022/06/08/business/dealbook/wall-street-sec-gensler-gamestop-meme-stock-trading-rules.html,WMT,0.02463,Neutral,0.041415
Hundreds of CEOs just signed a letter to the Senate urging 'immediate action' on gun control,20220609T181530,https://www.fastcompany.com/90759797/hundreds-of-ceos-just-signed-a-letter-to-the-senate-urging-immediate-action-on-gun-control,WMT,0.14947,Bearish,-0.732857
StockNews.com Initiates Coverage on Profire Energy  ( NASDAQ:PFIE ) ,20220809T070042,https://www.defenseworld.net/2022/08/09/stocknews-com-initiates-coverage-on-profire-energy-nasdaqpfie.html,WMT,0.081552,Neutral,0.14906
Delcath Systems  ( NASDAQ:DCTH )  Now Covered by Analysts at StockNews.com,20220809T064248,https://www.etfdailynews.com/2022/08/09/delcath-systems-nasdaqdcth-now-covered-by-analysts-at-stocknews-com-2/,WMT,0.058047,Neutral,0.119032
Delcath Systems  ( NASDAQ:DCTH )  Now Covered by Analysts at StockNews.com,20220809T064242,https://www.defenseworld.net/2022/08/09/delcath-systems-nasdaqdcth-now-covered-by-analysts-at-stocknews-com-2.html,WMT,0.059785,Somewhat-Bullish,0.166015
An Investor's Guide to the Artificial Intelligence  ( AI )  Value Chain,20241209T121500,https://www.fool.com/investing/2024/12/09/an-investors-guide-to-the-artificial-intelligence/,WMT,0.017207,Neutral,0.112605
"Taboola to Acquire Gravity R&D, Founded by The AI Engineering Team that Won The Netflix Recommendation Prize; Adds New R&D Hub in Hungary to Accelerate Product Development",20220526T130000,https://www.benzinga.com/pressreleases/22/05/g27416194/taboola-to-acquire-gravity-r-d-founded-by-the-ai-engineering-team-that-won-the-netflix-recommendat,WMT,0.041408,Neutral,0.044532
Taboola Reports Q1 2022 Results,20220512T211000,https://www.globenewswire.com/news-release/2022/05/12/2442581/31297/en/Taboola-Reports-Q1-2022-Results.html,WMT,0.014004,Neutral,0.044344
Bio-Path  ( NASDAQ:BPTH )  Coverage Initiated by Analysts at StockNews.com,20240416T062842,https://www.defenseworld.net/2024/04/16/bio-path-nasdaqbpth-coverage-initiated-by-analysts-at-stocknews-com.html,WMT,0.092569,Somewhat-Bullish,0.17103
Bio-Path  ( NASDAQ:BPTH )  Earns Sell Rating from Analysts at StockNews.com,20220809T063249,https://www.etfdailynews.com/2022/08/09/bio-path-nasdaqbpth-earns-sell-rating-from-analysts-at-stocknews-com/,WMT,0.11983,Somewhat-Bullish,0.184449
Bio-Path  ( NASDAQ:BPTH )  Earns Sell Rating from Analysts at StockNews.com,20220809T063242,https://www.defenseworld.net/2022/08/09/bio-path-nasdaqbpth-earns-sell-rating-from-analysts-at-stocknews-com.html,WMT,0.118064,Somewhat-Bullish,0.237373
"Earnings Scheduled For May 17, 2022",20220517T084725,https://www.benzinga.com/news/earnings/22/05/27243756/earnings-scheduled-for-may-17-2022,WMT,0.121435,Neutral,-0.002523
Marqeta  ( MQ )  Q1 2024 Earnings Call Transcript,20240508T054513,https://www.fool.com/earnings/call-transcripts/2024/05/08/marqeta-mq-q1-2024-earnings-call-transcript/,WMT,0.004842,Neutral,0.045034
Marqeta  ( MQ )  Q4 2023 Earnings Call Transcript,20240229T021512,https://www.fool.com/earnings/call-transcripts/2024/02/28/marqeta-mq-q4-2023-earnings-call-transcript/,WMT,0.004952,Neutral,0.0
Eight CEOs Making Their Debut On The Fintech 50,20240213T111500,https://www.forbes.com/sites/rinatorchinsky/2024/02/13/eight-ceos-making-their-debut-on-the-fintech-50/,WMT,0.026981,Somewhat-Bullish,0.228501
Prediction: These Could Be the Best-Performing Fintech Stocks Through 2030,20240109T105500,https://www.fool.com/investing/2024/01/09/prediction-these-could-be-the-best-performing-fint/,WMT,0.044304,Neutral,0.073368
3 Fintech Stocks to Buy Before the Bear Market Is Over,20230120T121500,https://www.fool.com/investing/2023/01/20/3-fintech-stocks-to-buy-before-the-bear-market-is/,WMT,0.043342,Neutral,0.147493
"This Week In Credit Card News: Apple, Walmart Go Big Into Financial Services; Delinquencies, Charge-Offs Rise",20221208T193848,https://www.forbes.com/sites/billhardekopf/2022/12/08/this-week-in-credit-card-news-apple-walmart-go-big-into-financial-services-delinquencies-charge-offs-rise/,WMT,0.025569,Somewhat-Bullish,0.15269
One Growth Stock Down 83% You'll Wish You Own When the Bear Market Ends,20221130T121000,https://www.fool.com/investing/2022/11/30/one-growth-stock-down-83-youll-wish-you-own-when-t/,WMT,0.050359,Somewhat-Bullish,0.168279
"The CPI, Layoffs, Disney's Report, and More Top Market News",20221114T153600,https://www.fool.com/investing/2022/11/14/the-cpi-layoffs-disneys-report-and-more-top-market/,WMT,0.00661,Neutral,0.132698
3 Great Growth Stocks You Should Buy Now,20221113T121500,https://www.fool.com/investing/2022/11/13/3-great-growth-stocks-you-should-buy-now/,WMT,0.028592,Neutral,0.073702
"Marqeta, Inc.  ( MQ )  Q3 2022 Earnings Call Transcript",20221110T030053,https://www.fool.com/earnings/call-transcripts/2022/11/09/marqeta-inc-mq-q3-2022-earnings-call-transcript/,WMT,0.004704,Somewhat-Bullish,0.16621
1 Big Reason SoFi Technologies Should Be on Your Radar,20220708T091500,https://www.fool.com/investing/2022/07/08/one-big-reason-why-sofi-technologies-should-be-on/,WMT,0.050551,Bearish,-0.409912
Michael Lewis on How to Spot the Real Expert,20220526T213300,https://www.fool.com/investing/2022/05/26/michael-lewis-on-how-to-spot-the-real-expert/,WMT,0.057183,Bearish,-0.361542
