title,time_published,url,ticker,relevance_score,ticker_sentiment_label,ticker_sentiment_score
73 Biggest Movers From Yesterday,20220517T084925,https://www.benzinga.com/news/22/05/27243846/73-biggest-movers-from-yesterday,XERS,0.052564,Neutral,-0.026366
"Aquestive Therapeutics  ( AQST )  Reports Q4 Loss, Tops Revenue Estimates",20240305T231503,https://www.zacks.com/stock/news/2236358/aquestive-therapeutics-aqst-reports-q4-loss-tops-revenue-estimates,XERS,0.138863,Neutral,0.0
The Character of the Market Is Shifting: Here's What to Watch,20230803T160000,https://realmoney.thestreet.com/investing/the-character-of-the-market-is-shifting-here-s-what-to-watch-16130247,XERS,0.14131,Somewhat-Bullish,0.22258
"Earnings Scheduled For May 11, 2022",20220511T102312,https://www.benzinga.com/news/earnings/22/05/27129387/earnings-scheduled-for-may-11-2022,XERS,0.025426,Neutral,-0.028694
"Sapiens International Posts Downbeat Results, Joins Sky Harbour And Other Big Stocks Moving Lower In Monday's Pre-Market Session - Sapiens Intl Corp  ( NASDAQ:SPNS ) ",20241111T131641,https://www.benzinga.com/trading-ideas/movers/24/11/41877293/sapiens-international-posts-downbeat-results-joins-sky-harbour-and-other-big-stocks-moving-l,XERS,0.423843,Bullish,0.439337
"BioXcel Therapeutics, Alvotech And Other Big Stocks Moving Lower On Thursday - XIAO-I  ( NASDAQ:AIXI ) , Alvotech  ( NASDAQ:ALVO ) ",20230629T152337,https://www.benzinga.com/news/23/06/33062019/bioxcel-therapeutics-alvotech-and-other-big-stocks-moving-lower-on-thursday,XERS,0.414559,Bearish,-0.788402
