Symbol,Name,Price (Intraday),Change,% Change,Volume,Avg Vol (3 month),Market Cap,Date
TAWNF,Thai Airways International Public Company Limited,0.015,0.005,50.0,50000,56332,219003000,2024-12-02T06:34:24.141436
TSPH,TuSimple Holdings Inc.,0.4,0.16,66.67,225405,68925,83447000,2024-12-02T06:34:24.141436
OPTT,"Ocean Power Technologies, Inc.",0.5,0.1314,35.65,87047000,13015000,63115000,2024-12-02T06:34:24.141436
BSLK,"Bolt Projects Holdings, Inc.",0.71,0.414,139.86,79242000,1591000,22960000,2024-12-02T06:34:24.141436
HOVR,New Horizon Aircraft Ltd.,0.6749,0.1899,39.15,20144000,3527000,16585000,2024-12-02T06:34:24.141436
ECGS,Eco-Growth Strategies Inc.,0.089,0.039,78.0,1000,14285,3136000,2024-12-02T06:34:24.141436
