Symbol,Name,Price (Intraday),Change,% Change,Volume,Avg Vol (3 month),Market Cap,Date
TAWNF,Thai Airways International Public Company Limited,0.01,0.0029,40.85,80000,78880,219003000,2024-12-06T06:32:46.890049
FXLV,F45 Training Holdings Inc.,0.22,0.12,120.0,62,13703,21454000,2024-12-06T06:32:46.890049
MTEM,"Molecular Templates, Inc.",0.5396,0.2029,60.26,249422000,10732000,3553000,2024-12-06T06:32:46.890049
AOXG,"Aoxing Pharmaceutical Company, Inc.",0.01,0.0035,53.85,324410,30465,3412000,2024-12-06T06:32:46.890049
ASPU,"Aspen Group, Inc.",0.0257,0.0167,185.56,15099,14545,692864,2024-12-06T06:32:46.890049
